DHSID_EA,relevance_score,most_relevant_sentences
PE-2009-5Z-00000419,1.0,"Subaqueous dunes can form from the action of water flow (fluvial processes) on sand or gravel beds of rivers, estuaries, and the sea-bed. The dynamic action of wind and water can sometimes cause dunes to drift, which can have serious consequences. The stability of the dunes was once attributed to the vegetative cover but recent research has pointed to water as the main source of parabolic dune stability. Models of coastal dunes suggest that their final equilibrium height is related to the distance between the water line and where vegetation can grow. These plants are well adapted to the harsh conditions of the foredune, typically having deep roots which reach the water table, root nodules that produce nitrogen compounds, and protected stoma, reducing transpiration. These too are adapted to the low soil water content and have small, prickly leaves which reduce transpiration. These include:  Little available soil moisture  Little available soil organic matter/nutrients/water  Harsh winds  Salt spray  Erosion/shifting and sometimes burial or exposure (from shifting)  Tidal influences There are many adaptations plants have evolved to cope with these pressures:  Deep taproot to reach water table (Pink Sand Verbena)  Shallow but extensive root systems Rhizomes  Prostrate growth form to avoid wind/salt spray (Abronia spp., Beach Primrose)  Krummholz growth form (Monterrey Cypress-not a dune plant but deals with similar pressures)  Thickened cuticle/Succulence to reduce moisture loss and reduce salt uptake (Ambrosia/Abronia spp., Calystegia soldanella)  Pale leaves to reduce insolation (Artemisia/Ambrosia spp.) Thorny/Spiky seeds to ensure establishment in vicinity of parent, reduces chances of being blown away or swept out to sea (Ambrosia chamissonis)  Gypsum dunes [[File:Aerial view of dunefield, White Sands National Park, New Mexico, United States.png|thumb|Gypsum dune fields, White Sands National Park, New Mexico, United States]] In deserts where large amounts of limestone mountains surround a closed basin, such as at White Sands National Park in south-central New Mexico, occasional storm runoff transports dissolved limestone and gypsum into a low-lying pan within the basin where the water evaporates, depositing the gypsum and forming crystals known as selenite. Sub-aqueous dunes  Sub-aqueous (underwater) dunes form on a bed of sand or gravel under the actions of water flow. Once in this form, water passing through the rock can carry and deposit minerals, which can alter the color of the rock. The sand is likely composed of hydrocarbon particles, possibly with some water ice mixed in.Peeking Through the Haze: Titan's Surface, part II—The Planetary Society Blog | The Planetary Society   Dunes are a popular theme in science fiction, featuring in depictions of dry Desert planets appearing as early as the 1956 film Forbidden Planet and Frank Herbert's 1965 novel Dune."
PE-2000-4#-00000460,2.0,"Environment - current issues: deforestation (some the result of illegal logging); overgrazing of the slopes of the coast and sierra leading to soil erosion; desertification; air pollution in Lima; pollution of rivers and coastal waters from municipal and mining wastes  Environment - international agreements: party to: Antarctic Treaty, Antarctic-Environmental Protocol, Biodiversity, Climate Change, Desertification, Endangered Species, Hazardous Wastes, Nuclear Test Ban, Ozone Layer Protection, Ship Pollution, Tropical Timber 83, Tropical Timber 94, Wetlands, Whaling	 signed, but not ratified: Climate Change-Kyoto Protocol  Peru shares control of Lake Titicaca, world's highest navigable lake, with Bolivia. This leads to the pollution of the river Rimac that supplies water to the metropolitan area."
PE-2000-4#-00000031,1.0,The Marañón River runs through this gorge (and water gap) before it reaches the Amazon Basin.
PE-2000-4#-00000011,1.0,"Political division Bagua is divided into six districts, which are:   District Mayor Aramango  César Córdova Gonzáles Bagua Luis Sacarias Nuñez Teran Copallín  Enilo Cruz Cruz El Parco  Absalón Cardozo Díaz Imaza  Sergio Suwikái Tatse La Peca Alfonso Mendoza Lingán  'El Baguazo'  In August 2008 and June 2009, Bagua suffered social unrest and the occupation of road infrastructure by indigenous communities protesting against new laws that would allow oil and mining companies to enter indigenous territories without seeking the consent or consulting with local communities. In other areas affected by oil drilling and the dumping of toxic waste, local communities in Peru have already experienced severe environmental and health damage. ""Peru tribe battles oil giant over pollution"", BBC News, 24 March 2008 Congress responded in 2008 by repealing two of the decrees but took no action on others."
PE-2009-5Z-00000045,1.0,"These valleys have extensive sown plains with cotton, rice, sugar and nutritional products."
PE-2009-5Z-00000562,1.0,"While over water the aircraft flew too low and the right wing struck the surface of the ocean as the aircraft was lining up with the runway,  northwest of the airport. Shortly after dawn, search and rescue teams discovered the aircraft tail section floating and rescued Villar after more than 11 hours in the water."
PE-2000-4#-00001306,2.0,"Aside from sulfur, such deposits commonly contain antimony, arsenic, selenium and tellurium; acid mine drainage occurs on the volcano and has resulted in pollution of the Azufre River within the Lluta River watershed. A number of mines were active on Tacora volcano, with much of the mining infrastructure being present on the upper northwestern slopes of the mountain; this infrastructure includes cableways, offices, workers' camps and treatment plants both on the mountain and on its foot."
PE-2009-5Z-00000143,1.0,"The hall and the first jetbridge entered in operation on 20 September 2013.Airport expansion opened  - September 2013   Airlines and destinations    Passenger traffic information    Year   2019  2018  2017  2016  2015  2014  2013  2012  2011  2010 Passenger Traffic  1'990,820 1'921,316  1'689,921  1'634,090  1'492,423  1'351,182  1'282,504  1'148,438  1'025,476  939,397 YoY% Growth  3.62%  13.75%  3.42%  9.5%  10.45%  5.35%  11.67%  11.99%  9.16%  N/A  Airport expansion  The original airport was inaugurated in 1979 and its design considered a maximum capacity of 500,000 passengers per year, in 2011 the airport was given in concession to Aeropuertos Andinos del Perú for 25 years, even at that time the main terminal was operating at more than twice its planned capacity, the infrastructure was obsolete and neglected, part of the concession agreement required the airport operator to upgrade and expand the facilities. Phase 1 upgrade and expansion  By 2011 the original airport terminal area was around 4,000 sq meters (42,000 sq ft) and the airport had already exceeded over one million passengers per year (twice its planned capacity), the airport's infrastructure looked old and was inadequate for the needs of the city. In order to alleviate passenger congestion as well as to provide a more modern and secure infrastructure, the airport terminal area was very rapidly increased by more than 50% the original design (6,500 sq mt/70,000 sq ft) at an estimated cost of US$10 Million."
PE-2009-5Z-00000971,5.0,"Freiburg 12 (2004): 149–157.Alleged therapeutic propertiesAgiasmata springChios57.5 Endocrine and musculoskeletal system, degenerative arthritis, rheumatisms, spondyloarthritis, lumbago, sciatica, ankylosis, gynecological ailments, vasculopathies, tendonitis etc.Agios FokasKos46(45) Balneotherapy for ailments of the musculoskeletal and integumentary systemAgistro Serres39(34) Hydrotherapy for rheumatismApollonas Thermon Saline Spring Ikaria47.8 RadioactiveAsclepius Saline Spring Ikaria40Radioactive super warm springEftalouLesvos46(43) Hydrotherapy for chronic rheumatisms, arthritis, sciatica, lumbago, neuralgia, lymphatism, kidney grains, cholelithiasis, gynecological ailments, chest ailments, myositis, chronic degenerative arthritis, injuries, post surgery phase for hemorrhoids, paradontopathia, leucorrhea, skin ailmentsEdipsos Evia80(57) Saline water springChronic rheumatisms, degenerative arthritis, spondyloarthritis, neuritis, sciatica, lumbago, post trauma ankylosis and deformations, gynecological ailmentsEleftheron thermal spa Kavala Alkaline saline water springGenisaia (Potamia)Xanthi70(55) Chronic rheumatisms, gynecological ailments, neuralgia, neuritis, allergic skin ailmentsKaiafasIlia33.5(32)H2S saline water springRheumatisms, autoimmune ailments, rheumatoid arthritis, osteoarthritis of the hip and knee, fibromyalgia, skin ailments thumb|The spa facility in KaiafasKalymnos Kalymnos38.1 Arthritis, rheumatisms, sciatica, lumbagoKamena VourlaFthiotida42(30)Radioactive saline water springBalneotherapy for ailments of the musculoskeletal and integumentary systemKimolosKimolos46 Kolpou GerasLesvos39.7 Rheumatisms, arthritis, neurological ailments, chronic injuriesKylliniIlia H2S saline waterKythnos Kyklades 38–52Chalybeate acid water springChronic and subacute rheumatisms, gynecological ailments, arthritis, neuralgia, skin ailments, cervical syndrome, lumbago- sciatica etc."
PE-2009-5Z-00000435,1.0,"Tarma was the birthplace of Gen. Manuel A. Odría, President of Peru between 1948 and 1956, who during his presidential term undertook important infrastructure constructions in the city, all of them in operation until today. Cement production stands out for the UNACEM factory, which on the one hand is one of the most important in Peru and generates a great economic and banking movement; on the other hand it causes environmental pollution."
PE-2000-4#-00000533,4.0,"The measures required new sulfuric acid plants, elimination of fugitive gases from the coke plant, use of oxygenated gases in the anodic residue plant, a water treatment plant for the copper refinery, a recirculation system for cooling waters at the smelter, management and disposal of acidic solutions at the silver refinery, an industrial wastewater treatment plant for the smelter and refinery, a containment dam for the lead mud near the zileret plant, a granulation process water at the lead smelter, an anode washing system at the zinc refinery, management and disposal of lead and copper slag wastes, domestic waste water treatment, and domestic waste disposal."
PE-2000-4#-00000032,1.0,"Besides destroying primary rainforest, and with it the habitat of many unique species, the storage of (toxic) residual waste in up-river impoundments may contaminate a huge ecosystem downstream."
PE-2009-5Z-00000016,1.0,"The Utcubamba River also passes through the Utcubamba Valley and is the source of irrigation for most of the cultivation done here. The tropical climate of the valley combined with the availability of water for the farms has helped to make this area one of the biggest producers of crops like maize, rice and banana."
PE-2009-5Z-00000027,1.0,"The Cenepa River is a 185-km stretch of river where its basin borders Ecuador and Peru, in the Cordillera del Cóndor mountain range in South America.Topographic map Gualaquiza, Ecuador; Peru SA-17-16, Joint Operations Graphic 1:250,000, U.S. National Imagery and Mapping Agency, February 1995 Its drainage basin borders to the north on Ecuador, to the east on the districts of Río Santiago and Nieva, on the south with the district of Imaza, and on the west with Ecuador. The water that originates in the Cordillera del Condor establishes a pivotal section of the subsystems that create the Cenepa river basin. The primary role of conservation in the region is to maintain the water cycles essential to the Cenepa River. The results revealed for the first time the topographic contours, watershed and drainage of the Cenepa River which were unknown until this survey."
PE-2000-4#-00000634,1.0,The cultive lands have been object of an intense work of leveling to facilitate the irrigation.
PE-2009-5Z-00000058,1.0,"Among its improvements are roofed stands, four light towers, a scoreboard, a special drainage system, broadcast booths, and offices for other sports that are housed under the stands."
PE-2009-5Z-00001080,1.0,"Locations Sections Malecón 2000 is divided into several sections:  The north section has several plazas, water fountains, an antique Ecuadorian train, spaces for aerobics and games for children, also a Planetarium, an anthropological Museum, a Contemporary Art Museum, and an IMAX  The central area is home the historic Civic Plaza with its sculptures: the Moorish Clock Tower and Rotonda Monument."
PE-2009-5Z-00000419,1.0,"Subaqueous dunes can form from the action of water flow (fluvial processes) on sand or gravel beds of rivers, estuaries, and the sea-bed. The dynamic action of wind and water can sometimes cause dunes to drift, which can have serious consequences. The stability of the dunes was once attributed to the vegetative cover but recent research has pointed to water as the main source of parabolic dune stability. Models of coastal dunes suggest that their final equilibrium height is related to the distance between the water line and where vegetation can grow. These plants are well adapted to the harsh conditions of the foredune, typically having deep roots which reach the water table, root nodules that produce nitrogen compounds, and protected stoma, reducing transpiration. These too are adapted to the low soil water content and have small, prickly leaves which reduce transpiration. These include:  Little available soil moisture  Little available soil organic matter/nutrients/water  Harsh winds  Salt spray  Erosion/shifting and sometimes burial or exposure (from shifting)  Tidal influences There are many adaptations plants have evolved to cope with these pressures:  Deep taproot to reach water table (Pink Sand Verbena)  Shallow but extensive root systems Rhizomes  Prostrate growth form to avoid wind/salt spray (Abronia spp., Beach Primrose)  Krummholz growth form (Monterrey Cypress-not a dune plant but deals with similar pressures)  Thickened cuticle/Succulence to reduce moisture loss and reduce salt uptake (Ambrosia/Abronia spp., Calystegia soldanella)  Pale leaves to reduce insolation (Artemisia/Ambrosia spp.) Thorny/Spiky seeds to ensure establishment in vicinity of parent, reduces chances of being blown away or swept out to sea (Ambrosia chamissonis)  Gypsum dunes [[File:Aerial view of dunefield, White Sands National Park, New Mexico, United States.png|thumb|Gypsum dune fields, White Sands National Park, New Mexico, United States]] In deserts where large amounts of limestone mountains surround a closed basin, such as at White Sands National Park in south-central New Mexico, occasional storm runoff transports dissolved limestone and gypsum into a low-lying pan within the basin where the water evaporates, depositing the gypsum and forming crystals known as selenite. Sub-aqueous dunes  Sub-aqueous (underwater) dunes form on a bed of sand or gravel under the actions of water flow. Once in this form, water passing through the rock can carry and deposit minerals, which can alter the color of the rock. The sand is likely composed of hydrocarbon particles, possibly with some water ice mixed in.Peeking Through the Haze: Titan's Surface, part II—The Planetary Society Blog | The Planetary Society   Dunes are a popular theme in science fiction, featuring in depictions of dry Desert planets appearing as early as the 1956 film Forbidden Planet and Frank Herbert's 1965 novel Dune."
PE-2000-4#-00000460,2.0,"Environment - current issues: deforestation (some the result of illegal logging); overgrazing of the slopes of the coast and sierra leading to soil erosion; desertification; air pollution in Lima; pollution of rivers and coastal waters from municipal and mining wastes  Environment - international agreements: party to: Antarctic Treaty, Antarctic-Environmental Protocol, Biodiversity, Climate Change, Desertification, Endangered Species, Hazardous Wastes, Nuclear Test Ban, Ozone Layer Protection, Ship Pollution, Tropical Timber 83, Tropical Timber 94, Wetlands, Whaling	 signed, but not ratified: Climate Change-Kyoto Protocol  Peru shares control of Lake Titicaca, world's highest navigable lake, with Bolivia. This leads to the pollution of the river Rimac that supplies water to the metropolitan area."
PE-2000-4#-00000031,1.0,The Marañón River runs through this gorge (and water gap) before it reaches the Amazon Basin.
PE-2000-4#-00000011,1.0,"Political division Bagua is divided into six districts, which are:   District Mayor Aramango  César Córdova Gonzáles Bagua Luis Sacarias Nuñez Teran Copallín  Enilo Cruz Cruz El Parco  Absalón Cardozo Díaz Imaza  Sergio Suwikái Tatse La Peca Alfonso Mendoza Lingán  'El Baguazo'  In August 2008 and June 2009, Bagua suffered social unrest and the occupation of road infrastructure by indigenous communities protesting against new laws that would allow oil and mining companies to enter indigenous territories without seeking the consent or consulting with local communities. In other areas affected by oil drilling and the dumping of toxic waste, local communities in Peru have already experienced severe environmental and health damage. ""Peru tribe battles oil giant over pollution"", BBC News, 24 March 2008 Congress responded in 2008 by repealing two of the decrees but took no action on others."
PE-2009-5Z-00001046,1.0,At Arica the water reached the cathedral.
PE-2000-4#-00000677,2.0,"Although most households have water and sewage systems, some are available for only a few hours a day."
PE-2000-4#-00001191,1.0,"Pucachuaña (possibly from Aymara puka colored, ch'uwaña oozing of water and other liquids; melting of metals and other things) is a mountain in the Vilcanota mountain range in the Andes of Peru, about  high."
PE-2009-5Z-00000062,2.0,"Yuracyacu (possibly from Quechua Yuraq Yaku, yuraq white, yaku water, ""white water"") is a mountain in the Cordillera Blanca in the Andes of Peru, about  high."
PE-2000-4#-00000199,1.0,"Food autonomy is reached thanks to ecological techniques, rational use of water, promotion of improved seeds, conservation of biodiversity, strengthening of producer associations, and complementary livestock breeding."
PE-2000-4#-00000542,1.0,"Located within the province is the lake Ñawinpukyu  west of the city Huancayo, with surface water spanning , where the breeding of trout, mule trips, and boating occur."
PE-2009-5Z-00000896,1.0,"Other privileges that supervisors and families enjoyed were transportation, free education, school materials, water, electricity and gas, something that was clearly a catch for anyone who accepted to relocate in a now-isolated area of the country."
PE-2009-5Z-00000251,1.0,Archaeology The oldest known irrigation canals in the Americas are located in the Nanchoc District of San Miguel Province.
PE-2000-4#-00000079,2.0,From Huallanca the river flows westward and furnishes water for irrigation of large banana plantations in the arid coastal plain; just north of Chimbote the river empties into the Pacific Ocean.
PE-2009-5Z-00000064,2.0,"Etymology  Conchucos means 'country of water' in Kulyi language (kon water, chucu country).Torero, Alfredo: Idioma de los Andes (2002)  See also  Cordillera Blanca  References  Category:Districts of the Pallasca Province Category:Districts of the Ancash Region"
PE-2000-4#-00001343,1.0,"This block was crossed by a street that was called Santa Ana, to pass next to the Main Church, consecrated to Santa Ana, first patron of the city  At first, this street was non-existent, being actually a water ditch that linked the neighborhoods of San Blas and San Sebastiá."
PE-2009-5Z-00000578,1.0,"There were also four water fountains, bronze streetlamps, and flower-filled gardens."
PE-2000-4#-00000199,1.0,"Food autonomy is reached thanks to ecological techniques, rational use of water, promotion of improved seeds, conservation of biodiversity, strengthening of producer associations, and complementary livestock breeding."
PE-2000-4#-00000542,1.0,"Located within the province is the lake Ñawinpukyu  west of the city Huancayo, with surface water spanning , where the breeding of trout, mule trips, and boating occur."
PE-2000-4#-00001191,1.0,"Pucachuaña (possibly from Aymara puka colored, ch'uwaña oozing of water and other liquids; melting of metals and other things) is a mountain in the Vilcanota mountain range in the Andes of Peru, about  high."
PE-2009-5Z-00000062,2.0,"Yuracyacu (possibly from Quechua Yuraq Yaku, yuraq white, yaku water, ""white water"") is a mountain in the Cordillera Blanca in the Andes of Peru, about  high."
PE-2009-5Z-00000214,1.0,"Water used for irrigation originates at Sara Sara's foot. Aside from Pausa, other towns and Lake Parinacochas (an important source of water for the region) are located close to the volcano."
PE-2009-5Z-00000580,1.0,"The water and gas pipelines connected to the Barracks of Santa Catalina were cut. and the incumbent classes who presented the parliamentarians with a list of demands that, among other things, demanded: the execution of the former president Augusto B. Leguía, overthrown in 1930 by the Commander EP Luis Miguel Sánchez Cerro and that he was prisoner and sick; the separation of all the high chiefs of the Army and the construction of hygienic barracks."
PE-2004-5#-00001184,1.0,"Chinkani (chinka a type of water plant,David L. Browman, Aspectos de Nutrición Prehistórica en la Cuenca del Lago Titicaca, Revista Diálogo Andino No 2 - 1983, Departamento de Historia y Geografía, Universidad de Tarapacá, Arica-Chile Aymara -ni a suffix to indicate ownership, ""the one with the chinka plant"", also spelled Chincani) is a mountain east of the Apolobamba mountain range in the Andes of Bolivia, about  high."
PE-2004-5#-00001184,2.0,"Janq'u Uma (Aymara janq'u white, uma water, ""white water"", also spelled Ccancouma, Janjouma) is a mountain in the north of the Apolobamba mountain range in the Andes of Peru, about  high."
PE-2000-4#-00000207,1.0,"Chuaña (possibly from Aymara for oozing of water and other liquids / melting of metals and other things) is a mountain in the Andes of Peru, about  high."
PE-2000-4#-00001053,2.0,"Challuma (possibly from Aymara ch'alla sand, uma water, ""sand water"") is a  mountain in the Andes of southern Peru near a lake of the same name."
PE-2000-4#-00000197,3.0,"Chuañuma (possibly from Aymara ch'uwaña oozing of water and other liquids / melting of metals and other things, uma water, ""oozing water"") is a mountain in the Andes of Peru, about  high."
PE-2000-4#-00000599,4.0,"Origin of the Lake Formerly, the Lake Conache was seasonal and periodically it was formed during the rainy season in the area, and months after it dried, but after completing the second phase of the special project of irrigation Chavimochic, with the continuous flood irrigation of the crops in the Pampas de San Juan, the water table increased gradually by the leaks, and the lake came to have a permanent water and it was growing its volumen."
PE-2009-5Z-00000163,3.0,"Chuañuma (possibly from Aymara ch'uwaña oozing of water and other liquids / melting of metals and other things, uma water, ""oozing water"") is a mountain in the Huanzo mountain range in the Andes of Peru, about  high."
PE-2000-4#-00000200,1.0,"Chuaña (possibly from Aymara for oozing of water and other liquids / melting of metals and other things) is a mountain in the Chila mountain range in the Andes of Peru, about  high."
PE-2000-4#-00000333,1.0,"When the water cleared, the shepherd's children repopulated the region."
PE-2009-5Z-00000061,1.0,"Lake Auquiscocha or Auquishcocha (both possibly from Wanka Quechua  to water, to irrigate; to give to drink, Quechua  prince; a mythical figure of the Andean culture, qucha lake) is a lake in the Cordillera Blanca in the Andes of Peru located in the Ancash Region, Carhuaz Province, Shilla District."
PE-2000-4#-00000032,1.0,References  Category:Dams completed in 2010 Category:Energy infrastructure completed in 2010 Category:Dams in Ecuador Category:Concrete-face rock-fill dams Category:Hydroelectric power stations in Ecuador Category:Buildings and structures in Cañar Province
PE-2009-5Z-00000581,1.0,"2013 - Air pollution in Lima reaches annual mean of 48 PM2.5 and 88 PM10, more than recommended."
PE-2009-5Z-00000334,1.0,"Hydrothermal activity occurred both before and after the eruption of the Atunsulla tuff, and the mineralization occurred 1.9 million years ago, This volcano is among the youngest in a Central Peru volcanic chain ; hot water indicate that the geothermal system may be still active ."
PE-2004-5#-00001184,1.0,"Chinkani (chinka a type of water plant,David L. Browman, Aspectos de Nutrición Prehistórica en la Cuenca del Lago Titicaca, Revista Diálogo Andino No 2 - 1983, Departamento de Historia y Geografía, Universidad de Tarapacá, Arica-Chile Aymara -ni a suffix to indicate ownership, ""the one with the chinka plant"", also spelled Chincani) is a mountain east of the Apolobamba mountain range in the Andes of Bolivia, about  high."
PE-2004-5#-00001184,2.0,"Janq'u Uma (Aymara janq'u white, uma water, ""white water"", also spelled Ccancouma, Janjouma) is a mountain in the north of the Apolobamba mountain range in the Andes of Peru, about  high."
PE-2000-4#-00000207,1.0,"Chuaña (possibly from Aymara for oozing of water and other liquids / melting of metals and other things) is a mountain in the Andes of Peru, about  high."
PE-2000-4#-00001053,2.0,"Challuma (possibly from Aymara ch'alla sand, uma water, ""sand water"") is a  mountain in the Andes of southern Peru near a lake of the same name."
