DHSID_EA,relevance_score,most_relevant_sentences
PK-2017-7#-00000402,2.0,They described being deprived of food and water and being fed filthy food and water when they were fed.U.S.
PK-2006-5#-00000863,1.0,"Some have suggested the Sanskrit name may mean ""clear blue water."" Another theory derives the word Swat from the Sanskrit word shveta (), also used to describe the clear water of the Swat River. Furthermore, school infrastructure score is 90.26 ranking the district at number 31 out of 155 districts."
PK-2006-5#-00000814,1.0,"In spite of the Kunar carrying more water than the Kabul, the river continues as the Kabul River after this confluence, mainly for the political and historical significance of the name. History  Expedition of Alexander the Great into Asia  In Arrian's The Campaigns of Alexander, the River Kabul is referred to as Κωφήν Kōphēn (Latin spelling Cophen).Arrian, John Rooke;   Modern era Since approximately March 2019, ten of thousands of gallons of untreated sewage from the Makroyan Waste Water Treatment Plant has been dumped into the Kabul River each month, reportedly causing gastrointestinal issues among the 3,000 families that live along the river."
PK-2017-7#-00000382,2.0,"There is a water system which is now abandoned for use but is a marvel of civil works for meeting water requirements of the station. It used to store rain water in three stages in order to clean the water using its usual flow. The water was then pumped to the airfield, and also up to the Victoria Hut, which is nearly  from the water tank system."
PK-2006-5#-00000272,1.0,"There are also canals that cut across the Muzaffargarh District, providing water to farms."
PK-2017-7#-00000402,1.0,"The pass crosses the Hindu Kush mountains but is now bypassed through the Salang Tunnel, which runs underneath it at a height of about 3,400 m. The tunnel was built by engineers and construction crews from the Soviet Union in 1958 – 1964 as part of a wide-ranging infrastructure build out in Afghanistan carried out by the USSR."
PK-2006-5#-00000198,1.0,"He also improved civil infrastructure, and ordered construction of the Alamgiri Bund - a channel built to divert the flow of the River Ravi. As late as 1864, the Lahori Mandi area had been known as kacha kot, meaning ""the mud fort,"" a name derived from the gradient of the land, the water flow, and the formation of mohallahs, kuchas, and kattrahs. The Shahi Hammam (; ""Royal Baths""), is a Persian-style bath which was built in 1635 C.E."
PK-2006-5#-00000126,1.0,"The CDA Engineering and the Environmental Protection Agency supervised the engineering the Supreme Court's monument and civil works infrastructure throughout its lengthy construction since the 1960s. In the 1980s–90s, CDA Engineering later expanded infrastructure of the Supreme Court especially when building the Supreme Court's law library.|  The Court Complex is comprised on Main Central Block, Judges Chamber's block, and Administrative Block, covering 339,861sq."
PK-2017-7#-00000488,2.0,"Being an area of low rainfall, the most vital requirement is water for irrigation, livestock, drinking, and domestic use."
PK-2006-5#-00000571,1.0,"Accreditation Aga Khan University Hospital, Karachi is a Joint Commission International (JCI) accredited hospital.Aga Khan University Hospital is an accredited organization by  the Joint Commission International, jointcommissioninternational.org website, Retrieved 9 August 2017  Cooperation with other Karachi hospitals In 2017, a joint board was set up to conduct a study of all major hospitals in Karachi under the Karachi Municipal Corporation (KMC) and the Aga Khan University Hospital to try to help upgrade all of KMC-affiliated medical facilities in Karachi.Aga Khan University Hospital experts to help upgrade Karachi Municipal Corporation hospitals, The News International (newspaper), Published 22 February 2017, Retrieved 9 August 2017  Aga Khan University Hospital is among the leaders in Pakistan in introducing new healthcare technology."
PK-2017-7#-00000562,2.0,Operation The project was designed primarily to increase the amount of water that could be used for irrigation from the flow of the Jhelum and its tributaries.
PK-2017-7#-00000560,1.0,"For facilities and infrastructure, the district ranked 116 out of 145."
PK-2006-5#-00000708,1.0,It has its own source of natural mineral water.
PK-2006-5#-00000262,1.0,"It is the easternmost tributary of the Indus River.The Bhakra Dam is built around the river Sutlej to provide irrigation and other facilities to the states of Punjab, Rajasthan and Haryana. The waters of the Sutlej are allocated to India under the Indus Waters Treaty between India and Pakistan, and are mostly diverted to irrigation canals in India to include Sirhind canal, Bhakra Main Line and Rajasthan canal . The drainage basin is mainly in India's Himachal Pradesh, Punjab, Jammu and Kashmir and Haryana states. Continuing west-southwest, the Sutlej enters Pakistan about  east of Bhedian Kalan, Kasur District, Punjab province, continuing southwest to water the ancient and historical former Bahawalpur princely state. During floods, Indus river water flows in to Indian part of Great Rann of Kutch. Sutlej-Yamuna Link  There has been a proposal to build a  long heavy freight and irrigation canal, to be known as the Sutlej-Yamuna Link (SYL) to connect the Sutlej and Yamuna rivers.http://india.gov.in/sectors/water_resources/sutlej_link.php Sutlej-Yamuna Link The project is intended to connect the Ganges, which flows to the east coast of the subcontinent, with points west, via Pakistan. To augment nearly 100 tmcft water availability for the needs of this link canal, Tso Moriri lake/Lingdi Nadi (a tributary of Tso Moriri lake) waters can be diverted to the Sutlej basin by digging a 10 km long gravity canal to connect to the Ungti Chu river."
PK-2006-5#-00000321,1.0,"India's nuclear bomb project  Efforts towards building the nuclear bomb, infrastructure, and research on related technologies have been undertaken by India since World War II."
PK-2006-5#-00000793,1.0,Physical features  Saiful Muluk was formed by glacial moraines that blocked the water of the stream passing through the valley. Melting water collected into the lake.
PK-2006-5#-00000711,1.0,"History  In the late 1960s, a government study concluded that more medical colleges were needed in Pakistan to improve medical education, research, and healthcare in the country."
PK-2006-5#-00000925,1.0,"Coalition and Afghan government plans include the construction of a local mosque, the rebuilding of a district centre, police buildings, schools, and the repair of the electricity infrastructure."
PK-2006-5#-00000205,1.0,"Fatima Jinnah Medical University with its associated teaching hospital Sir Ganga Ram Hospital, is a medical institution to teach and train female doctors and post-graduate students and provide medical and healthcare facilities to the citizens of the country, particularly in and around Lahore, and more particularly to the female population. It is now a tertiary healthcare unit and is recognised by the Higher Education Commission of Pakistan.Fatima Jinnah Medical University is on the List of Recognised Universities by the Higher Education Commission of Pakistan Higher Education Commission of Pakistan website, Retrieved 3 May 2021University Overview of Fatima Jinnah Medical University on UniRank website Retrieved 3 May 2021  Sir Ganga Ram Hospital was established in 1921 in the walled city of Lahore by a philanthropist Sir Ganga Ram who also donated a piece of land."
PK-2017-7#-00000141,1.0,"Khanki headworks is also used to divert water to the Lower Chenab Canal, which originates from Khanki Headworks. Khanki controls water distribution over 3 million acres (12,000 km²) of agricultural lands by one main distributary, the Lower Chenab Canal, and 59 minor distributaries. The Lower Chenab Canal originates from the Barrage carrying about 11,600 cusecs of water. New Khanki Barrage will divert 11,653 cusecs of sustainable irrigation supplies to the downstream Lower Chenab Canal. The irrigation distribution system has already been remodeled for additional flows. The barrage will ensure sustainable irrigation of 3.03 million acres of fertile land in eight districts of central Punjab - Gujranwala, Hafizabad, Sheikhupura, Nankana Sahid, Faisalabad, Jhang, Chiniot and Toba Tek Singh. Both countries monitor and watch the river water flow levels in their areas – especially closely during the flooding season.Water flow normal in all rivers The News International (newspaper), Published 2 September 2020, Retrieved 30 November 2020   Education  Khanki is becoming a centre of education after Saroke."
PK-2006-5#-00000414,2.0,"The Marala–Ravi Link Canal was constructed between 1952–1956 in the wake of the Indo-Pakistani water dispute of 1948, when Pakistan became apprehensive of water security on the Ravi and Sutlej rivers."
PK-2017-7#-00000406,1.0,"Pagara پګړه یا اشر:  When someone needs to do any hard task and he or she can not do it alone or want to do it in short time, or if there is a public work such as constructing a mosque, road, water canal etc."
PK-2006-5#-00000670,1.0,Its walls were loop-holed and flanked with towers that sloped to the water's edge: they did not exceed twenty feet in height.
PK-2017-7#-00000382,1.0,"Chabahar free trade–industrial zone was established in 1992 along with the two other free trade zones Qeshm and Kish Island to use global expertise (mostly from South East Asia) as a tool for the development of the country, accelerating the accomplishment of infrastructure, creation of employment, and representation in global markets.Article 1 of law on the establishment and administration of free trade-industrial zone  The Chabahar free trade–industrial zone achieved its importance mainly from its geographical location as the shortest and the most secure route connecting the Commonwealth of Independent States (CIS) as well as Afghanistan to warm waters and its proximity to one of the largest oil, gas and mineral resources of the world and as the only ocean port of the country."
PK-2017-7#-00000402,1.0,"In 2004 – 2005, one male bear and one deer died, apparently from diseases and improper nutrition."
PK-2017-7#-00000137,1.0,But afterwards this territory became unpopulated and jungle because of shortage of water and Afghan incursions. Mostly people from Hafizabad take bath in that river. It is famous and known that during Shab e barat when he was watering the fields of his master the water became milk.
PK-2017-7#-00000206,1.0,"It is used for irrigation and flood control. It was completed in 1927 as the Sutlej Valley Project for irrigation of Nili Bar. Every September when the flood level rises and India releases a large amount of water, it creates havoc in areas downstream from the headworks. However, it can be developed into an ecotourism site for those who are interested in the hydrology of the Indus basin and the effect of shortages of water in this part of the world. The desertification of the area from the nearby Choolistan desert is an interesting phenomenon and the pollution of the river from upstream industry in India is a cause of concern."
PK-2017-7#-00000382,1.0,"The highly congested Bandar Abbas port is not a deep water port and cannot handle the 250,000-ton oceangoing cargo ships. The India–Iran–Afghanistan three-way memorandum of understanding (MoU) plans have committed at least $21bn to Chabahar–Hajigak corridor, including $85m for Chabahar port development by India, $150m line of credit by India to Iran, $8bn India-Iran MoU for Indian industrial investment in Chabahar Special Economic Zone, $11-billion Hajigak iron and steel mining project awarded to seven Indian companies in central Afghanistan, and India's $2bn commitment to Afghanistan for developing supporting infrastructure including the Chabahar-Hajigaj railway, with potential for several times more trade via connectivity to 7,200-km-long multi-mode North–South Transport Corridor (INSTC) connecting to Europe and Turkey, R297 Amur highway and Trans-Siberian Highway across Russia, and planned Herat to Mazar-i-Sharif railway providing access to Turkmenistan, Uzbekistan, Tajikistan and Kyrgyzstan. It has signed a memorandum of understanding (MoU) with Afghanistan and Tajikistan on the construction of railway lines, water pipelines and energy transmission lines. The Government of India has pledged to Afghanistan to spend $2bn in developing supporting infrastructure including Chabahar to Hajigaj railway. Despite intentions, India's involvement in the infrastructure development within Iran has been minimal, possibly due to the Western pressure to apply sanctions. India Ports Global will modernize ancillary infrastructure by installing four rail-mounted gantry cranes, sixteen rubber-tire gantry cranes, two reach stackers, two empty handlers, and six mobile harbor cranes. Indian commitments to Iranian infrastructure could total $635 million as per the twelve memoranda of understanding signed in May 2016.$400 million steel + $85 million for development of port, and $150 line of credit. The Government of India had pledged to spend $2bn in developing supporting infrastructure."
PK-2006-5#-00000925,1.0,The university does not have a proper central library due to the lack of infrastructure and instead contains 8 small libraries in different faculties and departments.
PK-2006-5#-00000271,1.0,"Jatoi is an agricultural city, with very fertile soil and water provided by a canal system and tube wells, producing two or three crops in a year."
PK-2006-5#-00000925,1.0,"Coalition and Afghan government plans include the construction of a local mosque, the rebuilding of a district centre, police buildings, schools, and the repair of the electricity infrastructure."
PK-2006-5#-00000205,1.0,"Fatima Jinnah Medical University with its associated teaching hospital Sir Ganga Ram Hospital, is a medical institution to teach and train female doctors and post-graduate students and provide medical and healthcare facilities to the citizens of the country, particularly in and around Lahore, and more particularly to the female population. It is now a tertiary healthcare unit and is recognised by the Higher Education Commission of Pakistan.Fatima Jinnah Medical University is on the List of Recognised Universities by the Higher Education Commission of Pakistan Higher Education Commission of Pakistan website, Retrieved 3 May 2021University Overview of Fatima Jinnah Medical University on UniRank website Retrieved 3 May 2021  Sir Ganga Ram Hospital was established in 1921 in the walled city of Lahore by a philanthropist Sir Ganga Ram who also donated a piece of land."
PK-2017-7#-00000141,1.0,"Khanki headworks is also used to divert water to the Lower Chenab Canal, which originates from Khanki Headworks. Khanki controls water distribution over 3 million acres (12,000 km²) of agricultural lands by one main distributary, the Lower Chenab Canal, and 59 minor distributaries. The Lower Chenab Canal originates from the Barrage carrying about 11,600 cusecs of water. New Khanki Barrage will divert 11,653 cusecs of sustainable irrigation supplies to the downstream Lower Chenab Canal. The irrigation distribution system has already been remodeled for additional flows. The barrage will ensure sustainable irrigation of 3.03 million acres of fertile land in eight districts of central Punjab - Gujranwala, Hafizabad, Sheikhupura, Nankana Sahid, Faisalabad, Jhang, Chiniot and Toba Tek Singh. Both countries monitor and watch the river water flow levels in their areas – especially closely during the flooding season.Water flow normal in all rivers The News International (newspaper), Published 2 September 2020, Retrieved 30 November 2020   Education  Khanki is becoming a centre of education after Saroke."
PK-2006-5#-00000414,2.0,"The Marala–Ravi Link Canal was constructed between 1952–1956 in the wake of the Indo-Pakistani water dispute of 1948, when Pakistan became apprehensive of water security on the Ravi and Sutlej rivers."
PK-2017-7#-00000406,1.0,"Pagara پګړه یا اشر:  When someone needs to do any hard task and he or she can not do it alone or want to do it in short time, or if there is a public work such as constructing a mosque, road, water canal etc."
PK-2006-5#-00000670,1.0,Its walls were loop-holed and flanked with towers that sloped to the water's edge: they did not exceed twenty feet in height.
PK-2017-7#-00000382,1.0,"Chabahar free trade–industrial zone was established in 1992 along with the two other free trade zones Qeshm and Kish Island to use global expertise (mostly from South East Asia) as a tool for the development of the country, accelerating the accomplishment of infrastructure, creation of employment, and representation in global markets.Article 1 of law on the establishment and administration of free trade-industrial zone  The Chabahar free trade–industrial zone achieved its importance mainly from its geographical location as the shortest and the most secure route connecting the Commonwealth of Independent States (CIS) as well as Afghanistan to warm waters and its proximity to one of the largest oil, gas and mineral resources of the world and as the only ocean port of the country."
PK-2017-7#-00000402,1.0,"In 2004 – 2005, one male bear and one deer died, apparently from diseases and improper nutrition."
PK-2017-7#-00000137,1.0,But afterwards this territory became unpopulated and jungle because of shortage of water and Afghan incursions. Mostly people from Hafizabad take bath in that river. It is famous and known that during Shab e barat when he was watering the fields of his master the water became milk.
PK-2017-7#-00000206,1.0,"It is used for irrigation and flood control. It was completed in 1927 as the Sutlej Valley Project for irrigation of Nili Bar. Every September when the flood level rises and India releases a large amount of water, it creates havoc in areas downstream from the headworks. However, it can be developed into an ecotourism site for those who are interested in the hydrology of the Indus basin and the effect of shortages of water in this part of the world. The desertification of the area from the nearby Choolistan desert is an interesting phenomenon and the pollution of the river from upstream industry in India is a cause of concern."
PK-2017-7#-00000382,1.0,"The highly congested Bandar Abbas port is not a deep water port and cannot handle the 250,000-ton oceangoing cargo ships. The India–Iran–Afghanistan three-way memorandum of understanding (MoU) plans have committed at least $21bn to Chabahar–Hajigak corridor, including $85m for Chabahar port development by India, $150m line of credit by India to Iran, $8bn India-Iran MoU for Indian industrial investment in Chabahar Special Economic Zone, $11-billion Hajigak iron and steel mining project awarded to seven Indian companies in central Afghanistan, and India's $2bn commitment to Afghanistan for developing supporting infrastructure including the Chabahar-Hajigaj railway, with potential for several times more trade via connectivity to 7,200-km-long multi-mode North–South Transport Corridor (INSTC) connecting to Europe and Turkey, R297 Amur highway and Trans-Siberian Highway across Russia, and planned Herat to Mazar-i-Sharif railway providing access to Turkmenistan, Uzbekistan, Tajikistan and Kyrgyzstan. It has signed a memorandum of understanding (MoU) with Afghanistan and Tajikistan on the construction of railway lines, water pipelines and energy transmission lines. The Government of India has pledged to Afghanistan to spend $2bn in developing supporting infrastructure including Chabahar to Hajigaj railway. Despite intentions, India's involvement in the infrastructure development within Iran has been minimal, possibly due to the Western pressure to apply sanctions. India Ports Global will modernize ancillary infrastructure by installing four rail-mounted gantry cranes, sixteen rubber-tire gantry cranes, two reach stackers, two empty handlers, and six mobile harbor cranes. Indian commitments to Iranian infrastructure could total $635 million as per the twelve memoranda of understanding signed in May 2016.$400 million steel + $85 million for development of port, and $150 line of credit. The Government of India had pledged to spend $2bn in developing supporting infrastructure."
PK-2006-5#-00000925,1.0,The university does not have a proper central library due to the lack of infrastructure and instead contains 8 small libraries in different faculties and departments.
PK-2006-5#-00000271,1.0,"Jatoi is an agricultural city, with very fertile soil and water provided by a canal system and tube wells, producing two or three crops in a year."
PK-2017-7#-00000366,1.0,"Pilgrims then take a ritual bath in the sacred Hingol River before finally approaching the shrine marking the goddess’s resting place.https://www.nationalgeographic.com/culture/2019/01/muslim-majority-country-hindu-goddess-lives-Balochistan-pictures/ The annual four-day pilgrimage to the Hinglaj Mata Temple is in April. But in recent years, new infrastructure has allowed an unprecedented number of pilgrims to enter the site, altering centuries-old rituals. Temporary bathroom facilities and camps are installed. But in recent years, new infrastructure has allowed an unprecedented number of pilgrims to enter the site, altering centuries-old rituals. After only a few kilometers, Sita becomes thirsty in the burning desert heat and requests that Hanuman and Lakshmana  bring her water. Hanuman tries to extract water from the soil by stomping his  foot violently on the ground, but this produces only a dry riverbed. After a physically challenging journey, Rama reaches the shrine of the Goddess, and  the Devi grants him purification of his sin. To mark his completed yātrā, he  carves the symbols of the sun and moon on the mountain opposite the temple which can be seen even today.http://40.114.28.106/PDF/5322-pdf-VNV/p2/9780190850531.PDF  Hinglaj pilgrims before going to Hinglaj goes to Khari Nadi, where people take a bath in the ocean and worship Rama.http://40.114.28.106/PDF/5322-pdf-VNV/p2/9780190850531.PDF  Hinglaj Sheva Mandali The Hinglaj Sheva Mandali is the temple committee established to promote an annual pilgrimage to the shrine."
PK-2006-5#-00000539,1.0,"It has state-of-the-art equipment enabling it to provide comprehensive obstetric, gynecological, and neonatal healthcare."
PK-2006-5#-00000344,1.0,"The water falls with great speed. These fish were again dropped in the water after sewing pearls in their noses"".Tuzk i Jahangiri translation by A. Rogers ICS, and edited by Beveridge, 1909  The Emperor Shah Jahan stayed at Wah while on his way to Kabul in 1639. He made bathrooms having mixture of cold and hot water at the southern end of these twelve-door structures."
PK-2006-5#-00000925,2.0,"Services The hospital has:  150-bed surgical unit  3 operating theatres  blood bank  X-ray department  kitchen facilities to provide food for patients and staff  laundry facility  According to a report by The Senlis Council, not only people from Kandahar province are treated at Mirwais Hospital but also from neighboring Helmand, Zabul, Oruzgan and others."
PK-2006-5#-00000033,3.0,"Main source of drinking water both for human beings and animals, is rain water which is stored in “Tobas” and “Kunds” (water reservoir)."
PK-2006-5#-00000559,2.0,"The colony faces various problems with utilities including sewerage, water, electricity and the condition of roads."
PK-2006-5#-00000114,1.0,"New road projects, new sewage system, High Schools, Agriculture reform, Hospitals, SUI Gas and many other."
PK-2017-7#-00000281,2.0,"The only place for kids to enjoy a dip when it rains (depression area), as the entire town was secured by a central drainage system that was built to last and water never stood."
PK-2017-7#-00000285,2.0,"The aquarium had 33 seawater exhibition tanks where sea-based fish were kept, and 14 fresh water tanks exhibiting fish species that live in fresh water."
PK-2017-7#-00000200,2.0,This barrage controls water flow in the River Indus for irrigation and flood control purposes.
PK-2006-5#-00000621,1.0,"Many development projects were carried out with many roads, infrastructure of the city and surrounding areas, education, health sector and other basic necessities were the top priorities."
PK-2006-5#-00000072,1.0,"The total population of the village is 12000+ and total houses are 1500.Jhalandhar Araiyan, Faisalabad Facilities like electricity, gas, telephone, water, cable, schools, and Internet are available."
PK-2006-5#-00000444,1.0,"During the 2010 Pakistan floods, a controversial decision was made by Provincial Minister of Sindh, Zulfiqar Mirza, to release saline water and effluent into Shakoor Lake to alleviate pressure on the Left Bank Outfall Drain (LBOD) in Badin, Pakistan. Environmental concerns  The way water retention and salt extraction has been practised in the Rann of Kutch region, is causing, and has already caused, devastating effects on the local environment; reducing the natural wild life population, drying up and deforesting jungle habitats and mangroves, and threatening the entire regional ecosystem."
PK-2006-5#-00000830,1.0,"Air pollution in Peshawar reaches annual mean of 111 PM2.5 and 540 PM10, much higher than recommended."
PK-2017-7#-00000390,1.0,"The construction of dam was started in July, 2011 and completed in June, 2014 at a cost of PKR 142 million.FATA Development Authority » Zao Small Dam in Khyber Agency The dam has a height of 85 feet, covered a length of around 270 feet, with actual storage capacity of water 800 acre feet."
