DHSID_EA,relevance_score,most_relevant_sentences
PK-2006-5#-00000134,1.0,"Founded in 1967 as Reactor School from the sponsorship of the Pakistan Atomic Energy Commission in response to support and manage the nuclear energy infrastructure in the country, the institute started its educational activities with the affiliation of Quaid-e-Azam University, and became Centre for Nuclear Studies (CNS) in 1976— the center gained its new name and became independent as public university in 1997. History  In 1967, the institute was found and established as the Reactor School by I. H. Usmani who put the administrative management of the school under the Pakistan Atomic Energy Commission (PAEC)— the school was originally aimed towards providing technical training to support Pakistan's nuclear energy infrastructure. Due to enhancements in its infrastructure that created the capability for offering programs in many different fields of science, its name was changed to Pakistan Institute of Engineering and Applied Sciences (PIEAS) in 1997— the year when the Institute of Applied Sciences was granted its status as public research university."
PK-2006-5#-00000460,2.0,"Retrieved 10 June 2012 It is a fresh water lake and the main source of water are the streams comes through from Kirthar Mountains.Article:Killer lake continues to bring misery , Published in The News on 29 November 2009. But now environment and wildlife of this lake is badly affected by discharging of poisonous and saline water of the Hirdin drain.Sweet water bodies destroyed Published in Dawn News."
PK-2017-7#-00000318,1.0,"Chotiari Dam () is an artificial water reservoir situated 35 km away from the Sanghar town in Sanghar District, Sindh, Pakistan. The main purpose of constructing this dam is to discharge saline water of the Left Bank Outfall Drain (LBOD). Now the environment and wildlife of this area is badly affected by the saline water discharge of Left Bank Outfall Drain (LBOD)."
PK-2017-7#-00000502,1.0,Zharba Lake uses as a water reservoir for the residents of Shigar Valley.
PK-2006-5#-00000014,1.0,very peaceful railway station  drinking water is also available there.
PK-2006-5#-00000615,2.0,"The building is currently undergoing restorations since its drainage might be blocked, leading to water accumulating within the location."
PK-2017-7#-00000176,1.0,"Such traditions included the tying of a turban (dastar bandi) to signify inheritance of Baba Farid's spiritual authority, the regularization of qawwali music, establishment of the shrine's free kitchen, and opening of the tomb's southern door to allow visitors to the urs festival to directly pass the shrine's most sacred area."
PK-2017-7#-00000093,1.0,"Etymology  There are three theories on how Kallar Syedan obtained its name:  Kallar was a wasteland jungle, and all the wells in the area were (Dhara), a term used for ""rough water."""
PK-2006-5#-00000689,1.0,"An ancient water tank, known as Bhodesar Talao, was also built in the nearby hills."
PK-2006-5#-00000197,1.0,"Although, the hospital's primary task is to cater military officers, soldiers, and their families; it provides equal healthcare facilities to civilians. Some of the specialized healthcare units available in the hospital are:  Trauma center  Department of Medicine  Department of Gastroenterology  Department of Pulmonology  Department of Mental illnesses   General Surgery Department  Department of Neurology  Department of Ophthalmology  Department of Ear, Nose, Throat  Dedicated Breast Cancer Clinic  Thoracic Surgery Department  Intensive Care Unit  Orthopedic Department  Plastic Surgery  Rehabilitation Department  Hand and Upper Limb Surgery Department   Maxillofacial Center  Army Cardiac Center   Training / teaching facilities  The hospital serves as a teaching hospital to CMH Lahore Medical And Dental College."
PK-2006-5#-00000072,1.0,"The total population of the village is 12000+ and total houses are 1500.Jhalandhar Araiyan, Faisalabad Facilities like electricity, gas, telephone, water, cable, schools, and Internet are available."
PK-2006-5#-00000444,1.0,"During the 2010 Pakistan floods, a controversial decision was made by Provincial Minister of Sindh, Zulfiqar Mirza, to release saline water and effluent into Shakoor Lake to alleviate pressure on the Left Bank Outfall Drain (LBOD) in Badin, Pakistan. Environmental concerns  The way water retention and salt extraction has been practised in the Rann of Kutch region, is causing, and has already caused, devastating effects on the local environment; reducing the natural wild life population, drying up and deforesting jungle habitats and mangroves, and threatening the entire regional ecosystem."
PK-2006-5#-00000830,1.0,"Air pollution in Peshawar reaches annual mean of 111 PM2.5 and 540 PM10, much higher than recommended."
PK-2017-7#-00000390,1.0,"The construction of dam was started in July, 2011 and completed in June, 2014 at a cost of PKR 142 million.FATA Development Authority » Zao Small Dam in Khyber Agency The dam has a height of 85 feet, covered a length of around 270 feet, with actual storage capacity of water 800 acre feet."
PK-2006-5#-00000115,2.0,"One water turbine supplies fresh water, the result of a project of the World Health Organization, but they have not worked for 14 to 15 years."
PK-2006-5#-00000713,1.0,"Departments  Basic Sciences Anatomy Physiology Biochemistry Pharmacology and therapeutics Pathology and microbiology Preventive medicine Forensic medicine and toxicology  Clinical sciences Medicine (including neurology, pulmonology, cardiology, gastroenterology and nephrology) Surgery Otolaryngology Ophthalmology Orthopaedic surgery Obstetrics and Gynaecology Paediatrics Psychiatry Radiology Radiation oncology Urology Dermatology Anaesthesiology  Teaching hospitals of Bannu Medical College  Khalifa Gul Nawaz Memorial Hospital Khalifa Gul Nawaz Hospital is a 600-bed hospital located in Bannu Township."
PK-2017-7#-00000502,1.0,"Original usage of this structure can be identified through its sequence of rooms including entrance hall, grand audience hall, retiring rooms for the ruler, and kitchen."
PK-2017-7#-00000495,1.0,"The former fort was captured by Murad Khan of Maqpon Dynasty, the ruler of Baltistan, in the Conquest of Khaplu in the 1590s by cutting off the water and other supplies to the fort."
PK-2017-7#-00000402,3.0,"Speaking on the occasion, Ismail Khan said the Shahtoot dam will provide potable water to more than 2 million residents of Kabul, in addition to the irrigation of 4,000 hectares of land in Char Asiab and neighboring districts."
PK-2017-7#-00000487,1.0,The town management society of Dourkhan is working on development and infrastructure improvement with the support of Aga Khan Development Network and other international non-governmental organizations.
PK-2006-5#-00000720,1.0,"Andritz Hydro Austria has supplied and installed the complete electro-mechanical equipment and services with the focus on its ""water to wire"" concept. Dam Type: Concrete gravity dam Length: 202 m. Height: 40.5 m. Design Discharge: 29 Cusecs Headrace Tunnel Length: 4.873 km Design Head: 535 m.http://eng.sinohydro.com/index.php?m=content&c=index&a=show&catid=42&id=105   See also    Allai Khwar Hydropower Plant  Gomal Zam Dam  List of dams and reservoirs in Pakistan  List of power stations in Pakistan  Satpara Dam   References   Category:Energy infrastructure completed in 2014 Category:Hydroelectric power stations in Pakistan Category:Run-of-the-river power stations Category:2014 establishments in Pakistan Category:Dams in Khyber Pakhtunkhwa"
PK-2017-7#-00000520,1.0,See also    List of dams and reservoirs in Pakistan  List of power stations in Pakistan  Khan Khwar Hydropower Project  Satpara Dam  Gomal Zam Dam  Duber Khwar hydropower project  Kohala Hydropower Project   References   Category:Energy infrastructure completed in 2012 Category:Hydroelectric power stations in Pakistan Category:Run-of-the-river power stations Category:Dams in Khyber Pakhtunkhwa
PK-2006-5#-00000738,1.0,"The Project is based on the state of the art, water to wire concept developed by Andritz Hydro for the supply, installation and commissioning of the hydro power plants. From the intake there will be a headrace channel leading to the tunnel, which will discharge the flow into the surge chamber and a combination of vertical and horizontal pressure shafts from where water flows to the surface powerhouse which is located on the left bank of Mastuj River, just downstream from the confluence of the Golen Gol and the Mastuj River."
PK-2006-5#-00000303,1.0,"Sir Ganga Ram (1851–1927), a civil engineer and leading philanthropist of his time, established Renala Hydral Power Station in 1925, Pakistan's (Indian subcontinent's) first hydropower station.http://www.projectsmonitor.com/engg-legends/sir-ganga-ram-civil-engineer-renala-hydropower-station/ Sir Ganga Ram, engineer and philanthropist, born in 1851 in Mangtanwala, a small village of Punjab province in British India, now in Punjab, Pakistan, were leading philanthropist and agriculturist of his time and established the Renala hydropower station in Renala Khurd, Punjab, in 1925.http://www.projectsmonitor.com/engg-legends/sir-ganga-ram-civil-engineer-renala-hydropower-station/   See also    List of dams and reservoirs in Pakistan  List of power stations in Pakistan  Satpara Dam  Allai Khwar Hydropower Project  Gomal Zam Dam  References  Category:Dams completed in 1925 Category:Energy infrastructure completed in 1925 Category:Dams in Pakistan Category:Hydroelectric power stations in Pakistan Category:Run-of-the-river power stations Category:Energy in Punjab, Pakistan"
PK-2006-5#-00000294,1.0,"See also    Duber Khwar Hydroelectric Plant  Gomal Zam Dam  Khan Khwar Hydropower Plant  List of dams and reservoirs in Pakistan  List of power stations in Pakistan  Satpara Dam   References   Category:Dams completed in 1959 Category:Energy infrastructure completed in 1959 Category:Dams in Pakistan Category:Run-of-the-river power stations Category:Hydroelectric power stations in Pakistan Category:Energy in Punjab, Pakistan"
PK-2006-5#-00000407,1.0,"See also    List of dams and reservoirs in Pakistan  List of power stations in Pakistan  Khan Khwar Hydropower Project  Duber Khwar hydropower project   References   Category:Dams completed in 1963 Category:Energy infrastructure completed in 1963 Category:Dams in Pakistan Category:Run-of-the-river power stations Category:Hydroelectric power stations in Pakistan Category:1963 establishments in Pakistan Category:Energy in Punjab, Pakistan"
PK-2006-5#-00000107,1.0,"See also    List of dams and reservoirs in Pakistan  List of power stations in Pakistan  Khan Khwar Hydropower Project  Satpara Dam  Gomal Zam Dam  Duber Khwar hydropower project   References   Category:Dams in Pakistan Category:Dams completed in 1961 Category:Hydroelectric power stations in Pakistan Category:Energy infrastructure completed in 1961 Category:Gujrat, Pakistan Category:Energy in Punjab, Pakistan"
PK-2017-7#-00000017,1.0,Salient technical features  Installed capacity: 22 MW (4 Units of 5.5 MW each)  Annual net electrical output: 122 GWh   Design discharge: 34 m3/s (8.5 m3/s per unit)   Rated net: head 76.8 m  Generation voltage: 11 kV  Transmission voltage: 132 kV   See also    List of dams and reservoirs in Pakistan  List of power stations in Pakistan  Satpara Dam  Gomal Zam Dam  Duber Khwar hydropower project   References   Category:Dams completed in 1938 Category:Energy infrastructure completed in 1938 Category:Dams in Pakistan Category:Hydroelectric power stations in Pakistan Category:Run-of-the-river power stations
PK-2006-5#-00000787,1.0,Salient Technical Features Installed Capacity: 20 MW (4 Units of 5.0 MW each) Annual Net Electrical Output: 162 GWh  Design Discharge: 34 m3/s (8.5 m3/s per unit)  Rated Net: Head 76.8 m  Generation Voltage: 11 kV  Transmission Voltage: 132 kV   See also    List of dams and reservoirs in Pakistan  List of power stations in Pakistan  Khan Khwar Hydropower Project  Satpara Dam  Gomal Zam Dam  Duber Khwar hydropower project   References   Category:Dams completed in 1952 Category:Hydroelectric power stations in Pakistan Category:Run-of-the-river power stations Category:Dams in Pakistan Category:1952 establishments in Pakistan Category:Energy infrastructure completed in 1952
PK-2006-5#-00000205,1.0,"Following are the categories of  these awards: Presidential National Iqbal Award (Urdu) – Annual basis Presidential National Iqbal Award (English) – Three year basis Presidential Iqbal Award (Pakistani Languages) – Three year basis Presidential International Iqbal Award – Three year basis  IT, Websites, Mobiles Applications Utilising modern means of dissemination the Academy’s IT Section promotes the organisational mission through various initiatives, including: Planning, development, maintenance and implementation of IT Policy, infrastructure and Management Information System."
PK-2006-5#-00000720,1.0,Work on the water diversion tunnel was inaugurated December 2018.
PK-2017-7#-00000014,1.0,The total cost of the project is about PKR 10.73 billion out of which PKR 5.049 billion is accounted for foreign exchange component.http://www.aaj.tv/2012/07/72-mw-khan-khwar-hydro-power-project-inaugurated-by-pm/   Dam: Type: RCC Length: 112 m. Height: 46 m. Design Discharge: 29 Cusecs Design Head: 244 m.   See also    List of dams and reservoirs in Pakistan  List of power stations in Pakistan  Satpara Dam  Allai Khwar Hydropower Project  Gomal Zam Dam   References   Category:Dams completed in 2012 Category:Energy infrastructure completed in 2012 Category:Dams in Pakistan Category:Hydroelectric power stations in Pakistan Category:Run-of-the-river power stations Category:Dams in the Indus River basin Category:China–Pakistan relations Category:Dams in Khyber Pakhtunkhwa
PK-2006-5#-00000720,1.0,Dam: Type: RCC Length: 88 m. Height: 51 m. Design Discharge: 29 Cusecs Design Head: 687 m.   See also    List of dams and reservoirs in Pakistan  List of power stations in Pakistan  Khan Khwar Hydropower Project  Satpara Dam  Gomal Zam Dam  Duber Khwar hydropower project   References   Category:Dams completed in 2012 Category:Energy infrastructure completed in 2012 Category:Dams in Pakistan Category:Hydroelectric power stations in Pakistan Category:Dams in the Indus River basin Category:Run-of-the-river power stations Category:Dams in Khyber Pakhtunkhwa
PK-2006-5#-00000748,1.0,A water canal is flowing between the village from west to east.
PK-2006-5#-00000456,2.0,"Moreover, Nai Gaj Dam will supply 50 cusecs of water to the Lake Manchar for decreasing its pollution."
PK-2006-5#-00000246,1.0,"The barrage diverts an average of  of water into the  long Thal Canal where it serves areas in Bhakkar, Khushab, Layyah, Mianwali and Muzaffargarh Districts with  of additional canal branches and distributors."
PK-2017-7#-00000133,1.0,"The land of 65 acres for this campus was donated by the Punjab Government of that time, but the development and infrastructure was built and maintained by donations, contributions, fund raising and tuition fees."
PK-2006-5#-00000211,1.0,"Fodder for animals, hot and cold water, and bed steads were provided free of charge. The sarai also had a physician, as well as a resident baker, and a water well located outside of the walls of the sarai."
PK-2006-5#-00000211,1.0,"The tomb once had a water reservoir, which fed into fountains and pathways."
PK-2006-5#-00000928,1.0,"In the past, Jungle piralizai comprised a small number of houses with no proper roads, water or electricity, hospital except one primary school built during the times of President Ayub Khan. Drinking water was salty and scarce."
PK-2006-5#-00000371,1.0,"Underground water owing to the nearby Salt Range is sour qua Salt. Owing to being on the tail of the canal now water resources are meagre to meet the purpose, therefore the poor Farmers families are selling their agricultural land on throw-away price and are leaving for nearby cities."
PK-2006-5#-00000194,1.0,"History In 1984, the idea of the building a child healthcare institute was presented in the annual meeting of Pakistan Paediatric Association."
PK-2006-5#-00000082,2.0,"Water was supplied only by irrigation, and portable containers stored rainwater."
PK-2017-7#-00000562,2.0,It withdraws water released from the existing Mangla Dam and returns that water to the main stem of the Jhelum River through a 7.5 km long tailrace constructed in a sub-channel of the River Jhelum.
PK-2006-5#-00000339,1.0,An Aqueduct connected to 30 lines provided a reliable water supply.
PK-2017-7#-00000552,1.0,"(subscription required) A major earthquake in 2005 killed at least 100,000 people and left another three million people displaced, causing widespread devastation to the region's infrastructure and economy. Since then, with help from the Government of Pakistan and foreign aid, reconstruction of infrastructure is underway. Development According to the project report by the Asian Development Bank, the bank has set out development goals for Azad Kashmir in the areas of health, education, nutrition, and social development."
PK-2006-5#-00000838,1.0,"SKMCH&RC, Peshawar is built according to the latest international healthcare standards and its covered area is even bigger than SKMCH&RC, Lahore. The research section has been developed over the last five years and, recently, received a donation to refurbish the third floor of the hospital into a research wing, housing a suite of research laboratories, a data management and epidemiology division, as well as a clinical research section responsible for clinical trials."
PK-2006-5#-00000324,2.0,"Dunes were fixed and stabilized by mechanical and vegetative means, and the area is now covered with trees with orchards of zizyphus, date palms, and grassland grown with collected rainwater and saline groundwater."
PK-2006-5#-00000925,3.0,"Rivers and lakes  [[File:Aerial photograph of Kandahar Province in 2011.jpg|thumb|Helmand River and Boghra Canal running parallel in Helmand Province]] [[File:Lake Band-e-Amir.jpg|left|thumb|Band-e Amir in central Afghanistan]] left|thumb|Scenic view in western Afghanistan [[File:River in Badakhshan province of Afghanistan.jpg|thumb|The Kokcha River in Badakhshan Province]] Afghanistan usually does not face much water shortage because it receives snow during winter and once that melts the water runs into numerous rivers, lakes, and streams, but most of its national water flows into neighboring countries."
PK-2017-7#-00000382,5.0,1910. p. 242    Category:Gulfs of Iran Category:Seas of Iran Category:Bodies of water of Iran Oman Category:Bodies of water of Pakistan Category:Bodies of water of Oman Category:Bodies of water of the United Arab Emirates Oman Category:Bodies of water of the Arabian Sea Category:Iran–Pakistan border Category:Oman–United Arab Emirates border
PK-2006-5#-00000358,1.0,"Furthermore, rates of craniofacial trauma and infection increased through time demonstrating that the civilisation collapsed amid illness and injury. The bioarchaeologists who examined the remains have suggested that the combined evidence for differences in mortuary treatment and epidemiology indicate that some individuals and communities at Harappa were excluded from access to basic resources like health and safety."
PK-2006-5#-00000668,1.0,"The temple complex is spread on two interconnected islands; Sadh Belo having kitchen, verandah, many temples, and Deen Belo which houses samadhis, a park, and Rishi Nol mandir. She gave him an oblong metal object called Kamandal and told him that, as long as this object is in the complex, there won't be any shortage of grain for the community kitchen. The annual death anniversary of Baba Bankhandi Maharaj called the Baba Bankhandi Maharaj Mela attended by thousands and is celebrated by a three-day festival in which pilgrims are provided with free lodging, food, and water."
PK-2017-7#-00000494,1.0,"Melt waters from glaciers, such as those south and east of K2, feed agriculture in the valleys and contribute significantly to the regional fresh-water supply."
PK-2006-5#-00000654,1.0,Now Tando Adam has a medical college namely;'Suleman Roshan  Medical College' at Hyderabad Road near Suleman Roshan Hospital and also has a water park at green city near Hyderabad road.both are created by senator Imamuddin Shouqeen  Economic activity The town has many emerging and established industries with Ismail jee considered the trade hub of the district.
PK-2006-5#-00000699,2.0,Salt water was drained out and an embankment was constructed around the lake which was fed with fresh water through a canal.
PK-2006-5#-00000244,1.0,"The nearby Kurran-Garhi Project (finished in 1962) provides flood control and is used for irrigation and power. Most of the flat terraces available along the river are utilized for agriculture for which water from the river is utilised. Moreover, there exist number of irrigation canals and civil channels on overtaking from the river."
PK-2006-5#-00000883,1.0,"In total, 174 mammals, 177 reptiles, 22 amphibians, 198 freshwater fish species and 5,000 species of invertebrates (including insects) have been recorded in Pakistan. Pakistan has the second-highest rate of deforestation in the world, which, along with hunting and pollution, has had adverse effects on the ecosystem. Land and water resources have not risen proportionately, but the increases have taken place mainly due to gains in labour and agriculture productivity. Infrastructure   Pakistan was recognised as the best country for infrastructure development in South Asia during the IWF and World Bank annual meetings in 2016. According to the WEF's Global Competitiveness Report, quality ratings of Pakistan's port infrastructure increased from 3.7 to 4.1 between 2007 and 2016. Science and technology   Developments in science and technology have played an important role in Pakistan's infrastructure and helped the country connect to the rest of the world. The Pakistan government reportedly spends ₨ 4.6 billion on information technology projects, with emphasis on e-government, human resources, and infrastructure development. Expenditure on healthcare was ~2.8% of GDP in 2013. There is a Roman Catholic community in Karachi that was established by Goan and Tamil migrants when Karachi's infrastructure was being developed by the British during the colonial administration between World War I and World War II. Several examples of architectural infrastructure demonstrating the influence of British design can be found in Lahore, Peshawar, and Karachi."
PK-2006-5#-00000001,2.0,"Furthermore, it must be kept in mind the sole purpose of Tarbela Dam is to provide water for irrigation. At times when irrigation requirement is low, water flow through the channel is low and so is the power generation. Environmental aspects  The project has negligible impact on existing groundwater table or quality of water due to complete length of the power channel being concrete-based."
PK-2006-5#-00000146,1.0,"The word Punjab was formally introduced in the early 17th century CE as an elision of the Persian words panj (five) and āb (water), thus meaning the (land of) five rivers, similar in meaning to the Sanskrit and Greek name for the region. 190px|thumb|right|Industrial Zones Punjab, Source: Despite its tropical wet and dry climate, extensive irrigation makes it a rich agricultural region. Attaining self-sufficiency in agriculture has shifted the focus of the strategies towards small and medium farming, stress on barani areas, farms-to-market roads, electrification for tube-wells and control of water logging and salinity."
PK-2006-5#-00000321,1.0,"Two important infrastructure projects were commissioned. Canada and United States The plutonium used in the test was created in the CIRUS reactor supplied by Canada and using heavy water supplied by the United States. Canada concluded that the test violated a 1971 understanding between the two states, and froze nuclear energy assistance for the two heavy water reactors then under construction."
PK-2006-5#-00000883,1.0,"The division also divided the natural resources, industries, economic infrastructure, manpower, and military might, with India as the larger share owner."
PK-2006-5#-00000861,1.0,"http://uswat.edu.pk/  Since the rule of the Mian family in Saidu Sharif, Swat has set the excellent ground for education and infrastructure improving its image as a well preserve touristic site."
PK-2017-7#-00000083,3.0,"In case of unavoidable circumstances a joint irrigation /regulation system to apply the minimum water to avoid damages of watercourses and canal irrigation system. District tank is one of the most backward districts of KP and even the people have an acute problem of clean drinking water, and the operationalization of the waran canal indirectly contribute to the need of safe drinking water by rising the under ground water table."
PK-2017-7#-00000463,1.0,"thumb|right|Lake of Simly dam Simly Dam is an  high earthen embankment dam on the Soan River,  east of Islamabad and Rawalpindi in Rawalpindi District, Punjab, Pakistan.PERMEABILITY TESTS AT THE SIMLY DAM PROJECT It is the largest reservoir of drinking water to people living in Islamabad, the capital of Pakistan. The water stored in this dam is fed by the melting snow & natural springs of Murree hills."
