DHSID_EA,relevance_score,most_relevant_sentences
PH-2017-7#-00000435,1.0,On-campus dormitories: Four students share one room with a bathroom.
PH-2017-7#-00000435,2.0,"Lotus Pond was the site for several water sporting events for World Games 2009, including canoe polo, water ski, and dragon boat."
PH-2003-4#-00000579,1.0,"Aquino privatized many of the utilities the government owned, such as water and electricity. Duterte initiated the ""Build, Build, Build"" program in 2017 that aimed to usher the Philippines into a new ""golden age of infrastructure"" and was expected to create more jobs and business opportunities, which, in turn, would sustain the country's economic growth and accelerate poverty reduction. The country is expected to spend $160 billion to $180 billion up to 2022 for the public investments in infrastructure."
PH-2003-4#-00000255,1.0,"The volcano has a 2,500 m (8202 ft) crater that is breached to the east along a narrow valley drained by the Cabongaan water stream."
PH-2008-5#-00000018,1.0,"The Sky Garden's water features include two bubblers, a simulated river flowing at the central part of the park, and waterfalls at the end of the second floor which can also be used as a screen where promotional materials can be projected."
PH-2017-7#-00000435,1.0,"On 1958, the A Company of the 802nd Engineer Aviation Battalion, US Army Corps of Engineers was deployed to Tainan Air Force Base for infrastructure work, construction of new base buildings, and laying of new concrete runways."
PH-2017-7#-00000580,1.0,"The special economic zone is also adjacent to a body of water, the Subic Bay."
PH-2008-5#-00000173,1.0,"Moments later, seamen in Wyffels spotted the first wave of attacking planes as they came into view low over the water, some four miles away."
PH-2017-7#-00000530,1.0,"Thus, upon the suggestion of Prof. Kenzo Hemmi, IRRI BOT chair, PhilRice sought infrastructure and technical assistance from the Government of Japan through the Japan International Cooperation Agency (JICA)."
PH-2003-4#-00000694,1.0,"In October 1882, a typhoon hit the country causing the rise of flood water, reaching within the church's vicinity."
PH-2003-4#-00000571,1.0,"This is because it serves as a catch basin for runoff water from higher elevated Quezon City, as Sampaloc used to be a swamp-marsh area."
PH-2003-4#-00000099,1.0,"To date, CLSU is one of the premiere institutions for agriculture in the Philippines and in Southeast Asia known for its research in aquaculture, ruminants, crops, orchard, and water management. To date, CLSU is one of the premier institutions of agriculture in Southeast Asia known for its breakthrough researches in aquatic culture (pioneer in the sex reversal of tilapia), ruminant, crops, orchard, and water management researches. A modern auditorium was later built beside Reimer's Hall during the time of then CLSU president Amado Campos, who changed the complexion of the campus with his more than P45-million infrastructure build-up during his term from 1972 to 1986."
PH-2003-4#-00000683,1.0,"In 2010 the hotel embarked on a program called ""Green Housekeeping"" in order to reduce the use of chemicals and improve cleanliness, with initiatives like low-temperature washing and lower electricity use."
PH-2008-5#-00000154,2.0,"SRPC substantially completed the SRMP at midnight, February 14, 2003, at which time its peaking power, irrigation, flood control and enhanced water quality benefits became available to the surrounding regions, which include the Northwest Luzon Economic Growth Quadrangle."
PH-2003-4#-00000290,1.0,"History The name Calagnaan comes from dagna or lagna, which is the Visayan word for water springs several of which can be found on the island."
PH-2017-7#-00000435,1.0,Its water is clear and unpolluted.
PH-2017-7#-00000435,1.0,History The water tower was constructed in the 1960s. The existing water piping is painted and transformed into installation art to accentuate the theme of the park.
PH-2017-7#-00000435,1.0,"The Farglory Ocean Park () or Hualien Ocean Park is a water theme park in Yanliao Village, Shoufeng Township, Hualien, Taiwan."
PH-2003-4#-00000579,1.0,The fountain was installed in a  diameter pool and the 222 RGB LED lamps light up the water in various colors.
PH-2017-7#-00000271,1.0,The mall has its disaster resilient features which include expansion joints for mitigating earthquake damage and rainwater catchment basin for prevention of flood within its perimeter and surrounding community.
PH-2008-5#-00000594,1.0,"They have also seized 5 water vessels, one motor launch and four jungkungs (motorboat)."
PH-2017-7#-00000435,1.0,"The third floor is the guest room, youth activity center, office and kitchen."
PH-2017-7#-00000435,1.0,"In 1919, the Japanese colonial government constructed a dam to generate hydroelectric power, causing the lake's water level to rise."
PH-2017-7#-00000308,1.0,"The rectory had a kitchen, two brick chimneys, four rooms and offices. Over time, the painting had developed some discolorations and acquired dirt and insect excrement."
PH-2003-4#-00000625,1.0,"In July 2010, the leak of the underground pipeline of the First Philippine Industrial Corporation (FPIC), which carries oil from the oil refineries in the province of Batangas to Pandacan, caused the contamination of water bed table at the basement of West Tower Condominium in Bangkal in Makati."
PH-2008-5#-00000106,1.0,"The government also reconstructed buildings, restored water supply, and set up a field hospital to provide immediate medical response such as delivery of babies, perform surgeries and treatment of more than 2,800 victims."
PH-2017-7#-00000435,1.0,The lake has water all year round but it changes levels according to the seasons.
PH-2017-7#-00000435,2.0,"Geography The reservoir can contain 9,790,000 m3 of water as the main water resource of Chiayi City."
PH-2017-7#-00001154,1.0,The falls are cascades of cold water that plunges into a natural pool.
PH-2017-7#-00000302,1.0,"Government investment has focused largely on infrastructure improvements, with the circle last being renovated in 2006, and a bike lane connecting it to the Paraiso ng Batang Maynila opening in 2012."
PH-2017-7#-00000435,1.0,"Water Square offers 20-minute-long ""water dances"" several times a day."
PH-2017-7#-00000435,1.0,"thumb|SWCB Nantou Branch  The Soil and Water Conservation Bureau (SWCB; ) is the agency of the Council of Agriculture of the Taiwan (ROC) with the main tasks of soil and water conservation, watershed management and erosion control."
PH-2017-7#-00000435,3.0,"Unit 1 was operating at full power on 25 March 2005 when the reactor tripped on low-low water level in steam generator C. Prior to the trip, the high water level alarm in steam generator C was triggered when the water level kept rising and the main feedwater control valve did not respond to manual intervention."
PH-2017-7#-00000302,1.0,Replacement of main water tank with 2 new tanks in Assumption Building.
PH-2017-7#-00000435,1.0,Design The layout of the storage trenches was designed to the surrounding topography and ground water table. See also   List of power stations in Taiwan  Nuclear power in Taiwan  References  Category:1980 establishments in Taiwan Category:Buildings and structures in Taitung County Category:Energy infrastructure completed in 1980 Category:Nuclear power in Taiwan Category:Radioactive waste repositories
PH-2003-4#-00000141,1.0,"It overlooks four bodies of water – Taal Lake, Balayan Bay, Laguna de Bay and Manila Bay."
PH-2017-7#-00000435,1.0,See also   List of power stations in Taiwan  List of coal power stations  Electricity sector in Taiwan   References   Category:2002 establishments in Taiwan Category:Buildings and structures in Hualien County Category:Coal-fired power stations in Taiwan Category:Energy infrastructure completed in 2002
PH-2017-7#-00000435,1.0,See also   List of power stations in Taiwan  List of coal power stations  Electricity sector in Taiwan  References  Category:1982 establishments in Taiwan Category:Buildings and structures in Kaohsiung Category:Coal-fired power stations in Taiwan Category:Energy infrastructure completed in 1982
PH-2017-7#-00000435,1.0,"The cooling system for the plant comes directly from the sea water with a total usage amount of 200,000 tons per day. See also   List of power stations in Taiwan  List of coal power stations  Electricity sector in Taiwan  References  Category:1999 establishments in Taiwan Category:Buildings and structures in Yunlin County Category:Coal-fired power stations in Taiwan Category:Energy infrastructure completed in 1999"
PH-2017-7#-00000435,1.0,See also   List of power stations in Taiwan  Electricity sector in Taiwan  References  External links   Talin power station at SourceWatch  Category:1969 establishments in Taiwan Category:Buildings and structures in Kaohsiung Category:Coal-fired power stations in Taiwan Category:Energy infrastructure completed in 1969
PH-2017-7#-00000435,1.0,See also   List of power stations in Taiwan  List of natural gas power stations  Electricity sector in Taiwan  References  Category:1983 establishments in Taiwan Category:Buildings and structures in Miaoli County Category:Energy infrastructure completed in 1983 Category:Natural gas-fired power stations in Taiwan Category:Oil-fired power stations in Taiwan
PH-2017-7#-00000435,1.0,See also   List of power stations in Taiwan  Electricity sector in Taiwan  References  Category:2003 establishments in Taiwan Category:Buildings and structures in Chiayi County Category:Energy infrastructure completed in 2003 Category:Natural gas-fired power stations in Taiwan
PH-2017-7#-00000435,4.0,"Awards The power plant won the 2006 Water Conservation Outstanding Performance Awards for its effort in implementing water saving at the plant, especially in the recycling and reusing of boiler drain water and waste water."
PH-2017-7#-00000435,1.0,The installed capacity of the power plant is 980 MW.http://www.tepco.co.jp/en/press/corp-com/release/betu04_e/images/040329e1.pdf   See also    List of power stations in Taiwan  Electricity sector in Taiwan   References   Category:2004 establishments in Taiwan Category:Buildings and structures in Tainan Category:Energy infrastructure completed in 2004 Category:Natural gas-fired power stations in Taiwan
PH-2017-7#-00000435,1.0,See also   List of power stations in Taiwan  Electricity sector in Taiwan  References  Category:1982 establishments in Taiwan Category:Buildings and structures in Taitung County Category:Energy infrastructure completed in 1982 Category:Oil-fired power stations in Taiwan
PH-2017-7#-00000435,1.0,See also    List of power stations in Taiwan  Electricity sector in Taiwan   References   Category:2009 establishments in Taiwan Category:Buildings and structures in Changhua County Category:Energy infrastructure completed in 2009 Category:Natural gas-fired power stations in Taiwan
PH-2017-7#-00000435,1.0,See also   List of power stations in Taiwan  Electricity sector in Taiwan  References  Category:2004 establishments in Taiwan Category:Buildings and structures in Changhua County Category:Energy infrastructure completed in 2004 Category:Natural gas-fired power stations in Taiwan
PH-2017-7#-00000435,1.0,See also    List of power stations in Taiwan  Electricity sector in Taiwan   References   Category:2000 establishments in Taiwan Category:Buildings and structures in Penghu County Category:Energy infrastructure completed in 2000 Category:Oil-fired power stations in Taiwan
PH-2017-7#-00000435,1.0,History The park used to be a landfill. See also  List of parks in Taiwan  References  Category:Former landfills in Taiwan Category:Parks in Kaohsiung
PH-2017-7#-00000435,1.0,See also  Port of Taichung  References  Category:1989 establishments in Taiwan Category:Ports and harbors of Taichung Category:Transport infrastructure completed in 1989
PH-2017-7#-00000435,3.0,"Once it passes the factories, the river comes to the Shihlong Creek and Yuanjhonggang Creek water intake stations, which supply irrigation water for 1,390 hectares of farmland in Ciaotou and Yanchao District."
PH-2017-7#-00000435,1.0,"The goal of the project was to provide irrigation for over 100-thousand hectares of farmland in the Chianan area. After construction of the reservoir, the irrigation plain became an important producer of rice for consumption in Taiwan and Japan, with three rice harvests possible each year. Construction of the reservoir and of the Wusanto Dam used an uncommon semi-hydraulic fill technique, where fine-grained material is placed at the end of an embankment and then washed into its desired position using jets of water; this is a variant of the hydraulic fill technique."
PH-2017-7#-00000435,2.0,It has a capacity to store water for irrigation of over 130 hectares of farmland.
PH-2017-7#-00000435,1.0,Features The hot spring water is abundant and the cherry blossoms are graceful during the blossom season. The water is colorless and odorless. Visitors can also play with water or fish in the rivers nearby.
PH-2017-7#-00000435,2.0,"Holistic Health Care Demonstration Center  The nursing school has been established a very thorough Holistic Health Care Demonstration Center that is mainly aimed the trend at ageing society and accorded with modern streams contains the area of simulated experience ageing, a residence for an elderly, activating exercise program for psychomotor function with visual aids, long-term care demonstrations, bath and shower."
PH-2017-7#-00000424,1.0,"It has been the drainage of mine tailings from copper and gold mines in Tuba, Benguet."
PH-2008-5#-00000036,1.0,"It also refers to the healthcare facility complex that is occupied by the unit along V. Luna Avenue in Pinyahan, Quezon City."
PH-2003-4#-00000097,1.0,"Underneath Mount Guiwan, a tunnel that diverts water from the Casecnan River in Brgy."
PH-2017-7#-00000435,1.0,Technical specifications The water intake for the reservoir inside the dam comes from Bazhang River.
PH-2017-7#-00000435,3.0,"Its water surface spans over an area of 4.32 km2 with a maximum depth of 300 m.  Functions The dam supplies water to the public in Taichung City and Miaoli County, as well as 4,209 hectares of irrigation area."
PH-2017-7#-00000435,1.0,"Features After the development of the lake into a scenic spot, the lake becomes the site of various recreational activities, such as light boat sailing, water sports, etc."
PH-2008-5#-00000501,1.0,"Large sea fans and sponges live in the areas with deeper water, as does branch coral."
PH-2017-7#-00000435,2.0,"The dam was designed by Yoichi Hatta and built between 1920 and 1930 during Japanese rule to provide irrigation water for the Chianan Plain as part of the Chianan Irrigation system. Because the natural flow of the Guantian River and other local streams was insufficient for irrigation of a planned , a tunnel was constructed to divert water from the Zengwun River to fill the reservoir."
PH-2017-7#-00000435,1.0,"The dam supplies water to a power station consisting of four 45 megawatt (MW) turbines for a total capacity of 180 MW, generating 507 million kilowatt hours per year. The dam was built between 1957 and 1961 and stands  high and  long, holding up to  of water."
PH-2017-7#-00000435,1.0,"The dam is  high and  long, with a storage capacity of  of water. It supplies water to a power station consisting of one 105 megawatt (MW) turbine and four 22.5 MW turbines for a capacity of 195 MW, generating 557 million kilowatt hours per year."
PH-2017-7#-00000435,1.0,"The dam supplies water through a tunnel to a 133.47 MW power station near Xinshe with two 66.735 MW turbines, generating 410.2 million kilowatt hours per year."
PH-2017-7#-00000435,1.0,"The dam supplies water to a power station with a capacity of 360 megawatts (MW) from four 90 MW turbines, generating 591 million kilowatt hours annually."
PH-2017-7#-00000435,1.0,"The dam was built from 1974 to 1977 for flood control and irrigation purposes, and stands  high and  long, holding a reservoir with an original capacity of . Subsequently, an embankment cofferdam was built to prevent water from flowing through the breach, while the collapsed section has been retained as a memorial. Since this reduces the storage capacity of the dam, it is no longer used for flood control, but remains an important source of agricultural water."
PH-2017-7#-00000435,1.0,"A reservoir would be required to control the flow of water to the power stations and serve the dual purposes of flood control and trapping sediment. The Wushe Reservoir's normal water level is , with a flood level of , and covers an area of . In 1943, it began generating power using water from Wanda Creek, which joins with the Wushe Creek here to form the Zhuoshui River. In 1957 generating units G1 and G2 were put into service, using water from the Wushe reservoir at a gross head of . See also  List of dams and reservoirs in Taiwan Minghu Dam Mingtan Dam Sun Moon Lake Wujie Dam Electricity sector in Taiwan  References  External links  Current water levels at Taiwan reservoirs (Chinese)  Category:1960 establishments in Taiwan Category:Arch-gravity dams Category:Dams completed in 1960 Category:Dams in Nantou County Category:Hydroelectric power stations in Taiwan"
PH-2017-7#-00000435,1.0,"The dam was built in two stages, from 1919–1922 and 1927–1934, and serves primarily to divert water from the Zhuoshui River to a storage reservoir at Sun Moon Lake and its associated hydroelectric projects (Mingtan Pumped Storage Hydro Power Plant and Minhu Pumped Storage Hydro Power Station)."
PH-2017-7#-00000642,1.0,"Old pictures of the different areas of the house are also displayed inside because these were Doña Carmen's way of reminding the maids how they should fix the curtains, furniture and other fixtures back in place when they are removed for cleaning. The bathrooms still has its original and working plumbing fixtures from the 1930s."
PH-2003-4#-00000290,1.0,"History The name Calagnaan comes from dagna or lagna, which is the Visayan word for water springs several of which can be found on the island."
PH-2017-7#-00000435,1.0,Its water is clear and unpolluted.
PH-2017-7#-00000435,1.0,History The water tower was constructed in the 1960s. The existing water piping is painted and transformed into installation art to accentuate the theme of the park.
PH-2017-7#-00000435,1.0,"The Farglory Ocean Park () or Hualien Ocean Park is a water theme park in Yanliao Village, Shoufeng Township, Hualien, Taiwan."
PH-2003-4#-00000579,1.0,The fountain was installed in a  diameter pool and the 222 RGB LED lamps light up the water in various colors.
PH-2017-7#-00000271,1.0,The mall has its disaster resilient features which include expansion joints for mitigating earthquake damage and rainwater catchment basin for prevention of flood within its perimeter and surrounding community.
PH-2008-5#-00000594,1.0,"They have also seized 5 water vessels, one motor launch and four jungkungs (motorboat)."
PH-2017-7#-00000435,1.0,"The third floor is the guest room, youth activity center, office and kitchen."
PH-2017-7#-00000435,1.0,"In 1919, the Japanese colonial government constructed a dam to generate hydroelectric power, causing the lake's water level to rise."
PH-2017-7#-00000308,1.0,"The rectory had a kitchen, two brick chimneys, four rooms and offices. Over time, the painting had developed some discolorations and acquired dirt and insect excrement."
PH-2003-4#-00000625,1.0,"In July 2010, the leak of the underground pipeline of the First Philippine Industrial Corporation (FPIC), which carries oil from the oil refineries in the province of Batangas to Pandacan, caused the contamination of water bed table at the basement of West Tower Condominium in Bangkal in Makati."
PH-2008-5#-00000106,1.0,"The government also reconstructed buildings, restored water supply, and set up a field hospital to provide immediate medical response such as delivery of babies, perform surgeries and treatment of more than 2,800 victims."
PH-2017-7#-00000435,1.0,The lake has water all year round but it changes levels according to the seasons.
PH-2017-7#-00000435,2.0,"Geography The reservoir can contain 9,790,000 m3 of water as the main water resource of Chiayi City."
PH-2017-7#-00001154,1.0,The falls are cascades of cold water that plunges into a natural pool.
PH-2017-7#-00000302,1.0,"Government investment has focused largely on infrastructure improvements, with the circle last being renovated in 2006, and a bike lane connecting it to the Paraiso ng Batang Maynila opening in 2012."
PH-2017-7#-00000435,1.0,"Water Square offers 20-minute-long ""water dances"" several times a day."
PH-2017-7#-00000435,1.0,"thumb|SWCB Nantou Branch  The Soil and Water Conservation Bureau (SWCB; ) is the agency of the Council of Agriculture of the Taiwan (ROC) with the main tasks of soil and water conservation, watershed management and erosion control."
PH-2017-7#-00000435,3.0,"Unit 1 was operating at full power on 25 March 2005 when the reactor tripped on low-low water level in steam generator C. Prior to the trip, the high water level alarm in steam generator C was triggered when the water level kept rising and the main feedwater control valve did not respond to manual intervention."
PH-2017-7#-00000302,1.0,Replacement of main water tank with 2 new tanks in Assumption Building.
PH-2017-7#-00000435,1.0,Design The layout of the storage trenches was designed to the surrounding topography and ground water table. See also   List of power stations in Taiwan  Nuclear power in Taiwan  References  Category:1980 establishments in Taiwan Category:Buildings and structures in Taitung County Category:Energy infrastructure completed in 1980 Category:Nuclear power in Taiwan Category:Radioactive waste repositories
PH-2003-4#-00000141,1.0,"It overlooks four bodies of water – Taal Lake, Balayan Bay, Laguna de Bay and Manila Bay."
PH-2017-7#-00000435,1.0,See also   List of power stations in Taiwan  List of coal power stations  Electricity sector in Taiwan   References   Category:2002 establishments in Taiwan Category:Buildings and structures in Hualien County Category:Coal-fired power stations in Taiwan Category:Energy infrastructure completed in 2002
PH-2017-7#-00000435,1.0,See also   List of power stations in Taiwan  List of coal power stations  Electricity sector in Taiwan  References  Category:1982 establishments in Taiwan Category:Buildings and structures in Kaohsiung Category:Coal-fired power stations in Taiwan Category:Energy infrastructure completed in 1982
PH-2017-7#-00000435,1.0,"The cooling system for the plant comes directly from the sea water with a total usage amount of 200,000 tons per day. See also   List of power stations in Taiwan  List of coal power stations  Electricity sector in Taiwan  References  Category:1999 establishments in Taiwan Category:Buildings and structures in Yunlin County Category:Coal-fired power stations in Taiwan Category:Energy infrastructure completed in 1999"
PH-2017-7#-00000435,1.0,See also   List of power stations in Taiwan  Electricity sector in Taiwan  References  External links   Talin power station at SourceWatch  Category:1969 establishments in Taiwan Category:Buildings and structures in Kaohsiung Category:Coal-fired power stations in Taiwan Category:Energy infrastructure completed in 1969
PH-2017-7#-00000435,1.0,See also   List of power stations in Taiwan  List of natural gas power stations  Electricity sector in Taiwan  References  Category:1983 establishments in Taiwan Category:Buildings and structures in Miaoli County Category:Energy infrastructure completed in 1983 Category:Natural gas-fired power stations in Taiwan Category:Oil-fired power stations in Taiwan
PH-2017-7#-00000435,1.0,See also   List of power stations in Taiwan  Electricity sector in Taiwan  References  Category:2003 establishments in Taiwan Category:Buildings and structures in Chiayi County Category:Energy infrastructure completed in 2003 Category:Natural gas-fired power stations in Taiwan
PH-2017-7#-00000435,4.0,"Awards The power plant won the 2006 Water Conservation Outstanding Performance Awards for its effort in implementing water saving at the plant, especially in the recycling and reusing of boiler drain water and waste water."
PH-2017-7#-00000435,1.0,The installed capacity of the power plant is 980 MW.http://www.tepco.co.jp/en/press/corp-com/release/betu04_e/images/040329e1.pdf   See also    List of power stations in Taiwan  Electricity sector in Taiwan   References   Category:2004 establishments in Taiwan Category:Buildings and structures in Tainan Category:Energy infrastructure completed in 2004 Category:Natural gas-fired power stations in Taiwan
PH-2017-7#-00000435,1.0,See also   List of power stations in Taiwan  Electricity sector in Taiwan  References  Category:1982 establishments in Taiwan Category:Buildings and structures in Taitung County Category:Energy infrastructure completed in 1982 Category:Oil-fired power stations in Taiwan
PH-2017-7#-00000435,1.0,See also    List of power stations in Taiwan  Electricity sector in Taiwan   References   Category:2009 establishments in Taiwan Category:Buildings and structures in Changhua County Category:Energy infrastructure completed in 2009 Category:Natural gas-fired power stations in Taiwan
PH-2017-7#-00000435,1.0,See also   List of power stations in Taiwan  Electricity sector in Taiwan  References  Category:2004 establishments in Taiwan Category:Buildings and structures in Changhua County Category:Energy infrastructure completed in 2004 Category:Natural gas-fired power stations in Taiwan
PH-2017-7#-00000435,1.0,See also    List of power stations in Taiwan  Electricity sector in Taiwan   References   Category:2000 establishments in Taiwan Category:Buildings and structures in Penghu County Category:Energy infrastructure completed in 2000 Category:Oil-fired power stations in Taiwan
