DHSID_EA,relevance_score,most_relevant_sentences
PH-2017-7#-00000435,1.0,"Facilities The area around the beach provides facilities such as changing rooms, toilets, rental and sale of swimming equipment, restaurants and parking."
PH-2017-7#-00000949,1.0,Housing and construction is mostly simple timber or concrete huts without power or plumbing.
PH-2017-7#-00000435,1.0,"Several years later, the Kaohsiung City Government carried out a conservation plan to protect the soil and water for the abandoned mine area."
PH-2008-5#-00000460,1.0,The island is  above sea level.Tumaguin Island geographical info There is a four fathom patch of deep water a little over  from the island.
PH-2017-7#-00000435,1.0,The 18 hours of daily water capture and storage will generate enough electricity to supply the six hours of peak load in the region. Safety The power plant will open the floodgate to release excessive water during high river intensity to prevent the buildup of sediment. See also   List of power stations in Taiwan  Electricity sector in Taiwan  References  Category:2011 establishments in Taiwan Category:Buildings and structures in Hualien County Category:Dams completed in 2011 Category:Energy infrastructure completed in 2011 Category:Hydroelectric power stations in Taiwan
PH-2008-5#-00000459,1.0,"The Pan de Azucar Seascape is an area of 2,480.1478 square meters that includes both land and sea water areas around the island."
PH-2003-4#-00000471,1.0,"The house still uses the traditional ""Banggera"" (English:Sink) which is used as window shelf for kitchen wares and utensils and tub for washing at present."
PH-2003-4#-00000565,1.0,"Route description thumb|Housing developments at the former Smokey Mountain landfill Mel Lopez Boulevard originates at Anda Circle, the intersection of Andres Soriano Avenue, Bonifacio Drive, and Roberto Oca Street, as a continuation of Bonifacio Drive (formerly Malecon Drive) in Port Area. Continuing north, it soon crosses over the Estero de Vitas (Vitas Creek) and enters the Balut area of Tondo where the old dumpsite of Smokey Mountain is located."
PH-2008-5#-00000313,1.0,The original road existed as an access road for irrigation canals maintained by the National Irrigation Authority (NIA).
PH-2008-5#-00000023,3.0,"Automated Trash Rake In 2014, the Department of Science and Technology built an automated garbage rake in the intersection of Araneta Avenue and Mauban Street, functioning as a cleaning facility for the river, in response to the perennial flooding and garbage problems in the area."
PH-2017-7#-00001152,1.0,"The complex will house a condominium, a hotel, a museum, a hangar, a water park, a commercial center, and an administration complex."
PH-2017-7#-00000435,1.0,See also  List of tourist attractions in Taiwan  Electricity sector in Taiwan  References  Category:Buildings and structures in Kaohsiung Category:Electric power infrastructure in Taiwan Category:Pylons Category:Tourist attractions in Kaohsiung Category:Towers in Taiwan
PH-2017-7#-00000435,2.0,Geology The water source of the lake comes from Dingjin Canal at the east side of the freeway and the lake water flows into Port of Kaohsiung through the escape canal and the Love River.
PH-2017-7#-00000501,1.0,"Biodiversity  The Sierra Madre mountain range is rich in genetic, species, and habitat diversity, supplying food, water, and shelter to millions of people."
PH-2017-7#-00000435,1.0,"National Fire Agency reported that about 400,000 households were left without water supply. During her visit to Tainan, President-elect Tsai Ing-wen said that safety checks of old buildings and urban renewal will be the top priority of her administration, later stating that Taiwan has become a developed society that demands improved public infrastructure and better quality of life."
PH-2017-7#-00000435,1.0,"The ventilation systems in the windows and walls prevent moisture from causing the rice to swell, ferment or germinate."
PH-2017-7#-00000435,1.0,"Their main products were newsprint, banknotes, lottery paper, toilet paper and wood-free paper."
PH-2017-7#-00000435,1.0,"During the Japanese rule of Taiwan, the pond had a surface area of 55 hectares and there were abundant fish and shrimp inside the water. Lotuses and water chestnuts also grew in the pond. However, after the Large Dapo Drainage Ditch water conservation facility, natural silting and other factors, the surface area of the pond gradually shrinks. Geology Dapo Pond is an inland freshwater swamp. Its water comes from an underground stream located at the tip of the alluvial fan of Xinwulyu River."
PH-2017-7#-00000435,1.0,"Name Ciaonan means south of the bridge, in which the bridge mentioned crosses a small water body that once formed part of Yuejin Harbor."
PH-2017-7#-00000435,3.0,"In 1925, the Gangshan Aqueduct was constructed and completed in 1926, a water canal and water purification system based on the Qing Dynasty style."
PH-2008-5#-00000288,1.0,Gallery  Notes  References  Category:Energy infrastructure completed in 2008 Category:2008 establishments in the Philippines Category:Transmission lines in the Philippines Category:Buildings and structures in Tarlac Category:Buildings and structures in Pampanga
PH-2017-7#-00000567,3.0,Capas officials and residents also initially opposed the landfill project but also likewise changed their stance after being brief of the technology used at the sanitary landfill.
PH-2008-5#-00000004,1.0,"After the onslaught of Typhoon Vamco (Ulysses) in November, the beach was dumped with garbage, with the DENR denying reports that the dolomite was washed away, saying that black sand was washed in to the beach. The University of the Philippines (UP, the national state university) Marine Science Institute (MSI) disapproved of the laying of crushed dolomite sand, saying that it will not improve the water quality in Manila Bay, and that continuous replenishment of the sand will be expensive."
PH-2017-7#-00000268,2.0,"Managed by Manila Water, the facility is the largest sewage treatment plant in the Philippines processing  of used water daily."
PH-2008-5#-00000004,1.0,"Other planned modes of transportation include trackless electric trams, ferries and water taxis."
PH-2017-7#-00000710,1.0,The water is often calm.
PH-2017-7#-00000955,1.0,"thumb|right|270px|Four Japanese snipers shot and killed in the muddy water of a bomb crater A more serious danger to the US forces developed at sea. On the west, Irving sent the 34th Infantry's 1st Battalion under Lt. Col. Thomas E. Clifford, over water from the Carigara area to a point  west of the southward turn of Highway 2, and moved it inland."
PH-2003-4#-00000072,2.0,"Water supply Before the war and during the siege, Corregidor depended on Bataan for most of its potable water."
PH-2017-7#-00000435,1.0,"It features three lakes, which are the main water body, Nanren Lake and Yilan Lake."
PH-2017-7#-00000942,1.0,Fires began to rage and she went dead in the water. Wreck Chōkai sits upright in  of water on the edge of the Philippine Deep.
PH-2017-7#-00000807,5.0,"Although a potable water supply system, a solid waste disposal system, as well as a sewage treatment plant which began operation in 2003 were installed to remedy the insufficient sewage and septic conditions in the island, environmental concerns regarding coliform bacteria persisted due to noncompliance of some business establishments in the island."
PH-2017-7#-00000435,1.0,"Attacking from the water using only the rattan shields and swords, these troops cut down Russian forces traveling by rafts on the river, without suffering a single casualty."
PH-2017-7#-00000435,1.0,"With a severe shortage of food, water and medicine, 211 of the girls died while trying to care for the wounded soldiers."
PH-2017-7#-00000274,1.0,"The river covers an area of around  and measures about  in length and is the principal drainage system for Marikina. Primarily, flooding within Marikina is caused by the increase of water level in major rivers and its tributaries from the Sierra Madre mountains, followed by overflowing from its riverbanks to low-lying areas throughout the city. The local government constructed a 66-kilometer network of bikeways to help reduce air pollution, greenhouse gas emissions, fuel consumption, and traffic congestion in the city. River ferry terminals still not operational in the city due to the threat of overflowing water in the river during heavy downpours or typhoon season. End-to-end travel time is estimated to be around 16 minutes.https://www.rappler.com/business/marikina-ortigas-cable-car-project-neda-body-approval  Manila Urban Cable Car System (with 1 proposed station):  LRT-2 Santolan-Marikina  Public services and utilities Health facilities thumb|right|200px|Amang Rodriguez Memorial Medical Center  Marikina Health Office is a center of health services in the city and responsible for providing healthcare services as well as planning and implementation of the health care programs provided by the city government."
PH-2008-5#-00000308,1.0,"Father Manuel de Arce noted that the 1716 eruption ""killed all the fishes...as if they had been cooked, since the water had been heated to a degree that it appeared to have been taken from a boiling caldron"". The Pansipit River was blocked, causing the water level in the lake to rise. It seems that when the black, fan-shaped cloud spread, it created a blast downward that forced hot steam and gases down the slopes of the crater, accompanied by a shower of hot mud and sand. This shower was the main cause of the loss of life and destruction of property around the volcano. There was a green lake, a yellow lake, a red lake and some holes filled with hot water from which steam issued. The crater lake gradually rose to the level of the water in Taal Lake. Popular opinions after the creation of the lake held that the presence of the water in the crater cooled off the material below and thus lessened the chances of an explosion or the extinction of the volcano. The 1965 eruption was classified as phreatomagmatic, generated by the interaction of magma with the lake water to produce the violent explosion that cut an embayment on Volcano Island. The composition of Main Crater Lake water has shown above normal values of MgCl, SO4Cl, and Total Dissolved Solids. Field measurements on May 24 showed that lake temperatures had increased slightly, pH values were slightly more acidic, and water levels were  higher. Increased water and/or ground probe hole temperatures, increased bubbling at Crater Lake. On the Main Crater Lake, changes in the water temperature, level, and bubbling or boiling activity on the lake."
PH-2003-4#-00000605,1.0,"Under the leadership of UP President Salvador P. Lopez, UP Diliman was given part of the P150 million grant from the national budget to improve infrastructure. Much of this property is utilized by the university in the form of infrastructure and research facilities, while the remaining area is forested, reserved for development and residential use, or unoccupied. According to then Vice Chancellor for Community Affairs Cynthia Grace Gregorio, the policy also promotes lessening air pollution by creating biking lanes on the inner side of the circle. Though this has not been verified in any study, some have posited reasons for the sinking: one is that it is because of underground trenches over the campus' sewer system that connects to the Marikina Fault Line, an active geologic structure that runs across the east of Metro Manila. Finally, the vice chancellor for student affairs assists the chancellor in promoting wellness and discipline among students in areas such as health, food services, and scholarship management."
PH-2008-5#-00000046,1.0,"With the ambition of regaining its former glory, and as the infrastructure around the area improved, a 20-year redevelopment project, known as the Araneta Center Master Plan, was formulated in 1999-2000 and was unveiled in 2002, with an estimated budget of over ₱80 Billion ($1.62 Billion), led by J. Amado's son, Jorge L. Araneta."
PH-2003-4#-00000567,1.0,"The area also hosted Smokey Mountain, a landfill which served Metro Manila and employed thousands of people from around 1960 until its closure in the late 1990s. The dumpsite served as a symbol of poverty even at least two decades since its closure."
PH-2003-4#-00000683,1.0,"According to local authorities, the homemade bomb was placed in front of a toilet beside a video arcade."
PH-2008-5#-00000327,1.0,"The central portion of the vessel sank in  of water about  northeast of Corregidor (at approximately ),."
PH-2008-5#-00000326,2.0,"In the lowland areas, hundreds of artesian wells and deep wells provide water supply for both residential and irrigation purposes. This type of soil is planted to rice with irrigation or sugarcane without irrigation."
PH-2017-7#-00000435,1.0,"In addition, the site lacked adequate supplies of fresh water, which had to be shipped from the Formosan mainland. After nine months and the loss of 1,600 Dutch lives, the Dutch surrendered on 1 February 1662, when it became clear that no reinforcements were forthcoming from Batavia (present day Jakarta, Java, Indonesia) and when the defenders ran short of fresh water."
PH-2003-4#-00000390,1.0,References   External links    Leyte - Luzon HVDC Transmission line and tower photo  Category:Submarine power cables Category:HVDC transmission lines Category:Energy infrastructure completed in 1998 Category:Transmission lines in the Philippines Category:1998 establishments in the Philippines
PH-2008-5#-00000385,1.0,The tamaraw is a bovine related to the water buffalo (carabao) and is an endangered species.
PH-2017-7#-00000435,2.0,"In early 2015, more than  of garbage piled up on the island when the county government forgot to budget funds to transport it to Taiwan Island for incineration."
PH-2017-7#-00000866,1.0,"The creek provided salt to the Ati people as well as animals which lick the salt out of the salty water. Igmatongtong    River System  List of major river in Panay Island by length: [[File:US Navy 080626-N-5961C-005 igh above Roxas, standing water is visible after the wake ofTyphoon Fengshen.jpg|thumb|Aerial view of Panay River in Roxas City.]]"
PH-2017-7#-00000932,1.0,"There are  of brackish water fish ponds which produce prawns, shrimps and milkfish. Points of interest  Bagongbong Falls It is also called Bagumbong falls, crystal-clear and ice-cold rapids of water coming from the cathedral-like falls nestled in a forested area of Almeria town. Ulan-ulan Falls Derived from the Visayan dialect which means “rain,"" the falls' cascading waters form a catch basin with water sufficient for swimming. Recoletos Falls The waterfall which is approximately 15 meters high, has a wide pool with deep water that is perfect for swimming and cliff jumping. The wide and flat stones surrounding the basin of water is perfect for picnic. Kasabangan Falls The nice ambience of the waterfall adds to its attraction, and its cold water is refreshing and relaxing."
PH-2003-4#-00000103,2.0,"Roads and irrigation As communities expanded inward, first along the rivers and then along the railways, the need for roads and irrigation systems leading to communities in the plains became more urgent."
PH-2017-7#-00000733,1.0,Power and water supply were cut off within the danger zone to further discourage residents from returning. Power and water supply in the danger zones were restored.
PH-2003-4#-00000500,3.0,"According to the report, there are two river ecosystems draining the geothermal site namely: (1) Marbel-Matingao river ecosystem- characterized by narrower river channels at highly elevated areas, much faster water flow, clearer water and rock boulder-rich water beds."
PH-2017-7#-00000435,1.0,"921 earthquake When the devastating 921 earthquake struck Nantou County on 21 September 1999, all major buildings and dormitories in campus were critically damaged, and the University suffered a great loss of equipment and basic infrastructure."
PH-2003-4#-00000490,2.0,"Some of the fish products include brackish water milkfish, tilapia, shrimp, and crab; and freshwater catfish and tilapia."
PH-2003-4#-00000589,1.0,"While inside, she placed the envelope on top of the (toilet bowl) tank."
PH-2017-7#-00000264,1.0,"The College of Nursing and Medicine publishes the Journal of Health and Caring Sciences which publishes emerging topics on human health, wellness and caring science."
PH-2017-7#-00000435,1.0,Sika Deer Ecological Park  Sleeping Beauty Rock  Zhaori Hot Spring Sea water heated from the volcanic action and raise to surface next to coral reefs at 53℃ and pH7.5.
PH-2017-7#-00000133,1.0,"After the collapse of the negotiations between the government and the National Democratic Front (NDF), Aquino declared the ""Total War Policy"", aimed at recovering New People's Army (NPA) controlled areas and to destroy the NPA's organizational and infrastructure base."
PH-2017-7#-00000435,1.0,"External links    Taiwan Aborigine Monograph Series 2  Taipei Multicultural Arts Group  Cultural Survival on Orchid Island  Some information and pictures about the island  Taipower, North Korea strike accord on nuke waste storage  Orchid Island: Taiwan's nuclear dumpsite  Syaman Rapongan, Taiwan's Ocean Literature Writer  BBC News: Taiwan's paradise island fights to save its identity  A subaqueous loner — Syaman Rapongan  Category:Islands of Taiwan Category:Landforms of Taitung County Category:Lands inhabited by indigenous peoples Category:Miocene volcanoes Category:Subduction volcanoes Category:Volcanoes of Taiwan"
PH-2017-7#-00000591,1.0,"Surrounding areas were severely damaged by pyroclastic surges, pyroclastic falls, and subsequently, by the flooding lahars caused by rainwater re-mobilizing earlier volcanic deposits. This caused extensive destruction to infrastructure and changed river systems for years after the eruption. Lake Pinatubo  The 1991 caldera afterwards filled with water from annual monsoon rains and a crater lake, Lake Pinatubo, was formed. thumb|Mount Pinatubo crater lake in 2012  Recent activity On July 10, 2002, the west wall of the crater collapsed, slowly releasing approximately  of water and sediments into the Maraunot River in Botolan, Zambales."
PH-2017-7#-00000435,1.0,"Architecture The pier spans over an area of 147.7 hectares, which consists of 131.8 hectares of water area and 15.9 hectares of land area. It has a width of 120 meters and water channel depth of 8 meters."
PH-2017-7#-00000435,1.0,The water has pH level of 7–7.5 with a 48–60°C temperature.
PH-2017-7#-00000435,1.0,"See also  Geothermal energy in Taiwan  List of power stations in Taiwan  References  Category:2021 establishments in Taiwan Category:Buildings and structures in Yilan County, Taiwan Category:Energy infrastructure completed in 2021 Category:Geothermal power stations Category:Renewable energy power stations in Taiwan"
PH-2017-7#-00000435,1.0,See also  Port of Taichung  References  Category:1953 establishments in Taiwan Category:Ports and harbors of Penghu County Category:Transport infrastructure completed in 1953
PH-2017-7#-00000715,1.0,The water is a comfortable 26 Celsius and the visibility is generally +20m and as diving tourism is fairly new here crowds are non-existent; on any given day you may be the only person diving on the entire island. Access  By water Access to Tablas is usually by ferry from the Port of Batangas City in southern Luzon and disembarking at the Port of Odiongan in Barangay Poctoy.
PH-2008-5#-00000403,2.0,The water of the Cantingas River as well as most of the other smaller rivers and rivulets on the island was tested to be one of the best water quality for human consumption worldwide.
PH-2008-5#-00000403,1.0,"It was during this expedition that one of the peaks, now known as ""Mayo's Peak"" was named after one of the team members, Mayo Monteza, who celebrated his birthday during the climb, while one of the water spring sources now known as ""Bulod's Spring"" was named after one of the local guides, Bulod, who volunteered (along with another locals) to join the climb."
PH-2003-4#-00000564,1.0,It was named after the water cabbage (Pistia stratiotes) that floated out of the Pasig river.
PH-2008-5#-00000345,1.0,"Future expansion In 2016, Enchanted Kingdom began a 10-year expansion which includes the redevelopment of the existing theme park and addition of new zones, a regional convention center, a water park and a lifestyle center."
PH-2008-5#-00000138,2.0,"The School of Hotel, Restaurant, and Institution Management occupies four floors with 14 classrooms, a tiered demonstration kitchen, demonstration bar, institutional hot, cold, and baking/pastry kitchens with adequate cold and dry storage areas, two basic food laboratories, two computer laboratories, a nutrition laboratory, conference rooms, a clinic, and a chapel."
PH-2008-5#-00000349,2.0,"The mountain and its environs are considered sacred by local residents; the water from its sacred springs are deemed ""holy water"" for allegedly having beneficial qualities, issuing forth from locations called ""puestos"" or ""holy sites""."
PH-2017-7#-00000541,1.0,"The construction of the irrigation component of the project started in 2010 but was suspended after the opposition of then General Tinio mayor  Virgilio Bote. The irrigation system's dry run was conducted from December 2020 until May 2021 which produced 91,182 sacks of rice in its service area. The project was inaugurated on May 25, 2021 which provides irrigation for  of agricultural land, cultivated by at least 223 farm families living in barangays of Bago, Nazareth and Rio Chico in General Tinio, and barangay San Mariano (Maugat) in nearby Peñaranda town. See also  Agriculture in the Philippines  Energy in the Philippines  Water supply and sanitation in the Philippines  References  Category:Dams in the Philippines Category:Dams completed in 2020 Category:2020 establishments in the Philippines Category:Buildings and structures in Nueva Ecija Category:Earth-filled dams Category:Sierra Madre (Philippines)"
PH-2017-7#-00000435,1.0,The water from the park has a temperature of 95–104°C.
PH-2008-5#-00000215,1.0,Pigs and carabaos (water buffaloes) are seen in the wild.
PH-2003-4#-00000348,1.0,"Notable alumni  See also University of San Carlos Museum University of San Carlos Stadium  References  External links  Today's Carolinian on Facebook (USC's Official Student Publication)  USC Supreme Student Council on Facebook USC Blogspot    San Carlos, University of San Carlos, University of San Carlos, University of Category:Universities and colleges in Cebu City Category:Research universities in the Philippines Category:Spanish colonial infrastructure in the Philippines Category:Divine Word Missionaries Order Category:1783 establishments in the Philippines Category:Educational institutions established in 1783"
PH-2017-7#-00000377,1.0,"In location, acreage, buildings, equipment and sanitary arrangements, this institution is a most attractive contrast to the private universities described above. Due to its established IT infrastructure and well-developed curriculum, the college was designated by CHED as a Center of Excellence in Information Technology Education. Of the first type, housekeeping is generally maintained by a dorm staff and meals are supervised by the University's Food Services. In these dormitories, residents undertake the housekeeping and planning of the food."
PH-2003-4#-00000578,1.0,"Martin Guillet O.P., who was tasked with replacing Letran's old infrastructure and constructing a new and modern building. St. John Paul Solamo Building thumb|Blessed Antonio Varona Gym It serves as the headquarters of maintenance and housekeeping of the Colegio. Jose Maria Sison (HS '56) – Founding Chairman, Communist Party of the Philippines; Current Chairman, International League of Peoples' Struggle, Literary critic, Marxist theoretician, Award-winning Poet  Antonio M. Molina – composer, conductor, pedagogue, historian, and music administrator, Premio Zobel awardee (1985)  Sources For the Alumni list:  https://web.archive.org/web/20091018232147/http://geocities.com/sinupan/pinoy.htm https://web.archive.org/web/20071018192233/http://letranalumni.org/awards_awardees.asp https://web.archive.org/web/20071120130909/http://philippinefolio.com/contdetail.php?id=25&id_app2=353&id_app3=01674 http://www.letran.edu/about/letranites.php http://www.letran.edu/about/presidents.php https://web.archive.org/web/20070224043336/http://elibrary.supremecourt.gov.ph/index4.php  References  External links  Official website of Colegio de San Juan de Letran- Intramuros, Manila Official website of Colegio de San Juan de Letran- Calamba, Laguna Official website of Colegio de San Juan de Letran- Abucay, Bataan Official website of Letran Alumni Association, Inc. (Ex-Alumnos de Letran)  Category:Colegio de San Juan de Letran Category:Catholic universities and colleges in Manila Category:Educational institutions established in the 1620s Category:1620 establishments in the Philippines Category:Education in Intramuros Category:Education in Calamba, Laguna Category:Universities and colleges in Laguna (province) Category:Universities and colleges in Manila Category:Universities and colleges in Bataan Category:Universities and colleges in Pangasinan Category:National Collegiate Athletic Association (Philippines) Category:Dominican educational institutions in the Philippines Category:Spanish colonial infrastructure in the Philippines"
PH-2017-7#-00000435,2.0,The DND also announced the commissioning of a desalination plant to provide potable water to personnel assigned to the island.
PH-2017-7#-00000754,2.0,"Utilities Water supplied by the established water system under the Pili Water District (PIWAD), which has a water source from Mt."
