DHSID_EA,relevance_score,most_relevant_sentences
PH-2003-4#-00000290,1.0,"History The name Calagnaan comes from dagna or lagna, which is the Visayan word for water springs several of which can be found on the island."
PH-2017-7#-00000435,1.0,Its water is clear and unpolluted.
PH-2017-7#-00000435,1.0,History The water tower was constructed in the 1960s. The existing water piping is painted and transformed into installation art to accentuate the theme of the park.
PH-2017-7#-00000435,1.0,"The Farglory Ocean Park () or Hualien Ocean Park is a water theme park in Yanliao Village, Shoufeng Township, Hualien, Taiwan."
PH-2003-4#-00000579,1.0,The fountain was installed in a  diameter pool and the 222 RGB LED lamps light up the water in various colors.
PH-2017-7#-00000271,1.0,The mall has its disaster resilient features which include expansion joints for mitigating earthquake damage and rainwater catchment basin for prevention of flood within its perimeter and surrounding community.
PH-2008-5#-00000594,1.0,"They have also seized 5 water vessels, one motor launch and four jungkungs (motorboat)."
PH-2017-7#-00000435,1.0,"The third floor is the guest room, youth activity center, office and kitchen."
PH-2017-7#-00000435,1.0,"In 1919, the Japanese colonial government constructed a dam to generate hydroelectric power, causing the lake's water level to rise."
PH-2017-7#-00000308,1.0,"The rectory had a kitchen, two brick chimneys, four rooms and offices. Over time, the painting had developed some discolorations and acquired dirt and insect excrement."
PH-2003-4#-00000625,1.0,"In July 2010, the leak of the underground pipeline of the First Philippine Industrial Corporation (FPIC), which carries oil from the oil refineries in the province of Batangas to Pandacan, caused the contamination of water bed table at the basement of West Tower Condominium in Bangkal in Makati."
PH-2008-5#-00000106,1.0,"The government also reconstructed buildings, restored water supply, and set up a field hospital to provide immediate medical response such as delivery of babies, perform surgeries and treatment of more than 2,800 victims."
PH-2017-7#-00000435,1.0,The lake has water all year round but it changes levels according to the seasons.
PH-2017-7#-00000435,2.0,"Geography The reservoir can contain 9,790,000 m3 of water as the main water resource of Chiayi City."
PH-2017-7#-00001154,1.0,The falls are cascades of cold water that plunges into a natural pool.
PH-2017-7#-00000302,1.0,"Government investment has focused largely on infrastructure improvements, with the circle last being renovated in 2006, and a bike lane connecting it to the Paraiso ng Batang Maynila opening in 2012."
PH-2017-7#-00000435,1.0,"Water Square offers 20-minute-long ""water dances"" several times a day."
PH-2017-7#-00000435,1.0,"thumb|SWCB Nantou Branch  The Soil and Water Conservation Bureau (SWCB; ) is the agency of the Council of Agriculture of the Taiwan (ROC) with the main tasks of soil and water conservation, watershed management and erosion control."
PH-2017-7#-00000435,3.0,"Unit 1 was operating at full power on 25 March 2005 when the reactor tripped on low-low water level in steam generator C. Prior to the trip, the high water level alarm in steam generator C was triggered when the water level kept rising and the main feedwater control valve did not respond to manual intervention."
PH-2017-7#-00000302,1.0,Replacement of main water tank with 2 new tanks in Assumption Building.
PH-2017-7#-00000435,1.0,Design The layout of the storage trenches was designed to the surrounding topography and ground water table. See also   List of power stations in Taiwan  Nuclear power in Taiwan  References  Category:1980 establishments in Taiwan Category:Buildings and structures in Taitung County Category:Energy infrastructure completed in 1980 Category:Nuclear power in Taiwan Category:Radioactive waste repositories
PH-2003-4#-00000141,1.0,"It overlooks four bodies of water – Taal Lake, Balayan Bay, Laguna de Bay and Manila Bay."
PH-2017-7#-00000435,1.0,See also   List of power stations in Taiwan  List of coal power stations  Electricity sector in Taiwan   References   Category:2002 establishments in Taiwan Category:Buildings and structures in Hualien County Category:Coal-fired power stations in Taiwan Category:Energy infrastructure completed in 2002
PH-2017-7#-00000435,1.0,See also   List of power stations in Taiwan  List of coal power stations  Electricity sector in Taiwan  References  Category:1982 establishments in Taiwan Category:Buildings and structures in Kaohsiung Category:Coal-fired power stations in Taiwan Category:Energy infrastructure completed in 1982
PH-2017-7#-00000435,1.0,"The cooling system for the plant comes directly from the sea water with a total usage amount of 200,000 tons per day. See also   List of power stations in Taiwan  List of coal power stations  Electricity sector in Taiwan  References  Category:1999 establishments in Taiwan Category:Buildings and structures in Yunlin County Category:Coal-fired power stations in Taiwan Category:Energy infrastructure completed in 1999"
PH-2017-7#-00000435,1.0,See also   List of power stations in Taiwan  Electricity sector in Taiwan  References  External links   Talin power station at SourceWatch  Category:1969 establishments in Taiwan Category:Buildings and structures in Kaohsiung Category:Coal-fired power stations in Taiwan Category:Energy infrastructure completed in 1969
PH-2017-7#-00000435,1.0,See also   List of power stations in Taiwan  List of natural gas power stations  Electricity sector in Taiwan  References  Category:1983 establishments in Taiwan Category:Buildings and structures in Miaoli County Category:Energy infrastructure completed in 1983 Category:Natural gas-fired power stations in Taiwan Category:Oil-fired power stations in Taiwan
PH-2017-7#-00000435,1.0,See also   List of power stations in Taiwan  Electricity sector in Taiwan  References  Category:2003 establishments in Taiwan Category:Buildings and structures in Chiayi County Category:Energy infrastructure completed in 2003 Category:Natural gas-fired power stations in Taiwan
PH-2017-7#-00000435,4.0,"Awards The power plant won the 2006 Water Conservation Outstanding Performance Awards for its effort in implementing water saving at the plant, especially in the recycling and reusing of boiler drain water and waste water."
PH-2017-7#-00000435,1.0,The installed capacity of the power plant is 980 MW.http://www.tepco.co.jp/en/press/corp-com/release/betu04_e/images/040329e1.pdf   See also    List of power stations in Taiwan  Electricity sector in Taiwan   References   Category:2004 establishments in Taiwan Category:Buildings and structures in Tainan Category:Energy infrastructure completed in 2004 Category:Natural gas-fired power stations in Taiwan
PH-2017-7#-00000435,1.0,See also   List of power stations in Taiwan  Electricity sector in Taiwan  References  Category:1982 establishments in Taiwan Category:Buildings and structures in Taitung County Category:Energy infrastructure completed in 1982 Category:Oil-fired power stations in Taiwan
PH-2017-7#-00000435,1.0,See also    List of power stations in Taiwan  Electricity sector in Taiwan   References   Category:2009 establishments in Taiwan Category:Buildings and structures in Changhua County Category:Energy infrastructure completed in 2009 Category:Natural gas-fired power stations in Taiwan
PH-2017-7#-00000435,1.0,See also   List of power stations in Taiwan  Electricity sector in Taiwan  References  Category:2004 establishments in Taiwan Category:Buildings and structures in Changhua County Category:Energy infrastructure completed in 2004 Category:Natural gas-fired power stations in Taiwan
PH-2017-7#-00000435,1.0,See also    List of power stations in Taiwan  Electricity sector in Taiwan   References   Category:2000 establishments in Taiwan Category:Buildings and structures in Penghu County Category:Energy infrastructure completed in 2000 Category:Oil-fired power stations in Taiwan
PH-2008-5#-00000018,1.0,"The mall is characterized by alfresco areas punctuated with water features and landscaping. These water features flow into pools at the Trinoma Park, a green area that sits atop the mall. The Park also houses a stage, surrounded by pools of water, for performances and shows."
PH-2003-4#-00000232,1.0,"Powerful secondary explosions followed immediately, and by 06:00 Maya was dead in the water and listing heavily to port. Wreck On 19 April 2019, researchers aboard  announced they had located the wreck of Maya in around  of water."
PH-2003-4#-00000582,1.0,"Mission To be a catalyst in the empowerment of farmers and fisherfolk by helping them become better informed, and more efficient and conscientious in the management of their plant nutrition and crop protection requirements and preservation of marine and aquatic resources to increase their agricultural productivity, increase income and assist the Philippine government in its sustainable development plan including its goal on rice sufficiency."
PH-2008-5#-00000119,1.0,"Its functions are:  to provide remote sensing services and vital data on the environment, land use, forestry, agriculture, water resources, coastal zone, among others, and to conduct researches on remote sensing and GIS applications."
PH-2008-5#-00000006,2.0,"In terms of public health, the Americans improved on the sewer system and provided a safer water supply. Legarda said universal healthcare coverage means that any non-member of PhilHealth will automatically be made a member upon availment of healthcare service in a public hospital."
PH-2017-7#-00000797,1.0,"PHIVOLCS also warned residents near valleys and streams against sediment-laden stream flows in the event of heavy and continuous rainfall.Bulusan volcano spews more ash | ABS-CBN News | Latest Philippine Headlines, Breaking News, Video, Analysis, Features  February 2011 After months of little activity, the volcano suddenly erupted and sent a plume of ash  high, after water reacted with the hot magma."
PH-2017-7#-00000325,1.0,"Trinity is affiliated with St. Luke's Medical Center as its university hospital, a healthcare institution founded by the Protestant Episcopalians as the third American and Protestant hospital in the Philippines. Episcopalian American missionaries established the St. Luke's Medical Center in 1903 which later the Trinity University of Asia is closely affiliated with..  St. Luke's foundation as a dispensary in 1903 by the Episcopalians as the second Protestant hospital in the Philippines after Iloilo Mission Hospital of Central Philippine University in Iloilo, has made it grow and become one of the reputable and renowned healthcare institutions in the country."
PH-2003-4#-00000648,1.0,"UE Caloocan enhanced its own infrastructure and that of Caloocan with the Tan Yan Kee Academic Building, which was opened in the second semester of the 2003–2004 school year and was inaugurated in December 2003. HRM Mock Hotel Among the university's most recent infrastructure milestones is the HRM Building. It has two main parts: the mock hotel and the kitchen. The hotel is composed of reception area, travel area, dining area, suite, regular room (guest room), housekeeping room, and the skills laboratory. P6.3 million is the allotted budget for the building itself while the equipment for the kitchen costs about P8 million."
PH-2017-7#-00000724,5.0,"As of 2016, 96% of Filipino households have an improved source of drinking water, and 92% of households had sanitary toilet facilities, although connections of these toilet facilities to appropriate sewerage systems remain largely insufficient especially in rural and urban poor communities."
PH-2017-7#-00000435,1.0,"Japanese colonial rule was instrumental in the industrialization of the island, extending the railways and other transport networks, building an extensive sanitation system, and establishing a formal education system in Taiwan. Duties of local governments include social services, education, urban planning, public construction, water management, environmental protection, transport, public safety, and more. Public health  [[File:National Taiwan University Hospital Taipei.jpg|thumb|National Taiwan University Hospital]]  The current healthcare system in Taiwan, known as National Health Insurance (NHI, ), was instituted in 1995. NHI is a single-payer compulsory social insurance plan that centralizes the disbursement of healthcare funds. The system promises equal access to healthcare for all citizens, and the population coverage had reached 99 per cent by the end of 2004.Fanchiang, Cecilia. However, many healthcare providers took advantage of the system by offering unnecessary services to a larger number of patients and then billing the government. The implementation of universal healthcare created fewer health disparities for lower-income citizens in Taiwan. Chains such as FamilyMart provide clothing laundry services, and it is possible to purchase or receive tickets for TRA and THSR tickets at convenience stores, specifically 7-Eleven, FamilyMart, Hi-Life and OK.  Taiwanese culture has also influenced other cultures."
PH-2017-7#-00000441,1.0,The water is slightly acidic and the silica content is relatively high since the spring flows directly from lava flow deposits. The spring water can be classified as near-neutral sodium chloride brine.
PH-2003-4#-00000156,1.0,"The rocky island was levelled by U.S. Army Corps of Engineers and was built up with thick layers of steel-reinforced concrete into a massive structure roughly resembling a battleship,  long,  wide, and with a top deck  above water at mean low tide. Until that time, the cage mast control tower masked the fire of the rear main turret, while the height of the gun above water created a dead space, even had the field of fire been clear."
PH-2017-7#-00000435,1.0,On-campus dormitories: Four students share one room with a bathroom.
PH-2017-7#-00000435,2.0,"Lotus Pond was the site for several water sporting events for World Games 2009, including canoe polo, water ski, and dragon boat."
PH-2003-4#-00000579,1.0,"Aquino privatized many of the utilities the government owned, such as water and electricity. Duterte initiated the ""Build, Build, Build"" program in 2017 that aimed to usher the Philippines into a new ""golden age of infrastructure"" and was expected to create more jobs and business opportunities, which, in turn, would sustain the country's economic growth and accelerate poverty reduction. The country is expected to spend $160 billion to $180 billion up to 2022 for the public investments in infrastructure."
PH-2003-4#-00000255,1.0,"The volcano has a 2,500 m (8202 ft) crater that is breached to the east along a narrow valley drained by the Cabongaan water stream."
PH-2008-5#-00000018,1.0,"The Sky Garden's water features include two bubblers, a simulated river flowing at the central part of the park, and waterfalls at the end of the second floor which can also be used as a screen where promotional materials can be projected."
PH-2017-7#-00000435,1.0,"On 1958, the A Company of the 802nd Engineer Aviation Battalion, US Army Corps of Engineers was deployed to Tainan Air Force Base for infrastructure work, construction of new base buildings, and laying of new concrete runways."
PH-2017-7#-00000580,1.0,"The special economic zone is also adjacent to a body of water, the Subic Bay."
PH-2008-5#-00000173,1.0,"Moments later, seamen in Wyffels spotted the first wave of attacking planes as they came into view low over the water, some four miles away."
PH-2017-7#-00000530,1.0,"Thus, upon the suggestion of Prof. Kenzo Hemmi, IRRI BOT chair, PhilRice sought infrastructure and technical assistance from the Government of Japan through the Japan International Cooperation Agency (JICA)."
PH-2003-4#-00000694,1.0,"In October 1882, a typhoon hit the country causing the rise of flood water, reaching within the church's vicinity."
PH-2003-4#-00000571,1.0,"This is because it serves as a catch basin for runoff water from higher elevated Quezon City, as Sampaloc used to be a swamp-marsh area."
PH-2003-4#-00000099,1.0,"To date, CLSU is one of the premiere institutions for agriculture in the Philippines and in Southeast Asia known for its research in aquaculture, ruminants, crops, orchard, and water management. To date, CLSU is one of the premier institutions of agriculture in Southeast Asia known for its breakthrough researches in aquatic culture (pioneer in the sex reversal of tilapia), ruminant, crops, orchard, and water management researches. A modern auditorium was later built beside Reimer's Hall during the time of then CLSU president Amado Campos, who changed the complexion of the campus with his more than P45-million infrastructure build-up during his term from 1972 to 1986."
PH-2003-4#-00000683,1.0,"In 2010 the hotel embarked on a program called ""Green Housekeeping"" in order to reduce the use of chemicals and improve cleanliness, with initiatives like low-temperature washing and lower electricity use."
PH-2008-5#-00000154,2.0,"SRPC substantially completed the SRMP at midnight, February 14, 2003, at which time its peaking power, irrigation, flood control and enhanced water quality benefits became available to the surrounding regions, which include the Northwest Luzon Economic Growth Quadrangle."
PH-2017-7#-00000264,1.0,"Some of the operations offices are also located at the concourse, as well as a restroom."
PH-2003-4#-00000625,1.0,"According to legend, the image of the Santo Niño was recovered from a well near the church and some say the water from the well resulted in the miraculous healing of the infirm."
PH-2003-4#-00000784,1.0,"On 1 March, Inazuma was involved in the Second Battle of the Java Sea, where she assisted in the  sinking of the British destroyer  and the cruiser , which she hit with two torpedoes.See 1 March entry at http://www.combinedfleet.com/inazum_t.htm She then rescued 400 odd survivors from Exeter that same day.See 1 March entry at http://www.combinedfleet.com/inazum_t.htm Two days later, just before midnight on 3 March,See 3 March entry at http://www.combinedfleet.com/inazum_t.htm she rescued the entire crew from the American destroyer  (except one that had died just prior to abandoning ship) who had been in the water for almost 60 hours,Lt."
PH-2017-7#-00000435,1.0,"In mid April 2016, the museum was closed due to reparation work of water leakage in its main hall building."
PH-2017-7#-00000710,1.0,"The island has tropical forest with springs with drinkable freshwater, making it habitable. Asian water monitors are found in the dense mangroves that surrounds parts of the island."
PH-2017-7#-00000435,1.0,"After a decade without proper management, the park was flooded with wild plants and trashes, which eventually turned out to be a landfill."
PH-2017-7#-00000435,3.0,"It supplies water for domestic and agriculture water demands in Checheng, Fangliao, Fangshan, Hengchun, Manzhou and Mudan Townships, as well as public water around Kenting National Park."
PH-2017-7#-00000435,1.0,"Name The lake is named Pipa because it resembles the shape of a pipa where it has a shape of two connected water bodies, in which one is the bigger one and the other is the smaller one."
PH-2017-7#-00000435,1.0,"The second stage saw the completion of its water plant, electricity plant, pumping station and path for the cemetery."
PH-2017-7#-00001100,2.0,"Underneath the mall is a rainwater catchment basin measuring 75 x 40 meters floor area and as high as 6 meters which can hold up to 13,650 cubic meters of water to reduce the risk of flooding."
PH-2017-7#-00000101,1.0,"Phase 2, was planned to be completed by February 2016, in time for the 2016 Cordillera Administrative Region Athletic Association (Caraa) meet which involved the installing of rubber tracks from Switzerland, continuation of unfinished bleachers and repair of the venue's old drainage system."
PH-2017-7#-00000435,1.0,"According to the establishment of Penghu hospital in 1914 (Taishō 3rd year of Japan Empire), the Shigong Temple was moved to the eastern side of Tianhou Temple (Chinese: 天后宮), where was ever a kitchen of military camp during Qing dynasty."
PH-2017-7#-00000435,1.0,"While Kaobinge was in business, the first floor served as a kitchen and staff living quarters."
PH-2017-7#-00000435,1.0,"The rocks were wrapped in it, but gradually became exposed and became an independent rock because of continuous erosion by wind and sea water."
PH-2003-4#-00000709,1.0,Gallery     Notes  References  External links  Philippines_Sucat_Balintawak_2007.pdf - 2007 evaluation by Entwicklungsbank.de  Category:Energy infrastructure completed in 2000 Category:Transmission lines in the Philippines
PH-2017-7#-00001021,1.0,"Pinukis, the sacred mountain of the Subanen tribe, and a main source for the water system of the three provinces of the Zamboanga peninsula, is under threat from multinational mining companies who wish to engage in open-cast mining."
PH-2017-7#-00000435,1.0,"This was unusual as BOT schemes are generally reserved for major infrastructure projects such as subway systems and toll roads. Hsu, who had “settled in the northern Tulan village near Shanyuan Bay, looking for a pure source of water for her craft-brewed vinegar”, had been involved in environmental protests from her home county of Hsinchu, and was a member of the Taitung chapter of the Taiwan Environmental Protection Union (TEPU).The News Lens: Anti-Miramar activists successfully stalled opening, 2018 After discussing the issue with Lin, Hsu raised the topic at a TEPU meeting. As such, the Taitung Government is psychologically prepared to face the consequences of a compensation request for terminating the contract, just like the Taitung Incinerator.” Storm Media, Miramar case: Taitung government files appeal Dec 1, 2104 (In 2011, the Build Operate Own (BOO) builders of the “mothballed” Taitung Incinerator were controversially granted a compensation payout of NT$1.96 billion as a result of a dispute resolution tribunal convened by Huang government Secretary General, Chen Chin-hu (陳金虎)).Vision, United Daily News, Taitung Incinerator failed to burn one day of garbage 10 years after completion, Aug 15, 2015Lih-Ren Liu, Yuh-Ming Lee,Remedial Measures for Erroneous Environmental Policies: Assessing Infrastructure Projects of Waste-to-Energy Incineration in Taiwan with a Case Study of the Taitung Incinerator, 2016, p8   Dispute resolution tribunal  An arbitration tribunal is composed of the two disputant parties and a mediator."
PH-2017-7#-00000435,1.0,"Technical details The plant has a capacity of treating 900 tons of garbage per day from its two boilers. It is managed by Onyx Ta-Ho Environmental Services Co., Ltd.  See also  Air pollution in Taiwan  References  Category:2001 establishments in Taiwan Category:Buildings and structures in Chiayi County Category:Incinerators in Taiwan Category:Infrastructure completed in 1990"
PH-2017-7#-00000435,1.0,History thumb|Surrounding area pre-1960  Around the station  Zhongdu Wetlands Park  See also  List of railway stations in Taiwan  References  Category:2018 establishments in Taiwan Category:Railway stations in Kaohsiung Category:Railway stations served by Taiwan Railways Administration Category:Transport infrastructure completed in 2018
PH-2017-7#-00000435,1.0,The wetland consists of around 100 types of water plants.
PH-2017-7#-00000557,1.0,References  Category:Energy infrastructure completed in 1991 Category:Transmission lines in the Philippines
PH-2017-7#-00000435,1.0,"of the Ming Dynasty (15721620), she survived a shipwreck in the Taiwan Strait and made the cave her own home, surviving on spring water and wild fruits."
PH-2017-7#-00000435,1.0,Exhibitions The museum exhibits traditional irrigation techniques and their history.
PH-2008-5#-00000094,2.0,"It was built on the site of a former garbage transfer station during the term of Mayor Toby Tiangco who described the project as ""garbage turned into gold."""
PH-2017-7#-00000435,1.0,"Due to the abundance of water, this was one of the first areas settled in Taichung."
PH-2017-7#-00000228,1.0,"The following month, the local government also awarded the rehabilitation of the drainage line located at the park to a local construction firm."
PH-2017-7#-00000435,1.0,"In the same year, a fire destroyed the log mill, water pipes and hydrants at the area."
PH-2003-4#-00000132,1.0,"See also   List of lighthouses in the Philippines  Calatagan, Batangas  Cape Santiago   References    External links      Celeste Barile's photo essay on Philippine lighthouses from the April 1996 issue of the NAMRIA Infomapper  Colorized photos of Cape Santiago Lighthouse from 1902  Category:Lighthouses completed in 1890 Category:Lighthouses in the Philippines Category:Buildings and structures in Batangas Category:Spanish colonial infrastructure in the Philippines Category:Marked Historical Structures of the Philippines Category:Tourist attractions in Batangas"
PH-2017-7#-00000283,1.0,The construction of a pavilion and viewdeck at the lake was announced in 2017 by the local government as part of its economic and infrastructure development spending of  for fiscal year 2018.
PH-2017-7#-00000435,1.0,See also  List of oil refineries  Mining in Taiwan  References  Category:2000 establishments in Taiwan Category:Buildings and structures in Yunlin County Category:Energy infrastructure completed in 2000 Category:Formosa Plastics Group Category:Oil refineries in Taiwan
