DHSID_EA,relevance_score,most_relevant_sentences
PE-2009-5Z-00000599,1.0,"Universidad Privada San Juan Bautista is a private university in the city of Lima, Peru. It offers 16 career programs categorized in 4 schools."
PE-2009-5Z-00000472,2.0,"Floor  Telecommunications Engineering  Software Engineering  Civil Engineering  Computer Science  Electrical Engineering  Industrial engineering  Faculty of Human Medicine  Human Medicine  Psychology  Dentistry  Faculty of Communication Studies  Communication Studies  Faculty of Health Science  Nursing  Obstetrics  Faculty of Education and Humanities  Early childhood education  Primary education  Faculty of Economic Sciences  Economics  Administration  Accountancy  Faculty of Law and Politic Sciences  Law  Faculty of Architecture, Urbanism and Arts  Architecture  Faculty of Agricultural Sciences  Veterinary medicine  Agronomy  Food Engineering  See also Victor Larco Herrera District List of universities in Peru  References  Category:Universities from Trujillo, Peru Category:Companies based in Trujillo, Peru"
PE-2000-4#-00000677,4.0,"The number of private schools is much greater than public schools (6,242 vs 1,805) while the average size of private schools is 100 for elementary and 130 for high school."
PE-2000-4#-00000319,1.0,"This was a school that was built by the Spanish to educate the Incas and their descendants with the methods and disciplines of European renaissance style artwork. This school was famous throughout the colonial Americas, but the Quechua painters were limited to painting scenes of European and Catholic importance."
PE-2009-5Z-00000617,4.0,It is the campus that was first built upon the university's founding and has classroom capacity for about 4000 students.
PE-2009-5Z-00000577,1.0,"The lakes named Huarmicocha (possibly in Quechua Warmiqucha, ""woman lake"") and Challhuacocha (possibly in Quechua Challwaqucha, ""fish lake"") lie west."
PE-2009-5Z-00000469,1.0,"The capacity of the arena is 7,000 spectators  and has hosted some 2011 FIVB Women's Junior World Championship, 1982 FIVB Women's World Championship, and Peru women's national volleyball team matches."
PE-2009-5Z-00000269,1.0,"The capacity of the arena is 13,000 spectators  and has hosted some Peru women's national volleyball team matches."
PE-2009-5Z-00000679,7.0,"Notable alumni  See also Category:Federico Villarreal National University alumni Laura Bozzo (TV talk show and lawyer)  Mercedes Cabanillas (educator and politician)  César Hildebrandt (journalist)  José Luis Pérez-Albela (doctor-writer, former athlete and lecturer)  Alejandro Aguinaga (administrator, surgeon and politician)  Arturo Cavero Velásquez (singer of Creole music)  José Antonio Chang (industrial engineer, rector and politician)  Teófilo Cubillas (soccer player, accountant)  Liliana La Rosa (nurse, university professor and former minister)  Luis Nava Guibert (lawyer and politician)  Julián Pérez Huarancca (novelist and short story writer)  Nidia Vílchez (public and political accountant)  César Villanueva (administrator and politician)  José Watanabe (poet)  Juan Sheput (industrial engineer, politician and university professor)  Zulema Tomás (doctor, politician and ex health minister)   Cooperations    University of Salamanca  Complutense University of Madrid  Harvard University - Laspau  Virginia International University  National University of Colombia  Autonomous University of Asunción  Technical University of Machala   Municipal University of Sao Caetano do Sul  University of Buenos Aires  University of Seville  University of La Laguna   University of Atlántico  Continuing on the route of internationalization, since 2017, UNFV joined the Compostela Group of Universities.thumb|UNFV campus near downtown of Lima  References  External links  Official site  Comunidad UNFV  Category:Universities in Lima Category:Educational institutions established in 1963 Category:1963 establishments in Peru"
PE-2000-4#-00000353,3.0,"T'allani Urqu (Aymara t'alla noble woman, lady, -ni a suffix, Quechua urqu mountain, ""the mountain with a noble woman"", Hispanicized spelling Tallani Orcco) is a mountain in the Andes of Peru which reaches a height of approximately ."
PE-2000-4#-00000537,2.0,"Warmi Sinqa (Quechua warmi woman, sinqa nose, ""woman's nose"", also spelled Huarmisenga)  is a mountain in the Andes of Peru which reaches a height of approximately ."
PE-2000-4#-00000196,1.0,"Icma (possibly from Quechua for widow) is a mountain in the west of the Chila mountain range in the Andes of Peru, about  high."
PE-2000-4#-00000821,3.0,"Purpose In addition to the general aims of every university, its purpose is to give to the female youth a more integral formation, not only academic and scientific, but humanistic and ethical, under Christian and Catholic inspiration, which leads it to project towards the achievement of a Society more just, supportive and inclusive."
PE-2000-4#-00000001,1.0,"The National University Toribio Rodríguez de Mendoza (UNTRM) is a state-owned university in Chachapoyas, Peru."
PE-2009-5Z-00000214,1.0,"The volcano was worshipped by the local population, and an Inca mummy of a 15-year old girl was found on the summit by archaeologists. This mummy was nicknamed ""Sarita"" and appears to be a 15-year old girl."
PE-2000-4#-00000679,4.0,ARCHI includes free educational resources to complement the teaching learning process in the classroom.
PE-2009-5Z-00000580,1.0,"It dates to the 1800s decade and was built on a land called ""Huerta de los Llanos"" and ""Huerta Perdida"" or that of the ""Cuero"", which belonged to the Monasteries of Santa Catalina de SienaThe Convent of Santa Catalina de Siena in Lima was founded by the mother of Isabel Flores Oliva, in memory to St. Catherine of Siena, the Dominican tertiary from Siena whose steps followed St. Rose of Lima. Upon the death of the beneficiary, the ""empiteusis"" is sold and transferred to Pedro Tramarría, who points out how his wife, Doña Nicolasa de la Presa, would benefit. This school is in charge of the integral restoration of the aforementioned monument."
PE-2000-4#-00001413,1.0,thumb|right|250px|An Asháninka woman.
PE-2009-5Z-00000466,1.0,"The attack, which took place around 22:00 local time (UTC−05) on 23 May, was confirmed by general César Cervantes, commander general of the National Police of Peru, who informed about the mass shooting deaths of ten men, six women and two minors in a red-light zone bar in the locality."
PE-2000-4#-00000691,1.0,"It is a modern private university that occupies award-winning buildings. History  It is a modern private university that occupies award-winning buildings. Education The university has a cross curricular ""Laboratory for Educational Innovation"" which it calls Moray."
PE-2004-5#-00000205,1.0,"Hatun K'irawniyuq (Quechua hatun big, k'iraw cradle, bed of a child, -ni, -yuq suffixes,Diccionario Quechua - Español - Quechua, Academía Mayor de la Lengua Quechua, Gobierno Regional Cusco, Cusco 2005 (Quechua_Spanish dictionary)Teofilo Laime Ajacopa, Diccionario Bilingüe Iskay simipi yuyayk'ancha, La Paz, 2007 (Quechua-Spanish dictionary) ""the one with a big cradle"" or ""the big one with a cradle"", Hispanicized spelling Jatun Quirauniyoc) is a mountain in the Arequipa Region in the Andes of Peru, about  high."
PE-2009-5Z-00000577,1.0,"The lakes named Quyllurqucha, Warmiqucha (Quechua for ""woman lake"", Huarmicocha) and Challwaqucha (""fish lake"", Challhuacocha) lie at its feet."
PE-2009-5Z-00000168,1.0,"Yuraq Punta lies west of Minata, northeast of Chawpi Chawpi and Chunta, and east of Tintaya, north of a lake named Ikmaqucha (Quechua for ""widow lake"")."
PE-2000-4#-00000353,1.0,Igma (possibly from Quechua for widow) is a   mountain in the Huanzo mountain range in the Andes of Peru.
PE-2000-4#-00000319,1.0,"Years later the property was purchased from the heirs of the conquistador by Diego de Silva y Guzmán and his wife Teresa Orgoñez, who donated it to the Jesuits after their arrival to the city in 1571. The Jesuit college in Cusco was dedicated the Transfiguration of Christ, and the high altar features a painting of the Transfiguration attributed to the Jesuit Diego de la Puente. This noble indigenous woman, Beatriz Clara, was heiress of the Lordship of Yucay. New York Public Library]] Next to their church, the Jesuits built their own university: the University of San Ignacio de Loyola, now the premises of the National University of Saint Anthony the Abbot."
PE-2000-4#-00000579,5.0,"In 1956, after spending two years as a secondary education teacher in Otuzco, he entered the staff of the UNT where he would over the years teach botany and phytogeography—eventually achieving the title of ""principal exclusive professor"" (profesor principal dedicación exclusiva)—as well as becoming the first official curator of the university's herbarium."
PE-2000-4#-00000767,7.0,"The following year the faculty of education was created and the first academic year of undergraduate at the Villa campus was inaugurated; and in 2015, the San Miguel campus is inaugurated and the psychology faculty is created."
PE-2000-4#-00000839,3.0,"During his third term, district mayor Michel Azcueta decided to name the stadium to honor the memory of Moreno who had been his student while he, the mayor, was a school teacher in the district."
PE-2000-4#-00000433,1.0,"Name  The name comes from the shape of the mountain, which resembles a woman lying down, and is present in a local folktale."
PE-2000-4#-00000691,1.0,"The Chef de cuisine is Pía León, wife of Martínez Véliz."
PE-2000-4#-00000767,4.0,"ESAN University is a leading academic institution in business education, that was founded in 1963 as ESAN - Escuela de Administración de Negocios para Graduados, the first graduate business school in Latin America."
PE-2009-5Z-00000635,4.0,"Alas Peruanas International  The Universidad Alas Peruanas promotes the exchange of knowledge and research at the international level in all its academic areas at undergraduate and graduate levels as well as for its teaching staff. Institutes  They are educational institutions of higher education promoted by the Universidad Alas Peruanas, with the purpose of forming technical professionals in accordance with the current Technological Superior Education Institutes and Schools Act (MODULAR system) using state-of-the-art equipment and experienced scholars in the teaching and learning process."
PE-2000-4#-00001174,2.0,"Awallani (Aymara awalla the first one of two newborn girl, -ni a suffix to indicate ownership, ""the one with the first one of two newborn girl"", Hispanicized spelling Aguallane) is a mountain in the Andes of Peru, about  high."
PE-2000-4#-00000355,1.0,"Mamañawi (Quechua mama mother, madam; vein (or seam), ñawi eye, Hispanicized spelling Mamañahui) is a  mountain in the Andes of Peru, about  high."
PE-2000-4#-00001044,2.0,"Wawa Chaki (Quechua wawa child, baby, chaki foot, ""child foot"", Hispanicized spelling Huahuachaqui,Municipalidad Provincia de Mariscal Nieto, Ley Organica 27972 del 26-05-2003 also Negra Huahuachaqui, Negro Huahuachaqui) is a mountain in the Andes of southern Peru, about  high."
PE-2000-4#-00000887,1.0,"Winsu (Quechua for firstborn child, also spelled Huinso) is mountain in the Cordillera Central in the Andes of Peru which reaches a height of approximately ."
PE-2000-4#-00000887,1.0,"Sapallan Warmi (Quechua sapalla only, unique, -n a suffix, warmi woman, also spelled Sapallanhuarmi) is a mountain in the Cordillera Central in the Andes of Peru which reaches a height of approximately ."
PE-2009-5Z-00000186,1.0,"Moonbouncer54 created the website for Cayley Chemicals and volunteered to help the two sons of John Mills (Philip and Nick Mills, both directors of CCC Trading Ltd t/a Cayley Chemicals), not that I have ever been involved in any Wiki related activity before, but probably more able to teach self the basics. Its a steep learning curve though and all the advice so genuinely offered really is appreciated. Decided to jump into making some edits and creating a page for my favorite resource (have a couple of kids entering school age and found it to be really valuable) - GreatSchools."
PE-2000-4#-00000435,4.0,"Warmi Wañusqa (Quechua warmi woman, wife, wañusqa died, dead, ""woman (who) died"" or ""dead woman"", also spelled Huarmihuañusca) is a mountain in the Andes of Peru which reaches a height of approximately ."
PE-2000-4#-00000350,1.0,"Chaupimaquito (possibly from Quechua chawpi central, middle, makitu an additional sleeve which Andean women and men put on in some cold regions,Diccionario Quechua - Español - Quechua, Academía Mayor de la Lengua Quechua, Gobierno Regional Cusco, Cusco 2005 (Quechua-Spanish dictionary) ""central makitu"") is a mountain in the Vilcanota mountain range in the Andes of Peru, about  high."
PE-2000-4#-00000383,4.0,"Chuqi Warmi (Aymara chuqi gold, warmi woman, Quechua chuqi precious metal, warmi woman, ""gold (or metal) woman"", Hispanicized spelling Choquehuarmi) or Chuki Warmi (Quechua chuki hard; sword; spear, lance, ""hard (sword, spear or lance) woman"") is a  mountain in the Andes of southern Peru."
PE-2000-4#-00000355,1.0,"The mountain northwest of it is Atawallpa Much'u (""hen's little child"")."
PE-2000-4#-00000355,2.0,"Atawallpa Much'u (Aymara atawallpa hen, much'u little child, ""hen's little child"", Hispanicized spelling Atahualpa Mocho) is a mountain in the Andes of Peru, about  high."
PE-2000-4#-00000122,1.0,"T'alla Kallanka (Quechua t'alla outstanding woman of the Inca aristocracy, kallanka large roofed building used for celebrations during the Inca Empire,Diccionario Quechua - Español - Quechua, Academía Mayor de la Lengua Quechua, Gobierno Regional Cusco, Cusco 2005 (Quechua-Spanish dictionary) Hispanicized spelling Tallacallanca) is a mountain in the Wansu mountain range in the Andes of Peru, about  high."
PE-2009-5Z-00000577,1.0,"The lakes Quyllurqucha, Warmiqucha (Quechua for ""woman lake"", Huarmicocha) and Challwaqucha (""fish lake"", Challhuacocha) lie northeast of Waylla Hirka."
PE-2009-5Z-00000577,1.0,"Yanacushman (possibly from Quechua yana black, kusma (or kushma in the local variant) nightdress, shirt of a woman,Diccionario Quechua - Español - Quechua, Academía Mayor de la Lengua Quechua, Gobierno Regional Cusco, Cusco 2005 (Quechua-Spanish dictionary) ""black nightdress"" or ""black shirt"", -n a suffix) is a mountain in the Huayhuash mountain range in the Andes of Peru, about  high."
PE-2009-5Z-00000703,2.0,"Warmi Mach'ay (Quechua warmi woman, mach'ay cave, ""woman cave"", Hispanicized spelling Huarmimachay) is a mountain in the Andes of Peru, about  high."
PE-2009-5Z-00000451,1.0,"Huarmicochas Lakes (possibly from Quechua warmi woman, qucha lake) are a group of lakes in Peru located in the Junín Region, Jauja Province, Canchayllo District."
PE-2000-4#-00000070,2.0,"Notable people  Orlando Alvarez Castro Due to the persistence, will, firmness and enthusiasm of Orlando Alvarez Castro, the highway was built from the coast to this cut-off city by means of the system of ""topos"", where 10 metres of road would be constructed by each member of the community, shopkeeper or teacher, and even the children, supported by food given by the women (unmarried and widows). Geologist Mercedes Caballero Calderón mother of six kids; Roberto Mejia Caballero, Guillermo Mejia Caballero, Carlos Mejia Caballero, Marina Mejia Caballero, Irma Victoria Mejia Caballero, Mirtha Consuelo Mejia Caballero (mother of Carlos Mauricio Martinez Mejia)."
PE-2000-4#-00001069,1.0,It was named after the medical student Daniel Alcides Carrión.
PE-2000-4#-00001306,1.0,"In local belief, Tacora and Sajama were two mountains in competition for two women (the Nevados de Payachata). Depending on the specific myth either the two women drove Tacora off and removed the top of the mountain, or Sajama did and injured Tacora; Tacora subsequently fled, shedding blood and a piece of its heart."
PE-2009-5Z-00000261,1.0,The school moved to this new facility in 1965.
PE-2009-5Z-00000219,1.0,"The origin of its name comes from the battle of San Pablo, where three students from San Ramón de Cajamarca School died for Perú, in the War of the Pacific."
PE-2009-5Z-00000435,1.0,"Economy The most important economic activities belong to the service sector (commerce, tourism) and the public sector (public administration, health, and education)."
PE-2009-5Z-00000027,1.0,"In the 1970s the ""first registrations and land titles where awarded to the communities that roughly corresponded to the locations of where the bilingual schools had been established in the 1960s"". The land tiles were given to fourteen local communities and had the common attempt to protect the land on the banks of the Cenepa river that were in the local vicinity of the established schools. In the 1960s the first bilingual schools were established in the Cenepa River Basin region. The increase in schools and other services to the region such as health posts has resulted in the population around the Cenepa River to rise."
PE-2000-4#-00000207,1.0,"Ampato was the site of human sacrifice during Inca times, around 1466 the Mummy Juanita was offered for sacrifice on the mountain, along with two other girls and a boy."
PE-2000-4#-00000319,1.0,"This was a school that was built by the Spanish to educate the Incas and their descendants with the methods and disciplines of European renaissance style artwork. This school was famous throughout the colonial Americas, but the Quechua painters were limited to painting scenes of European and Catholic importance."
PE-2009-5Z-00000617,4.0,It is the campus that was first built upon the university's founding and has classroom capacity for about 4000 students.
PE-2009-5Z-00000577,1.0,"The lakes named Huarmicocha (possibly in Quechua Warmiqucha, ""woman lake"") and Challhuacocha (possibly in Quechua Challwaqucha, ""fish lake"") lie west."
PE-2004-5#-00000205,1.0,"Hatun K'irawniyuq (Quechua hatun big, k'iraw cradle, bed of a child, -ni, -yuq suffixes,Diccionario Quechua - Español - Quechua, Academía Mayor de la Lengua Quechua, Gobierno Regional Cusco, Cusco 2005 (Quechua_Spanish dictionary)Teofilo Laime Ajacopa, Diccionario Bilingüe Iskay simipi yuyayk'ancha, La Paz, 2007 (Quechua-Spanish dictionary) ""the one with a big cradle"" or ""the big one with a cradle"", Hispanicized spelling Jatun Quirauniyoc) is a mountain in the Arequipa Region in the Andes of Peru, about  high."
PE-2009-5Z-00000577,1.0,"The lakes named Quyllurqucha, Warmiqucha (Quechua for ""woman lake"", Huarmicocha) and Challwaqucha (""fish lake"", Challhuacocha) lie at its feet."
PE-2009-5Z-00000168,1.0,"Yuraq Punta lies west of Minata, northeast of Chawpi Chawpi and Chunta, and east of Tintaya, north of a lake named Ikmaqucha (Quechua for ""widow lake"")."
PE-2000-4#-00000353,1.0,Igma (possibly from Quechua for widow) is a   mountain in the Huanzo mountain range in the Andes of Peru.
PE-2000-4#-00000319,1.0,"Years later the property was purchased from the heirs of the conquistador by Diego de Silva y Guzmán and his wife Teresa Orgoñez, who donated it to the Jesuits after their arrival to the city in 1571. The Jesuit college in Cusco was dedicated the Transfiguration of Christ, and the high altar features a painting of the Transfiguration attributed to the Jesuit Diego de la Puente. This noble indigenous woman, Beatriz Clara, was heiress of the Lordship of Yucay. New York Public Library]] Next to their church, the Jesuits built their own university: the University of San Ignacio de Loyola, now the premises of the National University of Saint Anthony the Abbot."
PE-2000-4#-00000579,5.0,"In 1956, after spending two years as a secondary education teacher in Otuzco, he entered the staff of the UNT where he would over the years teach botany and phytogeography—eventually achieving the title of ""principal exclusive professor"" (profesor principal dedicación exclusiva)—as well as becoming the first official curator of the university's herbarium."
PE-2000-4#-00000767,7.0,"The following year the faculty of education was created and the first academic year of undergraduate at the Villa campus was inaugurated; and in 2015, the San Miguel campus is inaugurated and the psychology faculty is created."
PE-2000-4#-00000839,3.0,"During his third term, district mayor Michel Azcueta decided to name the stadium to honor the memory of Moreno who had been his student while he, the mayor, was a school teacher in the district."
PE-2000-4#-00000433,1.0,"Name  The name comes from the shape of the mountain, which resembles a woman lying down, and is present in a local folktale."
PE-2000-4#-00000691,1.0,"The Chef de cuisine is Pía León, wife of Martínez Véliz."
PE-2000-4#-00000767,4.0,"ESAN University is a leading academic institution in business education, that was founded in 1963 as ESAN - Escuela de Administración de Negocios para Graduados, the first graduate business school in Latin America."
PE-2009-5Z-00000635,4.0,"Alas Peruanas International  The Universidad Alas Peruanas promotes the exchange of knowledge and research at the international level in all its academic areas at undergraduate and graduate levels as well as for its teaching staff. Institutes  They are educational institutions of higher education promoted by the Universidad Alas Peruanas, with the purpose of forming technical professionals in accordance with the current Technological Superior Education Institutes and Schools Act (MODULAR system) using state-of-the-art equipment and experienced scholars in the teaching and learning process."
PE-2000-4#-00001174,2.0,"Awallani (Aymara awalla the first one of two newborn girl, -ni a suffix to indicate ownership, ""the one with the first one of two newborn girl"", Hispanicized spelling Aguallane) is a mountain in the Andes of Peru, about  high."
PE-2000-4#-00000355,1.0,"Mamañawi (Quechua mama mother, madam; vein (or seam), ñawi eye, Hispanicized spelling Mamañahui) is a  mountain in the Andes of Peru, about  high."
PE-2000-4#-00001044,2.0,"Wawa Chaki (Quechua wawa child, baby, chaki foot, ""child foot"", Hispanicized spelling Huahuachaqui,Municipalidad Provincia de Mariscal Nieto, Ley Organica 27972 del 26-05-2003 also Negra Huahuachaqui, Negro Huahuachaqui) is a mountain in the Andes of southern Peru, about  high."
PE-2000-4#-00000887,1.0,"Winsu (Quechua for firstborn child, also spelled Huinso) is mountain in the Cordillera Central in the Andes of Peru which reaches a height of approximately ."
PE-2000-4#-00000887,1.0,"Sapallan Warmi (Quechua sapalla only, unique, -n a suffix, warmi woman, also spelled Sapallanhuarmi) is a mountain in the Cordillera Central in the Andes of Peru which reaches a height of approximately ."
PE-2009-5Z-00000186,1.0,"Moonbouncer54 created the website for Cayley Chemicals and volunteered to help the two sons of John Mills (Philip and Nick Mills, both directors of CCC Trading Ltd t/a Cayley Chemicals), not that I have ever been involved in any Wiki related activity before, but probably more able to teach self the basics. Its a steep learning curve though and all the advice so genuinely offered really is appreciated. Decided to jump into making some edits and creating a page for my favorite resource (have a couple of kids entering school age and found it to be really valuable) - GreatSchools."
PE-2000-4#-00000435,4.0,"Warmi Wañusqa (Quechua warmi woman, wife, wañusqa died, dead, ""woman (who) died"" or ""dead woman"", also spelled Huarmihuañusca) is a mountain in the Andes of Peru which reaches a height of approximately ."
PE-2000-4#-00000350,1.0,"Chaupimaquito (possibly from Quechua chawpi central, middle, makitu an additional sleeve which Andean women and men put on in some cold regions,Diccionario Quechua - Español - Quechua, Academía Mayor de la Lengua Quechua, Gobierno Regional Cusco, Cusco 2005 (Quechua-Spanish dictionary) ""central makitu"") is a mountain in the Vilcanota mountain range in the Andes of Peru, about  high."
PE-2000-4#-00000383,4.0,"Chuqi Warmi (Aymara chuqi gold, warmi woman, Quechua chuqi precious metal, warmi woman, ""gold (or metal) woman"", Hispanicized spelling Choquehuarmi) or Chuki Warmi (Quechua chuki hard; sword; spear, lance, ""hard (sword, spear or lance) woman"") is a  mountain in the Andes of southern Peru."
PE-2000-4#-00000355,1.0,"The mountain northwest of it is Atawallpa Much'u (""hen's little child"")."
PE-2000-4#-00000355,2.0,"Atawallpa Much'u (Aymara atawallpa hen, much'u little child, ""hen's little child"", Hispanicized spelling Atahualpa Mocho) is a mountain in the Andes of Peru, about  high."
PE-2000-4#-00000122,1.0,"T'alla Kallanka (Quechua t'alla outstanding woman of the Inca aristocracy, kallanka large roofed building used for celebrations during the Inca Empire,Diccionario Quechua - Español - Quechua, Academía Mayor de la Lengua Quechua, Gobierno Regional Cusco, Cusco 2005 (Quechua-Spanish dictionary) Hispanicized spelling Tallacallanca) is a mountain in the Wansu mountain range in the Andes of Peru, about  high."
PE-2009-5Z-00000577,1.0,"The lakes Quyllurqucha, Warmiqucha (Quechua for ""woman lake"", Huarmicocha) and Challwaqucha (""fish lake"", Challhuacocha) lie northeast of Waylla Hirka."
PE-2000-4#-00000319,1.0,"This was a school that was built by the Spanish to educate the Incas and their descendants with the methods and disciplines of European renaissance style artwork. This school was famous throughout the colonial Americas, but the Quechua painters were limited to painting scenes of European and Catholic importance."
PE-2009-5Z-00000617,4.0,It is the campus that was first built upon the university's founding and has classroom capacity for about 4000 students.
