DHSID_EA,relevance_score,most_relevant_sentences
PE-2009-5Z-00000954,1.0,"A few small stores sell basic goods, and a health clinic and six schools are found. Guests typically take food staples (cooking oil, rice, etc., but no sugar products, as they have no dental facilities) as a gift, or school supplies for the children on the island. The women exclusively make yarn and weave."
PE-2000-4#-00000175,2.0,"Early efforts to gather funds were largely organized by the university, which organized several fund-raisers by giving volunteering students lottery tickets to sell throughout the city."
PE-2009-5Z-00000176,1.0,"The San Cristóbal of Huamanga National University (in Spanish, Universidad Nacional de San Cristóbal de Huamanga) is a public university located in the city of Ayacucho (formerly known as Huamanga) in southern Peru. The university was established in 1677 by Cristóbal de Castilla y Zamora, the Catholic archbishop of La Plata o Charcas. The government of Perú reopened it in 1959 as a national university. In the 1960s, the university became a breeding ground for communist organizations, including the Shining Path. This group, led by philosophy professor Abimael Guzmán, started there before growing into a violent guerrilla movement that conducted a bloody campaign against the government of Perú and against rival leftists groups. The rector of the university is Homero Ango Aguilar, a biologist."
PE-2000-4#-00000518,1.0,"In March 2012, the university announced that it would open a new research center at the site in September 2012, related to a longterm project to study the area for the next 15 years."
PE-2000-4#-00000115,1.0,"+Religion in Apurímac Religion   PercentageNumberCatholicism77.9%256,430Evangelical17.7%58,404Other2.4%7,798Irreligious2%6,525   Literacy  80.8% (324,938) of the population is literate and 19.2% (77,347) of the population is illiterate. In Andahuaylas, women and men dance in groups day and night."
PE-2000-4#-00000207,1.0,"+Religion in Arequipa (2017) ReligionPercentageNumberCatholicism83.3%983,652Evangelical6.3%74,582Other6.1%72,330Irreligious4.3%50,278   Literacy  In 2017, 91.5% (1,274,358) of the population was literate and 8.5% (118,691) of the population was illiterate."
PE-2000-4#-00000384,1.0,"The following table shows the results concerning the language learnt first in the department of Huancavelica by province:inei.gob.pe  INEI, Peru, Censos Nacionales 2007   Province Quechua Aymara Asháninka Another native language Spanish Foreign language Deaf or mute TotalAcobamba51,3384911108,261 -7859,747Angaraes40,669  627710,922   -5651,723Castrovirreyna4,093141314,168   -7318,352Churcampa33,025274198,542 312741,747Huancavelica73,340117281359,544 4157133,203Huaytara5,670134316,218 22821,938Tayacaja63,95091231533,900 124298,222Total272,0853737870151,55510761424,932%64.030.090.020.0235.670.000.18100.00  Education  The National University of Huancavelica is the only university in the region and it has branches in Pampas, Lircay, Acobamba and Castrovirreyna. Notable natives  Lina Medina, world's youngest mother   Authorities   Governor: Rubén Alva Ochoa (2015–2018)   See also   Aknuqucha  Chunta mountain range  Chuqlluqucha  Inka Wasi  Urququcha  Warmiqucha   Sources    External links   Official regional site Official municipal site    Huancavelica"
PE-2000-4#-00000939,1.0,"Demographics  Loreto is home to many Amazonian indigenous peoples such as the Amhuacas and the Urarina.Dean, Bartholomew 2009 Urarina Society, Cosmology, and History in Peruvian Amazonia, Gainesville: University Press of Florida     Languages  According to the 2007 Peru Census, the mother tongue of most of the residents was Spanish (92.51%). The following table shows the mother tongue of the people of the Loreto Region by province:inei.gob.pe INEI, Peru, Censos Nacionales 2007   Province Quechua Aymara Asháninka Another native language Spanish Foreign language Deaf or mute TotalAlto Amazonas367161512,81181,9287 	14695,290Datem del Marañón1,73613820,01422,3291 	4344,144Loreto548984,618 	50,7951 	7956,058 	M. Ramón Castilla49730134,41144,08338 	4449,116Maynas2,612140804,466446,809266 	427454,800Requena296161,44957,561- 	6459,125Ucayali10115245,74849,835 	5 	5555,783Total5,89022916453,517	753,340 	318 	858814,316		%0.72 	0.020.036.5792.510.040.11100.00  Local customs Festivities  First week of January."
PE-2009-5Z-00000831,3.0,"Education  Secondary education has been attended by 33.3% of the population and 5.5% also have graduated from non-university higher education, while 4.3% have complete university studies."
PE-2009-5Z-00001040,1.0,"A singular and moving civic patriotic act in which the women of Tacna carry the red and white Peruvian flag through the streets of the city. Later, various associations, groups of students, and the armed and police forces take part in a parade that ends in the main square, where the Arch of the Heroes is located."
PE-2009-5Z-00001085,3.0,"Secondary education has been completed by 31.8% of the population and 4.5% also have graduated from non-university higher education, while 2.3% have complete university studies."
PE-2009-5Z-00001131,3.0,"Education Secondary education has been attended by 29% of the population and 2.3% also have graduated from non-university higher education, while 1.7% have complete university studies."
PE-2009-5Z-00001046,1.0,"Geography and demography According to the 2002 census by the National Statistics Institute (INE), the province spans an area of  and had a population of 186,488 inhabitants (92,487 men and 94,001 women), giving it a population density of ."
PE-2000-4#-00000055,1.0,"As archaeologist Julio C. Tello put it, ""Chavín was the mother of all the cultures that later bloomed in the old Peru."" +Ethnicity in Ancash (2017) EthnicityPercentageNumberMestizo54.9%478,312Quechua35.3%307,965White5.9%51,268Afro-Peruvian3.2%27,953Other0.7%5,671AymaraNegligible852   Religion  +Religion in Ancash (2017) ReligionPercentageNumberCatholicism76.9%686,511Evangelical15.5%138,659Irreligious4.6%41,411Other3%26,641   Literacy  As of 2017, 85.3% (923,542) of the population is literate and 14.7% (158,839) of the population is illiterate."
PE-2009-5Z-00000943,1.0,"The mother earth (Pachamama), the principal Andean deity, directly controls harvesting and fertility; the island is home to four Apus, Andean mountaintop deities."
PE-2009-5Z-00000971,2.0,"One small group people, descendants of Armenians, Jews, and Germans have the higher education and economic rate in the city; many of their members emigrated from Moyobamba to other areas and are very active in politics, economy, trade and education in largest cities of Peru (like Lima, Trujillo, Arequipa, Ica and Chiclayo)."
PE-2000-4#-00000756,2.0,"This attack was used as a justification for the La Cantuta massacre two days later on 18 July, in which nine students and one teacher at the National University of Education Enrique Guzmán y Valle, Shining Path suspects, were kidnapped and disappeared during the night by members of the Grupo Colina death squad."
PE-2009-5Z-00001046,2.0,The university was created in 1981 from the former campus of the University of Chile in Iquique.
PE-2009-5Z-00001046,1.0,"University of Tarapacá () is a university in Arica, Chile. It is a derivative university part of the Chilean Traditional Universities. The university publishes Revista Chungará a journal on anthropology and archaeology."
PE-2000-4#-00000319,1.0,"This was a school that was built by the Spanish to educate the Incas and their descendants with the methods and disciplines of European renaissance style artwork. This school was famous throughout the colonial Americas, but the Quechua painters were limited to painting scenes of European and Catholic importance."
PE-2004-5#-00000205,1.0,"Hatun K'irawniyuq (Quechua hatun big, k'iraw cradle, bed of a child, -ni, -yuq suffixes,Diccionario Quechua - Español - Quechua, Academía Mayor de la Lengua Quechua, Gobierno Regional Cusco, Cusco 2005 (Quechua_Spanish dictionary)Teofilo Laime Ajacopa, Diccionario Bilingüe Iskay simipi yuyayk'ancha, La Paz, 2007 (Quechua-Spanish dictionary) ""the one with a big cradle"" or ""the big one with a cradle"", Hispanicized spelling Jatun Quirauniyoc) is a mountain in the Arequipa Region in the Andes of Peru, about  high."
PE-2009-5Z-00000577,1.0,"The lakes named Quyllurqucha, Warmiqucha (Quechua for ""woman lake"", Huarmicocha) and Challwaqucha (""fish lake"", Challhuacocha) lie at its feet."
PE-2009-5Z-00000168,1.0,"Yuraq Punta lies west of Minata, northeast of Chawpi Chawpi and Chunta, and east of Tintaya, north of a lake named Ikmaqucha (Quechua for ""widow lake"")."
PE-2000-4#-00000353,1.0,Igma (possibly from Quechua for widow) is a   mountain in the Huanzo mountain range in the Andes of Peru.
PE-2000-4#-00000319,1.0,"Years later the property was purchased from the heirs of the conquistador by Diego de Silva y Guzmán and his wife Teresa Orgoñez, who donated it to the Jesuits after their arrival to the city in 1571. The Jesuit college in Cusco was dedicated the Transfiguration of Christ, and the high altar features a painting of the Transfiguration attributed to the Jesuit Diego de la Puente. This noble indigenous woman, Beatriz Clara, was heiress of the Lordship of Yucay. New York Public Library]] Next to their church, the Jesuits built their own university: the University of San Ignacio de Loyola, now the premises of the National University of Saint Anthony the Abbot."
PE-2000-4#-00000579,5.0,"In 1956, after spending two years as a secondary education teacher in Otuzco, he entered the staff of the UNT where he would over the years teach botany and phytogeography—eventually achieving the title of ""principal exclusive professor"" (profesor principal dedicación exclusiva)—as well as becoming the first official curator of the university's herbarium."
PE-2000-4#-00000767,7.0,"The following year the faculty of education was created and the first academic year of undergraduate at the Villa campus was inaugurated; and in 2015, the San Miguel campus is inaugurated and the psychology faculty is created."
PE-2000-4#-00000839,3.0,"During his third term, district mayor Michel Azcueta decided to name the stadium to honor the memory of Moreno who had been his student while he, the mayor, was a school teacher in the district."
PE-2000-4#-00000433,1.0,"Name  The name comes from the shape of the mountain, which resembles a woman lying down, and is present in a local folktale."
PE-2000-4#-00000691,1.0,"The Chef de cuisine is Pía León, wife of Martínez Véliz."
PE-2000-4#-00000767,4.0,"ESAN University is a leading academic institution in business education, that was founded in 1963 as ESAN - Escuela de Administración de Negocios para Graduados, the first graduate business school in Latin America."
PE-2009-5Z-00000635,4.0,"Alas Peruanas International  The Universidad Alas Peruanas promotes the exchange of knowledge and research at the international level in all its academic areas at undergraduate and graduate levels as well as for its teaching staff. Institutes  They are educational institutions of higher education promoted by the Universidad Alas Peruanas, with the purpose of forming technical professionals in accordance with the current Technological Superior Education Institutes and Schools Act (MODULAR system) using state-of-the-art equipment and experienced scholars in the teaching and learning process."
PE-2000-4#-00001174,2.0,"Awallani (Aymara awalla the first one of two newborn girl, -ni a suffix to indicate ownership, ""the one with the first one of two newborn girl"", Hispanicized spelling Aguallane) is a mountain in the Andes of Peru, about  high."
PE-2000-4#-00000355,1.0,"Mamañawi (Quechua mama mother, madam; vein (or seam), ñawi eye, Hispanicized spelling Mamañahui) is a  mountain in the Andes of Peru, about  high."
PE-2000-4#-00001044,2.0,"Wawa Chaki (Quechua wawa child, baby, chaki foot, ""child foot"", Hispanicized spelling Huahuachaqui,Municipalidad Provincia de Mariscal Nieto, Ley Organica 27972 del 26-05-2003 also Negra Huahuachaqui, Negro Huahuachaqui) is a mountain in the Andes of southern Peru, about  high."
PE-2000-4#-00000887,1.0,"Winsu (Quechua for firstborn child, also spelled Huinso) is mountain in the Cordillera Central in the Andes of Peru which reaches a height of approximately ."
PE-2000-4#-00000887,1.0,"Sapallan Warmi (Quechua sapalla only, unique, -n a suffix, warmi woman, also spelled Sapallanhuarmi) is a mountain in the Cordillera Central in the Andes of Peru which reaches a height of approximately ."
PE-2009-5Z-00000186,1.0,"Moonbouncer54 created the website for Cayley Chemicals and volunteered to help the two sons of John Mills (Philip and Nick Mills, both directors of CCC Trading Ltd t/a Cayley Chemicals), not that I have ever been involved in any Wiki related activity before, but probably more able to teach self the basics. Its a steep learning curve though and all the advice so genuinely offered really is appreciated. Decided to jump into making some edits and creating a page for my favorite resource (have a couple of kids entering school age and found it to be really valuable) - GreatSchools."
PE-2000-4#-00000435,4.0,"Warmi Wañusqa (Quechua warmi woman, wife, wañusqa died, dead, ""woman (who) died"" or ""dead woman"", also spelled Huarmihuañusca) is a mountain in the Andes of Peru which reaches a height of approximately ."
PE-2000-4#-00000350,1.0,"Chaupimaquito (possibly from Quechua chawpi central, middle, makitu an additional sleeve which Andean women and men put on in some cold regions,Diccionario Quechua - Español - Quechua, Academía Mayor de la Lengua Quechua, Gobierno Regional Cusco, Cusco 2005 (Quechua-Spanish dictionary) ""central makitu"") is a mountain in the Vilcanota mountain range in the Andes of Peru, about  high."
PE-2000-4#-00000383,4.0,"Chuqi Warmi (Aymara chuqi gold, warmi woman, Quechua chuqi precious metal, warmi woman, ""gold (or metal) woman"", Hispanicized spelling Choquehuarmi) or Chuki Warmi (Quechua chuki hard; sword; spear, lance, ""hard (sword, spear or lance) woman"") is a  mountain in the Andes of southern Peru."
PE-2000-4#-00000355,1.0,"The mountain northwest of it is Atawallpa Much'u (""hen's little child"")."
PE-2000-4#-00000355,2.0,"Atawallpa Much'u (Aymara atawallpa hen, much'u little child, ""hen's little child"", Hispanicized spelling Atahualpa Mocho) is a mountain in the Andes of Peru, about  high."
PE-2000-4#-00000122,1.0,"T'alla Kallanka (Quechua t'alla outstanding woman of the Inca aristocracy, kallanka large roofed building used for celebrations during the Inca Empire,Diccionario Quechua - Español - Quechua, Academía Mayor de la Lengua Quechua, Gobierno Regional Cusco, Cusco 2005 (Quechua-Spanish dictionary) Hispanicized spelling Tallacallanca) is a mountain in the Wansu mountain range in the Andes of Peru, about  high."
PE-2000-4#-00000319,1.0,"This was a school that was built by the Spanish to educate the Incas and their descendants with the methods and disciplines of European renaissance style artwork. This school was famous throughout the colonial Americas, but the Quechua painters were limited to painting scenes of European and Catholic importance."
PE-2009-5Z-00000617,4.0,It is the campus that was first built upon the university's founding and has classroom capacity for about 4000 students.
PE-2009-5Z-00000577,1.0,"The lakes named Huarmicocha (possibly in Quechua Warmiqucha, ""woman lake"") and Challhuacocha (possibly in Quechua Challwaqucha, ""fish lake"") lie west."
PE-2009-5Z-00000469,1.0,"The capacity of the arena is 7,000 spectators  and has hosted some 2011 FIVB Women's Junior World Championship, 1982 FIVB Women's World Championship, and Peru women's national volleyball team matches."
PE-2009-5Z-00000269,1.0,"The capacity of the arena is 13,000 spectators  and has hosted some Peru women's national volleyball team matches."
PE-2004-5#-00000205,1.0,"Hatun K'irawniyuq (Quechua hatun big, k'iraw cradle, bed of a child, -ni, -yuq suffixes,Diccionario Quechua - Español - Quechua, Academía Mayor de la Lengua Quechua, Gobierno Regional Cusco, Cusco 2005 (Quechua_Spanish dictionary)Teofilo Laime Ajacopa, Diccionario Bilingüe Iskay simipi yuyayk'ancha, La Paz, 2007 (Quechua-Spanish dictionary) ""the one with a big cradle"" or ""the big one with a cradle"", Hispanicized spelling Jatun Quirauniyoc) is a mountain in the Arequipa Region in the Andes of Peru, about  high."
PE-2009-5Z-00000577,1.0,"The lakes named Quyllurqucha, Warmiqucha (Quechua for ""woman lake"", Huarmicocha) and Challwaqucha (""fish lake"", Challhuacocha) lie at its feet."
PE-2009-5Z-00000168,1.0,"Yuraq Punta lies west of Minata, northeast of Chawpi Chawpi and Chunta, and east of Tintaya, north of a lake named Ikmaqucha (Quechua for ""widow lake"")."
PE-2000-4#-00000353,1.0,Igma (possibly from Quechua for widow) is a   mountain in the Huanzo mountain range in the Andes of Peru.
PE-2000-4#-00000319,1.0,"Years later the property was purchased from the heirs of the conquistador by Diego de Silva y Guzmán and his wife Teresa Orgoñez, who donated it to the Jesuits after their arrival to the city in 1571. The Jesuit college in Cusco was dedicated the Transfiguration of Christ, and the high altar features a painting of the Transfiguration attributed to the Jesuit Diego de la Puente. This noble indigenous woman, Beatriz Clara, was heiress of the Lordship of Yucay. New York Public Library]] Next to their church, the Jesuits built their own university: the University of San Ignacio de Loyola, now the premises of the National University of Saint Anthony the Abbot."
PE-2000-4#-00000579,5.0,"In 1956, after spending two years as a secondary education teacher in Otuzco, he entered the staff of the UNT where he would over the years teach botany and phytogeography—eventually achieving the title of ""principal exclusive professor"" (profesor principal dedicación exclusiva)—as well as becoming the first official curator of the university's herbarium."
PE-2000-4#-00000767,7.0,"The following year the faculty of education was created and the first academic year of undergraduate at the Villa campus was inaugurated; and in 2015, the San Miguel campus is inaugurated and the psychology faculty is created."
PE-2000-4#-00000839,3.0,"During his third term, district mayor Michel Azcueta decided to name the stadium to honor the memory of Moreno who had been his student while he, the mayor, was a school teacher in the district."
PE-2000-4#-00000433,1.0,"Name  The name comes from the shape of the mountain, which resembles a woman lying down, and is present in a local folktale."
PE-2000-4#-00000691,1.0,"The Chef de cuisine is Pía León, wife of Martínez Véliz."
PE-2000-4#-00000767,4.0,"ESAN University is a leading academic institution in business education, that was founded in 1963 as ESAN - Escuela de Administración de Negocios para Graduados, the first graduate business school in Latin America."
PE-2009-5Z-00000635,4.0,"Alas Peruanas International  The Universidad Alas Peruanas promotes the exchange of knowledge and research at the international level in all its academic areas at undergraduate and graduate levels as well as for its teaching staff. Institutes  They are educational institutions of higher education promoted by the Universidad Alas Peruanas, with the purpose of forming technical professionals in accordance with the current Technological Superior Education Institutes and Schools Act (MODULAR system) using state-of-the-art equipment and experienced scholars in the teaching and learning process."
PE-2000-4#-00001174,2.0,"Awallani (Aymara awalla the first one of two newborn girl, -ni a suffix to indicate ownership, ""the one with the first one of two newborn girl"", Hispanicized spelling Aguallane) is a mountain in the Andes of Peru, about  high."
PE-2000-4#-00000355,1.0,"Mamañawi (Quechua mama mother, madam; vein (or seam), ñawi eye, Hispanicized spelling Mamañahui) is a  mountain in the Andes of Peru, about  high."
PE-2000-4#-00001044,2.0,"Wawa Chaki (Quechua wawa child, baby, chaki foot, ""child foot"", Hispanicized spelling Huahuachaqui,Municipalidad Provincia de Mariscal Nieto, Ley Organica 27972 del 26-05-2003 also Negra Huahuachaqui, Negro Huahuachaqui) is a mountain in the Andes of southern Peru, about  high."
PE-2000-4#-00000887,1.0,"Winsu (Quechua for firstborn child, also spelled Huinso) is mountain in the Cordillera Central in the Andes of Peru which reaches a height of approximately ."
PE-2000-4#-00000887,1.0,"Sapallan Warmi (Quechua sapalla only, unique, -n a suffix, warmi woman, also spelled Sapallanhuarmi) is a mountain in the Cordillera Central in the Andes of Peru which reaches a height of approximately ."
PE-2009-5Z-00000186,1.0,"Moonbouncer54 created the website for Cayley Chemicals and volunteered to help the two sons of John Mills (Philip and Nick Mills, both directors of CCC Trading Ltd t/a Cayley Chemicals), not that I have ever been involved in any Wiki related activity before, but probably more able to teach self the basics. Its a steep learning curve though and all the advice so genuinely offered really is appreciated. Decided to jump into making some edits and creating a page for my favorite resource (have a couple of kids entering school age and found it to be really valuable) - GreatSchools."
PE-2000-4#-00000435,4.0,"Warmi Wañusqa (Quechua warmi woman, wife, wañusqa died, dead, ""woman (who) died"" or ""dead woman"", also spelled Huarmihuañusca) is a mountain in the Andes of Peru which reaches a height of approximately ."
PE-2000-4#-00000350,1.0,"Chaupimaquito (possibly from Quechua chawpi central, middle, makitu an additional sleeve which Andean women and men put on in some cold regions,Diccionario Quechua - Español - Quechua, Academía Mayor de la Lengua Quechua, Gobierno Regional Cusco, Cusco 2005 (Quechua-Spanish dictionary) ""central makitu"") is a mountain in the Vilcanota mountain range in the Andes of Peru, about  high."
PE-2009-5Z-00000599,1.0,"Universidad Privada San Juan Bautista is a private university in the city of Lima, Peru. It offers 16 career programs categorized in 4 schools."
PE-2009-5Z-00000472,2.0,"Floor  Telecommunications Engineering  Software Engineering  Civil Engineering  Computer Science  Electrical Engineering  Industrial engineering  Faculty of Human Medicine  Human Medicine  Psychology  Dentistry  Faculty of Communication Studies  Communication Studies  Faculty of Health Science  Nursing  Obstetrics  Faculty of Education and Humanities  Early childhood education  Primary education  Faculty of Economic Sciences  Economics  Administration  Accountancy  Faculty of Law and Politic Sciences  Law  Faculty of Architecture, Urbanism and Arts  Architecture  Faculty of Agricultural Sciences  Veterinary medicine  Agronomy  Food Engineering  See also Victor Larco Herrera District List of universities in Peru  References  Category:Universities from Trujillo, Peru Category:Companies based in Trujillo, Peru"
PE-2000-4#-00000677,4.0,"The number of private schools is much greater than public schools (6,242 vs 1,805) while the average size of private schools is 100 for elementary and 130 for high school."
PE-2009-5Z-00000482,3.0,"Faculties  thumb|View of the university in Trujillo   Faculty of Engineering   Industrial Engineering  Agro Industrial Engineering  Civil Engineering  Systems Engineering   Faculty of Human Medicine   Human Medicine  Psychology   Faculty of Communication Studies   Communication Studies   Faculty of Health Science   Obstetrics   Faculty of Education and Humanities   Early childhood education  Primary education  Translation and interpreting   Faculty of Economic Sciences   Administration  Accountancy   Faculty of Law and Politic Sciences   Law   Faculty of Architecture   Architecture   See also   Club Deportivo Universidad César Vallejo  CV Universidad César Vallejo  Victor Larco Herrera District  List of universities in Peru  Trujillo   References   Category:Universities from Trujillo, Peru Category:Companies based in Trujillo, Peru"
PE-2000-4#-00000319,1.0,"This was a school that was built by the Spanish to educate the Incas and their descendants with the methods and disciplines of European renaissance style artwork. This school was famous throughout the colonial Americas, but the Quechua painters were limited to painting scenes of European and Catholic importance."
PE-2009-5Z-00000954,1.0,"A few small stores sell basic goods, and a health clinic and six schools are found. Guests typically take food staples (cooking oil, rice, etc., but no sugar products, as they have no dental facilities) as a gift, or school supplies for the children on the island. The women exclusively make yarn and weave."
PE-2000-4#-00000175,2.0,"Early efforts to gather funds were largely organized by the university, which organized several fund-raisers by giving volunteering students lottery tickets to sell throughout the city."
PE-2009-5Z-00000954,1.0,"A few small stores sell basic goods, and a health clinic and six schools are found. Guests typically take food staples (cooking oil, rice, etc., but no sugar products, as they have no dental facilities) as a gift, or school supplies for the children on the island. The women exclusively make yarn and weave."
PE-2000-4#-00000175,2.0,"Early efforts to gather funds were largely organized by the university, which organized several fund-raisers by giving volunteering students lottery tickets to sell throughout the city."
