DHSID_EA,clean_sentences,most_relevant_sentences
CI-1998-3Z-00000011,"['The Agneby River, also known as the Agbo River, is a river in Ivory Coast in West Africa', ' The river originates from springs near Agoua in the region of Bongouanou, flows southwards and empties into the Ébrié Lagoon in the south of the country', ' The climate in this region alternates between moisture bearing winds from the Atlantic Ocean forming the West African monsoon and dry harmattan winds from the Sahara', ' These alternating wet and dry seasons causes great variations in the volume of water in the river', '  References  Category:Rivers of Ivory Coast']",These alternating wet and dry seasons causes great variations in the volume of water in the river
CI-1998-3Z-00000073,"['Divo Biomass Power Station, also Soden Biomass Power Station, is a  biomass-fired thermal power plant under development in Ivory Coast', ' Société des Energies Nouvelles, an Ivorian IPP is leading the development of this biomass waste-to-energy infrastructure project', ' The main fuel is intended to be cocoa bean shells, cocoa pod husks and ""cocoa sweatings""', ' The U', 'S', ' Trade and Development Agency (USTDA) has provided partial funding for this power station', '  Location The power plant is under development in the city of Divo, in Divo Department, Gôh-Djiboua District,  in the Lôh-Djiboua Region, in the central southern part of the country', ' Divo is located approximately , by road, northwest of Abidjan, the capital and largest city in Ivory Coast', ""  Overview Ivory Coast is the world's leading producer of cocoa, accounting for more than 40 percent of global production, as of 2021"", ' The cocoa bean is a small component of the cocoa plant', ' While the bean is transformed into chocolate, confectionery and cocoa drinks, the rest of the fruit is thrown away as waste', '  Société des Energies Nouvelles (Soden) (English: New Energy Company), an Ivorian business, is in the process of building a power station with capacity between 60 and 70 megawatts, derived from incinerating biomass, primarily cocoa waste', ' With abundant raw material, other biomass-fired power stations are in the planning stages around the country', '  Ownership The power station is owned and is under development by SODEN, an Ivorian IPP', '  See also  List of power stations in Ivory Coast Ayebo Biomass Power Station  References  External links  Ivory Coast studies first cocoa-fired power station As of 2 July 2018', '  Category:Power stations in Ivory Coast Category:Gôh-Djiboua District Category:Biofuel power stations in Ivory Coast']","Société des Energies Nouvelles, an Ivorian IPP is leading the development of this biomass waste-to-energy infrastructure project"
CI-2012-6#-00000016,"['The Singrobo Hydroelectric Power Station, also Singrobo-Ahouaty Hydroelectric Power Project, is a hydroelectric power station under construction across the Bandama River, in Ivory Coast', ' When completed, as expected in 2023, the power station will be the first, grid-ready hydroelectric power station, developed and owned by a independent power producer (IPP) in West Africa', ' The energy generated here will be sold to the Ivorian electric utility company, Cienergues, under a 35-year power purchase agreement (PPA)', '  Location The power station is located in the villages of Singrobo and Ahouaty, in Tiassalé Department, Agnéby-Tiassa Region, in the Lagunes District of Ivory Coast', ' The dam lies across the Bandama River, about , northwest of Agboville, the regional capital', ' This is approximately  northwest of Abidjan, the largest city in the country', ' Singrobo is located off the main highway between Abidjan and Yamoussoukro (A3), about  southeast of Yamoussoukro,  the legal capital of Ivory Coast', '  Overview In October 2018, the French civil engineering and construction company, Eiffage Group, was awarded the engineering, procurement and construction (EPC) contract to design and build this hydro power plant', ' The 44 megawatt power station involves the construction of a ""mixed rockfill and concrete dam"", measuring  in height and  in length, creating a reservoir that can store  of water', '  Other related infrastructure under the same EPC, includes the construction of a ""discharge channel"" for the power station, a 90kV substation outside the power station, a 90kV high voltage transmission line measuring  that will evacuate the power to a location where it will enter the national grid, and access roads to the power station', '  Ownership The power station is owned by a consortium comprising the shareholders outlined in the table below', ' The special purpose vehicle company created by the consiotium is called Ivoire Hydro Energy or IHE', '  + Shareholding In Singrobo Hydroelectric Power StationRank Shareholder Domcile Notes1 Themis GroupUnited States 2 Government of Ivory Coast Ivory Coast 3Africa Finance CorporationNigeria 4IHE Holding Ivory Coast   Construction costs and funding The cost of construction is quoted as €195 million or US$214 million', ' Funding agencies for this project include (a) Africa Finance Corporation (AFC) (b) Emerging Africa Infrastructure Fund (EAIF) and the German Investment Corporation (DEG)', ' The lenders are providing an estimated 75 percent of the budget while the owner consortium will raise the remaining 25 percent as equity investment', '  Other considerations The power station will on annual basis supply 217 GWh of clean energy, enabling the country to avoid the emission of 124,000 tons of carbon dioxide in the same period', ' During the construction period, an estimated 500 jobs are expected to be created', '  The African Development Bank, agreed with the developer/owner consortium to implement a Resettlement Action Plan (RAP) involving 730 people, who ""will be impacted by the project""', '  See also   List of power stations in Ivory Coast  References  External links  About Singrobo Hydroelectric Power Station In original French Language', ' Google can Translate', '  Category:Energy infrastructure under construction']","The 44 megawatt power station involves the construction of a ""mixed rockfill and concrete dam"", measuring in height and in length, creating a reservoir that can store of water.Other related infrastructure under the same EPC, includes the construction of a ""discharge channel"" for the power station, a 90kV substation outside the power station, a 90kV high voltage transmission line measuring that will evacuate the power to a location where it will enter the national grid, and access roads to the power station.Category:Energy infrastructure under construction"
CI-1998-3Z-00000073,"['Divo Biomass Power Station, also Soden Biomass Power Station, is a  biomass-fired thermal power plant under development in Ivory Coast', ' Société des Energies Nouvelles, an Ivorian IPP is leading the development of this biomass waste-to-energy infrastructure project', ' The main fuel is intended to be cocoa bean shells, cocoa pod husks and ""cocoa sweatings""', ' The U', 'S', ' Trade and Development Agency (USTDA) has provided partial funding for this power station', '  Location The power plant is under development in the city of Divo, in Divo Department, Gôh-Djiboua District,  in the Lôh-Djiboua Region, in the central southern part of the country', ' Divo is located approximately , by road, northwest of Abidjan, the capital and largest city in Ivory Coast', ""  Overview Ivory Coast is the world's leading producer of cocoa, accounting for more than 40 percent of global production, as of 2021"", ' The cocoa bean is a small component of the cocoa plant', ' While the bean is transformed into chocolate, confectionery and cocoa drinks, the rest of the fruit is thrown away as waste', '  Société des Energies Nouvelles (Soden) (English: New Energy Company), an Ivorian business, is in the process of building a power station with capacity between 60 and 70 megawatts, derived from incinerating biomass, primarily cocoa waste', ' With abundant raw material, other biomass-fired power stations are in the planning stages around the country', '  Ownership The power station is owned and is under development by SODEN, an Ivorian IPP', '  See also  List of power stations in Ivory Coast Ayebo Biomass Power Station  References  External links  Ivory Coast studies first cocoa-fired power station As of 2 July 2018', '  Category:Power stations in Ivory Coast Category:Gôh-Djiboua District Category:Biofuel power stations in Ivory Coast']","Société des Energies Nouvelles, an Ivorian IPP is leading the development of this biomass waste-to-energy infrastructure project"
CI-2012-6#-00000019,"['Félix-Houphouët-Boigny International Airport , also known as Port Bouët Airport, is located  south east of Abidjan, Ivory Coast', ' It is the largest airport in the country for air traffic', "" The airport is the main hub of the national airline Air Côte d'Ivoire"", ' Named after the first president of Ivory Coast, Félix Houphouët-Boigny, this international airport is directly connected currently to five different airports in Europe and to many destinations within the rest of Africa and the Middle East', ' Usually, the airport is served by over 20 airlines, covering more than 36 destinations', '   History  [[File:Arrive du CONCORDE à Abidjan en 1978', 'jpg|thumb|Concorde at Abidjan Airport, 1978]] thumb|Check-in area thumb|Departure gates thumb|Business lounge The airport is managed by Aeria, a private Ivorian company, who continually developed the airport over the decades and contributing to making it one of the most modern and one of the main hubs of West Africa', '  Disturbances that took place in Ivory Coast in the early 2000s had a negative impact on the airport', ' It is a strategic infrastructure for both the evacuation of foreign nationals and the delivery of military equipment', ' In November 2004, during the French–Ivorian clashes that occurred in Abidjan, the airport was looted and damaged', ' It was taken back by French troops and returned to the Ivorian government in the second half of November', ' The airport was later refurbished by the Ivorian government and modernized with new modern facilities', '  On the night of 2 to 3 April 2011, the airport was again taken by the French troops in order to evacuate French nationals and foreigners, as the final assault against the presidential palace was announced, during the battle for Abidjan', ""La force française Licorne prend le contrôle de l'aéroport d'Abidjan – France 24Inquiétude pour la communauté française d'Abidjan – Le Monde Afrique After the civil war ended in April 2011, the airport was returned to the Ivorian government and development projects, paused for almost a decade, were restarted"", '  Following the gradual recovery of economic activities in Ivory Coast from 2012, investments and projects to increase the capacity of the airport, provided in March 2010,Modernisation et extension de Aéria – Banzio pour le déguerpissement des populations – Le Temps sur Abidjan', 'net are in the works since October 2011', ""Inauguration de l'aérogare charter d'Abidjan, Soro rallume les réacteurs du développement – Nord-Sud sur Abidjan"", ""net  In February 2012, Abdoulaye Coulibaly, president of Aeria's board of directors, indicated that he wanted to make the airport suitable for the Airbus A380"", ' Air France did not deny that it could eventually use the A380 on the Paris-Abidjan route if there were sufficiently strong economic growth', ""Air France, qui propose déjà sept vols hebdomadaires entre Paris et Abidjan opérés par des Boeing B777-200 et des B777-300, va augmenter de façon pérenne dès son programme d'été"", '', '', ' – La Tribune  On 4 May 2012, PROPARCO loans 10 billion CFA francs (15 million euros) to Aeria to fund a major expansion and modernization program for the airport', "" This loan is part of the renewal of Aeria's concession, effective 1 January 2010, for a period of 20 years"", ' This concession provides investment programs in increments of five years', ' The first slice of 24 million dollars, includes the renovation of the international terminal, the rehabilitation of the charter terminal and development of new infrastructure', ""L'aéroport Houphouët-Boigny se modernise – Journal d'Abidjan Modernisation de l'aéroport d'Abidjan financé par Proparco – Marchés Tropicaux & Méditerranéens   In addition, the refurbishment included an extension of the international terminal of a surface 11 000 to 26 000 m2, the refurbishment of the aircraft parking area, renovation of access roads and the construction of a new parking lot"", ' The ultimate goal is to create a commercial zone next to the airport, with a lodging area, hangars, a convention center, a free zone, office buildings, warehouses, exhibition halls, a shopping center and housing for dedicated staff', ' On 16 June 2012, the Radisson Hotels group announced the laying of the first stone of the Radisson Blu hotel on the airport grounds', 'Radisson Blu Hotel Abidjan Airport for Ivory Coast – Hotel & Restaurant', 'co', 'za The Radisson Blu opened in the spring of 2016 and has over 200 rooms and suites, as well as a restaurant, outdoor pool and fitness center', 'Abidjan aura son Radisson Blu – Jeune Afrique Économie Radisson Blu: Un hôtel flambant neuf dans 24 mois, à Port-Bouët – Nord-Sud sur Abidjan', 'net Also on the airport grounds, ONOMO Hotels operates a 118-room select-service property', ' Both the ONOMO and the Radisson Blu are accessible from the passenger terminal via shuttle buses', '  Tens of thousands were left homeless in January 2020 as homes in Adjoufou, a shanty town near the airport, were demolished, officially for safety reasons', ' Residents said they were targeted because they are poor', 'Ivory Coast demolitions: Shantytown near airport cleared by Laura Burdon-Manley, Al Jazeera, 24 Jan 2020   Airlines and destinations   Passenger   Cargo   Statistics Before the decade of political and military turmoil, the Felix-Houphouet-Boigny airport was among the most important in West Africa, with passenger traffic exceeding one million travelers in the late 1990s', "" The succession of political and military crises seriously affected the country's image and reduced the importance of the airport in the sub-region in terms of traffic, but in recent years, as stability and strong economic growth have returned, airport traffic has been growing at a fast pace, and is now at its highest ever"", ' In 2017, the airport handled 2', '070 million passengers, the highest number in its history', '  In 2019,  2,271,700 passengers used the airport', ""    Approximate traveler attendance per year 1998  1999  2000  2004  2009  2010  2011  2012  2013  2015  2016  20172019 *Aéroport d'Abidjan: bilan positif, de gros investissements en vue - article d'Acturoutes publié le 5 mars 2014"", ""  Interview with Général Abdoulaye Coulibaly – L'Expression on Abidjan"", 'net  Rognone, DG AERIA : « Les temps sont durs » - article de Ouest Afrique Économie publié le 2 décembre 2001', ""      L'A380 d'Air France sur la ligne Abidjan-Paris décollera en avril 2014 - article d'Acturoutes publié le 23 mai 2013"", ""  Félix Houphouët-Boigny airport : Charter terminal works launched yesterday – L'Expression on Abidjan"", 'net', ' Consulté le 16 novembre 2012', '  Félix Houphouët-Boigny airport : a 50% passenger increase in 2012 – a FratMat', 'info article published on the 28th of Janvier 2013 ', '  Infrastructures aéroportuaires / Modernisation de l’aéroport d’Abidjan : 21 milliards FCFA investis dans la réhabilitation et l’extension de l’aérogare de fret - article from L’intelligent d’Abidjan on Abidjan', 'net published on 3 March 2014', '      2,271,700   Ground transport The airport is to be served by the new Abidjan Metro, construction of which started in November 2017', ' The metro should enter commercial service in 2022 and reach the airport by mid-2023', '   Accidents and incidents  3 January 1987: a Varig Boeing 707-379C registration PP-VJK operating flight 797 from Abidjan to Rio de Janeiro-Galeão crashed due to a failure on engine 1 shortly after take-off', "" While attempting to return to the airport for an emergency landing, it crashed on a field 18\xa0km away from Abidjan's airport"", ' Of the 51 passengers and crew aboard, a single passenger survived', ' 30 January 2000: Kenya Airways flight 431, crashed into the sea shortly after take-off from Port Bouet', ' Of the 179 passengers and crew on board the Airbus A310, only ten people survived', '  References   External links    Website Official  A-Z World Airports Online: Abidjan International Airport (ABJ/DIAP)  Category:Airports in Ivory Coast Category:Buildings and structures in Abidjan Category:Transport in Abidjan']","It is a strategic infrastructure for both the evacuation of foreign nationals and the delivery of military equipment.The first slice of 24 million dollars, includes the renovation of the international terminal, the rehabilitation of the charter terminal and development of new infrastructure"
CI-2012-6#-00000349,"[""250px|thumbnail|Kossou dam power plant The Kossou Dam is an embankment dam that impounds the Bandama River about  northwest of Yamoussoukro in  Côte d'Ivoire"", ' It has a power generating capacity of , enough to power over 118,000 homes', "" The dam impounds the largest lake in Côte d'Ivoire, Lake Kossou"", ' 650px|thumbnail|center|Kossou dam  References  Category:Dams completed in 1972 Category:Energy infrastructure completed in 1972 Kossou Category:Hydroelectric power stations in Ivory Coast Category:Embankment dams Category:Buildings and structures in Yamoussoukro Category:1972 establishments in Ivory Coast']",650px|thumbnail|center|Kossou dam References Category:Dams completed in 1972 Category:Energy infrastructure completed in 1972 Kossou Category:Hydroelectric power stations in Ivory Coast Category:Embankment dams Category:Buildings and structures in Yamoussoukro Category:1972 establishments in Ivory Coast
CI-2012-6#-00000103,"[""The Buyo Dam is an embankment dam on the Sassandra River in the Bas-Sassandra district of Côte d'Ivoire"", ' Completed in 1980,http://www', 'country-data', 'com/cgi-bin/query/r-6974', 'html it has a hydroelectric power station with an installed capacity of , enough to power over 111,000 homes', '  References  Category:Dams completed in 1980 Category:Energy infrastructure completed in 1980 Buyo Category:Hydroelectric power stations in Ivory Coast Category:Buildings and structures in Bas-Sassandra District Category:1980 establishments in Ivory Coast']",References Category:Dams completed in 1980 Category:Energy infrastructure completed in 1980 Buyo Category:Hydroelectric power stations in Ivory Coast Category:Buildings and structures in Bas-Sassandra District Category:1980 establishments in Ivory Coast
CI-1998-3Z-00000051,"['thumb|Boulay Island The name of Île Boulay is applied an island in the Ébrié Lagoon in Ivory Coast', ' This island is relatively unpopulated (a bit over 10,000 people) and remains in an undeveloped state, considering their proximity to the urban areas of Abidjan', ' Île Boulay is only 15 minutes from downtown Abidjan by boat', '  It contains vacation cottages for some of the richer residents of the city', '  Water skiing is a popular activity offshore', '  Since 2008 there has been a project to extend the Autonomous Port of Abidjan to the island, and to build a bridge to it', '  Also in 2008, the government of Mali begin construction of a warehouse for goods transshipped through Abidjan', '  These projects have created considerable opposition from the local residents', ' The waters around Île Boulay have also been affected by bacterial and chemical pollution', ""  Geographical coordinates: 5°16′45″N; 4°06′56″W  External links  Article Le Matin d'Abidjan (in French)  port development  pollution in the lagoon  Category:Populated places in Abidjan Category:Islands of Ivory Coast""]",The waters around Île Boulay have also been affected by bacterial and chemical pollution.Geographical coordinates: 5°16′45″N; 4°06′56″W External links Article Le Matin d'Abidjan (in French) port development pollution in the lagoon Category:Populated places in Abidjan Category:Islands of Ivory Coast
