DHSID_EA,clean_sentences,most_relevant_sentences
SL-2019-7Z-00000154,"['thumb|Albert Academy logo The Albert Academy (AA) is a secondary school in Freetown, Sierra Leone', ""  The school's motto is Esse Quam Vederi (Rather to be than to Seem)"", ' It is situated at Berry Street in Freetown', "" Among its alumni are Sierra Leone's first Prime Minister, Sir Milton Margai and Sierra Leone's first president, Siaka Stevens and Chernor Bah"", '  The school is sometimes referred to as Mende Man College reflecting the fact that over the years students from the Mende tribe in Sierra Leone were overrepresented', ' AA students have also been referred to as Okamory Boys due to the area in which the school is located in Freetown', ' However, the school has students from everywhere in Sierra Leone and it is not restricted to any tribe', '  Although the school has a Christian tradition, the United Methodist Church, students from all religious background can attend', ' It has alumni associations in the UK, USA and Freetown', ' The alumni associations make contributions to the school including, for example, giving scholarships and grants to students', ""   History  A girls' school had been established in the British colony of Sierra Leone in Moyamba in 1900, and it was decided to establish a similar boys' school"", ' The UBC mission was responsible for finding land for the school, and originally proposed locating it in Shenge, the home of missionary Ira Albert', "" Eventually, however, the board decided that Shenge was too small, so they established the school in the colony's capital at Freetown"", '  The Albert Academy was founded on 4 October 1904, and was named after Ira Albert, who had recently been killed in a boating accident', ' When the academy was founded, it had just one teacher, a Mr L Turner, and four pupils', ' The first principal was Reverend Raymond P', ' Dougherty, with Edwin Hursh as vice principal', "" The original location was in Freetown's East Street"", '  In 1907, the academy relocated to its present location on Berry Street', '  Notable alumni Sir Milton Margai, lead Sierra Leone to independence and became prime minister from 1961-1964  Siaka Stevens, First Executive President  Notes  References    External links Albert Academy Alumni Association, Washington DC Chapter  Category:Secondary schools in Sierra Leone Category:Schools in Freetown Category:1904 establishments in Sierra Leone Category:Educational institutions established in 1904']","The school is sometimes referred to as Mende Man College reflecting the fact that over the years students from the Mende tribe in Sierra Leone were overrepresented.AA students have also been referred to as Okamory Boys due to the area in which the school is located in Freetown.However, the school has students from everywhere in Sierra Leone and it is not restricted to any tribe.Although the school has a Christian tradition, the United Methodist Church, students from all religious background can attend.The alumni associations make contributions to the school including, for example, giving scholarships and grants to students.History A girls' school had been established in the British colony of Sierra Leone in Moyamba in 1900, and it was decided to establish a similar boys' school"
SL-2013-6#-00000117,"['Jamiatul Atiq Mosque, also locally known as Fourah Bay Mosque, is a large mosque located in the neighborhood of Fourah Bay, in Freetown,  Sierra Leone', ' The mosque regularly holds Islamic prayer services five times a day; and its also teaches Islamic education', ' The chief Imam of the Jamiatul Atiq Masjid is Chief Sheikh Alhaji Hassan Karim, and the deputy chief Imam is Sheikh Alhaji Nazir King', '  The mosque is the main mosque that serves the Fourah Bay community, a predominantly conservative Muslim community in Freetown', ""  The then Minister of Social Welfare, Gender and Children's affairs, Sylvia Blyden, who is a Christian, joined Muslims in prayers at the mosque in celebrating of the 2017 Eid al-Fitr"", '  See also  Islam in Sierra Leone  References  Category:Buildings and structures in Freetown Category:Mosques in Sierra Leone']",The mosque regularly holds Islamic prayer services five times a day; and its also teaches Islamic education
SL-2016-7#-00000261,"['Moyamba is the capital and largest city of Moyamba District, in the Southern Province of Sierra Leone', ' There has been a recorded population of 11,485 in the 2004 census', ' The city is ethnically diverse, although the Mende people make up the majority', ' The city is home to the Hatford Secondary School for Girls, which is one of the elite secondary schools in Sierra Leone', ' The school attract some of the most gifted students from all parts of Sierra Leone, along with students abroad', ' The school is an all-girls secondary school, and the students are in a boarding home in the school campus', "" The city has a history of producing some of Sierra Leone's most prominent politicians, including the country's first president, Siaka Stevens"", '  Ethnicity Moyamba is an ethnically diverse city, although the Mende make up the largest population', ' The most widely spoken languages in the city are Krio and the Mende language', '  Sport Like the rest of the country, football is the most popular sport in Moyamba', ' The biggest and most popular club from the city is the Yambatui Stars, which currently plays in Sierra Leone second division', '  Media Radio Modcar 94', '8 is the local radio station in the city', ' SLBS TV and SLBS Radio are broadcast along with Sierra Leone’s national radio and television stations in Moyamba', '  Notable people from Moyamba Sir Milton Margai, lead Sierra Leone to independence and was prime minister from 1962-1963 Sir Albert Margai, prime minister of Sierra Leone from 1964-1967 Siaka Stevens, president of Sierra Leone from 1971-1985 Banja Tejan-Sie, Sierra Leone governor general from 1967-1968 Madam Ella Koblo Gulama, prominent Sierra Leonean politician and the first woman to be elected in the parliament and the first woman to be elected as cabinet minister  Category:Populated places in Sierra Leone Category:Southern Province, Sierra Leone']","The school is an all-girls secondary school, and the students are in a boarding home in the school campus"
SL-2008-5#-00000262,"[""Princess Christian Maternity Hospital is a hospital in Freetown, Sierra Leone nicknamed the 'Cottage Hospital'"", ' On May 2006 Ahmad Tejan Kabbah re-opened the hospital alongside Connaught Hospital', '   2014 Ebola epicemic Princess Christian Maternity hospital came under severe pressure during the 2014 Ebola virus epidemic in Sierra Leone', "" Scientific studies have shown that pregnant women are among the least likely to survive an onset of ebola, most likely because the mother's body lowers its immune response to prevent it rejecting the baby"", ' In a previous outbreak in Zaire, 14 out of 15 pregnant women who contracted the disease died', "" With the country's health facilities completely overrun and already unable to cope with the patient numbers, the authorities decided to place pregnant women last in the queue for treatment, and also segregated them from other ebola patients, under the assumption that there was little that could be done to save them"", ' Most of the pregnant ebola patients were sent to Princess Christian, but with health resources committed elsewhere, the hospital was severely neglected and conditions were so bad that the United Nations proposed closing the hospital altogether', '  References  Category:Buildings and structures in Freetown Category:Hospitals in Sierra Leone Category:Hospitals with year of establishment missing Category:Maternity hospitals Category:Maternity in Sierra Leone']","Scientific studies have shown that pregnant women are among the least likely to survive an onset of ebola, most likely because the mother's body lowers its immune response to prevent it rejecting the baby.In a previous outbreak in Zaire, 14 out of 15 pregnant women who contracted the disease died.With the country's health facilities completely overrun and already unable to cope with the patient numbers, the authorities decided to place pregnant women last in the queue for treatment, and also segregated them from other ebola patients, under the assumption that there was little that could be done to save them"
