DHSID_EA,relevance_score,most_relevant_sentences
MB-2005-5#-00000237,1.0,"A major goal of overhead power line design is to maintain adequate clearance between energized conductors and the ground so as to prevent dangerous contact with the line, and to provide reliable support for the conductors, resilience to storms, ice loads, earthquakes and other potential damage causes.Donald G. Fink and H. Wayne Beaty, Standard Handbook for Electrical Engineers, Eleventh Edition, McGraw-Hill, New York, 1978, , Chapter 14 Overhead Power Transmission Today overhead lines are routinely operated at voltages exceeding 765,000 volts between conductors. The weight of the conductor must be supported, as well as dynamic loads due to wind and ice accumulation, and effects of vibration. A large transmission line project may have several types of towers, with ""tangent"" (""suspension"" or ""line"" towers, UK) towers intended for most positions and more heavily constructed towers used for turning the line through an angle, dead-ending (terminating) a line, or for important river or road crossings. [[Image:Einebenenleitung.jpg|thumb|Low-profile power lines near an airfield]] Power lines and supporting structures can be a form of visual pollution. The number of disks is chosen based on line voltage, lightning withstand  requirement, altitude, and environmental factors such as fog, pollution, or salt spray. Strain insulators must be strong enough mechanically to support the full weight of the span of conductor, as well as loads due to ice accumulation, and wind.Advanced Rubber Products - Suspension Insulators  Porcelain insulators may have a semi-conductive glaze finish, so that a small current (a few milliamperes) passes through the insulator. Better pollution and wet performance is leading to the increased use of such insulators. The sag of the conductor (vertical distance between the highest and lowest point of the curve) varies depending on the temperature and additional load such as ice cover. The ice and wind loading of bundled conductors will be greater than a single conductor of the same total cross section, and bundled conductors are more difficult to install than single conductors. Overhead lines and structures may shed ice, creating a hazard. Glover, M. Sarma, and T. Overbye, Power System Analysis and Design, Fifth Edition, Cengage Learning, Connecticut, 2012, , Chapter 5 Transmission Lines: Steady-State Operation  The circuit can be characterized as  where Z is the total series line impedance z is the series impedance per unit length l is the line length  is the sinusoidal angular frequency The medium line has an additional shunt admittance  where Y is the total shunt line admittance y is the shunt admittance per unit length   See also    Aerial cable  Anchor portal  Conductor marking lights  CU project controversy  Overhead cable  Overhead line  Raptor conservation  Third rail  Operation Outward  Powerline river crossings in the United Kingdom  Wireless monitoring of overhead power lines  References  Further reading   William D. Stevenson, Jr."
MB-2005-5#-00000001,1.0,"It is one of the largest wetland areas of Europe. The marshes undergo substantial changes in size during the year, with melting snows in springtime and autumn rainfall causing extensive flooding as the river overflows. During the spring flood the swamps are almost completely covered with water, so the local population often has to cross through them in boats."
MB-2005-5#-00000276,1.0,"It is reported that there is no hot water in the facility.Yulia Tymoshenko's daughter: 'My mother's trial was a trial of revenge', guardian.co.uk (16 October 2011) According to TVi constitutional rights of prisoners has been violated in the institute.Pshonka orders checks on penal institutions in all regions in Ukraine, Kyiv Post (10 April 2012) In April 2012 Kyiv Prosecutor Anatoliy Melnyk stated the facility was and had been regularly overcrowded.Kyiv prosecutor vows to solve the problem of overcrowding in Kyiv’s detention center, Kyiv Post (11 April 2012)  In order to improve the living conditions of inmates the Ukrainian Ministry of Justice put the Lukyanivska complex on sale late February 2016."
MB-2005-5#-00000400,1.0,"The name is of Slavic origin, being derived from елха, elha (alder) and possessive suffix -ov, referring to a river which flowed through an alder forest.Constantin C. Giurescu, Istoria Bucureștilor."
MB-2005-5#-00000400,1.0,"Razgrad ( ) is a city in Northeastern Bulgaria in the valley of the Beli Lom river that falls within the historical and geographical region of Ludogorie. History  thumb|150px|Razgrad clock tower, the symbol of the city, built in 1864 Razgrad was built upon the ruins of the Ancient Roman town of Abritus on the banks of the Beli Lom river."
MB-2005-5#-00000237,2.0,"Upon the river situated couple of small Hydro Electric Stations (Bodnariv's and Martynkiv's), while along the river are some 140 ponds. Along the river, there are recreational areas for swimming in the water. Its international significance the river received following the first partition of Poland when between 1772 and 1793 the river was a border between Poland-Lithuania and Habsburg Monarchy. The slope of the river is 0.8 m / km, the cross-sectional area is 22 m ², the flow rate is 0.57 m / s, the water flow is 15.54 m³ / sec."
MB-2005-5#-00000400,1.0,"As of 2008, visible cracks were threatening the building, which was also sinking due to groundwater."
MB-2005-5#-00000373,2.0,"Odessa is situated () on terraced hills overlooking a small harbor on the Black Sea in the Gulf of Odessa, approximately  north of the estuary of the Dniester river and some  south of the Ukrainian capital Kyiv. Sources of running water in the city include the Dniester River, from which water is taken and then purified at a processing plant just outside the city."
MB-2005-5#-00000276,1.0,"Accidents thumb|Accident with the crane Zakhariy On November 18, 2011 a crane vessel Zakhariy that was being used in the construction fell into the river and broke apart. The accident destroyed the crane and polluted the Dnieper's waters with crane oil and construction materials."
MB-2005-5#-00000399,2.0,"Râușor is a rock-fill water dam build in 1987 in the far north of Argeș County, Romania."
MB-2005-5#-00000237,1.0,"thumb|left|Kremenets Castle, between 1862 and 1876 Facing increasing Tatar aggression for half of the century, fort-post overlooking river Ikva therein as Polish–Lithuanian Commonwealth property became perpetual battleground ascribing it to its borderline disposition. To many well known narration about a tradition that Bona observed hiding out in a water well of underground palace and every Easter used to come out holding in her chin a golden key to a secret treasure chest filled with gold. A deep well, later on becoming a source of an imaginary story, was dug out as main water supply for the troopers in case of prolonged siege. All the inside area of fortified perimeter was taken by thirty-four wooden structures of affluent town dwellers, where their most valuable possessions were secured due to prolonged subsistence on the front line, rainwater stone collector, nine magazines packed with provisions, living headquarter constructed out of durable wood, St. Michael's chapel, and other utility structures as dungeon, bakery, sentinel shack, etc."
MB-2005-5#-00000400,3.0,"Before entering the reservoir, the river gathers waters from the hilly Gerlovo region."
MB-2005-5#-00000237,1.0,"Located in the Someșul Mic river valley, the city is considered the unofficial capital of the historical province of Transylvania. Built on the banks of the river Someșul Mic, the city is also crossed over by brooks or streams such as Pârâul Țiganilor, Pârâul Popești, Pârâul Nădășel, Pârâul Chintenilor, Pârâul Becaș, Pârâul Murătorii; Canalul Morilor runs through the centre of town.Lukács 2005, pp.9–11  A wide variety of flora grow in the Cluj-Napoca Botanical Garden; some animals have also found refuge there. This park was founded during the 19th century and includes an artificial lake with an island, as well as the largest casino in the city, Chios. Various people report alien encounters in the Hoia-Baciu forest, large networks of catacombs that connect the old churches of the city, or the presence of a monster in the nearby lake of Tarnița. The end of the 19th century brought a building ensemble that fastens the corners of the oldest bridge over the river, at the north end of the Regele Ferdinand Avenue. The city also features three water polo teams, as recognised by the Romanian Water Polo Federation: CSS Viitorul, CS Voința and Poli CSM."
MB-2005-5#-00000373,2.0,"The length of the river , the watershed area is ."
MB-2005-5#-00000237,2.0,"From 2005 to 2008, volunteers cleaned the routes near the lake and the lake bottom down to  in depth."
MB-2005-5#-00000373,1.0,"The site had been listed as endangered 1999–2003 due to the prevention of seasonal flooding and agricultural use causing a decline or disappearance of the water and passerine bird populations.Struve Geodetic Arc150x150px|alt=  Cultural:(ii), (iii), (vi) 2005 The Struve Arc is a chain of survey triangulations stretching from Hammerfest in Norway to the Black Sea, through 10 countries and over 2,820 km."
MB-2005-5#-00000237,1.0,"Ancient sources    Ptolemy's Geographia    Tabula Peutingeriana    Etymology    History    Dacian town    Roman times    Archaeology   The first excavations at ""Poiana Bivolari"" were made in 1888–1889 in order to capture sulfurous thermal water."
MB-2005-5#-00000400,2.0,During winter the lake is dried artificially and a skate park is organized on the lake bed.
MB-2005-5#-00000003,1.0,"The January 2020 estimate of the raion population was    Natural tourist objects   Demchynskyi and Rayhorodskiy park-memorials landscape of gardening art of local value, hydro-recreation resource of the river Hnylopiat."
MB-2005-5#-00000001,1.0,River Sluch has numerous of thresholds and is interesting for the supporters of water tourism (the route of the second category of complication passes through this route). In honour of this event a memorable sign was set on the bank of the river Sluch.
MB-2005-5#-00000237,1.0,"He sent some forces, including mobilized peasants, to block possible routes of retreat for the horde, in order to force the horde to cross a river near the village of Martynów, where he planned to ambush them. In the ensuing retreat, many Tatars drowned in the Dniestr river or nearby muds, and Khan Temir was wounded."
MB-2005-5#-00000237,1.0,"It is located on the border of Skole Raion of the Lviv Oblast and the Volovets Raion of the Zakarpattia Oblast, on the watershed of the rivers Opir and Viche."
MB-2005-5#-00000400,1.0,"As of 2008, visible cracks were threatening the building, which was also sinking due to groundwater."
MB-2005-5#-00000373,2.0,"Odessa is situated () on terraced hills overlooking a small harbor on the Black Sea in the Gulf of Odessa, approximately  north of the estuary of the Dniester river and some  south of the Ukrainian capital Kyiv. Sources of running water in the city include the Dniester River, from which water is taken and then purified at a processing plant just outside the city."
MB-2005-5#-00000276,1.0,"Accidents thumb|Accident with the crane Zakhariy On November 18, 2011 a crane vessel Zakhariy that was being used in the construction fell into the river and broke apart. The accident destroyed the crane and polluted the Dnieper's waters with crane oil and construction materials."
MB-2005-5#-00000399,2.0,"Râușor is a rock-fill water dam build in 1987 in the far north of Argeș County, Romania."
MB-2005-5#-00000237,1.0,"thumb|left|Kremenets Castle, between 1862 and 1876 Facing increasing Tatar aggression for half of the century, fort-post overlooking river Ikva therein as Polish–Lithuanian Commonwealth property became perpetual battleground ascribing it to its borderline disposition. To many well known narration about a tradition that Bona observed hiding out in a water well of underground palace and every Easter used to come out holding in her chin a golden key to a secret treasure chest filled with gold. A deep well, later on becoming a source of an imaginary story, was dug out as main water supply for the troopers in case of prolonged siege. All the inside area of fortified perimeter was taken by thirty-four wooden structures of affluent town dwellers, where their most valuable possessions were secured due to prolonged subsistence on the front line, rainwater stone collector, nine magazines packed with provisions, living headquarter constructed out of durable wood, St. Michael's chapel, and other utility structures as dungeon, bakery, sentinel shack, etc."
MB-2005-5#-00000400,3.0,"Before entering the reservoir, the river gathers waters from the hilly Gerlovo region."
MB-2005-5#-00000237,1.0,"Located in the Someșul Mic river valley, the city is considered the unofficial capital of the historical province of Transylvania. Built on the banks of the river Someșul Mic, the city is also crossed over by brooks or streams such as Pârâul Țiganilor, Pârâul Popești, Pârâul Nădășel, Pârâul Chintenilor, Pârâul Becaș, Pârâul Murătorii; Canalul Morilor runs through the centre of town.Lukács 2005, pp.9–11  A wide variety of flora grow in the Cluj-Napoca Botanical Garden; some animals have also found refuge there. This park was founded during the 19th century and includes an artificial lake with an island, as well as the largest casino in the city, Chios. Various people report alien encounters in the Hoia-Baciu forest, large networks of catacombs that connect the old churches of the city, or the presence of a monster in the nearby lake of Tarnița. The end of the 19th century brought a building ensemble that fastens the corners of the oldest bridge over the river, at the north end of the Regele Ferdinand Avenue. The city also features three water polo teams, as recognised by the Romanian Water Polo Federation: CSS Viitorul, CS Voința and Poli CSM."
MB-2005-5#-00000373,2.0,"The length of the river , the watershed area is ."
MB-2005-5#-00000237,2.0,"From 2005 to 2008, volunteers cleaned the routes near the lake and the lake bottom down to  in depth."
MB-2005-5#-00000373,1.0,"The site had been listed as endangered 1999–2003 due to the prevention of seasonal flooding and agricultural use causing a decline or disappearance of the water and passerine bird populations.Struve Geodetic Arc150x150px|alt=  Cultural:(ii), (iii), (vi) 2005 The Struve Arc is a chain of survey triangulations stretching from Hammerfest in Norway to the Black Sea, through 10 countries and over 2,820 km."
MB-2005-5#-00000400,2.0,"As such, a concrete dam was built to surround the lake."
MB-2005-5#-00000400,1.0,Dervent Heights are situated between the Srem gorge of the river Tundzha in the west to the valleys of the rivers Popovska and Chengerligere in the east which separate them from the Strandzha mountain.
MB-2005-5#-00000237,1.0,"Its attractions include Synevyr lake, and a brown bear sanctuary."
MB-2005-5#-00000276,1.0,"Zhelezniakov is a river warship of the Soviet Navy, monitor of project SB-37."
MB-2005-5#-00000237,1.0,There have been fatalities from people falling into the water onto rocks near the waterfall.
MB-2005-5#-00000276,1.0,"In the early morning, protesters in central Kyiv continued supplying molotov cocktails and advanced on police cordons while fortifying barricades to their rear as police continuously used water cannons, fired rubber bullets, and jammed cell phone signals. Police were now able to block roads to restrict access to the city, and allowed the use of water cannons against rioters regardless of air temperature (−10 C at the time of the announcement). In an incident of cruel and unusual punishment, riot police detained two protesters, stripped them naked, doused them in water, and made them run back to Maidan on foot in the sub-freezing temperatures, while they were fired upon with rubber bullets. On 28 January, 52-year-old Bohdan Kalyniak died in hospital of pneumonia as a result of police water cannons being used against protestors in sub-freezing temperatures during clashes on Hrushevskoho Street. Meanwhile, the Interior Ministry stated that they reserved the right to use even greater force, defending their use of rubber ammunition, and outright denied the use of water canons on protesters."
MB-2005-5#-00000373,1.0,"Safyany () is a lake in the south-western Ukraine, in the delta of the Dniester River."
MB-2005-5#-00000373,2.0,"Lake Pohorile (, means 'burn lake') is a lake in the south-western Ukraine, in the delta of the Dniester River. The water source of the waterbody gets from several small canals, which connect the lake with the Turunchuk River. The oxygen content of the lake waters is 96.4-96.5%, with its concentration of 9.6-11.5 mg/l."
MB-2005-5#-00000373,2.0,"Lake Bile (, means 'white lake') is a lake in the south-western Ukraine, in the delta of the Dniester River. The white water lily (Nymphaea alba), water caltrop (Trapa natans), brandy-bottle (Nuphar lutea), and mint (Mentha sp.)"
MB-2005-5#-00000237,1.0,"It is located on the banks of the river Luchka,  from Kolomyia."
MB-2005-5#-00000400,1.0,"Lake Văcărești is a lake in the south of Bucharest, Sector 4. The lake has a surface of . History The lake was formed from an old bifurcation of the Dâmbovița River and was previously known as Balta Văcărești."
MB-2005-5#-00000276,1.0,"There were reports of police using water cannons to break through. Attack on Maidan Following the warning, the police advanced on thousands of protesters on Maidan Nezalezhnosti (Independence Square) with guns, a water cannon, and an armored personnel carrier."
MB-2005-5#-00000276,1.0,"History   Some historians trace the origins of the town to the town Nosov on the river Rud, mentioned in ancient Russian chronicles of about 1148 CE."
MB-2005-5#-00000276,2.0,"The Kyiv Reservoir serves as the lower reservoir and the upper reservoir is located  above the lower. During periods of low demand, such as night time, the pump-generators push water from the lower reservoir to the upper for use during peak hours. Specifications  The building of the pumped-storage power plant is connected with the upper basin by 6 pressure reinforced concrete and metal pipelines with a diameter of 3.8 m.  Upper basin created at a height of 70 m above the level of the Kiev reservoir with a useful volume - 3700000 cubic meters, where during the night decrease in energy consumption in the power system water is pumped. Response depth - 6,7 m. The reservoir on the Dnieper River serves as the lower reservoir of the pumped storage power plant."
MB-2005-5#-00000373,1.0,"Kakhovka is a port city located on the reservoir's southern bank. The primary purpose of the dam is hydroelectric power generation, irrigation and navigation. It is the 6th and the last dam in the Dnieper cascade. Dam The dam has an associated lock and a power station with an installed capacity of 357 MW. Construction on the dam began in September 1950 and the last generator was commissioned in October 1956."
MB-2005-5#-00000276,4.0,"The hydro-unit also includes the right-bank and left-bank dam, the protective dam of the right bank, the dam - the insert between the gateway and the building of the hydroelectric power station, the dam-wave separation, channel rowing and pressureless dam of the left bank and the Kiev navigable gateway (which today belongs to the State Enterprise ""Ukrvodshlyah"")."
MB-2005-5#-00000304,1.0,Geography The river of Yahorlyk divided the district into two parts: the western and eastern.
MB-2005-5#-00000373,1.0,"Wells were dug for water, which proved however to be extremely brackish."
MB-2005-5#-00000237,1.0,The western part of the castle yard housed a water well eliminated later in 19th century.
MB-2005-5#-00000237,1.0,"Lake Tarnița (, ) is a reservoir located in Cluj County, Romania, between the communes of Râșca, Mărișel and Gilău, west of Cluj-Napoca. Water from the Someșul Cald River flows into the reservoir. A 97 m high dam was completed in 1974."
MB-2005-5#-00000276,1.0,"The estate is over  and is situated on the banks of the Dnieper river (Kyiv Reservoir)Ukraine elections marked by curses, threats and brutality, The Guardian (26 October 2012) in the village of Novi Petrivtsi, Vyshhorod Raion. Accessed February 15, 2014 The length of the ""palace on the water"" is around ."
MB-2005-5#-00000373,1.0,"The bay of Sevastopol stretches from the open sea eastward to the Inkerman Cave Monastery at the end, narrowing down and finishing at the mouth of the Chorna river. Covering a large expanse of water, the harbor serves as a comfortable anchorage for a fleet."
MB-2005-5#-00000237,2.0,It was vital to prevent the spread of flames because at that time the city did not dispose of much water; it was necessary in fact to dig for 35m to find a source of water.
MB-2005-5#-00000237,2.0,"The area around the town is full of fresh water springs and spa waters that are not in use. The old town was a bit smaller, the island you see on river Olt was bigger and the road was on what is now the river bed."
MB-2005-5#-00000276,1.0,"Kyiv, historically situated on the right bank of the Dnieper River, now covers both banks of the river whose width, as it flows through the city, reaches several hundred metres. Currently there are eight bridges spanning across the river and a few dozen bridges across the canals and Dnieper tributaries. Due to the location and the width of the river, the bridges have always been a very attractive and hard to realize option throughout the long history of Kyiv. Such bridges could only be temporary, as the Dnieper freezes over in most winters at Kyiv's latitude, and ice drift each spring remain a concern even for modern bridges. Additionally, the river current was especially strong before the Dnieper was dammed in the 20th century. Within months after the Polish troops blew up the original chain bridge, that very summer 1920 the Ukrainian engineer Evgeny Paton proposed the reconstruction project that would have reused the old chains to be lifted from under water. Underwater tunnels  A few years before World War II the Soviet government planned two underground railroad lines to be laid underneath the bedrock of Dnieper river. The underdeveloped technology of the time required special makeshift caissons (vertical mines for ventilation and soil extraction) to be built in the middle of the river. Modern bridges Note: Bridges are listed southwards along the river flow. Such equipment allows automobile and limited railroad connection over the river, and is frequently used in military maneuvers."
MB-2005-5#-00000276,1.0,"The settlements of Bila Tserkva Raion are:   Bakaly  Bloschyntsi  Bykova Hreblia  Chepyliivka  Cherkas  Cherkas  Chmyrivka  Chupyra  Drozdy  Fastivka  Fesiury  Fursy  Haiok  Hlushky  Hlybochka  Horodysche  Ivanivka  Khrapachi  Klochky  Korzhivka  Kozhenyky  Krasne  Liudvynivka  Makiivka  Mala Antonivka  Mala Skvyrka  Mala Vilshanka  Matiushi  Mazepyntsi  Mezhove  Mykhailivka  Odnorih  Oliinykova Sloboda  Ostriiky  Ozerna  Pavlivka  Pischana  Popravka  Potiivka  Pylypcha  Rozaliivka  Scherbaky  Shkarivka  Skrebyshi  Sorokotiahy  Stepok  Sukholisy  Sydory  Tarasivka  Terezyne  Tomylivka  Trushky  Uzyn  Vasyliv  Verbova  Vilna Tarasivka  Volodymyrivka  Yablunivka  Yosypivka  Zatysha  Notable buildings [[Image:Oleksandriia Park in Bila Tserkva.jpg|thumb|250px|View of the so-called Ruins and the Laznevogo lake of the historical landscape park ""Oleksandriia"".]]"
MB-2005-5#-00000055,1.0,"Near the river, the raion's lowest elevation points are located. Culture Within the Boryspil raion operates a musical school for children (in the village of Schastlyve), a school of art (in the village of Velyka Oleksandrivka) Also, a couple of educational schools operate on the territory of the raion:   Institute of Cloning and Genetics of Animals (Ukrainian Academy of Agriculture);  Central science-laboratory for experiments with water and ground soil (Institute of Hydrotechno, UAAN)."
MB-2005-5#-00000400,3.0,"The country has a dense river network but with the notable exception of the river Danube, they are mostly short and with low water flow. The border with Serbia runs from Kitka through the mountainous region Kraishte, including the Ruy Mountain, crosses the valley of the river Nishava, runs through the main watershed of the western Balkan Mountains and follows the river Timok for 15 km until its confluence with the Danube."
MB-2005-5#-00000015,2.0,"The last estimate of the raion population was   Settlements Rural settlements in Brusyliv raion included:  Bolyachiv - 169 inhabitants Vodotyyi - 505 inhabitants Vilshka - 186 inhabitants Dyvyn - 324 inhabitants Yosypivka - 241 inhabitants Karabachyn - 309 inhabitants, on the river Zdvyzh Krakivshchyna - 115 inhabitants Lazarivka - 634 inhabitants Morozivka - 1,146 inhabitants Mistechko - 207 inhabitants, on the river Zdvyzh Novi Ozeryany - 603 inhabitants Ozera - 299 inhabitants Osivtsi - 684 inhabitants Pokryshiv - 479 inhabitants Pryvorittya - 803 inhabitants Romanivka - 275 inhabitants Skochyshche - 373 inhabitants Skochyshche Station Sobolivka - 538 inhabitants, on the Irpin River Soloviyivka - 892 inhabitants Stavyshche - 579 inhabitants Khomutets - 1,239 inhabitants Yastrubenka - 208 inhabitants   Brief  It was situated in the south-eastern part of the region."
