DHSID_EA,relevance_score,most_relevant_sentences
MB-2005-5#-00000400,1.0,"Cervenia is a commune in the southern part of Teleorman County, Muntenia, Romania, on the left (east) bank of the river Vedea, 22 km southeast from Alexandria."
MB-2005-5#-00000400,3.0,"Formerly an open salt water coastal lagoon, connected with the Black Sea, it was transformed into a freshwater lake in the 1920s."
MB-2005-5#-00000237,1.0,"The river Vișeu, a tributary of Tisa, flows through this commune."
MB-2005-5#-00000400,1.0,"Snagov (Romanian: Lacul Snagov) is a lake in Snagov commune, about 25–30 km north of Bucharest, Romania. Snagov monastery is situated on an islet near the lake's northeastern end, just across Snagov Stadium."
MB-2005-5#-00000237,1.0,"St. Elisabeth's, placed on a hill which is the watershed of the Baltic and Black Sea, with its facade flanked by two tall towers and an 85 m belfry on the north side with imposing spires was envisioned as Lviv's first landmark to greet visitors arriving in the city by train."
MB-2005-5#-00000003,1.0,At first the plan succeeded but the Polish forces caught up with the Russian army during its crossing of the Iber river and subsequently captured or destroyed a significant portion of the remaining Russian artillery and supplies.
MB-2005-5#-00000237,1.0,"Meanwhile, the condition of the building deteriorated, as evidenced by water stains on cracked walls and ceilings.Lviv regional authorities in Ukraine evict Russian cultural center, Deutsche Welle (27 October 2016) The Lviv regional council concluding that the building was being neglected late October 2016 and evicted the Russian cultural center from No."
MB-2005-5#-00000276,1.0,The only thing that remains now of the monastic complex is a water well.
MB-2005-5#-00000290,1.0,"The arena is frequently used for concerts, indoor sports such as ice hockey, exhibitions and shows and it was also the host stadium of the 2007 IIHF World U20 Championship. Since 1999 the arena bears the name of Lajos Vákár, a former ice hockey player and coach, one of the founding members of the hall's main tenant, HSC Csíkszereda. References  Category:Indoor arenas in Romania Category:Indoor ice hockey venues in Romania"
MB-2005-5#-00000400,1.0,"It is frequently used for concerts, indoor sports such as ice hockey, exhibitions and shows. It is home to the CSM Dunărea Galaţi ice hockey team. References  Category:Indoor arenas in Romania Category:Indoor ice hockey venues in Romania Category:Buildings and structures in Galați"
MB-2005-5#-00000219,1.0,"[[File:Danube delta chart.png|300px|thumb|Danube Delta full map with its distributaries identified]] right|200px|thumb|Sulina branch The Sulina branch is a distributary of the river Danube, that contributes in forming the Danube Delta."
MB-2005-5#-00000397,1.0,"[[File:Danube delta chart.png|300px|thumb|Danube Delta full map with its distributaries identified]] The Sfântu Gheorghe branch (; ) is a distributary of the river Danube, that contributes in forming the Danube Delta."
MB-2005-5#-00000237,1.0,"The facilities included numerous sawmills utilising wood from surrounding forests and exporting it via the Łomnica (Limnitsia) river, navigable for 6 months in a year."
MB-2005-5#-00000398,3.0,"Pipe deterioration eventually forced Brașov authorities to provide the aqueduct with water from the city area (popular myth still has it that water running through the aqueduct is spring water, and, occasionally, people still supply themselves directly from that location)."
MB-2005-5#-00000399,3.0,"The dam is a  high embankment dam with a clay core, the second largest embankment dam in Romania."
MB-2005-5#-00000373,1.0,"The university employs 68 doctorate staff and 256 scientists specialising in new ship design, safety at sea, unmanned underwater craft, structures and works (such as welding), marine metallurgy and marine power (such as low pollution alternative energy sources for the marine industry)."
MB-2005-5#-00000237,1.0,"Nevertheless, according to stadion.lviv.ua of April 20, 2010 that is referencing to the head of the Capital Construction Directorate of Ivano-Frankivsk city administration V.Kovalchuk Rukh requires nearly four million hryvnia to bring Rukh to the initially pre-designed form.Rukh needs four million  Among the mentioned issues there were: a system of artesian aquifer and sprinklers, pavilions for the substitution players and coaches, a stand cover for at least 500 seats, dressing rooms for players and coaches, a press-media room, parking for buses and cars. Nauka, the stadium is located in the same city park as Rukh by a big city lake."
MB-2005-5#-00000373,1.0,"The village is located on the right bank of the Tiasmyn River, a tributary of the Dnieper, 7 km from Chyhyryn, 21 km from Adamivka river port, and 38 km from Fundukliivka railway station. According to another legend, it came from the name of the place where water from two tributaries combines (known as ""subod'"")."
MB-2005-5#-00000400,1.0,"It is notable for its unique groundwater ecosystem abundant in hydrogen sulfide and carbon dioxide, but low in oxygen. It also contains 1–2% methane (CH4) and both the air and waters of the cave contain high concentrations of hydrogen sulfide (H2S) and ammonia (NH3). December 16, 2020 a water scorpion (Nepa anophthalma), and also a snail. Nepa anophthalma is the only known cave-adapted water scorpion in the world."
MB-2005-5#-00000400,1.0,The river Călmățui passes through the commune.
MB-2005-5#-00000397,2.0,"The commune's name is of Turkish origin: moru (""violet"") and göl (""lake"") compounded to mean ""violet lake"".Limba română, p.264."
MB-2005-5#-00000237,1.0,"The biggest river, Cheremosh runs along the Chernivtsi Region and serves as the natural border."
MB-2005-5#-00000237,1.0,The major river that flowed through the raion is the Dniester. The major water supply for the raion was provided by the Dniester River.
MB-2005-5#-00000276,1.0,"Reconstruction work began on the area in 2004, which, when finished (projected in 2008) will include new landscaping, water and canal features."
MB-2005-5#-00000399,1.0,The Topolog Viaduct is a viaduct east of Râmnicu Vâlcea over the river Topolog.
MB-2005-5#-00000055,1.0,"It stretched over the extensive territory from the left banks of the middle Dnieper river on the west to its eastern frontier that laid not far west from the Seversky Donets, where the legendary Cuman city of Sharuk(h)an was presumably situated."
MB-2005-5#-00000400,1.0,Name  The name is probably derived from a container used for water and beverages (ploscă is the Romanian word for canteen or bota bag).
MB-2005-5#-00000237,2.0,"Teștioara  Tăul Iezer lake complex, with a rich lake vegetation  Tihău  Roman castra. The commune has 32 km of drinking water supply network (put into operation in 1994) and 16.2 km of natural gas supply network (put into operation in 1999)."
MB-2005-5#-00000237,1.0,It can be reached in 2 hours from the Bâlea lake which is accessible by car in the summer and cable car in the winter.
MB-2005-5#-00000400,1.0,"As the Rezovo River constitutes the border between Bulgaria and the European part of Turkey, Rezovo directly overlooks the Turkish bank of the river and the Turkish village of Beğendik, in Demirköy district, Kırklareli Province. According to Austrian Wenzel von Brognard and other 18th-century western travellers, the river mouth at that place had a good wharf suitable as a storm and winter shelter."
MB-2005-5#-00000400,2.0,The name is of ancient origin meaning the place where the taurus knocked with his fist (hoof) and gushed water surrounded the two isles in the lake.
MB-2005-5#-00000248,3.0,"The reservoir is the largest artificial lake in Romania; it manages river levels downstream, provides fishing, attracts tourism, fuels the power plant, and controls flooding."
MB-2005-5#-00000276,1.0,"left|thumb|Park BridgeThe monument complex sits on top of the right bank of Dnieper river overwatching the Park Bridge and the Shore Highway (, Naberezhne shose)."
MB-2005-5#-00000323,2.0,"The Dubăsari Dam (also HPP Dubasari, ) is a hydroelectric dam at the Dniester river near Dubăsari in Transnistria, Moldova."
MB-2005-5#-00000237,1.0,There have been fatalities from people falling into the water onto rocks near the waterfall.
MB-2005-5#-00000276,1.0,"In the early morning, protesters in central Kyiv continued supplying molotov cocktails and advanced on police cordons while fortifying barricades to their rear as police continuously used water cannons, fired rubber bullets, and jammed cell phone signals. Police were now able to block roads to restrict access to the city, and allowed the use of water cannons against rioters regardless of air temperature (−10 C at the time of the announcement). In an incident of cruel and unusual punishment, riot police detained two protesters, stripped them naked, doused them in water, and made them run back to Maidan on foot in the sub-freezing temperatures, while they were fired upon with rubber bullets. On 28 January, 52-year-old Bohdan Kalyniak died in hospital of pneumonia as a result of police water cannons being used against protestors in sub-freezing temperatures during clashes on Hrushevskoho Street. Meanwhile, the Interior Ministry stated that they reserved the right to use even greater force, defending their use of rubber ammunition, and outright denied the use of water canons on protesters."
MB-2005-5#-00000373,1.0,"Safyany () is a lake in the south-western Ukraine, in the delta of the Dniester River."
MB-2005-5#-00000373,2.0,"Lake Pohorile (, means 'burn lake') is a lake in the south-western Ukraine, in the delta of the Dniester River. The water source of the waterbody gets from several small canals, which connect the lake with the Turunchuk River. The oxygen content of the lake waters is 96.4-96.5%, with its concentration of 9.6-11.5 mg/l."
MB-2005-5#-00000373,2.0,"Lake Bile (, means 'white lake') is a lake in the south-western Ukraine, in the delta of the Dniester River. The white water lily (Nymphaea alba), water caltrop (Trapa natans), brandy-bottle (Nuphar lutea), and mint (Mentha sp.)"
MB-2005-5#-00000237,1.0,"It is located on the banks of the river Luchka,  from Kolomyia."
MB-2005-5#-00000400,1.0,"Lake Văcărești is a lake in the south of Bucharest, Sector 4. The lake has a surface of . History The lake was formed from an old bifurcation of the Dâmbovița River and was previously known as Balta Văcărești."
MB-2005-5#-00000276,1.0,"There were reports of police using water cannons to break through. Attack on Maidan Following the warning, the police advanced on thousands of protesters on Maidan Nezalezhnosti (Independence Square) with guns, a water cannon, and an armored personnel carrier."
MB-2005-5#-00000276,1.0,"History   Some historians trace the origins of the town to the town Nosov on the river Rud, mentioned in ancient Russian chronicles of about 1148 CE."
MB-2005-5#-00000276,2.0,"The Kyiv Reservoir serves as the lower reservoir and the upper reservoir is located  above the lower. During periods of low demand, such as night time, the pump-generators push water from the lower reservoir to the upper for use during peak hours. Specifications  The building of the pumped-storage power plant is connected with the upper basin by 6 pressure reinforced concrete and metal pipelines with a diameter of 3.8 m.  Upper basin created at a height of 70 m above the level of the Kiev reservoir with a useful volume - 3700000 cubic meters, where during the night decrease in energy consumption in the power system water is pumped. Response depth - 6,7 m. The reservoir on the Dnieper River serves as the lower reservoir of the pumped storage power plant."
MB-2005-5#-00000373,1.0,"Kakhovka is a port city located on the reservoir's southern bank. The primary purpose of the dam is hydroelectric power generation, irrigation and navigation. It is the 6th and the last dam in the Dnieper cascade. Dam The dam has an associated lock and a power station with an installed capacity of 357 MW. Construction on the dam began in September 1950 and the last generator was commissioned in October 1956."
MB-2005-5#-00000276,4.0,"The hydro-unit also includes the right-bank and left-bank dam, the protective dam of the right bank, the dam - the insert between the gateway and the building of the hydroelectric power station, the dam-wave separation, channel rowing and pressureless dam of the left bank and the Kiev navigable gateway (which today belongs to the State Enterprise ""Ukrvodshlyah"")."
MB-2005-5#-00000400,2.0,"As such, a concrete dam was built to surround the lake."
MB-2005-5#-00000400,1.0,Dervent Heights are situated between the Srem gorge of the river Tundzha in the west to the valleys of the rivers Popovska and Chengerligere in the east which separate them from the Strandzha mountain.
MB-2005-5#-00000237,1.0,"Its attractions include Synevyr lake, and a brown bear sanctuary."
MB-2005-5#-00000276,1.0,"Zhelezniakov is a river warship of the Soviet Navy, monitor of project SB-37."
MB-2005-5#-00000237,2.0,"Lacul Auster (Romanian for the austere lake) is a natural salt lake in the town of Ocna Sibiului, Sibiu County, Transylvania, Romania. In 1922, its water level was much higher than at present, and it was lowered by artificial drainage because it was believed that its waters flooded the Ignaţiu salt mine, which was in operation. Information  Surface:  Maximum depth:  Salinity: 140 g/l Fauna: Artemia salina   Lakes of the salt mine   Auster   Lake Avram Iancu-Ocniţa  Balta cu Nămol   Brâncoveanu   Cloşca   Crişan  Lacul Fără Fund   Gura Minei   Horea   Mâţelor   Negru  Pânzelor   Rândunica   Verde (Freshwater lake)  Vrăjitoarelor (Freshwater lake)  References  Category:Lakes of Sibiu County"
MB-2005-5#-00000237,4.0,"In 1966, the water level of the lake had a sharp decrease of 11 m, because of the leakage of water through a crack produced in the salt wall in the underground lake adjacent to the Ignatius mine."
MB-2005-5#-00000237,2.0,"Lacul Verde (literally Green Lake) is a natural freshwater lake of the Ocna Sibiului mine, Romania. It is the only major freshwater lake of the mine, with the other lakes being salt lakes. The Lacul Vrăjitoarelor is also a freshwater lake, but it is too small and the condition is too poor for swimming. thumb|Ocna Sibiului within the Sibiu County   History   The origin of the lake is the collapse of two nearby, unrecognized saltworks, which were exploited at the same time and later abandoned due to water infiltration. Information  Surface:  Maximum depth:  Salinity: 8-9 g/l   Lakes of the salt mine   Auster   Lake Avram Iancu-Ocniţa  Balta cu Nămol   Brâncoveanu   Cloşca   Crişan  Lacul Fără Fund   Gura Minei   Horea   Mâţelor   Negru  Pânzelor   Rândunica   Verde (Freshwater lake)  Vrăjitoarelor (Freshwater lake)  References  Category:Lakes of Sibiu County"
MB-2005-5#-00000237,2.0,Information  Surface:  Maximum Depth:  Salinity: 120 g/l   Lakes of the salt mine   Auster   Lake Avram Iancu-Ocniţa  Balta cu Nămol   Brâncoveanu   Cloşca   Crişan  Lacul Fără Fund   Gura Minei   Horea   Mâţelor   Negru  Pânzelor   Rândunica   Verde (Freshwater lake)  Vrăjitoarelor (Freshwater lake)  References  Category:Lakes of Sibiu County
MB-2005-5#-00000237,3.0,"thumb|Ocna Sibiului within the Sibiu County   Name  The lake's name is The Black Lake, because the lake has mud at its bottom, making its water black."
MB-2005-5#-00000237,2.0,thumb|Ocna Sibiului within the Sibiu County   Name  Lacul Mâţelor means lake of the small cats or lake of the kittens. Lakes of the salt mine   Auster   Lake Avram Iancu-Ocniţa  Balta cu Nămol   Brâncoveanu   Cloşca   Crişan  Lacul Fără Fund   Gura Minei   Horea   Mâţelor   Negru  Pânzelor   Rândunica   Verde (Freshwater lake)  Vrăjitoarelor (Freshwater lake)   Sources   References  Category:Lakes of Sibiu County
MB-2005-5#-00000237,2.0,Information  Surface:  Maximum depth:    Lakes of the salt mine   Auster   Lake Avram Iancu-Ocniţa  Balta cu Nămol   Brâncoveanu   Cloşca   Crişan  Lacul Fără Fund   Gura Minei   Horea   Mâţelor   Negru  Pânzelor   Rândunica   Verde (Freshwater lake)  Vrăjitoarelor (Freshwater lake)   References     Category:Lakes of Sibiu County
MB-2005-5#-00000237,2.0,"Something else they have in common is that their depth is very small, probably reaching 1–2 m.   Lakes of the salt mine   Auster   Lake Avram Iancu-Ocniţa  Balta cu Nămol   Brâncoveanu   Cloşca   Crişan  Lacul Fără Fund   Gura Minei   Horea   Mâţelor   Negru  Pânzelor   Rândunica   Verde (Freshwater lake)  Vrăjitoarelor (Freshwater lake)   References   Category:Lakes of Sibiu County"
MB-2005-5#-00000237,2.0,"History   The lake was formed on the site of the Francisc Grube salt mine, which was abandoned in 1775 due to water infiltrations. Information  Surface:  Maximum depth:  Salinity: 96 g/l (at the surface), 318 g/l (at 6 m depth)   Lakes of the salt mine   Auster   Lake Avram Iancu-Ocniţa  Balta cu Nămol   Brâncoveanu   Cloşca   Crişan  Lacul Fără Fund   Gura Minei   Horea   Mâţelor   Negru  Pânzelor   Rândunica   Verde (Freshwater lake)  Vrăjitoarelor (Freshwater lake)   References  https://romania.directbooking.ro/prezentare-ocna-sibiului-informatii-poze-imagini-32.aspx  Category: Lakes of Sibiu County"
MB-2005-5#-00000237,2.0,"History  The lake originates from the ""Josef"" salt mine, exploited with two wells and abandoned in 1770, due to strong infiltration of water through the walls. Lakes of the salt mine   Auster   Lake Avram Iancu-Ocniţa  Balta cu Nămol   Brâncoveanu   Cloşca   Crişan  Lacul Fără Fund   Gura Minei   Horea   Mâţelor   Negru  Pânzelor   Rândunica   Verde (Freshwater lake)  Vrăjitoarelor (Freshwater lake)  References  Category:Lakes of Sibiu County"
MB-2005-5#-00000361,1.0,"Botna is a river in Moldova, a right tributary of Dniester. With a length of 152 kilometres, Botna is the sixth longest river in Moldova. The average slope of the river is 1.5 degrees. From the spring to the village of Salcuta, the course of the river is directed to the southeast, then it heads to the northeast. In the past, in the valley of the Costeşti village, the river is meandering."
MB-2005-5#-00000398,1.0,"In the first years, the station had only three-four tracks, a small warehouse with a platform and a small locomotive depot, with water supply and a turntable."
MB-2005-5#-00000237,1.0,"It is located on the border of Turka Raion (Lviv Oblast) and Velykyi Bereznyi Raion (Zakarpattia Oblast), on the watershed of San River and Uzh River."
MB-2005-5#-00000237,2.0,"The lake is the result of the lakes Avram Iancu and Ocnița merging into a single lake. The lake was also called Ocna Pustie (meaning the bare mine)  The name of the other lake, Ocnița, means small mine, after the Romanian word ocnă, meaning (salt) mine. Information  Surface:  (combined surface of the two old lakes) Maximum depth:  Salinity: 170-260 g/l Fauna: Artemia salina   Lakes of the salt mine   Auster   Lake Avram Iancu-Ocniţa  Balta cu Nămol   Brâncoveanu   Cloşca   Crişan  Lacul Fără Fund   Gura Minei   Horea   Mâţelor   Negru  Pânzelor   Rândunica   Verde (Freshwater lake)  Vrăjitoarelor (Freshwater lake)  References  Category:Lakes of Sibiu County"
MB-2005-5#-00000055,1.0,"The Umanka (Ukrainian: Уманка) is a  river in Cherkasy Oblast, Ukraine."
MB-2005-5#-00000400,2.0,"This flows into a well, and the water is annually blessed for holy water."
MB-2005-5#-00000361,1.0,"Its old name was replaced by a new one, Bender, meaning ""river port, berth""."
MB-2005-5#-00000399,1.0,"Architecture thumb|Back view 200px|thumb|The aghiasmatar (holy water basin) pavilion in front of the Cathedral The building resembles a very large and elaborate mausoleum, and was built in the Byzantine architectural style, with arabesques. A spring of clear water, named after Manole, is said to mark the spot where he fell."
MB-2005-5#-00000237,1.0,"The largest rivers are the Dnister (290 km, in the Oblast), Prut (128 km, in the Oblast) and Siret (113 km, in the Oblast).About Oblast  Chernivtsi Oblast State Administration   The oblast covers three geographic zones: a forest steppe region between Prut and Dnister rivers, a foothill region between the Carpathian Mountains and Prut river, and a mountain region known as the Bukovinian part of the Carpathian Mountains."
MB-2005-5#-00000373,2.0,"The city did not have a drinking water system until 1924, when a 55.3 km (34.4 mi) system was laid underground."
MB-2005-5#-00000400,2.0,"width=""30"" | % |- | Western Balkan Mountains|| align=""right"" | 4 196,9 || align=""right"" | 36.19 || align=""right"" | 849 || align=""right"" | – || align=""right"" | – || align=""right"" | 907.1 || align=""right"" | 21.61 || align=""right"" | 2 074,9 || align=""right"" | 49.44 || align=""right"" | 1 139,6 || align=""right"" | 27.15 || align=""right"" | 75.3 || align=""right"" | 1.79 |- | Central Balkan Mountains || align=""right"" | 3 400,9 || align=""right"" | 29.33 || align=""right"" | 961 || align=""right"" | – || align=""right"" | – || align=""right"" | 549.8 || align=""right"" | 16.17 || align=""right"" | 1 512,7 || align=""right"" | 44.48 || align=""right"" | 1 076,7 || align=""right"" | 31.66 || align=""right"" | 261.7 || align=""right"" | 7.70 |- | Eastern Balkan Mountains || align=""right"" | 3 998,6 || align=""right"" | 34.48 || align=""right"" | 385 || align=""right"" | 560 || align=""right"" | 14.00 || align=""right"" | 2 798,9 || align=""right"" | 70.00 || align=""right"" | 624.1 || align=""right"" | 15.61 || align=""right"" | 15.6 || align=""right"" | 0.39 || align=""right"" | – || align=""right"" | — |- | Total' || align=""right"" | 11 596,4 || align=""right"" | 100 || align=""right"" | 722 || align=""right"" | 560 || align=""right"" | 4.83 || align=""right"" | 4 255,8 || align=""right"" | 36.70 || align=""right"" | 4 211,7 || align=""right"" | 36.32 || align=""right"" | 2 231,9 || align=""right"" | 19.25 || align=""right"" | 337 || align=""right"" | 2.91 |}   Hydrology  thumb|A view of the Balkan Mountains [[File:Shipka-monument-bg.jpg|thumb|right|The monument on Shipka]] thumb|right|Central Balkan Mountains thumb|Rosomačka river, Serbia thumb|Horses at the Balkan Mountains, Serbia  [[File:Staraplanina-krassiu.jpg|thumb|View from Ray Resthouse towards the Central Balkan Mountains with Raysko Praskalo waterfall in the middle]] [[File:Белоградчишки скали 07.JPG|thumb|Belogradchik Rocks]] thumb|Kozya Stena Reserve In their central and eastern sections, the mountains form a water divide between the rivers flowing to the Danube in the north and those flowing to the Aegean Sea in the south."
MB-2005-5#-00000273,2.0,"One of the greatest dams in Romania, the Bicaz Dam is built along the Bistrița River, forming the Bicaz Lake; the water of the lake is used for electricity production at Bicaz-Stejaru Hydroelectric Power Station."
MB-2005-5#-00000361,1.0,"Transnistria, officially the Pridnestrovian Moldavian Republic (PMR), is an unrecognised breakaway state located in the narrow strip of land between the river Dniester and the Moldovan–Ukrainian border that is internationally recognised as part of Moldova. As part of that agreement, a three-party (Russia, Moldova, Transnistria) Joint Control Commission supervises the security arrangements in the demilitarised zone, comprising 20 localities on both sides of the river. It is a narrow valley stretching north–south along the bank of the Dniester river, which forms a natural boundary along most of the de facto border with Moldova. On the west bank, in Bessarabia, the city of Bender and four communes (containing six villages) to its east, south-east, and south, on the opposite bank of the river Dniester from the city of Tiraspol (Proteagailovca, Gîsca, Chițcani, and Cremenciug) are controlled by the PMR."
MB-2005-5#-00000237,2.0,"To distinguish Mykolaiv from the much larger southern city, the former is sometimes called Mykolaiv on Dniester (, Mykolaiv nad Dnistrom) after the major river it situated on (while the latter is located on the Southern Buh, another  major river)."
MB-2005-5#-00000237,1.0,"History  [[File:Hrubieszów - budynek (03).jpg|thumb|left|250px|Browar Sulewski - local brewery]]  The origins of the town go back to the early Middle Ages, when a Ruthenian defensive gord existed on the Huczwa river island."
MB-2005-5#-00000400,2.0,"For example, a 4 kilometre-long canal fed a large brick cistern that moved water from the Kriva river to the Inner Town via ceramic pipes."
MB-2005-5#-00000373,2.0,"For the end of 2011 in Zmiinyi Island coastal waters 58 fish species (12 of which are included into the Red Book of Ukraine)Snigirov S, Goncharov O, Sylantyev S. The fish community in Zmiinyi Island waters: structure and determinants."
MB-2005-5#-00000237,4.0,"200px|thumbnail|Leakage from the Lake Solina thumb|200px|Midsummer fire (Sobótka) at San river The San (;  Sian; ) is a river in southeastern Poland and western Ukraine, a tributary of the river Vistula, with a length of 458 km (it is the 6th-longest Polish river) and a basin area of 16,877 km2 (14,426 km2 of it in Poland).Statistical Yearbook of the Republic of Poland 2017, Statistics Poland, p. 85-86  Etymology San in proto-Indoeuropean languages means ""speed"" or ""rapid stream""."
MB-2005-5#-00000276,1.0,"Sport [[File:Ukraine Basketball SuperLeague final Budivelnyk-Khimik 29-04-2017.jpg|thumb|2016–17 Ukrainian Basketball SuperLeague final, Budivelynk vs. Khimik (April 2017)]] The hall hosts ice hockey, basketball and boxing competitions. The home teams have included the ice hockey club HK Sokol Kyiv and the basketball clubs BC Kyiv and BC Budivelnyk."
