DHSID_EA,relevance_score,most_relevant_sentences
MB-2005-5#-00000400,7.0,"Until the 20th century, fresh water from the lake emptied into the Black Sea through the Devnya River, but following the construction of the modern Port of Varna East (and the subsequent draining of the river), a canal was dug through the strip of sand between the sea and the lake between 1906 and 1909, which led to the lake's level dropping by 1.40 m and the incursion of sea water into the lake, which became brackish."
MB-2005-5#-00000237,1.0,"Durau Resort lies in Neamt county, at 780–800 m altitude, 9 km from Izvorul Muntelui Lake on the Bistrita river, in a sunny glade, on the north-west slope of the Ceahlau massif (Oriental Carpathians)."
MB-2005-5#-00000341,2.0,"Basic data  Location:Eastern Europe, northeast of RomaniaGeographic coordinates: Map references:Commonwealth of Independent States Area: total: 33,851 km2  land: 32,891 km2  water: 960 km2 Area - comparative:slightly larger than Maryland, United States slightly larger than Vancouver Island, CanadaLand boundaries: total: 1,390 km  border countries: Romania 450 km, Ukraine 940 km Coastline: 0 km (landlocked)Maritime claims:none (landlocked)Natural resources:lignite, phosphorites, gypsum, arable land, limestoneLand use: arable land: 53.47%  permanent crops: 8.77%  other: 37.75% (2011)Irrigated land:2,283 km2 (2011)Total renewable water resources:11.65 km 3Natural hazards:landslides (57 cases in 1998)   Climate  Moldova's proximity to the Black Sea gives it a mild and sunny climate. Underground water, extensively used for the country's water supply, includes about 2,200 natural springs."
MB-2005-5#-00000341,2.0,"According to a legend recounted by Moldavian chroniclers Dimitrie Cantemir and Grigore Ureche, Prince Dragoș named the river after hunting an aurochs: following the chase, the prince's exhausted hound Molda drowned in the river. In the east, the Dniester is the main river, flowing through the country from north to south, receiving the waters of Răut, Bîc, Ichel, Botna."
MB-2005-5#-00000241,1.0,"Access to some villages and hamlets required boats, especially in early spring, when the waters of the Pripyat and other rivers (like the Pina, the Styr and the Horyn) rose as the snow melted. The biggest lake in the voivodeship's area, Lake Wygonowskie, lay on the Oginski Canal."
MB-2005-5#-00000276,1.0,"However, the station's proximity to lake Vyrlytsia for which it was named, and the technique of construction proved to be unsuitable to guard it from flooding, which became evident since its opening."
MB-2005-5#-00000400,1.0,"The Danube, Europe's second-longest river, rises in Germany's Black Forest and flows in a southeasterly direction for , before emptying into Romania's Danube Delta. Among the native peoples, Herodotus listed the Getae of the Lower Danube region, the Agathyrsi of Transylvania and the Syginnae of the plains along the river Tisza at the beginning of the 5th century BC. After the Avar Khaganate collapsed in the 790s, Bulgaria became the dominant power of the region, occupying lands as far as the river Tisa. The Danube river forms a large part of the border with Serbia and Bulgaria, and flows into the Black Sea, forming the Danube Delta, which is the second-largest and best-preserved delta in Europe, and a biosphere reserve and a biodiversity World Heritage Site."
MB-2005-5#-00000237,3.0,"Natural hazards: earthquakes most severe in south and southwest; geologic structure and climate promote landslides  Environment  Environment - current issues: soil erosion and degradation; water pollution; air pollution in south from industrial effluents; contamination of Danube delta wetlands  Environment - international agreements:  party to: Air Pollution, Antarctic Treaty, Biodiversity, Climate Change, Desertification, Endangered Species, Environmental Modification, Hazardous Wastes, Law of the Sea, Nuclear Test Ban, Ozone Layer Protection, Ship Pollution, Wetlands  signed, but not ratified: Air Pollution-Persistent Organic Pollutants, Antarctic-Environmental Protocol, Climate Change-Kyoto Protocol  See also  Administrative divisions of Romania  List of cities in Romania  Reservoirs and dams in Romania  List of mountain peaks in Romania  List of fish of the Black Sea  References    2004 Romanian Statistical Yearbook - Geography, Meteorology and Environment"
MB-2005-5#-00000237,1.0,"Leopold Socha and Stefan Wróblewski, laborers maintaining the municipal sewage system, organized in their shelters for 21 one Jews who survived the ghetto's liquidation; 10 of them survived the war."
MB-2005-5#-00000237,4.0,"Its waters flow through the porous natural dam and return to the surface 350 meters to the west of the lake, 60 meters below the average lake level."
MB-2005-5#-00000276,2.0,"Great European Plain (subregion East European Plain)  Volhynia-Podillia Upland (Volhynia-Podillia Plateau)  Volhynian Upland  Podolian Upland  Small Polesia Plain  Khotyn Upland (part of Moldavian Plateau)  Roztocze  Sian-Dniester Lowland  Eastern Carpathian Foothills  Polesian Lowland  Dnieper Upland  Dnieper Lowland  Central Russian Upland   Donets-Azov Plateau  Donets Upland  Azov Upland  Donets Ridge  Black Sea-Azov Lowland  Black Sea Lowland  Crimean Lowland  Azov Lowland  Alpine system  Transcarpathian Lowland (extension of Great Hungarian Plain, part of Eastern Pannonian Basin)  Eastern Carpathians (part of Carpathian Mountains)  Outer Eastern Carpathians (more Eastern Beskids and the Ukrainian Carpathians)  Inner Eastern Carpathians (more Vihorlat-Gutin Area)  Crimean Mountains  Hydrography [[File:Ранок на Кальміусі.jpg|thumbnail|Kalmius river, Donetsk]]  The territory of Ukraine is bordered by the waters of the Black Sea and the Sea of Azov. Some regions lack adequate supplies of potable water. Air and water pollution affects the country, as well as deforestation, and radiation contamination in the northeast stemming from the 1986 accident at the Chernobyl Nuclear Power Plant."
MB-2005-5#-00000400,1.0,"As of 2008, visible cracks were threatening the building, which was also sinking due to groundwater."
MB-2005-5#-00000373,2.0,"Odessa is situated () on terraced hills overlooking a small harbor on the Black Sea in the Gulf of Odessa, approximately  north of the estuary of the Dniester river and some  south of the Ukrainian capital Kyiv. Sources of running water in the city include the Dniester River, from which water is taken and then purified at a processing plant just outside the city."
MB-2005-5#-00000276,1.0,"Accidents thumb|Accident with the crane Zakhariy On November 18, 2011 a crane vessel Zakhariy that was being used in the construction fell into the river and broke apart. The accident destroyed the crane and polluted the Dnieper's waters with crane oil and construction materials."
MB-2005-5#-00000399,2.0,"Râușor is a rock-fill water dam build in 1987 in the far north of Argeș County, Romania."
MB-2005-5#-00000237,1.0,"thumb|left|Kremenets Castle, between 1862 and 1876 Facing increasing Tatar aggression for half of the century, fort-post overlooking river Ikva therein as Polish–Lithuanian Commonwealth property became perpetual battleground ascribing it to its borderline disposition. To many well known narration about a tradition that Bona observed hiding out in a water well of underground palace and every Easter used to come out holding in her chin a golden key to a secret treasure chest filled with gold. A deep well, later on becoming a source of an imaginary story, was dug out as main water supply for the troopers in case of prolonged siege. All the inside area of fortified perimeter was taken by thirty-four wooden structures of affluent town dwellers, where their most valuable possessions were secured due to prolonged subsistence on the front line, rainwater stone collector, nine magazines packed with provisions, living headquarter constructed out of durable wood, St. Michael's chapel, and other utility structures as dungeon, bakery, sentinel shack, etc."
MB-2005-5#-00000400,3.0,"Before entering the reservoir, the river gathers waters from the hilly Gerlovo region."
MB-2005-5#-00000237,1.0,"Located in the Someșul Mic river valley, the city is considered the unofficial capital of the historical province of Transylvania. Built on the banks of the river Someșul Mic, the city is also crossed over by brooks or streams such as Pârâul Țiganilor, Pârâul Popești, Pârâul Nădășel, Pârâul Chintenilor, Pârâul Becaș, Pârâul Murătorii; Canalul Morilor runs through the centre of town.Lukács 2005, pp.9–11  A wide variety of flora grow in the Cluj-Napoca Botanical Garden; some animals have also found refuge there. This park was founded during the 19th century and includes an artificial lake with an island, as well as the largest casino in the city, Chios. Various people report alien encounters in the Hoia-Baciu forest, large networks of catacombs that connect the old churches of the city, or the presence of a monster in the nearby lake of Tarnița. The end of the 19th century brought a building ensemble that fastens the corners of the oldest bridge over the river, at the north end of the Regele Ferdinand Avenue. The city also features three water polo teams, as recognised by the Romanian Water Polo Federation: CSS Viitorul, CS Voința and Poli CSM."
MB-2005-5#-00000373,2.0,"The length of the river , the watershed area is ."
MB-2005-5#-00000237,2.0,"From 2005 to 2008, volunteers cleaned the routes near the lake and the lake bottom down to  in depth."
MB-2005-5#-00000400,2.0,"As such, a concrete dam was built to surround the lake."
MB-2005-5#-00000400,1.0,Dervent Heights are situated between the Srem gorge of the river Tundzha in the west to the valleys of the rivers Popovska and Chengerligere in the east which separate them from the Strandzha mountain.
MB-2005-5#-00000237,1.0,"In the north, there was a flat strip of land called Volhynian Polesie, which extended some 200 kilometres from the Southern Bug river to the Polish-Soviet border."
MB-2005-5#-00000400,1.0,"Cervenia is a commune in the southern part of Teleorman County, Muntenia, Romania, on the left (east) bank of the river Vedea, 22 km southeast from Alexandria."
MB-2005-5#-00000400,3.0,"Formerly an open salt water coastal lagoon, connected with the Black Sea, it was transformed into a freshwater lake in the 1920s."
MB-2005-5#-00000237,1.0,"The river Vișeu, a tributary of Tisa, flows through this commune."
MB-2005-5#-00000400,1.0,"Snagov (Romanian: Lacul Snagov) is a lake in Snagov commune, about 25–30 km north of Bucharest, Romania. Snagov monastery is situated on an islet near the lake's northeastern end, just across Snagov Stadium."
MB-2005-5#-00000237,1.0,"St. Elisabeth's, placed on a hill which is the watershed of the Baltic and Black Sea, with its facade flanked by two tall towers and an 85 m belfry on the north side with imposing spires was envisioned as Lviv's first landmark to greet visitors arriving in the city by train."
MB-2005-5#-00000003,1.0,At first the plan succeeded but the Polish forces caught up with the Russian army during its crossing of the Iber river and subsequently captured or destroyed a significant portion of the remaining Russian artillery and supplies.
MB-2005-5#-00000237,1.0,"Meanwhile, the condition of the building deteriorated, as evidenced by water stains on cracked walls and ceilings.Lviv regional authorities in Ukraine evict Russian cultural center, Deutsche Welle (27 October 2016) The Lviv regional council concluding that the building was being neglected late October 2016 and evicted the Russian cultural center from No."
MB-2005-5#-00000276,1.0,The only thing that remains now of the monastic complex is a water well.
MB-2005-5#-00000290,1.0,"The arena is frequently used for concerts, indoor sports such as ice hockey, exhibitions and shows and it was also the host stadium of the 2007 IIHF World U20 Championship. Since 1999 the arena bears the name of Lajos Vákár, a former ice hockey player and coach, one of the founding members of the hall's main tenant, HSC Csíkszereda. References  Category:Indoor arenas in Romania Category:Indoor ice hockey venues in Romania"
MB-2005-5#-00000400,1.0,"It is frequently used for concerts, indoor sports such as ice hockey, exhibitions and shows. It is home to the CSM Dunărea Galaţi ice hockey team. References  Category:Indoor arenas in Romania Category:Indoor ice hockey venues in Romania Category:Buildings and structures in Galați"
MB-2005-5#-00000219,1.0,"[[File:Danube delta chart.png|300px|thumb|Danube Delta full map with its distributaries identified]] right|200px|thumb|Sulina branch The Sulina branch is a distributary of the river Danube, that contributes in forming the Danube Delta."
MB-2005-5#-00000397,1.0,"[[File:Danube delta chart.png|300px|thumb|Danube Delta full map with its distributaries identified]] The Sfântu Gheorghe branch (; ) is a distributary of the river Danube, that contributes in forming the Danube Delta."
MB-2005-5#-00000237,1.0,"The facilities included numerous sawmills utilising wood from surrounding forests and exporting it via the Łomnica (Limnitsia) river, navigable for 6 months in a year."
MB-2005-5#-00000398,3.0,"Pipe deterioration eventually forced Brașov authorities to provide the aqueduct with water from the city area (popular myth still has it that water running through the aqueduct is spring water, and, occasionally, people still supply themselves directly from that location)."
MB-2005-5#-00000399,3.0,"The dam is a  high embankment dam with a clay core, the second largest embankment dam in Romania."
MB-2005-5#-00000373,1.0,"The university employs 68 doctorate staff and 256 scientists specialising in new ship design, safety at sea, unmanned underwater craft, structures and works (such as welding), marine metallurgy and marine power (such as low pollution alternative energy sources for the marine industry)."
MB-2005-5#-00000237,1.0,"Nevertheless, according to stadion.lviv.ua of April 20, 2010 that is referencing to the head of the Capital Construction Directorate of Ivano-Frankivsk city administration V.Kovalchuk Rukh requires nearly four million hryvnia to bring Rukh to the initially pre-designed form.Rukh needs four million  Among the mentioned issues there were: a system of artesian aquifer and sprinklers, pavilions for the substitution players and coaches, a stand cover for at least 500 seats, dressing rooms for players and coaches, a press-media room, parking for buses and cars. Nauka, the stadium is located in the same city park as Rukh by a big city lake."
MB-2005-5#-00000373,1.0,"The village is located on the right bank of the Tiasmyn River, a tributary of the Dnieper, 7 km from Chyhyryn, 21 km from Adamivka river port, and 38 km from Fundukliivka railway station. According to another legend, it came from the name of the place where water from two tributaries combines (known as ""subod'"")."
MB-2005-5#-00000400,1.0,"It is notable for its unique groundwater ecosystem abundant in hydrogen sulfide and carbon dioxide, but low in oxygen. It also contains 1–2% methane (CH4) and both the air and waters of the cave contain high concentrations of hydrogen sulfide (H2S) and ammonia (NH3). December 16, 2020 a water scorpion (Nepa anophthalma), and also a snail. Nepa anophthalma is the only known cave-adapted water scorpion in the world."
MB-2005-5#-00000400,1.0,The river Călmățui passes through the commune.
MB-2005-5#-00000397,2.0,"The commune's name is of Turkish origin: moru (""violet"") and göl (""lake"") compounded to mean ""violet lake"".Limba română, p.264."
MB-2005-5#-00000237,1.0,"The biggest river, Cheremosh runs along the Chernivtsi Region and serves as the natural border."
MB-2005-5#-00000237,1.0,The major river that flowed through the raion is the Dniester. The major water supply for the raion was provided by the Dniester River.
MB-2005-5#-00000276,1.0,"Reconstruction work began on the area in 2004, which, when finished (projected in 2008) will include new landscaping, water and canal features."
MB-2005-5#-00000399,1.0,The Topolog Viaduct is a viaduct east of Râmnicu Vâlcea over the river Topolog.
MB-2005-5#-00000055,1.0,"It stretched over the extensive territory from the left banks of the middle Dnieper river on the west to its eastern frontier that laid not far west from the Seversky Donets, where the legendary Cuman city of Sharuk(h)an was presumably situated."
MB-2005-5#-00000400,1.0,Name  The name is probably derived from a container used for water and beverages (ploscă is the Romanian word for canteen or bota bag).
MB-2005-5#-00000237,2.0,"Teștioara  Tăul Iezer lake complex, with a rich lake vegetation  Tihău  Roman castra. The commune has 32 km of drinking water supply network (put into operation in 1994) and 16.2 km of natural gas supply network (put into operation in 1999)."
MB-2005-5#-00000237,1.0,It can be reached in 2 hours from the Bâlea lake which is accessible by car in the summer and cable car in the winter.
MB-2005-5#-00000400,1.0,"As the Rezovo River constitutes the border between Bulgaria and the European part of Turkey, Rezovo directly overlooks the Turkish bank of the river and the Turkish village of Beğendik, in Demirköy district, Kırklareli Province. According to Austrian Wenzel von Brognard and other 18th-century western travellers, the river mouth at that place had a good wharf suitable as a storm and winter shelter."
MB-2005-5#-00000400,2.0,The name is of ancient origin meaning the place where the taurus knocked with his fist (hoof) and gushed water surrounded the two isles in the lake.
MB-2005-5#-00000237,1.0,"In the north, there was a flat strip of land called Volhynian Polesie, which extended some 200 kilometres from the Southern Bug river to the Polish-Soviet border."
MB-2005-5#-00000400,1.0,"Cervenia is a commune in the southern part of Teleorman County, Muntenia, Romania, on the left (east) bank of the river Vedea, 22 km southeast from Alexandria."
MB-2005-5#-00000400,3.0,"Formerly an open salt water coastal lagoon, connected with the Black Sea, it was transformed into a freshwater lake in the 1920s."
MB-2005-5#-00000237,1.0,"The river Vișeu, a tributary of Tisa, flows through this commune."
MB-2005-5#-00000400,1.0,"Snagov (Romanian: Lacul Snagov) is a lake in Snagov commune, about 25–30 km north of Bucharest, Romania. Snagov monastery is situated on an islet near the lake's northeastern end, just across Snagov Stadium."
MB-2005-5#-00000237,1.0,"St. Elisabeth's, placed on a hill which is the watershed of the Baltic and Black Sea, with its facade flanked by two tall towers and an 85 m belfry on the north side with imposing spires was envisioned as Lviv's first landmark to greet visitors arriving in the city by train."
MB-2005-5#-00000003,1.0,At first the plan succeeded but the Polish forces caught up with the Russian army during its crossing of the Iber river and subsequently captured or destroyed a significant portion of the remaining Russian artillery and supplies.
MB-2005-5#-00000237,1.0,"Meanwhile, the condition of the building deteriorated, as evidenced by water stains on cracked walls and ceilings.Lviv regional authorities in Ukraine evict Russian cultural center, Deutsche Welle (27 October 2016) The Lviv regional council concluding that the building was being neglected late October 2016 and evicted the Russian cultural center from No."
MB-2005-5#-00000276,1.0,The only thing that remains now of the monastic complex is a water well.
MB-2005-5#-00000400,2.0,"As such, a concrete dam was built to surround the lake."
MB-2005-5#-00000400,1.0,Dervent Heights are situated between the Srem gorge of the river Tundzha in the west to the valleys of the rivers Popovska and Chengerligere in the east which separate them from the Strandzha mountain.
MB-2005-5#-00000237,1.0,"Its attractions include Synevyr lake, and a brown bear sanctuary."
MB-2005-5#-00000276,1.0,"Zhelezniakov is a river warship of the Soviet Navy, monitor of project SB-37."
MB-2005-5#-00000237,2.0,"Lacul Auster (Romanian for the austere lake) is a natural salt lake in the town of Ocna Sibiului, Sibiu County, Transylvania, Romania. In 1922, its water level was much higher than at present, and it was lowered by artificial drainage because it was believed that its waters flooded the Ignaţiu salt mine, which was in operation. Information  Surface:  Maximum depth:  Salinity: 140 g/l Fauna: Artemia salina   Lakes of the salt mine   Auster   Lake Avram Iancu-Ocniţa  Balta cu Nămol   Brâncoveanu   Cloşca   Crişan  Lacul Fără Fund   Gura Minei   Horea   Mâţelor   Negru  Pânzelor   Rândunica   Verde (Freshwater lake)  Vrăjitoarelor (Freshwater lake)  References  Category:Lakes of Sibiu County"
MB-2005-5#-00000237,4.0,"In 1966, the water level of the lake had a sharp decrease of 11 m, because of the leakage of water through a crack produced in the salt wall in the underground lake adjacent to the Ignatius mine."
MB-2005-5#-00000237,2.0,"Lacul Verde (literally Green Lake) is a natural freshwater lake of the Ocna Sibiului mine, Romania. It is the only major freshwater lake of the mine, with the other lakes being salt lakes. The Lacul Vrăjitoarelor is also a freshwater lake, but it is too small and the condition is too poor for swimming. thumb|Ocna Sibiului within the Sibiu County   History   The origin of the lake is the collapse of two nearby, unrecognized saltworks, which were exploited at the same time and later abandoned due to water infiltration. Information  Surface:  Maximum depth:  Salinity: 8-9 g/l   Lakes of the salt mine   Auster   Lake Avram Iancu-Ocniţa  Balta cu Nămol   Brâncoveanu   Cloşca   Crişan  Lacul Fără Fund   Gura Minei   Horea   Mâţelor   Negru  Pânzelor   Rândunica   Verde (Freshwater lake)  Vrăjitoarelor (Freshwater lake)  References  Category:Lakes of Sibiu County"
MB-2005-5#-00000237,2.0,Information  Surface:  Maximum Depth:  Salinity: 120 g/l   Lakes of the salt mine   Auster   Lake Avram Iancu-Ocniţa  Balta cu Nămol   Brâncoveanu   Cloşca   Crişan  Lacul Fără Fund   Gura Minei   Horea   Mâţelor   Negru  Pânzelor   Rândunica   Verde (Freshwater lake)  Vrăjitoarelor (Freshwater lake)  References  Category:Lakes of Sibiu County
MB-2005-5#-00000237,3.0,"thumb|Ocna Sibiului within the Sibiu County   Name  The lake's name is The Black Lake, because the lake has mud at its bottom, making its water black."
MB-2005-5#-00000237,2.0,thumb|Ocna Sibiului within the Sibiu County   Name  Lacul Mâţelor means lake of the small cats or lake of the kittens. Lakes of the salt mine   Auster   Lake Avram Iancu-Ocniţa  Balta cu Nămol   Brâncoveanu   Cloşca   Crişan  Lacul Fără Fund   Gura Minei   Horea   Mâţelor   Negru  Pânzelor   Rândunica   Verde (Freshwater lake)  Vrăjitoarelor (Freshwater lake)   Sources   References  Category:Lakes of Sibiu County
MB-2005-5#-00000237,2.0,Information  Surface:  Maximum depth:    Lakes of the salt mine   Auster   Lake Avram Iancu-Ocniţa  Balta cu Nămol   Brâncoveanu   Cloşca   Crişan  Lacul Fără Fund   Gura Minei   Horea   Mâţelor   Negru  Pânzelor   Rândunica   Verde (Freshwater lake)  Vrăjitoarelor (Freshwater lake)   References     Category:Lakes of Sibiu County
MB-2005-5#-00000237,2.0,"Something else they have in common is that their depth is very small, probably reaching 1–2 m.   Lakes of the salt mine   Auster   Lake Avram Iancu-Ocniţa  Balta cu Nămol   Brâncoveanu   Cloşca   Crişan  Lacul Fără Fund   Gura Minei   Horea   Mâţelor   Negru  Pânzelor   Rândunica   Verde (Freshwater lake)  Vrăjitoarelor (Freshwater lake)   References   Category:Lakes of Sibiu County"
MB-2005-5#-00000237,2.0,"History   The lake was formed on the site of the Francisc Grube salt mine, which was abandoned in 1775 due to water infiltrations. Information  Surface:  Maximum depth:  Salinity: 96 g/l (at the surface), 318 g/l (at 6 m depth)   Lakes of the salt mine   Auster   Lake Avram Iancu-Ocniţa  Balta cu Nămol   Brâncoveanu   Cloşca   Crişan  Lacul Fără Fund   Gura Minei   Horea   Mâţelor   Negru  Pânzelor   Rândunica   Verde (Freshwater lake)  Vrăjitoarelor (Freshwater lake)   References  https://romania.directbooking.ro/prezentare-ocna-sibiului-informatii-poze-imagini-32.aspx  Category: Lakes of Sibiu County"
MB-2005-5#-00000237,2.0,"History  The lake originates from the ""Josef"" salt mine, exploited with two wells and abandoned in 1770, due to strong infiltration of water through the walls. Lakes of the salt mine   Auster   Lake Avram Iancu-Ocniţa  Balta cu Nămol   Brâncoveanu   Cloşca   Crişan  Lacul Fără Fund   Gura Minei   Horea   Mâţelor   Negru  Pânzelor   Rândunica   Verde (Freshwater lake)  Vrăjitoarelor (Freshwater lake)  References  Category:Lakes of Sibiu County"
MB-2005-5#-00000361,1.0,"Botna is a river in Moldova, a right tributary of Dniester. With a length of 152 kilometres, Botna is the sixth longest river in Moldova. The average slope of the river is 1.5 degrees. From the spring to the village of Salcuta, the course of the river is directed to the southeast, then it heads to the northeast. In the past, in the valley of the Costeşti village, the river is meandering."
MB-2005-5#-00000398,1.0,"In the first years, the station had only three-four tracks, a small warehouse with a platform and a small locomotive depot, with water supply and a turntable."
MB-2005-5#-00000237,1.0,"It is located on the border of Turka Raion (Lviv Oblast) and Velykyi Bereznyi Raion (Zakarpattia Oblast), on the watershed of San River and Uzh River."
