DHSID_EA,relevance_score,most_relevant_sentences
ZW-2005-5#-00000758,1.0,"South of Burma Valley, the Tsetsera, Gweni, and Tandara plateaus lie along the border, separated by east-west river valleys lying in fault rifts.Lister, L.A. (1987). Threats and preservation The mountain forests are vulnerable to logging and the grasslands susceptible to fire and the rainforests, which by definition grow on well-watered fertile land, to clearance for agriculture. External links    Eastern Zimbabwe Highlands (freshwater ecoregion)   See also    Nyanga National Park  Mutarazi Falls  References    Category:Afromontane ecoregions Category:Afrotropical ecoregions Category:Eastern Zimbabwe montane forest-grassland mosaic Category:Ecoregions of Mozambique Category:Ecoregions of Zimbabwe Category:Great Rift Valley Category:Highlands Category:Montane grasslands and shrublands Category:Mountains of Zimbabwe Category:Mountain ranges of Mozambique Category:Physiographic divisions Category:Freshwater ecoregions of Africa"
ZW-2010-6#-00000343,1.0,"Water resources The water supply for the Honde Valley comprises small piped systems and motorised pumps serving small towns, growth points, commercial plantations, service centres and some villages, as well as direct abstractions from the rivers by riparian village communities not connected to developed installations. There are a total of about seven small to medium-sized metered piped water systems at Hauna, Sachisuko, Honde Army, Zindi, Samanga, Mpotedzi and Sahumani. In addition there are other smaller un-metered water supply schemes that serve a number of villages and schools. The known smaller un-metered water supply schemes are Honde “Povo” Pipe Scheme, Chingaira Piped Scheme, St Columbus Secondary School, Sagambe Primary and Secondary School, Marige Water Project, Mahobo Piped Scheme and Mupenga Gravity Water Scheme. Pungwe River – fishing and white water rafting  Nyanga National ParkNyanga National Park."
ZW-2010-6#-00000363,2.0,"The river's course is dotted with numerous tree-covered islands, which increase in number where the river approaches the falls. thumb|Victoria Falls Bridge aerial view  The falls are formed where the full width of the river plummets in a single vertical drop into a transverse chasm  wide, carved by its waters along a fracture zone in the basalt plateau. This website gives mean monthly flow rates in cubic metres per second (i.e., the total volume of water passing in each calendar month divided by the number of seconds in the month), the standard measure used in hydrology to indicate seasonal variation in flow. Its surface is smooth at low water, but at high water is marked by enormous, slow swirls and heavy boiling turbulence. thumb|upright|Victoria Falls from the Zimbabwe side The principal gorges are  First Gorge: the one the river falls into at Victoria Falls  Second Gorge:  south of falls,  long, spanned by the Victoria Falls Bridge  Third Gorge:  south,  long, containing the Victoria Falls Power Station  Fourth Gorge:  south,  long  Fifth Gorge:  south,  long  Songwe Gorge:  south,  long named after the small Songwe River coming from the north-east, and the deepest at , the level of the river in them varies by up to  between wet and dry seasons. A 15–45 m scarp bounds the river about 5–6 km from the main channel, and a series of river terraces are evident between the scarp and the channel. When the river flow is at a certain level, usually between September and December, a rock barrier forms an eddy with minimal current, allowing adventurous swimmers to splash around in relative safety in front of the point where the water cascades over the falls. Extensive studies by Dube and Nhamo (2018 and 2019) shows that there is severe water flow variability from year to year with a significant drop in the general trend of water flow in September, October, November and December. : 6,000  211,888   Highest recorded flow: 12,800  452,0006,800 240,000 45,700  1,614,000Notes: See references for explanation of measurements.For water, cubic metres per second = tonnes per second.Half the water approaching Niagara is diverted for hydroelectric power.Iguazu has two drops; height given for biggest drop and total height.10 falls have greater or equal flow rates, but are not as high as Iguazu and Victoria Falls."
ZW-2015-7#-00000321,1.0,"The whites in the territory south of the river paid it scant regard though, and generally used the name ""Rhodesia"" in a narrow sense to mean their part."
ZW-2010-6#-00000324,2.0,"Promises by the government to draw water for the region through the Matabeleland Zambezi Water Project have not been carried out, continuing water shortages."
ZW-2005-5#-00000394,2.0,"Related projects Bulk water In order to meet the growing demand for power generation and mining activities in the Lephalale area, two main bulk raw water transfer systems were also required."
ZW-2015-7#-00000036,1.0,"As a result, the British government pushed through the Manika Treaty on June 11, 1891, that ensured ownership of Manica by the British South Africa Company; until then, the Portuguese colonial area had extended to the Mazoetal river, almost to Harare, Shamv and Mount Darwin."
ZW-2005-5#-00001014,1.0,"May Jel Mining Company era  May Jel Mine operating at Commoner has since drilled boreholes outside its yard and villagers in Maisa, Mahogo and Nzama villages fetch clean water from these water-points."
ZW-1999-4#-00000223,3.0,By late February the dam had not been fully breached but the unplanned rising reservoir behind the dam caused evacuations upstream.
ZW-2015-7#-00000170,3.0,The dam to supply the reservoir with water will be a  tall arch-gravity type.
ZW-2015-7#-00000207,1.0,"The southern Swaziland tripoint is situated at Abercorn Drift in the Usutu River (Maputo River), where the Mozambique–Swaziland border along the Lebombo Mountains meets the river."
ZW-2005-5#-00000388,3.0,"The dam supplies domestic water to Polokwane and Tzaneen, and irrigation water to the Letaba valley."
ZW-2010-6#-00000116,1.0,"Sports The sports on offer at Hellenic in summer include cricket, tennis, water polo, swimming, athletics, cross country, triathlon and Rugby 7s."
ZW-2005-5#-00000394,2.0,"Related projects Bulk water In order to meet the growing demand for power generation and mining activities in the Lephalale area, two main bulk raw water transfer systems were also required."
ZW-2015-7#-00000036,1.0,"As a result, the British government pushed through the Manika Treaty on June 11, 1891, that ensured ownership of Manica by the British South Africa Company; until then, the Portuguese colonial area had extended to the Mazoetal river, almost to Harare, Shamv and Mount Darwin."
ZW-2015-7#-00000386,1.0,It encloses the Doorndraai Dam reservoir.
ZW-2005-5#-00000388,1.0,"Dap Naudé Dam is dam on the Broederstroom River, near Polokwane, Limpopo, South Africa. The Dam has a surface area of 28 ha and when full provides the Dap Naude Dam Reservoir with 1.9 million cubic meters of water."
ZW-2015-7#-00000386,1.0,"Doorndraai Dam is a buttress type dam on the Sterk River, Mogalakwena River basin, located near Mokopane, Limpopo, South Africa."
ZW-2015-7#-00000386,1.0,"Glen Alpine Dam is a combined gravity and earth-fill type dam located on the Mogalakwena River, near Ga-Mankgodi, Bochum Limpopo, South Africa. The hazard potential of the dam has been ranked as high (3)."
ZW-2010-6#-00000154,2.0,"Its twin dam, the Nwanedi, is located to the west of the dam, less than  away."
ZW-2010-6#-00000154,6.0,"The dam is popularly known as 'Sterkrivier Dam' by the local people, the name Sterkrivier (Strong river) was given by the Afrikaner people, it is said that before the construction of the dam in 1980, the water that used to flow in this river was so powerful to an extent that a new name was given to the river, hence 'Sterkrivier'."
ZW-2005-5#-00000394,2.0,"The dam supplies water to Lephalale town. The dam supplies the  Lephalale area, Grootgeluk coal mine, Matimba power station and part of the water requirements of Medupi power station."
ZW-2010-6#-00000405,1.0,"Molatedi Dam is an earth-fill type dam located on the Marico River, near Zeerust, North West, South Africa. The hazard potential of the dam has been ranked high (3)."
ZW-2005-5#-00000388,1.0,"Mutshedzi Dam is a gravity type dam located on the Mutshedzi River, a tributary of the Nzhelele River. The hazard potential of the dam has been ranked significant (2)."
ZW-2010-6#-00000154,2.0,"It is a twin dam, the Luphephe Dam is located just east of the dam, less than 0.25 km away."
ZW-2005-5#-00000388,1.0,"Nzhelele Dam (also known as Njelele Dam) is an arch type dam located on the Nzhelele River in Limpopo Province, South Africa. It has a capacity of 55.3 million m3.Major rivers and streams within the Limpopo River Basin It was established in 1948.List of South African Dams from the Department of Water Affairs The main purpose of the dam is to serve for irrigation and its hazard potentials has been ranked high (3)."
ZW-2005-5#-00001014,1.0,"May Jel Mining Company era  May Jel Mine operating at Commoner has since drilled boreholes outside its yard and villagers in Maisa, Mahogo and Nzama villages fetch clean water from these water-points."
ZW-1999-4#-00000223,3.0,By late February the dam had not been fully breached but the unplanned rising reservoir behind the dam caused evacuations upstream.
ZW-2015-7#-00000170,3.0,The dam to supply the reservoir with water will be a  tall arch-gravity type.
ZW-2015-7#-00000207,1.0,"The southern Swaziland tripoint is situated at Abercorn Drift in the Usutu River (Maputo River), where the Mozambique–Swaziland border along the Lebombo Mountains meets the river."
ZW-2005-5#-00000388,3.0,"The dam supplies domestic water to Polokwane and Tzaneen, and irrigation water to the Letaba valley."
ZW-2010-6#-00000116,1.0,"Sports The sports on offer at Hellenic in summer include cricket, tennis, water polo, swimming, athletics, cross country, triathlon and Rugby 7s."
ZW-2005-5#-00000394,2.0,"Related projects Bulk water In order to meet the growing demand for power generation and mining activities in the Lephalale area, two main bulk raw water transfer systems were also required."
ZW-2015-7#-00000036,1.0,"As a result, the British government pushed through the Manika Treaty on June 11, 1891, that ensured ownership of Manica by the British South Africa Company; until then, the Portuguese colonial area had extended to the Mazoetal river, almost to Harare, Shamv and Mount Darwin."
ZW-2005-5#-00000758,1.0,"South of Burma Valley, the Tsetsera, Gweni, and Tandara plateaus lie along the border, separated by east-west river valleys lying in fault rifts.Lister, L.A. (1987). Threats and preservation The mountain forests are vulnerable to logging and the grasslands susceptible to fire and the rainforests, which by definition grow on well-watered fertile land, to clearance for agriculture. External links    Eastern Zimbabwe Highlands (freshwater ecoregion)   See also    Nyanga National Park  Mutarazi Falls  References    Category:Afromontane ecoregions Category:Afrotropical ecoregions Category:Eastern Zimbabwe montane forest-grassland mosaic Category:Ecoregions of Mozambique Category:Ecoregions of Zimbabwe Category:Great Rift Valley Category:Highlands Category:Montane grasslands and shrublands Category:Mountains of Zimbabwe Category:Mountain ranges of Mozambique Category:Physiographic divisions Category:Freshwater ecoregions of Africa"
ZW-2010-6#-00000343,1.0,"Water resources The water supply for the Honde Valley comprises small piped systems and motorised pumps serving small towns, growth points, commercial plantations, service centres and some villages, as well as direct abstractions from the rivers by riparian village communities not connected to developed installations. There are a total of about seven small to medium-sized metered piped water systems at Hauna, Sachisuko, Honde Army, Zindi, Samanga, Mpotedzi and Sahumani. In addition there are other smaller un-metered water supply schemes that serve a number of villages and schools. The known smaller un-metered water supply schemes are Honde “Povo” Pipe Scheme, Chingaira Piped Scheme, St Columbus Secondary School, Sagambe Primary and Secondary School, Marige Water Project, Mahobo Piped Scheme and Mupenga Gravity Water Scheme. Pungwe River – fishing and white water rafting  Nyanga National ParkNyanga National Park."
ZW-2010-6#-00000363,2.0,"The river's course is dotted with numerous tree-covered islands, which increase in number where the river approaches the falls. thumb|Victoria Falls Bridge aerial view  The falls are formed where the full width of the river plummets in a single vertical drop into a transverse chasm  wide, carved by its waters along a fracture zone in the basalt plateau. This website gives mean monthly flow rates in cubic metres per second (i.e., the total volume of water passing in each calendar month divided by the number of seconds in the month), the standard measure used in hydrology to indicate seasonal variation in flow. Its surface is smooth at low water, but at high water is marked by enormous, slow swirls and heavy boiling turbulence. thumb|upright|Victoria Falls from the Zimbabwe side The principal gorges are  First Gorge: the one the river falls into at Victoria Falls  Second Gorge:  south of falls,  long, spanned by the Victoria Falls Bridge  Third Gorge:  south,  long, containing the Victoria Falls Power Station  Fourth Gorge:  south,  long  Fifth Gorge:  south,  long  Songwe Gorge:  south,  long named after the small Songwe River coming from the north-east, and the deepest at , the level of the river in them varies by up to  between wet and dry seasons. A 15–45 m scarp bounds the river about 5–6 km from the main channel, and a series of river terraces are evident between the scarp and the channel. When the river flow is at a certain level, usually between September and December, a rock barrier forms an eddy with minimal current, allowing adventurous swimmers to splash around in relative safety in front of the point where the water cascades over the falls. Extensive studies by Dube and Nhamo (2018 and 2019) shows that there is severe water flow variability from year to year with a significant drop in the general trend of water flow in September, October, November and December. : 6,000  211,888   Highest recorded flow: 12,800  452,0006,800 240,000 45,700  1,614,000Notes: See references for explanation of measurements.For water, cubic metres per second = tonnes per second.Half the water approaching Niagara is diverted for hydroelectric power.Iguazu has two drops; height given for biggest drop and total height.10 falls have greater or equal flow rates, but are not as high as Iguazu and Victoria Falls."
ZW-2005-5#-00000758,1.0,"South of Burma Valley, the Tsetsera, Gweni, and Tandara plateaus lie along the border, separated by east-west river valleys lying in fault rifts.Lister, L.A. (1987). Threats and preservation The mountain forests are vulnerable to logging and the grasslands susceptible to fire and the rainforests, which by definition grow on well-watered fertile land, to clearance for agriculture. External links    Eastern Zimbabwe Highlands (freshwater ecoregion)   See also    Nyanga National Park  Mutarazi Falls  References    Category:Afromontane ecoregions Category:Afrotropical ecoregions Category:Eastern Zimbabwe montane forest-grassland mosaic Category:Ecoregions of Mozambique Category:Ecoregions of Zimbabwe Category:Great Rift Valley Category:Highlands Category:Montane grasslands and shrublands Category:Mountains of Zimbabwe Category:Mountain ranges of Mozambique Category:Physiographic divisions Category:Freshwater ecoregions of Africa"
ZW-2010-6#-00000343,1.0,"Water resources The water supply for the Honde Valley comprises small piped systems and motorised pumps serving small towns, growth points, commercial plantations, service centres and some villages, as well as direct abstractions from the rivers by riparian village communities not connected to developed installations. There are a total of about seven small to medium-sized metered piped water systems at Hauna, Sachisuko, Honde Army, Zindi, Samanga, Mpotedzi and Sahumani. In addition there are other smaller un-metered water supply schemes that serve a number of villages and schools. The known smaller un-metered water supply schemes are Honde “Povo” Pipe Scheme, Chingaira Piped Scheme, St Columbus Secondary School, Sagambe Primary and Secondary School, Marige Water Project, Mahobo Piped Scheme and Mupenga Gravity Water Scheme. Pungwe River – fishing and white water rafting  Nyanga National ParkNyanga National Park."
ZW-2010-6#-00000363,2.0,"The river's course is dotted with numerous tree-covered islands, which increase in number where the river approaches the falls. thumb|Victoria Falls Bridge aerial view  The falls are formed where the full width of the river plummets in a single vertical drop into a transverse chasm  wide, carved by its waters along a fracture zone in the basalt plateau. This website gives mean monthly flow rates in cubic metres per second (i.e., the total volume of water passing in each calendar month divided by the number of seconds in the month), the standard measure used in hydrology to indicate seasonal variation in flow. Its surface is smooth at low water, but at high water is marked by enormous, slow swirls and heavy boiling turbulence. thumb|upright|Victoria Falls from the Zimbabwe side The principal gorges are  First Gorge: the one the river falls into at Victoria Falls  Second Gorge:  south of falls,  long, spanned by the Victoria Falls Bridge  Third Gorge:  south,  long, containing the Victoria Falls Power Station  Fourth Gorge:  south,  long  Fifth Gorge:  south,  long  Songwe Gorge:  south,  long named after the small Songwe River coming from the north-east, and the deepest at , the level of the river in them varies by up to  between wet and dry seasons. A 15–45 m scarp bounds the river about 5–6 km from the main channel, and a series of river terraces are evident between the scarp and the channel. When the river flow is at a certain level, usually between September and December, a rock barrier forms an eddy with minimal current, allowing adventurous swimmers to splash around in relative safety in front of the point where the water cascades over the falls. Extensive studies by Dube and Nhamo (2018 and 2019) shows that there is severe water flow variability from year to year with a significant drop in the general trend of water flow in September, October, November and December. : 6,000  211,888   Highest recorded flow: 12,800  452,0006,800 240,000 45,700  1,614,000Notes: See references for explanation of measurements.For water, cubic metres per second = tonnes per second.Half the water approaching Niagara is diverted for hydroelectric power.Iguazu has two drops; height given for biggest drop and total height.10 falls have greater or equal flow rates, but are not as high as Iguazu and Victoria Falls."
ZW-2015-7#-00000321,1.0,"The whites in the territory south of the river paid it scant regard though, and generally used the name ""Rhodesia"" in a narrow sense to mean their part."
ZW-2005-5#-00000599,1.0,"Sport The following sporting disciplines are available at Chisipite: athletics, basketball, cross country, field hockey, indoor hockey,  rowing, soccer, squash, swimming, tennis, volleyball and water polo."
ZW-2005-5#-00000388,1.0,"The Tongwane River is a river in Limpopo Province, South Africa."
ZW-2015-7#-00000386,2.0,Schools    Mmadikana Secondary School is a public secondary school and Motshitshi Primary School is a public primary school located at Masehlaneng   Soccer Grounds  There are two soccer grounds where soccer is played:   Smiling Soccer Ground  Bananas Soccer Ground   River  Magopane River is a small river that supplies water to Mogalakwena River.
ZW-1999-4#-00000120,1.0,"The Mazowe Dam (or Mazoe Dam) is a dam on the Mazowe River in Zimbabwe, in the Iron Mask Hills about  north of Harare. The dam was also home to the Hunyani Rowing Club and formerly provided facilities for St. Georges, Prince Edward, Arundel and other rowing clubs. It is the only major dam on the Mazowe River. The concrete dam was built by the British civil contractor Pauling & Co. and was raised by  in 1961 by drilling into the foundation rock and installing post-tensioned tendons into the concrete. It can hold 35 million cu m of water and has a surface area of 445 ha when full. However, prolonged drought in the first two decades of the 21st century has left the dam virtually empty, badly damaging local agricultural production. It had previously almost dried up in the droughts of 1984-85 and again in 1996, but even after the breaking of the most recent drought the dam has remained empty."
ZW-2005-5#-00000860,2.0,The lake was designated a Ramsar wetland of international importance on 3 January 2013.
ZW-2005-5#-00000493,2.0,"The chrome and salt content of the water keep the water clear, a rare occurrence in Zimbabwe outside of the Eastern Highlands."
ZW-2005-5#-00000445,1.0,"right|thumb|300px|Shangani River in the Gwayi River catchment (center) The Shangani is a river in Zimbabwe that starts near Gweru, Gweru River being one of its main tributaries' and goes through Midlands and Matabeleland North provinces."
ZW-2010-6#-00000223,2.0,Mazvikadei Dam is a dam in Zimbabwe which provides water for farm irrigation.
ZW-1999-4#-00000170,1.0,"The hospital compound is close to the Shangani river, about 1157 metres above sea level."
ZW-2015-7#-00000042,1.0,"The Mucheke River is the only river in Masvingo town, Zimbabwe."
ZW-2005-5#-00000394,2.0,"Related projects Bulk water In order to meet the growing demand for power generation and mining activities in the Lephalale area, two main bulk raw water transfer systems were also required."
ZW-2010-6#-00000130,1.0,"The Okavango Delta, one of the world's largest inland river deltas, is in the north-west. The Notwane provides water to the capital through the Gaborone Dam. Three-quarters of the country's human and animal populations depend on groundwater due to drought. Surface water is scarce in Botswana and less than 5% of the agriculture in the country is sustainable by rainfall. To make them relocate, they were denied access to water on their land and faced arrest if they hunted, which was their primary source of food. Porridge (bogobe) is made by putting sorghum, maize or millet flour into boiling water, stirring into a soft paste, and cooking it slowly. There are some kinds of wild melon found in sandy desert areas which are an important food and water source for the people who live in those areas."
ZW-2005-5#-00000470,2.0,"The dam was built by Concor to provide water to the farming estates on the lowveld to the southwest, around the town of Triangle, where the main crop has been sugar cane. In the 1980s, drought drastically lowered the water level in the lake, but during the 1990s it recovered."
ZW-2015-7#-00000341,1.0,The village has an abundance of water for possible irrigation from the Save River and very fertile soils.
ZW-2015-7#-00000321,1.0,"Victoria Falls, one of the world's biggest and most spectacular waterfalls, is located in the country's extreme northwest and is part of the Zambezi river. Biodiversity  [[File:Curled trunk.jpg|thumb|An elephant at a water hole in Hwange National Park.]] Water supply and sanitation  Water supply and sanitation in Zimbabwe is defined by many small scale successful programs but also by a general lack of improved water and sanitation systems for the majority of Zimbabwe. clean, drinking-water sources, and only 40% of Zimbabweans had access to improved sanitation facilities. Access to improved water supply and sanitation is distinctly less in rural areas. There are many factors which continue to determine the nature, for the foreseeable future, of water supply and sanitation in Zimbabwe. Sadza is made by mixing the cornmeal with water to produce a thick paste/porridge. Other sports played in Zimbabwe are basketball, volleyball, netball, and water polo, as well as squash, motorsport, martial arts, chess, cycling, polocrosse, kayaking and horse racing."
ZW-2005-5#-00000681,4.0,"Elevation extremes: lowest point: junction of the Runde and Save rivers 162 m  highest point: Mount Nyangani 2,592 m  Natural resources: coal, chromium ore, asbestos, gold, nickel, copper, iron ore, vanadium, lithium, tin, diamond, platinum group metals  Land use: arable land: 10.49% permanent crops: 0.31% other: 89.20% (2011)  Irrigated land: 1,735 km² (2003)  Total renewable water resources: 20 km3 (2011)  Natural hazards: droughts; floods and severe storms are rare  Environment – current issues: deforestation; soil erosion; land degradation; air and water pollution; the black rhinoceros herd – once the largest concentration of the species in the world – has been significantly reduced by poaching; poor mining practices have led to toxic waste and heavy metal pollution  Environment – international agreements: party to: Biodiversity, Climate Change, Desertification, Endangered Species, Law of the Sea, Ozone Layer Protection signed, but not ratified: none of the selected agreements  Hydrology: The country is divided into six drainage basins."
ZW-2015-7#-00000386,1.0,"The sandstone formations could retain groundwater sufficient to make a suitable environment for primitive man. These surface waters all drain to the Limpopo River which flows easterly to discharge into the Indian Ocean. The river bushwillow is a riparian tree in this habitat. These riparian zones offer habitat for birds, reptiles and mammals that require more water than plateau species."
