DHSID_EA,relevance_score,most_relevant_sentences
ZW-2010-6#-00000343,1.0,"Water resources The water supply for the Honde Valley comprises small piped systems and motorised pumps serving small towns, growth points, commercial plantations, service centres and some villages, as well as direct abstractions from the rivers by riparian village communities not connected to developed installations. There are a total of about seven small to medium-sized metered piped water systems at Hauna, Sachisuko, Honde Army, Zindi, Samanga, Mpotedzi and Sahumani. In addition there are other smaller un-metered water supply schemes that serve a number of villages and schools. The known smaller un-metered water supply schemes are Honde “Povo” Pipe Scheme, Chingaira Piped Scheme, St Columbus Secondary School, Sagambe Primary and Secondary School, Marige Water Project, Mahobo Piped Scheme and Mupenga Gravity Water Scheme. Pungwe River – fishing and white water rafting  Nyanga National ParkNyanga National Park."
ZW-2010-6#-00000363,2.0,"The river's course is dotted with numerous tree-covered islands, which increase in number where the river approaches the falls. thumb|Victoria Falls Bridge aerial view  The falls are formed where the full width of the river plummets in a single vertical drop into a transverse chasm  wide, carved by its waters along a fracture zone in the basalt plateau. This website gives mean monthly flow rates in cubic metres per second (i.e., the total volume of water passing in each calendar month divided by the number of seconds in the month), the standard measure used in hydrology to indicate seasonal variation in flow. Its surface is smooth at low water, but at high water is marked by enormous, slow swirls and heavy boiling turbulence. thumb|upright|Victoria Falls from the Zimbabwe side The principal gorges are  First Gorge: the one the river falls into at Victoria Falls  Second Gorge:  south of falls,  long, spanned by the Victoria Falls Bridge  Third Gorge:  south,  long, containing the Victoria Falls Power Station  Fourth Gorge:  south,  long  Fifth Gorge:  south,  long  Songwe Gorge:  south,  long named after the small Songwe River coming from the north-east, and the deepest at , the level of the river in them varies by up to  between wet and dry seasons. A 15–45 m scarp bounds the river about 5–6 km from the main channel, and a series of river terraces are evident between the scarp and the channel. When the river flow is at a certain level, usually between September and December, a rock barrier forms an eddy with minimal current, allowing adventurous swimmers to splash around in relative safety in front of the point where the water cascades over the falls. Extensive studies by Dube and Nhamo (2018 and 2019) shows that there is severe water flow variability from year to year with a significant drop in the general trend of water flow in September, October, November and December. : 6,000  211,888   Highest recorded flow: 12,800  452,0006,800 240,000 45,700  1,614,000Notes: See references for explanation of measurements.For water, cubic metres per second = tonnes per second.Half the water approaching Niagara is diverted for hydroelectric power.Iguazu has two drops; height given for biggest drop and total height.10 falls have greater or equal flow rates, but are not as high as Iguazu and Victoria Falls."
ZW-2015-7#-00000321,1.0,"The whites in the territory south of the river paid it scant regard though, and generally used the name ""Rhodesia"" in a narrow sense to mean their part."
ZW-2010-6#-00000324,2.0,"Promises by the government to draw water for the region through the Matabeleland Zambezi Water Project have not been carried out, continuing water shortages."
ZW-2015-7#-00000040,1.0,"Surrounded and outnumbered about a hundred-fold, the patrol made a last stand as three of its number broke out and rode back to the river to muster reinforcements from Forbes. Wishing to know whether the king had crossed here or at another point on the river, Forbes sent Major Allan Wilson across to scout ahead with 12 men and eight officers, and told him to return by nightfall. Wilson's men remained north of the river far longer than expected, and had still not returned when darkness fell. Forbes, meanwhile, received a report that most of Lobengula's force, commanded by inDuna Mjaan, had separated from the king and was moving to attack the laager the same night (this was actually an exaggeration; only about 300 riflemen had split from the main Matabele force, though they were indeed south of the river, undetected by Forbes). The laager received no word from Wilson until about 21:00, when Sergeant-Major Judge and Corporal Ebbage arrived from across the river to tell Forbes that Wilson had found Lobengula's tracks, and followed him for . Wilson regarded the chances of taking the king alive as so good that he was going to remain north of the river overnight. Wilson repeated that he was going to stay north of the river overnight, close to the king, and asked Forbes to bring the whole column across by 04:00 in the morning. Forbes thought it unwise to attempt a full river crossing at night, which he reasoned might lead to his force being surrounded in the darkness and massacred, but also felt he could not recall Wilson, as to do so would be to lose Lobengula for sure. Engagement  Matabele ambushes on both sides of the river [[File:Shangani patrol map.jpg|thumb|upright=1.6|Sketch map of the area drawn by Frederick Russell Burnham, 1895|alt=A map. On the southern side of the river, the 300 Matabele riflemen took up a well-covered position near the riverbank, about  to the left of Forbes's position. Hearing the shots from the northern side of the river, Forbes uneasily moved towards the southern bank, intending to cross and help Wilson. Meanwhile, Wilson marched his officers and men back towards the river, hoping to reunite with Forbes. They moved on for about , but soon noticed that a line of Matabele warriors was blocking their way to the river. In an act of desperation, he instead sent three of his men—American scouts Frederick Russell Burnham and Pearl ""Pete"" Ingram, and Australian Trooper William Gooding—to charge through the Matabele line, cross the river and bring reinforcements back to help, while he, Borrow and the rest made a last stand. Burnham, Ingram and Gooding reached the Shangani about 08:00, but quickly saw that the water had risen far too high for Forbes to provide any assistance. Realising the futility of turning back to Wilson without help, they decided to rejoin Forbes anyway, and to that end traversed the swollen river with considerable difficulty. ; ;   Matabele victory north of the river; Wilson's last stand  What happened to the Shangani Patrol after this point is known only from Matabele sources. ; ; ;   Aftermath  Forbes's retreat, Lobengula's death and the end of the war After the battle on the southern side of the Shangani was over, Forbes and his column conducted a cursory search for survivors from Wilson's party, but, unable to cross the river, could see nothing to tell them what had happened. Guessing (correctly) that all Company men beyond the river had been killed, they turned and trekked back to Bulawayo in miserable fashion, their supplies all but gone and the Matabele impeding their progress at every turn. Controversy  Lobengula's box of sovereigns Soon following the end of the war, one of Lobengula's izinDuna told Dawson that just before Forbes's column had reached the Shangani, two Matabele messengers, Petchan and Sehuloholu, had been given a box of gold sovereigns by Lobengula, and instructed to intercept the column before it reached the river. The Company thought it unlikely that a Matabele inDuna would simply invent a story such as this, however, and angrily speculated that if it were true, then negotiations with Lobengula might have been opened and the war ended before Wilson crossed the river, and the entire episode of the Shangani Patrol avoided (though, as historian Robert Cary writes, this surmision ignores the fact that Forbes had been ordered to capture Lobengula, not end the war)."
ZW-2010-6#-00000154,2.0,He cursed the kraal which disappeared below the waters of the newly formed lake and the Venda claim that in the early morning it is possible to hear the sound of drums and the cries and bellowing of the drowned people and cattle.
ZW-2005-5#-00000388,1.0,"Currently the Sports Ground lack some proper dressing rooms, and is even without toilets and running water."
ZW-2010-6#-00000405,1.0,"The rocky cliffs are made of porous rock that absorbs rainwater, which then seeps out forming permanent cascades and pools, such as the Phothophotho Gorge."
ZW-2015-7#-00000040,1.0,"Surrounded and outnumbered about a hundred-fold, the patrol made a last stand as three of its number broke out and rode back to the river to muster reinforcements from Forbes. Wishing to know whether the king had crossed here or at another point on the river, Forbes sent Major Allan Wilson across to scout ahead with 12 men and eight officers, and told him to return by nightfall. Wilson's men remained north of the river far longer than expected, and had still not returned when darkness fell. Forbes, meanwhile, received a report that most of Lobengula's force, commanded by inDuna Mjaan, had separated from the king and was moving to attack the laager the same night (this was actually an exaggeration; only about 300 riflemen had split from the main Matabele force, though they were indeed south of the river, undetected by Forbes). The laager received no word from Wilson until about 21:00, when Sergeant-Major Judge and Corporal Ebbage arrived from across the river to tell Forbes that Wilson had found Lobengula's tracks, and followed him for . Wilson regarded the chances of taking the king alive as so good that he was going to remain north of the river overnight. Wilson repeated that he was going to stay north of the river overnight, close to the king, and asked Forbes to bring the whole column across by 04:00 in the morning. Forbes thought it unwise to attempt a full river crossing at night, which he reasoned might lead to his force being surrounded in the darkness and massacred, but also felt he could not recall Wilson, as to do so would be to lose Lobengula for sure. Engagement  Matabele ambushes on both sides of the river [[File:Shangani patrol map.jpg|thumb|upright=1.6|Sketch map of the area drawn by Frederick Russell Burnham, 1895|alt=A map. On the southern side of the river, the 300 Matabele riflemen took up a well-covered position near the riverbank, about  to the left of Forbes's position. Hearing the shots from the northern side of the river, Forbes uneasily moved towards the southern bank, intending to cross and help Wilson. Meanwhile, Wilson marched his officers and men back towards the river, hoping to reunite with Forbes. They moved on for about , but soon noticed that a line of Matabele warriors was blocking their way to the river. In an act of desperation, he instead sent three of his men—American scouts Frederick Russell Burnham and Pearl ""Pete"" Ingram, and Australian Trooper William Gooding—to charge through the Matabele line, cross the river and bring reinforcements back to help, while he, Borrow and the rest made a last stand. Burnham, Ingram and Gooding reached the Shangani about 08:00, but quickly saw that the water had risen far too high for Forbes to provide any assistance. Realising the futility of turning back to Wilson without help, they decided to rejoin Forbes anyway, and to that end traversed the swollen river with considerable difficulty. ; ;   Matabele victory north of the river; Wilson's last stand  What happened to the Shangani Patrol after this point is known only from Matabele sources. ; ; ;   Aftermath  Forbes's retreat, Lobengula's death and the end of the war After the battle on the southern side of the Shangani was over, Forbes and his column conducted a cursory search for survivors from Wilson's party, but, unable to cross the river, could see nothing to tell them what had happened. Guessing (correctly) that all Company men beyond the river had been killed, they turned and trekked back to Bulawayo in miserable fashion, their supplies all but gone and the Matabele impeding their progress at every turn. Controversy  Lobengula's box of sovereigns Soon following the end of the war, one of Lobengula's izinDuna told Dawson that just before Forbes's column had reached the Shangani, two Matabele messengers, Petchan and Sehuloholu, had been given a box of gold sovereigns by Lobengula, and instructed to intercept the column before it reached the river. The Company thought it unlikely that a Matabele inDuna would simply invent a story such as this, however, and angrily speculated that if it were true, then negotiations with Lobengula might have been opened and the war ended before Wilson crossed the river, and the entire episode of the Shangani Patrol avoided (though, as historian Robert Cary writes, this surmision ignores the fact that Forbes had been ordered to capture Lobengula, not end the war)."
ZW-2010-6#-00000154,2.0,He cursed the kraal which disappeared below the waters of the newly formed lake and the Venda claim that in the early morning it is possible to hear the sound of drums and the cries and bellowing of the drowned people and cattle.
ZW-2005-5#-00000599,1.0,"Sport The following sporting disciplines are available at Chisipite: athletics, basketball, cross country, field hockey, indoor hockey,  rowing, soccer, squash, swimming, tennis, volleyball and water polo."
ZW-2005-5#-00000388,1.0,"The Tongwane River is a river in Limpopo Province, South Africa."
ZW-2015-7#-00000386,2.0,Schools    Mmadikana Secondary School is a public secondary school and Motshitshi Primary School is a public primary school located at Masehlaneng   Soccer Grounds  There are two soccer grounds where soccer is played:   Smiling Soccer Ground  Bananas Soccer Ground   River  Magopane River is a small river that supplies water to Mogalakwena River.
ZW-2005-5#-00001014,1.0,"May Jel Mining Company era  May Jel Mine operating at Commoner has since drilled boreholes outside its yard and villagers in Maisa, Mahogo and Nzama villages fetch clean water from these water-points."
ZW-1999-4#-00000223,3.0,By late February the dam had not been fully breached but the unplanned rising reservoir behind the dam caused evacuations upstream.
ZW-2015-7#-00000170,3.0,The dam to supply the reservoir with water will be a  tall arch-gravity type.
ZW-2015-7#-00000207,1.0,"The southern Swaziland tripoint is situated at Abercorn Drift in the Usutu River (Maputo River), where the Mozambique–Swaziland border along the Lebombo Mountains meets the river."
ZW-2005-5#-00000388,3.0,"The dam supplies domestic water to Polokwane and Tzaneen, and irrigation water to the Letaba valley."
ZW-2010-6#-00000130,1.0,"The Okavango Delta, one of the world's largest inland river deltas, is in the north-west. The Notwane provides water to the capital through the Gaborone Dam. Three-quarters of the country's human and animal populations depend on groundwater due to drought. Surface water is scarce in Botswana and less than 5% of the agriculture in the country is sustainable by rainfall. To make them relocate, they were denied access to water on their land and faced arrest if they hunted, which was their primary source of food. Porridge (bogobe) is made by putting sorghum, maize or millet flour into boiling water, stirring into a soft paste, and cooking it slowly. There are some kinds of wild melon found in sandy desert areas which are an important food and water source for the people who live in those areas."
ZW-2005-5#-00000470,2.0,"The dam was built by Concor to provide water to the farming estates on the lowveld to the southwest, around the town of Triangle, where the main crop has been sugar cane. In the 1980s, drought drastically lowered the water level in the lake, but during the 1990s it recovered."
ZW-2015-7#-00000341,1.0,The village has an abundance of water for possible irrigation from the Save River and very fertile soils.
ZW-2015-7#-00000321,1.0,"Victoria Falls, one of the world's biggest and most spectacular waterfalls, is located in the country's extreme northwest and is part of the Zambezi river. Biodiversity  [[File:Curled trunk.jpg|thumb|An elephant at a water hole in Hwange National Park.]] Water supply and sanitation  Water supply and sanitation in Zimbabwe is defined by many small scale successful programs but also by a general lack of improved water and sanitation systems for the majority of Zimbabwe. clean, drinking-water sources, and only 40% of Zimbabweans had access to improved sanitation facilities. Access to improved water supply and sanitation is distinctly less in rural areas. There are many factors which continue to determine the nature, for the foreseeable future, of water supply and sanitation in Zimbabwe. Sadza is made by mixing the cornmeal with water to produce a thick paste/porridge. Other sports played in Zimbabwe are basketball, volleyball, netball, and water polo, as well as squash, motorsport, martial arts, chess, cycling, polocrosse, kayaking and horse racing."
ZW-2005-5#-00000681,4.0,"Elevation extremes: lowest point: junction of the Runde and Save rivers 162 m  highest point: Mount Nyangani 2,592 m  Natural resources: coal, chromium ore, asbestos, gold, nickel, copper, iron ore, vanadium, lithium, tin, diamond, platinum group metals  Land use: arable land: 10.49% permanent crops: 0.31% other: 89.20% (2011)  Irrigated land: 1,735 km² (2003)  Total renewable water resources: 20 km3 (2011)  Natural hazards: droughts; floods and severe storms are rare  Environment – current issues: deforestation; soil erosion; land degradation; air and water pollution; the black rhinoceros herd – once the largest concentration of the species in the world – has been significantly reduced by poaching; poor mining practices have led to toxic waste and heavy metal pollution  Environment – international agreements: party to: Biodiversity, Climate Change, Desertification, Endangered Species, Law of the Sea, Ozone Layer Protection signed, but not ratified: none of the selected agreements  Hydrology: The country is divided into six drainage basins."
ZW-2015-7#-00000386,1.0,"The sandstone formations could retain groundwater sufficient to make a suitable environment for primitive man. These surface waters all drain to the Limpopo River which flows easterly to discharge into the Indian Ocean. The river bushwillow is a riparian tree in this habitat. These riparian zones offer habitat for birds, reptiles and mammals that require more water than plateau species."
ZW-2005-5#-00000394,2.0,"Related projects Bulk water In order to meet the growing demand for power generation and mining activities in the Lephalale area, two main bulk raw water transfer systems were also required."
ZW-2015-7#-00000036,1.0,"As a result, the British government pushed through the Manika Treaty on June 11, 1891, that ensured ownership of Manica by the British South Africa Company; until then, the Portuguese colonial area had extended to the Mazoetal river, almost to Harare, Shamv and Mount Darwin."
ZW-2015-7#-00000386,1.0,It encloses the Doorndraai Dam reservoir.
ZW-2005-5#-00000388,1.0,"Dap Naudé Dam is dam on the Broederstroom River, near Polokwane, Limpopo, South Africa. The Dam has a surface area of 28 ha and when full provides the Dap Naude Dam Reservoir with 1.9 million cubic meters of water."
ZW-2015-7#-00000386,1.0,"Doorndraai Dam is a buttress type dam on the Sterk River, Mogalakwena River basin, located near Mokopane, Limpopo, South Africa."
ZW-2015-7#-00000386,1.0,"Glen Alpine Dam is a combined gravity and earth-fill type dam located on the Mogalakwena River, near Ga-Mankgodi, Bochum Limpopo, South Africa. The hazard potential of the dam has been ranked as high (3)."
ZW-2010-6#-00000154,2.0,"Its twin dam, the Nwanedi, is located to the west of the dam, less than  away."
ZW-2010-6#-00000154,6.0,"The dam is popularly known as 'Sterkrivier Dam' by the local people, the name Sterkrivier (Strong river) was given by the Afrikaner people, it is said that before the construction of the dam in 1980, the water that used to flow in this river was so powerful to an extent that a new name was given to the river, hence 'Sterkrivier'."
ZW-2005-5#-00000394,2.0,"The dam supplies water to Lephalale town. The dam supplies the  Lephalale area, Grootgeluk coal mine, Matimba power station and part of the water requirements of Medupi power station."
ZW-2010-6#-00000405,1.0,"Molatedi Dam is an earth-fill type dam located on the Marico River, near Zeerust, North West, South Africa. The hazard potential of the dam has been ranked high (3)."
ZW-2005-5#-00000388,1.0,"Mutshedzi Dam is a gravity type dam located on the Mutshedzi River, a tributary of the Nzhelele River. The hazard potential of the dam has been ranked significant (2)."
ZW-2010-6#-00000154,2.0,"It is a twin dam, the Luphephe Dam is located just east of the dam, less than 0.25 km away."
ZW-2005-5#-00000388,1.0,"Nzhelele Dam (also known as Njelele Dam) is an arch type dam located on the Nzhelele River in Limpopo Province, South Africa. It has a capacity of 55.3 million m3.Major rivers and streams within the Limpopo River Basin It was established in 1948.List of South African Dams from the Department of Water Affairs The main purpose of the dam is to serve for irrigation and its hazard potentials has been ranked high (3)."
ZW-2010-6#-00000154,1.0,"Damani Dam, is an earth-fill type dam on the Mbwedi River, near Thohoyandou (former capital of Venda), Limpopo, South Africa."
ZW-2010-6#-00000219,2.0,"The river is dammed at Lake Mutirikwe, which is recognised as an important wetland, and at Bangala Dam near Renco."
ZW-2005-5#-00000836,1.0,The Ngezi River (formerly Ingezi River) is a river in southeastern Zimbabwe.
ZW-2005-5#-00000492,1.0,"right|thumb|330px|The Save River basin with the Chiredzi (center bottom) The Chiredzi River is a river in southeastern Zimbabwe. It is a tributary of the Runde River, and is dammed at Manjirenji Dam, which is recognised as an important wetland."
ZW-2015-7#-00000128,1.0,"It was built to provide irrigation water to the farming estates on the lowveld to the southwest, around the town of Chiredzi, where the main crop has been sugar cane. The lake and environs are protected as Manjirenji Dam Recreational Park."
ZW-2015-7#-00000371,1.0,"Makuleke Dam is an earth-fill type dam located on the Mphongolo River, a tributary of the Shingwedzi River. The dam was established in 1990 and serves mainly for irrigation purposes. The hazard potential of the dam has been ranked significant (2)."
ZW-2005-5#-00000599,1.0,"Sport The following sporting disciplines are available at Chisipite: athletics, basketball, cross country, field hockey, indoor hockey,  rowing, soccer, squash, swimming, tennis, volleyball and water polo."
ZW-2005-5#-00000388,1.0,"The Tongwane River is a river in Limpopo Province, South Africa."
ZW-2015-7#-00000386,2.0,Schools    Mmadikana Secondary School is a public secondary school and Motshitshi Primary School is a public primary school located at Masehlaneng   Soccer Grounds  There are two soccer grounds where soccer is played:   Smiling Soccer Ground  Bananas Soccer Ground   River  Magopane River is a small river that supplies water to Mogalakwena River.
ZW-2015-7#-00000386,1.0,"Course Jakkalskuil community source water direct from one of the main watercourses Mogalakwena River, in Limpopo, South Africa."
ZW-2005-5#-00001014,1.0,"May Jel Mining Company era  May Jel Mine operating at Commoner has since drilled boreholes outside its yard and villagers in Maisa, Mahogo and Nzama villages fetch clean water from these water-points."
ZW-1999-4#-00000223,3.0,By late February the dam had not been fully breached but the unplanned rising reservoir behind the dam caused evacuations upstream.
ZW-2015-7#-00000170,3.0,The dam to supply the reservoir with water will be a  tall arch-gravity type.
ZW-2015-7#-00000207,1.0,"The southern Swaziland tripoint is situated at Abercorn Drift in the Usutu River (Maputo River), where the Mozambique–Swaziland border along the Lebombo Mountains meets the river."
ZW-2005-5#-00000388,3.0,"The dam supplies domestic water to Polokwane and Tzaneen, and irrigation water to the Letaba valley."
ZW-2010-6#-00000116,1.0,"Sports The sports on offer at Hellenic in summer include cricket, tennis, water polo, swimming, athletics, cross country, triathlon and Rugby 7s."
ZW-2010-6#-00000339,1.0,"thumb|right|Ngondoma River Ngondoma River is a river in Zhombe Communal Land, Kwekwe District in the Midlands province of Zimbabwe.Getamap.net  Ngondoma River Retrieved 28 November 2015  Location Ngondoma River is in the Midlands Province, although some claim it to be in Mashonaland West Province. Retrieved 04 December 2015 on the Gokwe side of the river. Tributaries The main tributaries of Ngondoma River are:  Ufafi River    Mavulamachena River   Chebechebe River   Nevada River   Chevecheve River   Chikombera River   Ngondoma Dam In 1967, the Ngondoma Dam was constructed on the river 67 km northwest of Kwekwe and 54 km southwest of Kadoma (by air). The dam holds more than 7 million cubic metres of water.FAO. Fisheries Management of small water bodies in seven Countries in Africa, Asia FAO. It supplies the government managed Ngondoma Irrigation Scheme 900 000 cubic metres of water per year by a 5.8 km gravity driven concrete lined canal.Jamesm 10.1.1.196.2228.pdf Chapter 9.4.1.2. A Study to determine water demand management in Southern Africa: the Zimbabwean experience."
