DHSID_EA,relevance_score,most_relevant_sentences
MA-2003-4#-00000366,1.0,"The Center Task Force suffered some damage to its ships when trying to land in shallow water but the French ships were sunk or driven off; Oran surrendered after bombardment by British battleships. A former French pilot of the port onboard a US destroyer led her up the shallow river to take over the artillery battery, opening way for the troops to the air-base. Some delay and confusion, and damage to landing ships, was caused by the unexpected shallowness of water and sandbars; although periscope observations had been carried out, no reconnaissance parties had landed on the beaches to determine the local maritime conditions. Poor weather over Spain and the extreme range caused the formation to scatter and forced 30 of the 37 air transports to land in the dry salt lake to the west of the objective."
MA-2003-4#-00000265,5.0,"The Arrocampo reservoir as a wetland  thumb|right|200px|Arrocampo reservoir [[File:Ardea cinerea 2 (Marek Szczepanek).jpg|thumb|right|180px|The grey heron can be watched in Arrocampo]] Biomass (ecology): biomass of reservoir waters is very important on all trophic levels, including Phytoplankton and zooplankton."
MA-2003-4#-00000366,1.0,A team led by Dr Pablo Gonzalez of the University of Western Ontario in Canada reported in the journal Nature Geoscience in October 2012 that the pattern of earth movement was consistent with changes in stresses caused by the removal of water from underground reservoirs.
MA-2003-4#-00000246,1.0,There are also signs of an underground river that is believed to flow near the Grottes of Chiker.
MA-2003-4#-00000001,1.0,"The platform will be located both close to the coast and near the edge of the continental shelf, in shallow waters (30 meters depth). Marine test sites (harbor and offshore)  The harbor testing facility is located very close to the onshore facility (just a few meters with a direct view between both) and has clear and calm waters with maximum depths of 8 m. It is an optimal place for the early sea trials."
MA-2003-4#-00000263,2.0,"The dam was built by Construções A. Supico between 1973 and 1976.Gray, p. 188 It is in the Alvito Municipality within Beja District and impounds the Odivelas River creating the largest artificial lake in Europe."
MA-2003-4#-00000373,1.0,"In recent years the resort has made an effort to increase the number of services it offers, including expanding the Mirlo Blanco recreation zone, which now has an ice rink, toboggans, ski-bikes, mini-skis and a track for wheeled toboggans."
MA-2003-4#-00000265,1.0,Southwards there is a straight low ridge aligned in a N/S direction connecting with the Sierra de los Golondrinos prolongation further south straddling river Guadiana.
MA-2003-4#-00000275,1.0,It is also called Tamraght river valley after the name of the surrounding region.
MA-2003-4#-00000472,1.0,"Energy storage The PS10 solar power tower stores heat in tanks as superheated and pressurized water at 50 bar and 285 °C. The water evaporates and flashes back to steam, releasing energy and reducing the pressure."
MA-2003-4#-00000263,1.0,"The deck stands 20 metres above the river, allowing the navigation of ships of deep draft."
MA-2003-4#-00000159,1.0,"It is located at the mouth of the Bou Regreg river, opposite Salé, and adjacent to the old medina of Rabat. Awdāya is the plural of the word wadi, meaning ""river valley."" He also had an underground canal dug to divert a water source to the area, allowing for future settlement and urbanization. Meanwhile, the town of Salé across the river, grew in importance and was developed during the Marinid era. During this time (early 17th century) they built a broad platform on the kasbah's northeastern edge, overlooking the river, which was used for semaphore signalling. This was a round tower with openings for 4 canons aimed at the river. The tower rose only 3 meters above the water and was hidden from view behind the sqala, thus allowing its canons to catch pursuing enemy ships by surprise. Current status  Today, the Kasbah remains a popular free tourist attraction within Rabat, offering scenic views of the Plage of Rabat, the Bou Regreg river, neighboring Salé, and the Atlantic Ocean."
MA-2003-4#-00000063,2.0,"donkeys, horses) from drinking the same water as humans."
MA-2003-4#-00000256,1.0,"Ecology  Serra de Monchique is threatened by continued aggressive eucalyptus 'cash-crop' farming, recent publications have shown the water table to be lowering significantly and many endemic species to be on the brink of extinction, including the Bonellis Eagle, the Iberian emerald lizard and many more listed under European Union protection."
MA-2003-4#-00000265,1.0,Category:Buildings and structures in the Province of Badajoz Category:Uncompleted nuclear reactors Spain Category:Nuclear power stations using boiling water reactors
MA-2003-4#-00000256,1.0,"This beach is not only famous for its cliffs, but also for the quality of the water."
MA-2003-4#-00000265,1.0,There is a festival called ´San Cristobal and it is celebrated in the ´Charca.´  ´Charca´ is a big lake with fishing lines.
MA-2003-4#-00000263,1.0,"The dam of Santa Clara (Barragem de Santa Clara), one of the largest dams in Europe, is located here."
MA-2003-4#-00000256,1.0,"In the east is the roadway terminus of the parish, the Ribeira de Quarteira; the waterway, which springs in the north of the parish, results from the confluence of Ribeira de Algibre and Ribeira de Alte, and extends south to Paderne, around its castle."
MA-2003-4#-00000256,2.0,You can drink from this water (before it goes into the sea of course) and you can only see it when the sea is on low tide.
MA-2003-4#-00000256,1.0,"Economy [[File:Zoomarine.jpg|thumb|235px|left|The tourist attraction of Zoomarine, a water and marine theme park]]  The population of the civil parish has maintained an agricultural tradition, based on a rural society, producing fig, carob, almond, vineyards, wheat, barley and rye, in addition to a wide assortment of fresh vegetables."
MA-2003-4#-00000430,2.0,"Ecology The area surrounding the lake was once well-forested with Atlas cedar (Cedrus atlantica), but more recently, this forest has become degraded and the area around the lake has become dry, thorny scrubland dominated by Spanish juniper (Juniperus thurifera). The plankton and sediment in the lake is rich in diatoms, particularly of the genus Cyclotella, and these have been used to provide evidence of the paleohydrology and related hydroclimatic changes the lake has undergone over the aeons. A decreasing trend in precipitation has lowered the water level of the lake, and a marsh that used to be at the southwest end no longer exists. A reduced number of water birds visit the lake in winter and the great crested grebe no longer breeds here. The lake used to be the only place in the world where Salmo pallaryi, a native species of trout, lived but that fish became extinct after the common carp (Cyprinus carpio) was released into the lake in 1934."
MA-2003-4#-00000001,1.0,"All berths have turrets with water and electricity. This is the most popular beach in Playa Blanca for enjoying water based activities. At the foot of the crater wall is Lago Verde, a half-moon-shaped lagoon of a striking green colour, said to be caused by the volcanic minerals and micro-organisms that are believed to be unique in this lake. At its height the Salinas produced around 10,000 tons of sea salt per year, with the water originally being pumped into the lagoon by wind power, which has been replaced by electrically driven pumps."
MA-2003-4#-00000370,1.0,"thumb|left|Schematic representation of the Baetic System of mountain ranges [[File:Cuenca Valdeinfierno.JPG|thumb|Upper Valdeinfierno river basin in Sierra Nevada]] [[File:SierradeEnmedio03.JPG|thumb|Sierra de Enmedio near Puerto Lumbreras, at the eastern end of the system]] [[File:Sistemas Beticos.png|thumb|Map of the Baetic System within Andalusia]] The Penibaetic System ( or Cordillera Penibética) is the southernmost of the three systems of mountain ranges of the Baetic System in the southern Iberian Peninsula."
MA-2003-4#-00000366,1.0,"It has no rivers with a permanent water flow, although during rainy periods streams in several arroyos flow into coastal saltwater lagoon the Mar Menor."
MA-2003-4#-00000265,3.0,"The Plan includes provision for buying water rights from cereal producers to reassign them to illegal users, essentially small-scale horticulture and vine growers, which have been found to be more efficient in water use, generating more income per cubic meter of water used."
MA-2003-4#-00000002,1.0,The village has a small harbor and is a popular spot for water sports.
MA-2003-4#-00000370,2.0,The foundations of the arches rest on the limestone rock on both hillsides at the reservoir’s high water level.
MA-2003-4#-00000263,2.0,"except horse   In the casetas, throughout the day and night, people will usually be found drinking fino sherry, and in more recent years a new trend is to mix the fino with lemonade and ice cubes creating a cocktail commonly known as Rebujito."
MA-2003-4#-00000256,2.0,"Until the late 20th century, Ferragudo was a fishing community that depended on seasonal employment along the Arade River or in the Atlantic Ocean and the estuary of the Arade River and the river itself."
MA-2003-4#-00000265,1.0,"By 1790 around  of tunnels had been constructed inside the Rock.Chartrand, p. 24  The Second World War led to another great wave of tunnelling as work was undertaken to enable the Rock to house a garrison of 16,000 men with water, food, ammunition and fuel supplies sufficient to last a year under siege.Finlayson, p. 47 The Great Siege Tunnels were reused during the war; although it is uncertain exactly how they were used, it appears that they may have housed one of the generators used to power Gibraltar's searchlights, as a concrete mounting pad of the requisite dimensions was installed in one of the embrasures."
MA-2003-4#-00000256,1.0,In the nineteenth and twentieth centuries it also was a center of fish canning which led to urban growth especially near the river bank.
MA-2003-4#-00000256,1.0,"thumb|right|300px|Sítio das Fontes The Parque Municipal das Fontes (the Municipal Park of the Springs), or Fontes de Estômbar (The Estômbar Springs), is a park surrounding a major spring situated on the left bank of the estuary of the Arade River, north of the town of Estômbar, in Lagoa Municipality."
MA-2003-4#-00000472,1.0,"Located about 8 miles from Mérida, it is known for its unique Roman multiple arch buttress dam, the Esparragalejo Dam, its two natural lagoons, and its religious festivals."
MA-2003-4#-00000241,1.0,"The name La Maroma (""The Rope"") comes from a rope used to descend to an ancient ice house located close to the summit."
MA-2003-4#-00000223,1.0,"One apocryphal anecdote claims that the sultan, upon seeing the full cost of construction presented to him by nervous construction supervisors, ripped up the accounts book and threw it in the river, while proclaiming: ""What is beautiful is not expensive, no matter how large the sum."" This room is centered around a rectangular water basin and is surrounded by other small chambers. Prayer hall  [[File:Morocco (15126557324).jpg|thumb|The prayer hall and mihrab]] Along the south edge of the courtyard runs a small canal with water drawn from the Oued el-Lemtiyyin, one of the canals branching from the Oued Fes (Fez River) which supplies the city with water.Mohamed Mezzine ""Buinaniya Madrasa"" in Discover Islamic Art, Museum With No Frontiers, 2020. It is supplied with plenty of water which is used to wash away waste from the latrines included inside it. The water clock (Dar al-Magana)   [[File:Water Clock (4781609543).jpg|thumb|The restored facade of the Dar al-Magana today, with the remains of the hydraulic clock (except for the missing metal bowls).|alt=|left]] Also opposite the Madrasa Bou Inania is the Dar al-Magana, a house whose street facade features a famous but not fully understood hydraulic clock. It was likely powered in some way by running water, and it appears the weights or balls may have been suspended by a lead line attached to the projecting consoles above the windows."
MA-2003-4#-00000223,1.0,"Crucially, Idris II is responsible for moving the capital of his state from Walili (former Volubilis) to what is now Fez, founding in 809 a new city on the west bank of the river across from another settlement on the east bank founded by his father in 789. Two other Alaouite officials, in 1679 and in 1714, had new fountains installed and new sources of water redirected to the mosque (in one case, redirected from the Qarawiyyin). This entrance leads into the sahn or main courtyard, which includes a central fountain of white marble dating from the reign of Moulay Ismail (18th century) as well as wall fountains used for ablutions (washing and ritual purification)."
MA-2003-4#-00000263,1.0,"The river Ardila, which runs between Andalucía and Portugal, borders the comarca to the south."
MA-2003-4#-00000375,1.0,"Seaway has been used to link the city with Oran and Mers-el-Kebir, as there were links between these 2 cities when not at war, we know only that Turkish troops used the sea when coming to pick up the taxes   Water Sources  There was in the plain of what will become Ain el Turck at least eight sources of water:  The two sources of Ain Ouzel and Cape Falcon  Ain Ouansar near the farm Emeral  Source of St Maurice  Ain el Turck  Ain Atrouss (farm Clairefontaine-Navarre)  Bally source (barranco Bouisseville)  St Rock source   Ecology  Apart from some woods and groves located down the hills, vegetation was predominantly dwarf palms (Duma), Alfa tufts, some diss, lentisk (especially at the dunes), juniper, thorns, herbs, agave, Reeds and a multitude of flowers and plants which were used as forage."
MA-2003-4#-00000472,1.0,"Energy storage The PS10 solar power tower stores heat in tanks as superheated and pressurized water at 50 bar and 285 °C. The water evaporates and flashes back to steam, releasing energy and reducing the pressure."
MA-2003-4#-00000263,1.0,"The deck stands 20 metres above the river, allowing the navigation of ships of deep draft."
MA-2003-4#-00000159,1.0,"It is located at the mouth of the Bou Regreg river, opposite Salé, and adjacent to the old medina of Rabat. Awdāya is the plural of the word wadi, meaning ""river valley."" He also had an underground canal dug to divert a water source to the area, allowing for future settlement and urbanization. Meanwhile, the town of Salé across the river, grew in importance and was developed during the Marinid era. During this time (early 17th century) they built a broad platform on the kasbah's northeastern edge, overlooking the river, which was used for semaphore signalling. This was a round tower with openings for 4 canons aimed at the river. The tower rose only 3 meters above the water and was hidden from view behind the sqala, thus allowing its canons to catch pursuing enemy ships by surprise. Current status  Today, the Kasbah remains a popular free tourist attraction within Rabat, offering scenic views of the Plage of Rabat, the Bou Regreg river, neighboring Salé, and the Atlantic Ocean."
MA-2003-4#-00000063,2.0,"donkeys, horses) from drinking the same water as humans."
MA-2003-4#-00000256,1.0,"Ecology  Serra de Monchique is threatened by continued aggressive eucalyptus 'cash-crop' farming, recent publications have shown the water table to be lowering significantly and many endemic species to be on the brink of extinction, including the Bonellis Eagle, the Iberian emerald lizard and many more listed under European Union protection."
MA-2003-4#-00000265,1.0,Category:Buildings and structures in the Province of Badajoz Category:Uncompleted nuclear reactors Spain Category:Nuclear power stations using boiling water reactors
MA-2003-4#-00000256,1.0,"This beach is not only famous for its cliffs, but also for the quality of the water."
MA-2003-4#-00000265,1.0,There is a festival called ´San Cristobal and it is celebrated in the ´Charca.´  ´Charca´ is a big lake with fishing lines.
MA-2003-4#-00000472,1.0,"Named after the nearby river Guadiana and after Francisco Franco, also known as Caudillo, it was one of the villages founded by the Instituto Nacional de Colonización during the Francoist Spain."
MA-2003-4#-00000263,1.0,"The defensibility of the settlement was secured by its location in an elevated position, protected by the river and its inclined eastern and western margins."
MA-2003-4#-00000263,1.0,"In this meeting, the delegate alleged that the institute had many shortcomings, such as constant power cuts and water, malfunctioning heating, flooding, etc., not meeting the necessary conditions of a teaching center."
MA-2003-4#-00000265,1.0,"The Torre Nueva, also called Torrenueva and sometimes Torre Sabá, is a beacon located in the Andalusian town of La Línea de la Concepción and is one of the 44 towers of the same characteristics that dotted the Spanish coast from the river Guadiaro to the border with Portugal."
MA-2003-4#-00000002,1.0,"right|thumb|Subterranean salt lake  Jameos del Agua is a series of lava caves, located in the municipality of Haría in northern Lanzarote, Canary Islands, Spain. Jameos del Agua consists of a subterranean salt lake, restaurant, gardens, emerald-green pool, museum and auditorium. These squat lobsters are very sensitive to changes in the lagoon (derived from sea water), including effects regarding noise and light. They are also very sensitive to oxide, which can even kill them, and therefore, it is forbidden to throw coins in the water."
MA-2003-4#-00000001,1.0,"Places of interest  right|thumb|El Cotillo beach El Cotillo is surrounded by some of Europe's best beaches, including a range of bays with crystal clear waters and fine sand beaches, known as “la Concha” and “los Lagos”."
MA-2003-4#-00000472,1.0,It was a key point to guarantee access to the Ribera water.
MA-2003-4#-00000265,3.0,"In the casetas, throughout the day and night, people will usually be found drinking a traditional drink known as fino sherry, and in more recent years a new trend is to mix the fino with lemonade and ice cubes creating a cocktail commonly known as Rebujito."
MA-2003-4#-00000208,1.0,"Representatives of the Almoravid dynasty likely had the fortifications built, which included a wall of up to 12 metres high that closed off the only opening to the massif, two walls and defensive structures along the mountains, dams in the canyons to collect water, and a variety of structures on the plateaus. There is no source of water. That they are dams and not walls is proven by their position, as well as their construction: on the uphill side, they are covered by a layer of mortar whose density indicates it was a water barrier."
MA-2003-4#-00000237,1.0,An aqueduct bringing water from the 'Ain al-'Omair source also passed into the city near the gate's location.
MA-2003-4#-00000265,1.0,"To the south by Guadalquivir river in the corresponding section of Ronda de los Mártires, Paseo de la Ribera, Ronda de Isasa and Av."
MA-2003-4#-00000223,2.0,"The water was used for drinking, especially for the guests of the hotel."
MA-2003-4#-00000222,1.0,"Later it came to be known as the Madrasa as-Sahrij for the iconic sahrij (water basin) in the center of its courtyard (sahn). Together, these two madrasas provided both lodging and teaching for students studying at the nearby Andalus Mosque, much as the Seffarine and al-Attarine Madrasas served students at the al-Qarawiyyin Mosque across the river."
MA-2003-4#-00000241,2.0,It is here where people gathered to collect drinking water.
MA-2003-4#-00000237,1.0,"This garden was supplied with water from the Oued Fes via an aqueduct fed by an enormous noria (waterwheel) near Bab Dekkakin. The courtyard, still extant today, was adorned with green zellij tiles and centered around a large rectangular water basin. The river still passes underneath the square, reemerging via four semi-circular openings at the eastern base of its walls on the edge of the Jnan Sbil Gardens. Originally, though, this western wall was actually a large Marinid aqueduct built in 1286 to carry water to the Mosara Garden in the north; the faint outline of its arches can still be seen today within the structure of the wall. The creation of the mechouar required a minor diversion of the Oued Fes river at the time. The courtyard is arranged around a rectangular water basin at its middle, and at its southeastern end is a small pavilion chamber preceded by a portico supported by white marble columns topped with elegant capitals."
MA-2003-4#-00000472,1.0,"Name The plaza has undergone a series of name changes since the beginning of its construction in 1852:  1852: Plaza Nueva  1857: Infanta Isabel  1868: Plaza de la Libertad  1873: Plaza de la República  1875: Plaza de San Fernando  1931: Plaza Nueva  History Prior to the 11th century, the area that is now Plaza Nueva was part of the Guadalquivir river."
MA-2003-4#-00000222,1.0,"It was built on a cliffside along the shore of the Bou Khrareb River (Oued Bou Khrareb) which passes through the center of the city, though the river is now hidden underground between Place R'Cif and the south edge of the city. It is recorded that Moulay Slimane commissioned two marble fountains and a marble water basin which were placed in the mosque's courtyard (sahn) in 1797. Inside the mosque is a wide courtyard (sahn) surrounded by arcaded galleries, at the center of is a rectangular water basin (to aid in ablutions) under a small roofed pavilion. The mosque also had a public street fountain to offer water to local residents."
MA-2003-4#-00000223,1.0,"At the middle of the courtyard is a rectangular water basin, decorated with simple tilework, while around the courtyard are multiple small rooms which contain latrines."
MA-2003-4#-00000063,1.0,"The rest of the complex, on its eastern side, is occupied by the house of the muqaddam, a hospice for pilgrims, and a large midha (ablutions house) with a central water basin and 14 latrines."
MA-2003-4#-00000062,1.0,"It included a large water basin which was used for bathing during the summer. It is entered from the south via a triple-arched portico, in front of which a large square pool of water is positioned at the center of the courtyard. It once included a hexagonal pool of water and the usual green pyramidal roofs which were all aligned with the central axis of the Arsat an-Nil."
MA-2003-4#-00000222,1.0,"The largest section of the complex was centered around a large interior patio or courtyard with a central rectangular pool with a central fountain, flanked by two other fountains rising from smaller water basins."
MA-2003-4#-00000373,2.0,"300px|thumb|upright=1.5|Interior of the Bañuelo bath complex, showing the bayt al-wastani (the warm room), the largest and central chamber The Bañuelo or El Bañuelo (a diminutive of Spanish baño ""bath""), also known as the Baño del Nogal (""Bath of the Walnut"") or Hammam al-Yawza, is a preserved historic hammam (Islamic bathhouse) in Granada, Spain. As was common to other Muslim hammams, and in contrast with other versions of steam baths, bathers did not actually immerse themselves in water but instead washed themselves at the end of the process by having warm water poured onto them."
MA-2003-4#-00000204,1.0,"It underwent significant restoration and expansion under the Almohad caliph Muhammad al-Nasir (ruled 1199-1213), who, among other things, diverted a new source of water to it from a source 9 kilometres south of the city."
MA-2003-4#-00000265,1.0,"Very close to this place, many historians place the Greek colony of Mainake, whose exact location is still sought after, although the most striking archaeological remains have appeared next to the river Velez, in Torre del Mar."
MA-2003-4#-00000265,1.0,"The population of the neighbourhood is 2,582 inhabitants and it is situated between the river and the Guadarranque mountain."
MA-2003-4#-00000223,1.0,"The mosque also features another courtyard on its east side, centered on a water basin decorated with zellij (mosaic tilework) and surrounded by small latrine rooms."
MA-2003-4#-00000222,1.0,"Al-Fetouh was in rivalry with his brother, 'Ajisa, who controlled the other city, al-'Aliya, on the opposite shore of the river, and who in turn gave his name to the gate known as Bab Guissa."
MA-2003-4#-00000222,1.0,"He was also charged in 1889 with resolving issues with the water supply of the Oued Fes. The northern courtyard has a central fountain with a water basin shaped like an eight-pointed star. It is decorated with marble and faience tiles, star-shaped water basins, white marble fountains, zellij tilework, carved stucco, and sculpted wood ceilings."
MA-2003-4#-00000223,1.0,"That gate was named after a Zenata emir, 'Ajisa, who dominated the early city of al-'Aliya (on the Qarawiyyin quarter of Fes), in rivalry with his brother, el-Fetouh, who dominated the city of Madinat Fas (now the Andalous quarter) on the opposite shore of the river and who probably gave his name to another gate, Bab Ftouh."
MA-2003-4#-00000222,1.0,"(At the same time, on the opposite shore of the river, the khutba was transferred from the Mosque of the Sharifs, the later Zawiya of Idris II, to the Qarawiyyin Mosque.)"
MA-2003-4#-00000237,1.0,"This resembles the arrangement of the double northern gate of the Qarawiyyin Mosque (named Bab al-Ward and Bab al-Hafa), whereby one gate featured a water channel which allowed visitors to wash their feet as they entered, while the other gate was a regular entrance. Like in other mosques, it has a central water bassin (formerly linked to two other fountains on either side) and is surrounded by arched galleries."
