DHSID_EA,relevance_score,most_relevant_sentences
MA-2003-4#-00000265,1.0,"Initially, plans were made to provide a year's worth of accommodations for five men, including food, water, sanitation, and wireless communication. In addition, there was a  water tank. During the course of a 28-minute documentary that was filmed and produced in 1998, the team turned on the brass tap over the wash pit supplied by the 10,000 gallon water tank. The water, while initially black, soon ran clear. Cooper recalled a large water tank, as well as having to pedal a bicycle vigorously to generate power."
MA-2003-4#-00000265,1.0,The cave itself was eventually taken over for water tanks and pumps.
MA-2003-4#-00000265,1.0,The gun and its barbette stood in the centre of a rampart of compacted earth standing  high over a concrete apron which acted as a glacis and captured rainwater for use in the gun's pneumatic system.
MA-2003-4#-00000365,1.0,"Al-Hiba's mystical promise that ""French bullets would turn into water and French shells into watermelons"" had been tested and found wanting.Katz (2006:p.253); Burke (1976: p.200); Mangin (1986: p.116)  As al-Hiba's popularity was weakening, the qaids began feeling bolder. They carried with them two Krupp cannons and some eight hundred rounds, under the command of a Spanish renegade.Ferré (2000: p.177)  The French army was running out of water by this time, and another scorching hot day was ahead, so there was no question of avoiding or delaying engagement."
MA-2003-4#-00000061,1.0,"This type of structure for providing water near a mosque was also known as a mida'a (; ""ablutions facility"") and is found in later mosques in Marrakech."
MA-2003-4#-00000265,2.0,"By 1907, a supply of drinking water for Levant Battery had been provided by connecting it to reservoirs at the Mediterranean Steps."
MA-2003-4#-00000265,1.0,"View toward water tank end of shelter Lord Airey's Shelter is in Gibraltar, the British Overseas Territory at the southern end of the Iberian Peninsula."
MA-2003-4#-00000368,1.0,"Condenser cooling is via an air condenser, and a water consumption of 850,000 m3/year."
MA-2003-4#-00000472,2.0,"The Peña del Águila Dam on river Zapatón that supplies water to Alburquerque is located in the range.Sierra de San Pedro, Extremadura - Tourism A projection of the range stretching northwards from its western end is known as the Sierra de Carbajo, also named Sierra de Santiago, a small range located between Carbajo and Santiago de Alcántara."
MA-2003-4#-00000265,1.0,The Guadalhorce river has its sources in this range.
MA-2003-4#-00000472,2.0,"The location takes the name of the nearby stream that waters the area, the Lourianilla or Lorianilla, a tributary of the Alcazaba river."
MA-2003-4#-00000001,1.0,"They were formed by sand from the now subdued marine shelf, when it was laid dry during the last ice age and the wind blew the sand towards the coast of the island."
MA-2003-4#-00000265,2.0,"It was originally a marshy area known as the Morass at the far south-western end of the isthmus, occupying the area adjacent to the north-western flank of the Rock of Gibraltar.Hughes & Migos, p. 267 The Morass was dug out and expanded to create an artificial lake which was further obstructed by iron and wooden obstacles in the water."
MA-2003-4#-00000265,1.0,"They run from a natural fault called the Orillon to a cliff above the modern Laguna Estate, which stands on the site of the Inundation, an artificial lake created to obstruct landward access to Gibraltar.Hughes & Migos, pp."
MA-2003-4#-00000265,1.0,"The sand from the slopes that was then beneath the water catchments was extracted and transported along a conveyor belt system to the road below for industrial use. Discovery and rediscovery In 1985, when workers began removing sand from above the water catchments, they discovered the entrance to a small cave."
MA-2003-4#-00000265,1.0,"They are located at a height of about  on a natural ledge above the Queen's Lines, overlooking the landward entrance to Gibraltar, and run from a natural fault called the Orillon to a cliff at the southern end of the isthmus linking Gibraltar with Spain.Hughes & Migos, p. 335 The lines face out across the modern Laguna Estate, which stands on the site of the Inundation, an artificial lake created to obstruct landward access to Gibraltar."
MA-2003-4#-00000265,1.0,"To provide water to the city, the aqueduct began construction in 1777, completed in 1783. It is described as ""a beautiful aqueduct"" in 1911 when it was the water supply to the city."
MA-2003-4#-00000263,1.0,The channel in front of the dockyard is 2 fathoms deep at low water.
MA-2003-4#-00000263,1.0,Current activities In recent years the observatory has been adversely affected by light pollution.
MA-2003-4#-00000366,1.0,"The Tibi Dam (in Spanish embalse de Tibi) is a masonry dam on Monegre River about  south of Tibi in Valencian Community, Spain. It was constructed between 1579 and 1594 with the purpose of using its reservoir to help irrigate areas around Tibi. A spillway was constructed on the right side of the dam in 1697 after it partially failed due to flooding."
MA-2003-4#-00000306,2.0,"The watershed that supplies the dam has an area of . The new perimeter was sited where water from the dam could be used in irrigation. The dam was raised by  in 1968, which increased the volume of the reservoir to ."
MA-2003-4#-00000265,1.0,"The Gibraltar-San Roque Refinery () is an oil refinery owned by CEPSA located on the north shore of the Bay of Gibraltar, in Guadarranque Industrial Estate, between Puente Mayorga and the Guadarranque river, in the municipality of San Roque, Cadiz, Spain. The Spanish Government has been accused of having built the refinery deliberately in an effort to negatively affect the British Overseas Territory of Gibraltar, although pollution is indiscriminate and it also affects a large Spanish population in southern Spain."
MA-2003-4#-00000265,1.0,"The beach has two distinct areas, the first is southern part of the beach, surrounded by the suburb of El Rinconcillo and several bars and restaurants, and is characterized by shallow water, making it ideal for swimming. The second area, which is completely undeveloped, is nearest to the river mouth. It is completely surrounded by the river marshes and the Palmones dunes. This area is steeper and has deeper water than in the first section of the beach. The estuary here attracts numerous birds."
MA-2003-4#-00000265,1.0,"The beach has fine sand and calm waters sheltered by a small cove. The bottom of the water is largely rocky reefs, very dangerous for navigation."
MA-2003-4#-00000479,2.0,"The primary purpose of the dam is water supply to the city of Tetouan,  to the south."
MA-2003-4#-00000479,2.0,"It is at the confluence of the Smir and El-lile wadis and has a  saddle dam adjacent to the main dam. The primary purpose of the dam is water supply to the city of Tetouan,  to the south. The reservoir impounded by the dam has been designated as part of a Ramsar site since 2019."
MA-2003-4#-00000265,1.0,"Marinaleda belongs to the comarca of Estepa and is situated between this latter town and Écija, in the eastern part of the province of Seville, in the basin of the Genil river."
MA-2003-4#-00000265,1.0,"General Artigas Bridge   Uruguay and  Argentina  From Colón, Entre Ríos, Argentina to Paysandú, Paysandú Department, Uruguay, across the Uruguay river. Wiadukt Stanisława Markiewicza  Warsaw, Poland 1904 In Ulica Karowa which connects Krakowskie Przedmiescie to river level,  A-7000 (previously C-345)  Málaga-Colmenar road, Spain 2 spiral tunnels at  Route de Cilaos  Réunion   Sa Calobra  Majorca, Spain  N8 Bypass Brienzwiler  Switzerland  Isenfluh  Bern, SwitzerlandS232 Bridge South Approach Changzhou, ChinaWeidun Road Bridge Changzhou, ChinaCaiyuanba Bridge South Approach Chongqing, ChinaRongqiao Road Spiral Bridge Chongqing, ChinaTriple Loop Bridge Jialing Jiahua Bridge Approach Chongqing, ChinaZhoutouju Tunnel Approach Guangzhou, ChinaNansha Bridge Hai'ou Exit Guangzhou, ChinaInterchange made of ramps from alt=|30x30px spiraling up to the Nansha Bridge."
MA-2003-4#-00000366,1.0,"With a surface area of 135 km2, a coastal length of 70 km, and warm and clear water no more than 7 metres in depth, it is the largest lagoon in Spain. Its relatively high salinity which aids flotation, low waves, and remarkable sporting infrastructures makes it a popular place for a wide variety of water sports. Ecological importance At the northern end there are salt-flats which include a wetland of international importance. In July 2016 pollution was reportedly so severe as to render the area close to ecological collapse, following 18 years of neglected warnings. In October 2019 the pollution entering after floods in September led to thousands of dead fish lining the beaches, having suffocated due to a lack of oxygen. Intensive farming in surrounding areas leads to high levels of nitrates, ammonium and phosphates from fertilizers being washed into the lagoon, causing eutrophication, an excessive growth of algae and bacteria that deprives the water of oxygen. Panoramic view La Manga del Mar Menor   Notes  External links  Mar Menor Tourism Site Unofficial La Manga del Mar Menor Tourism guide Mar Menor Activities  Category:Landforms of the Region of Murcia Category:Lagoons of Europe Category:Coastal lagoons Category:Bodies of water of Spain Category:Wetlands of Spain Category:Ramsar sites in Spain Category:Special Protection Areas of Spain Category:World Heritage Sites in Spain Category:Biosphere reserves of Spain Category:Birdwatching sites in Spain Category:Eutrophication Category:Ecocide"
MA-2003-4#-00000263,1.0,It has a row of windows that bathe the transept area with light.
MA-2003-4#-00000159,4.0,"The latter is in charge of bulk water supply to the aforementioned utilities, water distribution in about 500 small towns, as well as sewerage and wastewater treatment in 60 of these towns."
MA-2003-4#-00000427,6.0,"Elevation extremes: Lowest point: Sebkha Tah −55 m Highest point: Toubkal mountain 4,165 m  Longest river: Draa River (1,100 km)  Land use and natural resources Natural resources: Phosphates, Iron ore, Manganese, Lead, Zinc, Fish, Salt  Land use: Arable land: 17.5% Permanent crops: 2.9% Permanent pastures: 47.1% Forests: 11.5% Other: 21.61% (2011)  Irrigated land: 14,850 km² (2004)  Total renewable water resources: 29 km3 (2011)  Natural hazards: periodic droughts  Environment  Ecoregions  Mediterranean forests, woodlands, and scrub  Mediterranean dry woodlands and steppe  Mediterranean woodlands and forests  Mediterranean Acacia-Argania dry woodlands and succulent thickets  Temperate coniferous forests  Mediterranean conifer and mixed forests  Montane grasslands and shrublands  Mediterranean High Atlas juniper steppe  Deserts and xeric shrublands  North Saharan steppe and woodlands  Freshwater ecoregions  Permanent Maghreb  Temporary Maghreb  Marine ecoregions  Alboran Sea  Saharan Upwelling  Current environmental issues Land degradation/desertification (soil erosion resulting from farming of marginal areas, overgrazing, destruction of vegetation); water supplies contaminated by raw sewage; siltation of reservoirs; oil pollution of coastal waters."
MA-2003-4#-00000375,1.0,"As they worked west their line drifted north until by the time they reached the river they were about 10′ north of 36°30′. This was because politicians in that region along that major river felt that it would be advantageous to be located in Missouri rather than in the Arkansas Territory, which became the State of Arkansas in 1836."
MA-2003-4#-00000263,2.0,"Limited excavations at Ammaia in the past two decades - albeit covering a mere  of the town's area - have revealed a successful, expanding provincial town that included running water, a forum, baths, a bridge over the river Sever (near today's 'Ponte Velha'), and monumental gates (one gate was removed to Castelo de Vide in the 18th century, yet sadly dynamited in 1890). The Visigothic capital was in Toledo, on the river Tagus: this favoured river transport of goods to-and-from Santarem and Lisbon. The Templars, strong allies of Alfonso I, had during the 12th century been given lands north of the Tagus, including their headquarters at Tomar, and Castelo Branco, and given broad responsibility to secure the river passage on the river."
MA-2003-4#-00000265,4.0,"The Mediterranean waters are so much saltier than the Atlantic waters that they sink below the constantly incoming water and form a highly saline (thermohaline, both warm and salty) layer of bottom water."
MA-2003-4#-00000237,1.0,"Sources also describe that the river, or some of its branches and canals, initially ran through the city itself. The water for the gardens was drawn from the Oued Fes via a huge noria (waterwheel) measuring 26 metres in diameter and 2 metres wide. The noria, sometimes referred to as the ""Grand Noria"", delivered the water into an aqueduct attached to Bab Dekkakin. From Bab Dekkakin, the aqueduct then carried the water to Bab Segma further north, and from there it was carried further into three large square basins spread across the gardens. This wall also incorporates remains of the aqueduct which once brought water to the Marinid royal gardens.|alt=]] Fes el-Jdid, along with Fes el-Bali, entered a period of relative neglect after the Marinid decline and under the rule of the Saadians, who made Marrakech their capital and seemed to view the population of Fes with suspicion."
MA-2003-4#-00000204,1.0,The ablutions house (Dar al-Wudu) consists of another courtyard surrounded by 22 changing rooms or latrines and centered around a large rectangular water basin. The madrasa's main courtyard has a marble water fountain in the middle and is surrounded by galleries on either side.
MA-2003-4#-00000001,2.0,"Aside from its rich fishing waters and phosphate reserves, Western Sahara has few natural resources and lacks sufficient rainfall and freshwater resources for most agricultural activities. For example, all drinking water for the city of Laayoune comes from desalinization facilities and costs 3 US dollars per cubic meter but is sold at the national price of 0.0275 US dollars; the difference is paid for by the government of Morocco."
MA-2003-4#-00000003,1.0,"Geographic coordinates:   Size Total: , about the size of Colorado land:  water:   Coastline:   Land boundaries:  – Algeria: , Mauritania: , Morocco:   Saguia el-Hamra is the northern third with the city El Aaiún. Current issues Sparse water and lack of arable land."
MA-2003-4#-00000256,1.0,"They have been improved dramatically over the last few decades, in terms of infrastructure and access, as well as in terms of water quality and the environment."
MA-2003-4#-00000256,2.0,"Although these references match the documented proofs, there is still some discrepancy in assuming that the town was built so easily, even as the coast was an active front piracy and lacked potable water."
MA-2003-4#-00000373,1.0,"To avoid capture, Brandi decided to sail U-617 to shallow waters and abandoned ship off Melilla, Spanish Morocco, in position ."
MA-2003-4#-00000265,3.0,"Having negligible natural resources and few natural freshwater resources, limited to natural wells in the north, until recently Gibraltar used large concrete or natural rock water catchments to collect rainwater."
MA-2003-4#-00000265,1.0,"Located at , it lies on the Genil river approximately 110 km from the provincial capital of Córdoba very close to the borders with both Málaga and Granada provinces at a height of 539 metres above sea level. The village itself is situated on top of a huge rocky outcropping overlooking the Embalse de Iznájar, the largest reservoir in the whole of Andalucía, which is frequented throughout the warm season as a beach."
MA-2003-4#-00000241,2.0,"In the center of this enormous estate there was an area where a lot of water accumulated, becoming a swamp sometimes due to the losses of the aquifer of la vega, there were two farms: Alquería de la Fuente and Alquería de los Vaqueros, which later would lead to Fuente Vaqueros."
MA-2003-4#-00000263,1.0,"Vila Nova de Milfontes is dominated by a large estuary and ecosystem, dominated by the Mira River that gives shelter to several species of birds and marine life, in addition to wild boar and fox in the surrounding woods. Beaches There are several beaches near the urban areas that regularly attract tourists and surfers:  Malhão   Praia da Franquia (also known as Praia do Rio)  Furnas  Aivados  Ribeira da Azenha  Foz  Economy Along the river, the small fishing port is still maintained, provide a small source of income. The tourist-oriented town, with only a small population, annually becomes inflated during the summer and holiday seasons, tourists attracted by the white sand beaches, clear water and landscape."
MA-2003-4#-00000263,1.0,"The control tower informed the crew of the thunderstorm activity, in addition to stating that there was water on the runway."
MA-2003-4#-00000472,1.0,"It is located between Badajoz and Mérida, near Guadiana river banks."
MA-2003-4#-00000263,1.0,The Odelouca receives water from two tributary streams: the Ribeira de Azilheire and Ribeira de Besteiros.
MA-2003-4#-00000265,1.0,"Pre-urban settlements around the mouth of the Guadalquivir river are known to have existed from the 8th century BC. Córdoba is located in the south of the Iberian Peninsula, in the depression formed by the Guadalquivir river, that cuts across the city in a east-north east to west-south west direction. The city of Córdoba lies in the middle course of the river. The landscape of the valley is further subdivided in the piedmont connecting with the Sierra, the fluvial terraces and the most immediate vicinity of the river course. Along the banks of the Guadalquivir are the Mills of the Guadalquivir, Moorish-era buildings that used the water flow to grind flour. In the Guadalquivir river, near the San Rafael Bridge is the Island of the sculptures, an artificial island with a dozen stone sculptures executed during the International Sculpture Symposium. Up the river, near the Miraflores bridge, is the ""Hombre Río"", a sculpture of a swimmer looking to the sky and whose orientation varies depending on the current. Parque de Miraflores, located on the south bank of the river Guadalquivir. The tour has numerous fountains, including six formed by a portico of falling water which form a waterfall to a pond with four levels. Integrated into the tour is a pond of water from the Roman era, and the building of the old train station of RENFE, now converted into offices of Canal Sur. Declared Natural monument by the Andalusian Autonomous Government, it is located in a stretch of the Guadalquivir river from the Roman Bridge and the San Rafael Bridge, with an area of 21.36 hectares.Los Sotos de la Albolafia, Inventario de Humedales de Andalucía. The Julio Romero de Torres Museum is located next to the Guadalquivir river and was opened in November 1931."
MA-2003-4#-00000265,1.0,"The crisis over Perejil Island was seen by the Spanish government as a way for Morocco to test the waters in regard to Spain's will to defend Ceuta and Melilla.Ceberia, Monica et al."
MA-2003-4#-00000241,1.0,"In 2012 the Spanish military garrison in the fort on Peñón de Alhucemas comprised an infantry section of 25–30 men from the 32nd Mixed Artillery Regiment, plus personnel from the marine services with an inflatable boat for reaching supply vessels.Ceberia, Monica et al (17 September 2012) The last remains of the empire El Pais in English, Retrieved 24 September 2012 On 29 August 2012, 19 sub-Saharan immigrants traversed the short expanse of water between Morocco and the Isla de Tierra."
MA-2003-4#-00000265,1.0,"Geography The municipality, part of the judicial district of Navalmoral de la Mata, is located in the Monfragüe National Park and crossed by the river Tagus in its northern corner."
MA-2003-4#-00000366,2.0,"The Escalera de los Moros (Moors ladder) is a medieval-Islamic public building works aimed at a Dam or wetland located on the promenade of the Oron river outside the village of Librilla, Murcia, Spain."
MA-2003-4#-00000366,1.0,"The Center Task Force suffered some damage to its ships when trying to land in shallow water but the French ships were sunk or driven off; Oran surrendered after bombardment by British battleships. A former French pilot of the port onboard a US destroyer led her up the shallow river to take over the artillery battery, opening way for the troops to the air-base. Some delay and confusion, and damage to landing ships, was caused by the unexpected shallowness of water and sandbars; although periscope observations had been carried out, no reconnaissance parties had landed on the beaches to determine the local maritime conditions. Poor weather over Spain and the extreme range caused the formation to scatter and forced 30 of the 37 air transports to land in the dry salt lake to the west of the objective."
MA-2003-4#-00000265,5.0,"The Arrocampo reservoir as a wetland  thumb|right|200px|Arrocampo reservoir [[File:Ardea cinerea 2 (Marek Szczepanek).jpg|thumb|right|180px|The grey heron can be watched in Arrocampo]] Biomass (ecology): biomass of reservoir waters is very important on all trophic levels, including Phytoplankton and zooplankton."
MA-2003-4#-00000366,1.0,A team led by Dr Pablo Gonzalez of the University of Western Ontario in Canada reported in the journal Nature Geoscience in October 2012 that the pattern of earth movement was consistent with changes in stresses caused by the removal of water from underground reservoirs.
MA-2003-4#-00000246,1.0,There are also signs of an underground river that is believed to flow near the Grottes of Chiker.
MA-2003-4#-00000001,1.0,"The platform will be located both close to the coast and near the edge of the continental shelf, in shallow waters (30 meters depth). Marine test sites (harbor and offshore)  The harbor testing facility is located very close to the onshore facility (just a few meters with a direct view between both) and has clear and calm waters with maximum depths of 8 m. It is an optimal place for the early sea trials."
MA-2003-4#-00000265,1.0,"Pre-urban settlements around the mouth of the Guadalquivir river are known to have existed from the 8th century BC. Córdoba is located in the south of the Iberian Peninsula, in the depression formed by the Guadalquivir river, that cuts across the city in a east-north east to west-south west direction. The city of Córdoba lies in the middle course of the river. The landscape of the valley is further subdivided in the piedmont connecting with the Sierra, the fluvial terraces and the most immediate vicinity of the river course. Along the banks of the Guadalquivir are the Mills of the Guadalquivir, Moorish-era buildings that used the water flow to grind flour. In the Guadalquivir river, near the San Rafael Bridge is the Island of the sculptures, an artificial island with a dozen stone sculptures executed during the International Sculpture Symposium. Up the river, near the Miraflores bridge, is the ""Hombre Río"", a sculpture of a swimmer looking to the sky and whose orientation varies depending on the current. Parque de Miraflores, located on the south bank of the river Guadalquivir. The tour has numerous fountains, including six formed by a portico of falling water which form a waterfall to a pond with four levels. Integrated into the tour is a pond of water from the Roman era, and the building of the old train station of RENFE, now converted into offices of Canal Sur. Declared Natural monument by the Andalusian Autonomous Government, it is located in a stretch of the Guadalquivir river from the Roman Bridge and the San Rafael Bridge, with an area of 21.36 hectares.Los Sotos de la Albolafia, Inventario de Humedales de Andalucía. The Julio Romero de Torres Museum is located next to the Guadalquivir river and was opened in November 1931."
MA-2003-4#-00000265,1.0,"The crisis over Perejil Island was seen by the Spanish government as a way for Morocco to test the waters in regard to Spain's will to defend Ceuta and Melilla.Ceberia, Monica et al."
MA-2003-4#-00000241,1.0,"In 2012 the Spanish military garrison in the fort on Peñón de Alhucemas comprised an infantry section of 25–30 men from the 32nd Mixed Artillery Regiment, plus personnel from the marine services with an inflatable boat for reaching supply vessels.Ceberia, Monica et al (17 September 2012) The last remains of the empire El Pais in English, Retrieved 24 September 2012 On 29 August 2012, 19 sub-Saharan immigrants traversed the short expanse of water between Morocco and the Isla de Tierra."
MA-2003-4#-00000265,1.0,"Geography The municipality, part of the judicial district of Navalmoral de la Mata, is located in the Monfragüe National Park and crossed by the river Tagus in its northern corner."
MA-2003-4#-00000366,2.0,"The Escalera de los Moros (Moors ladder) is a medieval-Islamic public building works aimed at a Dam or wetland located on the promenade of the Oron river outside the village of Librilla, Murcia, Spain."
