DHSID_EA,relevance_score,most_relevant_sentences
MA-2003-4#-00000237,2.0,The creation and maintenance of the gardens required the diversion of water from the Oued Fes river which flowed along the north edge of Fes el-Jdid.
MA-2003-4#-00000237,1.0,The dark rectangular opening in the upper part of the tower is where the water aqueduct for the Mosara Gardens once passed through the tower. The gardens were enclosed by their own walls and were supplied with water via a raised aqueduct that ran between Bab Dekkakin and Bab Segma.
MA-2003-4#-00000002,1.0,"The water pumped from the ocean would feed hydraulic turbines before reaching the Sebkha Tah 55 meters below. Part of the energy produced by wind turbines, when available, would be used to power pumps returning the water stored in the basin to the ocean."
MA-2003-4#-00000373,1.0,"The tour ends in a room dedicated entirely to the Water Synagogue in Úbeda (Jaén), with a recreation of its ritual bath (Mikveh)."
MA-2003-4#-00000237,1.0,"The district was first known as Hims, but also by the name Mellah ( or 'saline area') due to either a saline water source in the area or to the former presence of a salt warehouse."
MA-2003-4#-00000223,2.0,The heated water was then carried and poured into a large water basin (called a burma) in the middle of the hot room.
MA-2003-4#-00000223,1.0,"Its name comes from a local Muslim saint who is associated with the building, and the waters of the hammam were believed to have healing properties."
MA-2003-4#-00000265,2.0,"The Valdecañas reservoir (embalse de Valdecañas, in Spanish) is a reservoir on the Tagus River. Beneath its waters is a Bronze Age site with a dolmen that emerges when the waters drop."
MA-2003-4#-00000204,1.0,The latter is a rectangular building centered around a courtyard with a rectangular water basin at its center.
MA-2003-4#-00000373,2.0,"The river receives its name from the municipality Monachil, which the river passes through."
MA-2003-4#-00000472,1.0,"The drenching of the bodies, the accumulation of water in the surroundings, and the lack of maintenance of the enclosure caused it to become ruined in the 1850s."
MA-2003-4#-00000001,1.0,"John Murray, 2016  During an expedition to Kilimanjaro, the German adventurer Hans Heinrich Joseph Meyer visited Teide in 1894 to observe ice conditions on the volcano. Altitudinal change in needle water relations of the Canary pine (Pinus Canariensis) and possible evidence of a drought-induced alpine timberline on Mt."
MA-2003-4#-00000002,1.0,"Its name comes from a waterway that goes through the capital. The territory takes its name from an intermittent river, the Saguia el-Hamra, the route of which runs west from south of El Farcya to reach the Atlantic at Laayoune."
MA-2003-4#-00000001,2.0,"It also mentions that the depth of the water surrounding Cape Bojador is deceptively shallow, and the color of the sand underneath the water is a ""fearful sight""."
MA-2003-4#-00000265,1.0,"During the second half of the 18th century Málaga solved its chronic water supply problems with the completion of one of the largest infrastructure projects carried out in Spain at the time: the building of the Aqueduct of San Telmo. The Ir de Tapas (tapas tour), a Spanish expression meaning to make the rounds of bars drinking and eating snacks, is an important social activity for Spaniards. Some bars will serve a tapa for free when one orders a drink."
MA-2003-4#-00000256,2.0,The waters of the river form the reservoirs of Arade and Funcho.
MA-2003-4#-00000370,1.0,"For a substantial distance, the watershed stays consistently above . On the southern side of the range, several long, narrow river valleys lead off towards the south-west, separated by a number of subsidiary ridges."
MA-2003-4#-00000025,1.0,"The Todgha Gorges (; ) are a series of limestone river canyons, or wadi, in the eastern part of the High Atlas Mountains in Morocco, near the town of Tinerhir. During the dry season, the canyon floor is mostly dry; at most there will be a small stream of water."
MA-2003-4#-00000061,1.0,"The middle of the chamber is occupied by a square water basin, while a series of latrine rooms are accessible around the chamber's perimeter."
MA-2003-4#-00000373,1.0,"Olives are grown on the lower slopes, and in the valley below which extends from Órgiva to Cadiar, through which flows the Guadalfeo river. The plentiful water, milder climate, and fertile land favour the cultivation of grapes, citrus, and other fruit."
MA-2003-4#-00000370,1.0,"During the last ice age, species moved south to escape the colder climate in the north, and as the climate grew warmer again, these species survived by taking refuge in the mountains."
MA-2003-4#-00000265,1.0,"The urban area straddles the small Río de la Miel, which is the southernmost river of continental Europe. The lower course of the river Palmones forms part of the boundary of Algeciras with the municipality of Los Barrios."
MA-2003-4#-00000410,1.0,"The High Atlas forms the basins for a multiplicity of river systems. Liassic sedimentary systems evolved from extensive peritidal shallow water carbonate platforms (Hettangian-lower Sinemurian) that progressively backstepped toward the basin margins, to more localized platform development flanking the depocenters (Sinemurian).Martín Martín et al., 2016, p.5  Normal faulting and block tilting increased notably during Pliensbachian times, resulting in north to south compartmentalization of the basin. Pliensbachian carbonate platforms preferentially developed in the margins basin and in synsedimentary structural highs, promoting abrupt transitions in the marine sedimentary record from shallow water to basinal facies. This mixed system progressively graded to an extensive shallow water carbonate platform of the Anoual Formation, Bajocian to early Bathonian in age that is recognized throughout the central High Atlas."
MA-2003-4#-00000265,1.0,Fuente de Piedra Lagoon is a wetland located in the Málaga province of Spain. The flamingos need a certain amount of water to breed and will desert the eggs if the lagoon dries out too soon.
MA-2003-4#-00000080,1.0,"There are major freshwater and saline sites covering large areas of protected sand dunes, marsh- and swampland."
MA-2003-4#-00000263,2.0,"Two of these, the Nogales (sometimes called the Feria) and Chicapierna brooks, meet just south of the village to form the Albuera river, but none of these were formidable obstacles and the river itself could be crossed at two bridges and a ford."
MA-2003-4#-00000263,1.0,"thumb|right|220px|Fishing boat in Tavira  The 1755 earthquake  In the 18th century, the port on its river was of considerable importance, shipping produce such as salt, dried fish and wine. Its original economic reliance on the fishing industry has now passed due to changed migration patterns of Tuna and further silting up of the river Gilão."
MA-2003-4#-00000375,1.0,Removing the fleet to United States waters had formed part of the orders given by Darlan to Gensoul in the event that a foreign power should attempt to seize his ships.
MA-2003-4#-00000256,1.0,"The river and its ocean access to the ancient city of Shilb (Silves), then capital of the Arabian Algarve. Until bridge and road was constructed, 400 years later, it was the only form of crossing the river. The badlands of Ponta João D’Arens host several species of birds and the Ria de Alvor dunes allow the existence of a marshland and estuary, on which a great diversity of species depend, both fauna and flora, as well as the communities of fishermen and local shellfishers. Its maritime economy allowed the development of industries oriented towards salination of fish, the open-water fishing industry, conservation and canning, the construction of ships and transport. Sports  Portimão is known for its sporting events, mostly water sports, including surfing and kitesurfing; motorsport; beach soccer; and the professional football team Portimonense S.C.."
MA-2003-4#-00000001,1.0,"This denomination was maintained until 1555, as indicated in the land and water distribution documents of Gran Canaria, granted after the European conquest of the island."
MA-2003-4#-00000001,1.0,"The Spanish conquerors were quick to colonize this fertile and well-watered region, and introduced the cultivation of sugarcane and grapevines; the latter came to predominate. Those were times of constant alarm and fear for the inhabitants of the Canary Islands, because of the frequent appearance of pirates and corsairs in Canarian waters, and every town lived on a war footing to forestall their surprises and excesses. Today the Playa de San Marcos, protected by shell-shaped cliffs and covered with the black sand characteristic of northern Tenerife, is a place of recreation where the town's residents and their visitors can enjoy the magnificent surrounding landscape as well as a swim in its tranquil waters. Papas arrugadas (""wrinkled potatoes"") , potatoes cooked in salted water and served in their skins: Of all their varieties, the ""black"" is considered to be best."
MA-2003-4#-00000265,2.0,"They may also allow development of other applications, such as to agriculture or horticulture, to water extraction or distillation, or to improvement of urban air pollution. This solar cyclonic water distiller with a solar collector pond could adapt the solar collector-chimney system for large-scale desalination of collected brine, brackish- or waste-water pooled in the collector base. Energy production, water desalination or simple atmospheric water extraction could be used to support carbon-fixing or food-producing local agriculture, and for intensive aquaculture and horticulture under the solar collector as a greenhouse."
MA-2003-4#-00000001,2.0,"27.3% of fish are from the tropical eastern Atlantic Ocean, 10.2% from temperate waters and 6.8% from subtropical waters."
MA-2003-4#-00000001,1.0,"Pond with water birds Dolphinarium with 6 dolphins,Palmitos Park Ceta-Base and live dolphin shows interacting with the audience."
MA-2003-4#-00000001,1.0,"Between these extremes one finds a fascinating gamut of microclimates; for centuries, the inhabitants of La Gomera have farmed the lower levels by channelling runoff water to irrigate their vineyards, orchards and banana groves. He stopped here to replenish his crew's food and water supplies, intending to stay only four days. Memories of the people of the shore and the stories they told; sand and dunes and treasure, seabirds and creatures of the sea; and personal impressions of certain islands in African waters."
MA-2003-4#-00000055,1.0,"To the south, the mountain drops steeply down for  to a small lake called Lac d'Ifni. Past Aroumd a floodplain is crossed and the route follows the left slope of the valley southwards. In winter the mountains are covered in snow and ice, and can be prone to avalanches. The ascent during the end of the winter and spring (February/March) is more difficult; crampons are necessary to ascend through the snow and - in some cases - ice."
MA-2003-4#-00000256,1.0,"The Moors arrived in the 8th century from North Africa, renaming the settlement Zawaia (meaning lago, or lake). Beaches thumb|right|235px|A view of Lagos and the Meia Praia beach in the background  Meia Praia (Half Beach) —the most popular tourist beach, consisting of soft, white sand, Meia Praia is one of the largest open bays in Europe, resulting in calm seas, permitting conditions for many nautical sports, while cliffs provide sheltered coves from strong windy conditions;  Praia Solaria (Sunny Beach);  Praia da Batata (Potato Beach) — a small beach tucked between two small cliffs (where the river meets the Atlantic Ocean), it is known for the small music festivals that take place there during summer;  Praia dos Estudantes (Students' Beach);  Praia da Dona Ana (Dona Ana Beach) -its areal is slightly thicker than the beaches in the surrounding area and it is surrounded by striking rock formations."
MA-2003-4#-00000002,1.0,In 1964 Arrecife became the site of Lanzarote's first sea-water desalination plant.
MA-2003-4#-00000265,1.0,"They sing, dance, eat and drink to the beat of Chíviri."
MA-2003-4#-00000263,4.0,Higher sea water temperatures are reached if the weather patterns produce a significant outflow of warmer surface water out of the Mediterranean which bathe the coastal Algarve with much warmer water.
MA-2003-4#-00000265,1.0,"When the African tectonic plate collided tightly with the Eurasian plate, the Mediterranean became a lake that, over the course of time, dried up during the Messinian salinity crisis. Calcite, the mineral that makes up limestone, dissolves slowly in rainwater. The upper part of the tower housed the former occupants' living apartments and Moorish bath."
MA-2003-4#-00000263,1.0,History  Elvas lies on a hill  northwest of the Guadiana river. The Amoreira Aqueduct  long supplies the city with pure water; it was begun early in the 15th century and completed in 1622.
MA-2003-4#-00000012,1.0,"Two years later, beside Talborjt along the faultline of the river Tildi construction of the popular district of Yahchech began. State of the Country in 2010: The urban fabric of the city of Agadir, by district  Communal plan for Development (Fr)  New Talborjt This area is named after the old district of Talborjt (meaning ""small fort"" in local Berber, in remembrance of the water tower which was first built on the plateau in the former Talborjt). The record high temperature of Agadir  is  registered on July 17, 2012.https://www.wunderground.com/blog/JeffMasters/morocco-hits-121f-496c-a-national-alltime-heat-record.html  In 1950, a poster from the Navigation Company Pacquet proclaimed: ""Winter or summer, I bathe in Agadir"". ""Winter or summer, I bathe in Agadir""    Culture The Timitar festival, a festival of  Amazigh and music from around the world, has been held in Agadir every summer since its inception in July 2004."
MA-2003-4#-00000001,1.0,"thumb|right|321px|Playa de Arguineguín was upgraded with new sand in autumn 2004  thumb|right|321px|Parque Arguineguín was opened in April 2006  Arguineguín (Guanche for ""quiet water"") is one of the most populated towns along the south coast of Gran Canaria, Spain."
MA-2003-4#-00000263,1.0,"The strategic location of Mértola, on a hill by the northernmost navigable part of the Guadiana river, was crucial in its early development."
MA-2003-4#-00000263,1.0,"Castro Verde lies along a transport route linking the mines of Aljustrel (20 km to the north) with the port city of Mértola (40 km to the east) situated on tributaries of the Guadiana river. As the legend of the Battle describes, the battle lasted two days (between 24–25 July 1139) and was so excessively bloody that the waters of Ribeira de Cobres flowed the color of red. It was moved to the civic square in 1960, after being ruined by a lightning strike, wherein only the original staircase, base and the medallion survived the incident;  Source of Miracle of Saint Michael (), is a temple enclosing a water well, located  outside of Castro Verde is situated on the property Herdade do Mourão and dates from 1714, having been built during the same period as the Chapel of São Miguel. The site of the temple and water well has been in a phase recovery since 2009."
MA-2003-4#-00000263,1.0,"The Alqueva Dam, along the Guadiana River, is located in this territory, with major confluences including the Ribeira de Alcalate and Ribeira do Alandroal just the principal water resources."
MA-2003-4#-00000263,1.0,"Due to its proximity to the Alqueva reservoir, the megalithic heritage, its handicrafts and its wines, Reguengos de Monsaraz is today a city of great tourist interest, which has led to a significant development in recent years."
MA-2003-4#-00000265,1.0,"Until the 11th century, the mosque courtyard (also known as a sahn) was unpaved earth with citrus and palm trees irrigated at first by rainwater cisterns and later by aqueduct. As in most mosque courtyards, it had fountains or water basins to help Muslims perform ritual ablutions before prayer."
MA-2003-4#-00000263,3.0,"29 September 1864 – The Treaty of Lisbon (1864) between Portugal and Spain is signed, demarcating the border from the estuary of the Minho river, on the far North, to the confluence of the Caya River with the Guadiana river, just north of Olivenza."
MA-2003-4#-00000375,1.0,"Among these are the Chelif and Touil wadis, riverbeds that contains water only during wet periods, respectively draining  the Amour and Ouled-Naïl ranges of the Saharan Atlas."
MA-2003-4#-00000263,2.0,"Memorias do instituto de Malariologia de Aguas de Moura: da luta anti-paludica ao museu: Camara Municipalde Palmela CEVDI; Instituto Nacional de Sau´de Dr. Ricardo Jorge   Geography    Physical geography  thumb|235px|Alcácer do Sal, showing portions of the river and estuary thumb|235px|River front along the city center A few kilometres from the city of Alcácer, along the course of the Sado, is the Reserva Natural do Estuário do Sado (Sado Estuary Nature Reserve) which covers an area of , comprising marshes, canals, streams and mangroves. Santa Susana includes many white-painted houses, and is the location of the municipalities principal dam, Pego do Altar, and tourist-friendly water activities and forests."
MA-2003-4#-00000263,1.0,"Yet, although the few inhabitants lived in the zone, Moorish ships regularly patrolled the waters, until the 13th century, when Afonso III conquered the region. The area regained much of its importance at the beginning of the 8th century, when fishermen returned to the waters around Sines. The coastal plan (which occupies the major part of the municipality) slopes gradually from the interior and occupies an area of 3-12 kilometres cut by several water courses."
MA-2003-4#-00000001,1.0,"The island includes a small lake, but the low rainfall creates an arid landscape. In addition to birds a great diversity of fish can be spotted in its waters."
MA-2003-4#-00000404,1.0,"thumb|right|180px Tensift (Berber: Tansift) is a river in central Morocco. It originates in the eastern High Atlas, receiving water from many tributaries in the region. Its water discharge changes according to rainfall; it is one of the ten major rivers of Morocco, but frequently can be waded through even close to its outlet."
MA-2003-4#-00000265,1.0,Raymond of Fitero - Saints & Angels - Catholic Online  thumb|left|Guadiana river over the castle.
MA-2003-4#-00000265,1.0,"Facilities include, ice skating, cinemas, bowling, arcade games, fitness gym, al fresco dining, youth lounge, internet area and a nightclub. The ice skating rink and cinema are housed on the upper level."
MA-2003-4#-00000265,1.0,"Originally called Muralla de San Benito (English: St. Benedict's Wall), it was built in 1540 and strengthened in 1552 by Holy Roman Emperor Charles V. The wall remains largely intact and extends from South Bastion, which was once at the water's edge in the harbour, to the top ridge of the Rock of Gibraltar. Description The lower section of the wall runs up from the South Bastion which was once at the water's edge in the harbour, to Prince Edward's Gate at the base of a steep cliff."
MA-2003-4#-00000428,4.0,"The lake is fed by the seasonal river Oued Saoura but most of the year the volume of water evaporated from the surface exceeds the volume of water flowing in, and a salt crust is formed."
MA-2003-4#-00000265,2.0,"An aqueduct ran from a well to the south along the line wall to the Waterport, where it replenished a reservoir from which water for the galleys was drawn."
MA-2003-4#-00000265,1.0,"The foot of the glacis in front of the north bastion, and part of the curtain wall leading towards the Rock, was washed by the water of the bay."
MA-2003-4#-00000265,1.0,"The facilities included a bicycle to generate electricity and a 10,000 gallon water tank."
MA-2003-4#-00000431,3.0,"The dam is used for potable water, irrigation and the protection of downstream areas and dams against floods and siltation."
MA-2003-4#-00000256,2.0,Also at low tide the banks of the river Ribeira de Aljezur provides an excellent beach area but care should be taken at high tide as currents close to the mouth of the river can be very strong.
MA-2003-4#-00000265,1.0,"This easily covered both the Strait of Gibraltar and the Bay of Gibraltar, the distances across those bodies of water measuring 25,500 yds and 9,000 yds, respectively."
MA-2003-4#-00000265,1.0,"In 1868 ablutions and bath rooms had recently been fitted up in the barracks, Jenning's fitments (flush toilets) had been installed in the soldier's latrines and the drainage system overhauled. However, as of 1874 none of the barracks in Gibraltar had baths, and Grand Casemates was the only one with footpans that could be used to hold water for the men to wash themselves. In 1888 it was found that, due to faulty drains, sewage had been soaking into the ground near the soldiers rooms."
MA-2003-4#-00000265,3.0,It was once used to capture rainwater which was contained in underground tanks within the Rock to satisfy the population's potable water needs.
MA-2003-4#-00000265,1.0,"Initially, plans were made to provide a year's worth of accommodations for five men, including food, water, sanitation, and wireless communication. In addition, there was a  water tank. During the course of a 28-minute documentary that was filmed and produced in 1998, the team turned on the brass tap over the wash pit supplied by the 10,000 gallon water tank. The water, while initially black, soon ran clear. Cooper recalled a large water tank, as well as having to pedal a bicycle vigorously to generate power."
MA-2003-4#-00000265,1.0,The cave itself was eventually taken over for water tanks and pumps.
MA-2003-4#-00000265,1.0,The gun and its barbette stood in the centre of a rampart of compacted earth standing  high over a concrete apron which acted as a glacis and captured rainwater for use in the gun's pneumatic system.
MA-2003-4#-00000365,1.0,"Al-Hiba's mystical promise that ""French bullets would turn into water and French shells into watermelons"" had been tested and found wanting.Katz (2006:p.253); Burke (1976: p.200); Mangin (1986: p.116)  As al-Hiba's popularity was weakening, the qaids began feeling bolder. They carried with them two Krupp cannons and some eight hundred rounds, under the command of a Spanish renegade.Ferré (2000: p.177)  The French army was running out of water by this time, and another scorching hot day was ahead, so there was no question of avoiding or delaying engagement."
MA-2003-4#-00000061,1.0,"This type of structure for providing water near a mosque was also known as a mida'a (; ""ablutions facility"") and is found in later mosques in Marrakech."
MA-2003-4#-00000265,2.0,"By 1907, a supply of drinking water for Levant Battery had been provided by connecting it to reservoirs at the Mediterranean Steps."
MA-2003-4#-00000265,1.0,"View toward water tank end of shelter Lord Airey's Shelter is in Gibraltar, the British Overseas Territory at the southern end of the Iberian Peninsula."
MA-2003-4#-00000368,1.0,"Condenser cooling is via an air condenser, and a water consumption of 850,000 m3/year."
MA-2003-4#-00000472,2.0,"The Peña del Águila Dam on river Zapatón that supplies water to Alburquerque is located in the range.Sierra de San Pedro, Extremadura - Tourism A projection of the range stretching northwards from its western end is known as the Sierra de Carbajo, also named Sierra de Santiago, a small range located between Carbajo and Santiago de Alcántara."
MA-2003-4#-00000265,1.0,The Guadalhorce river has its sources in this range.
MA-2003-4#-00000472,2.0,"The location takes the name of the nearby stream that waters the area, the Lourianilla or Lorianilla, a tributary of the Alcazaba river."
MA-2003-4#-00000001,1.0,"They were formed by sand from the now subdued marine shelf, when it was laid dry during the last ice age and the wind blew the sand towards the coast of the island."
MA-2003-4#-00000265,2.0,"It was originally a marshy area known as the Morass at the far south-western end of the isthmus, occupying the area adjacent to the north-western flank of the Rock of Gibraltar.Hughes & Migos, p. 267 The Morass was dug out and expanded to create an artificial lake which was further obstructed by iron and wooden obstacles in the water."
MA-2003-4#-00000265,1.0,"They run from a natural fault called the Orillon to a cliff above the modern Laguna Estate, which stands on the site of the Inundation, an artificial lake created to obstruct landward access to Gibraltar.Hughes & Migos, pp."
MA-2003-4#-00000265,1.0,"The sand from the slopes that was then beneath the water catchments was extracted and transported along a conveyor belt system to the road below for industrial use. Discovery and rediscovery In 1985, when workers began removing sand from above the water catchments, they discovered the entrance to a small cave."
MA-2003-4#-00000265,1.0,"They are located at a height of about  on a natural ledge above the Queen's Lines, overlooking the landward entrance to Gibraltar, and run from a natural fault called the Orillon to a cliff at the southern end of the isthmus linking Gibraltar with Spain.Hughes & Migos, p. 335 The lines face out across the modern Laguna Estate, which stands on the site of the Inundation, an artificial lake created to obstruct landward access to Gibraltar."
MA-2003-4#-00000265,1.0,"To provide water to the city, the aqueduct began construction in 1777, completed in 1783. It is described as ""a beautiful aqueduct"" in 1911 when it was the water supply to the city."
MA-2003-4#-00000263,1.0,The channel in front of the dockyard is 2 fathoms deep at low water.
MA-2003-4#-00000263,1.0,Current activities In recent years the observatory has been adversely affected by light pollution.
