DHSID_EA,clean_sentences,most_relevant_sentences
LB-2007-5#-00000088,"['[[Image:Grand Cape Mount County Liberia locator', 'png|thumb|right|Grand Cape Mount County (highlighted) in western Liberia]]  Lake Piso, also known as Lake PisuWalters, Guanya Pau, p', ' 79', "" and Fisherman's Lake,Cole, The Liberian Yearbook, p"", ' 192', 'Nelson, Liberia, a Country Study, p', ' 47', ' is an oblongStreissguth, Liberia in Pictures, p', ' 10', ' tidal lagoonFox, Butterflies of Liberia, p', ' 26', 'Hughes et al', ', Directory of African Wetlands, p', ' 387', ' in Grand Cape Mount County in western Liberia, near the town of Robertsport', ' At an area of , it is the largest lake in Liberia', 'Streissguth, Liberia in Pictures, p', ' 72', ' Its name originates from a local term meaning ""pigeon\'s hole"" – a reference to the flocks of pigeons that once came to Lake Piso for water', '  Hydrology and geology The brackish water lake borders the Cape Mount peninsula, and is connected to the Atlantic Ocean by a narrow inlet known locally as the ""bar mouth""', 'Walters, Guanya Pau, p', ' 39', "" Various rivers empty into Lake Piso, including Mole Creek and Mafa River, which discharges at the 'bar mouth'"", ' There are a number of islands in the lake, including Massatin Island, which offered a haven for monkeys and birds species, it also served as temporary refuge for some Liberians during the Liberian Civil War', '  History During World War II, Lake Piso functioned as a military base for Allied seaplanes', '  Lake Piso overflowed its banks at least twice in 1998, causing heavy flooding in Garwular District', ' Flooding in August 1998 occurred due to a blockage of the narrow inlet connecting the lake to the Atlantic Ocean, damaging some homes', ' Additional flooding in September and October, brought about by heavy rains, affected over twenty settlements, causing at least ten deaths, leaving thousands homeless, and forcing others to leave their homes', ' The floods led the government of Liberia to declare the area a ""disaster zone""', '  On December 13–14, 2002, the Papa Friends 2000 capsized in Lake Piso, at the confluence of the lake and Mafa River', ' The overcrowded wooden ferry was transporting approximately 200 passengers, most returning from the funeral of a local footballer', ' Only 15 people were rescued; the rest drowned and were recovered or presumed dead', '  A nature reserve was designated near Lake Piso in 1999Outram, Africa South of the Sahara 2004, p', ' 613', "" and, as of 2004, the Lake Piso wetlands, covering an area of , were Liberia's only designated wetland of international importance"", 'UNEP, Desk Study on the Environment in Liberia, p', ' 52', '  Human activity The area near the lagoon is the homeland of the Vai people', '  Human activity in Lake Piso includes fishing and water sports such as swimming, canoeing and water skiing', ' Prior to the outbreak of the First Liberian Civil War, the lagoon was a popular travel destination for tourists', '  High-quality diamonds have been mined from the rivers that discharge into Lake Piso where ""igneous intrusions provide potentially rich structural traps""', '  Notes  References                  Category:Grand Cape Mount County Category:Lagoons of Africa Category:Bodies of water of Liberia Category:Tourist attractions in Liberia Category:Ramsar sites in Liberia']","High-quality diamonds have been mined from the rivers that discharge into Lake Piso where ""igneous intrusions provide potentially rich structural traps"""
LB-2007-5#-00000088,"['[[Image:Grand Cape Mount County Liberia locator', 'png|thumb|right|Grand Cape Mount County (highlighted) in western Liberia]]  Lake Piso, also known as Lake PisuWalters, Guanya Pau, p', ' 79', "" and Fisherman's Lake,Cole, The Liberian Yearbook, p"", ' 192', 'Nelson, Liberia, a Country Study, p', ' 47', ' is an oblongStreissguth, Liberia in Pictures, p', ' 10', ' tidal lagoonFox, Butterflies of Liberia, p', ' 26', 'Hughes et al', ', Directory of African Wetlands, p', ' 387', ' in Grand Cape Mount County in western Liberia, near the town of Robertsport', ' At an area of , it is the largest lake in Liberia', 'Streissguth, Liberia in Pictures, p', ' 72', ' Its name originates from a local term meaning ""pigeon\'s hole"" – a reference to the flocks of pigeons that once came to Lake Piso for water', '  Hydrology and geology The brackish water lake borders the Cape Mount peninsula, and is connected to the Atlantic Ocean by a narrow inlet known locally as the ""bar mouth""', 'Walters, Guanya Pau, p', ' 39', "" Various rivers empty into Lake Piso, including Mole Creek and Mafa River, which discharges at the 'bar mouth'"", ' There are a number of islands in the lake, including Massatin Island, which offered a haven for monkeys and birds species, it also served as temporary refuge for some Liberians during the Liberian Civil War', '  History During World War II, Lake Piso functioned as a military base for Allied seaplanes', '  Lake Piso overflowed its banks at least twice in 1998, causing heavy flooding in Garwular District', ' Flooding in August 1998 occurred due to a blockage of the narrow inlet connecting the lake to the Atlantic Ocean, damaging some homes', ' Additional flooding in September and October, brought about by heavy rains, affected over twenty settlements, causing at least ten deaths, leaving thousands homeless, and forcing others to leave their homes', ' The floods led the government of Liberia to declare the area a ""disaster zone""', '  On December 13–14, 2002, the Papa Friends 2000 capsized in Lake Piso, at the confluence of the lake and Mafa River', ' The overcrowded wooden ferry was transporting approximately 200 passengers, most returning from the funeral of a local footballer', ' Only 15 people were rescued; the rest drowned and were recovered or presumed dead', '  A nature reserve was designated near Lake Piso in 1999Outram, Africa South of the Sahara 2004, p', ' 613', "" and, as of 2004, the Lake Piso wetlands, covering an area of , were Liberia's only designated wetland of international importance"", 'UNEP, Desk Study on the Environment in Liberia, p', ' 52', '  Human activity The area near the lagoon is the homeland of the Vai people', '  Human activity in Lake Piso includes fishing and water sports such as swimming, canoeing and water skiing', ' Prior to the outbreak of the First Liberian Civil War, the lagoon was a popular travel destination for tourists', '  High-quality diamonds have been mined from the rivers that discharge into Lake Piso where ""igneous intrusions provide potentially rich structural traps""', '  Notes  References                  Category:Grand Cape Mount County Category:Lagoons of Africa Category:Bodies of water of Liberia Category:Tourist attractions in Liberia Category:Ramsar sites in Liberia']","High-quality diamonds have been mined from the rivers that discharge into Lake Piso where ""igneous intrusions provide potentially rich structural traps"""
LB-2019-7Z-00000254,"['The African Methodist Episcopal University (AMEU) is a private institution of higher learning located in Monrovia in the West African nation of Liberia', ' Located on Camp Johnson Road, the school is the second largest college in Liberia with over 5,000 students', ' The school was established in 1995 by the African Methodist Episcopal Church, and chartered by the Liberian Legislature in 1996', '  History AMEU was organized in 1995 by Bishop Cornal Garnett Henning, Sr', ' and leaders of the African Methodist Episcopal Church, during his administration as presiding prelate', ' Bryant Theological Seminary was the first component school of the university', ' Bryant Theological Seminary had been started in 1992 by David R', ' Daniels, Jr', ', now a bishop in the church', ' The university was then chartered in February 1996', '  In 2003, Louise C', ' York served as president of the university, and accounting was the most popular major at the Christian school', "" During the Second Liberian Civil War in 2003, the school's campus was attacked and ransacked"", ' As the commencement ceremony proceeded that year, the 185 graduates could hear mortar shells exploding in the background as rebel forces attempted to take the capital', "" After the civil strife ended, the country's National Commission on Higher Education approved the university to operate on a temporary basis in November 2005, and in February 2006 the school received full approval"", '  A scam by students at the school in February 2006 cost the university US$100,000 in lost funds, which resulted in the arrest of four people the next month', ' Also in February 2006, USAID paid for some reconstruction on the campus', "" Levi Zangar resigned as president of the school in November 2006 citing problems with the school's board of directors"", "" In April 2007, students protested against the university's administration for requiring students to pay 80% of tuition for the new semester prior to classes beginning"", '  The school held its eighth commencement in November 2007 at the Samuel Kanyon Doe Sports Complex, with Liberian President Ellen Johnson Sirleaf as the convocation speaker', ' The school graduated over 400 students at that time', ' In February 2011, students at AMEU protested an increase in tuition, poor pay for their instructors, and for providing a poor education', ' The school had raised the cost per course to US$11 from $8', ' As of 2018, the school had 5,051 students enrolled, with 254 of those being graduate students', ' The total enrollment placed the school as the second biggest in the country, behind only the University of Liberia', ' On March 31, 2020, a new interim president, Rev', ' Alvin E', ' Attah, Sr', ', was named by the Board of Trustees of the University', '  References  External links    Faith Based Higher Education Institutions at the National Commission on Higher Education, Liberia  Category:1995 establishments in Liberia Category:Educational institutions established in 1995 Category:Private universities and colleges in Africa Category:Universities and colleges affiliated with the African Methodist Episcopal Church Category:Universities and colleges in Monrovia']","In April 2007, students protested against the university's administration for requiring students to pay 80% of tuition for the new semester prior to classes beginning.In February 2011, students at AMEU protested an increase in tuition, poor pay for their instructors, and for providing a poor education"
LB-2007-5#-00000252,"['West Point is a township of the Liberian capital city of Monrovia, located on a 0', '53\xa0km2 peninsula which juts out into the Atlantic Ocean between the Mesurado and Saint Paul rivers', "" West Point is one of Monrovia's most densely populated slums"", '  Environmental degradation has gradually caused part of the peninsula to erode into the ocean', ' Endemic problems include overpopulation and diseases such as tuberculosis', '   History  The informal settlement was squatted in the 1940s or 1950s by fishermen', ' An experiment in the 1970s to move people from West Point failed', ' Residents returned despite squalid living conditions', ' People moved back to fish and make a living as informal shopkeepers and service providers close to the city centre', ' ""LIBERIA: Disease rife as more people squeeze into fewer toilets"", IRIN News, 19 November 2009', '  During the 2014 Ebola outbreak, the neighborhood was placed under quarantine, such that nobody could enter or leave, a practice known as Cordon sanitaire', ' This drew criticism from health experts and human rights advocates', ' The quarantine was halted after 10 days, and President Ellen Johnson Sirleaf later acknowledged that this decision had been a mistake', '   Government  In 2018 President George Weah appointed William C', ' Wea as Commissioner for West Point', 'Executive Mansion', ' President Weah Makes further Appointments in Government  West Point is part of the Montserrado-7 electoral district', 'National Electoral Commission', ' Montserrado County Electoral District No', '7 2017   Demographics  West Point (or Zone Z400) is divided into six communities:Liberia Institute of Statistics and Geo-Information Services', ' Population 2008, 2014 by County, District, Clan and Households, Liberia CommunityInhabitants (2014 est', ')No', ' of Households (2014 est', ')Central West Point7,9591,941Fish Town6,0941,486Grandcess Yard7,3411,790Police Station4,9111,198Power Plant4,6511,134West Point3,649890Total:34,605\t8,439   Social issues  Sanitation  The area lacks proper sanitation and public toilets', ' and a 2009 report by United Nations Office for the Coordination of Humanitarian Affairs estimated that there were four public toilets in the area', ' Pay toilets exist, but residents cannot afford them, and thus public defecation is common', ' The beach surrounding West Point is often used as a lavatory which creates health hazards as the water is used for drinking and fish from the water are consumed', '   See also   Clara Town Ebola virus epidemic in Liberia  Freeport of Monrovia  General:  Slums in Africa  References  Category:City corporations, townships and borough of the Greater Monrovia District Category:1940s establishments in Liberia Category:Slums in Africa Category:Squatting in Liberia']",West Point is one of Monrovia's most densely populated slums.Endemic problems include overpopulation and diseases such as tuberculosis
LB-2013-6Z-00000033,"['Plahn Nyarn District is one of 16 districts of Sinoe County, Liberia', ' As of 2008, the population was 6,805', '  References  History of The Plahn Tribe  Written by Dr', ' P', ' Potter Pajibo  To begin with the history of the Plahn tribe, it must be assumed that the Tribe had its origin from the Cavalla River (Jubu), in the eastern part of Sinoe County', ' Its descendancy links with the Grebo Tribe, and for this fact, the tribe is usually referred to as Bush Grebo', '  The continued rift between the belligerent Grebo Tribe and the Plahn Tribe stirred up a series of intertribal wars, and the latter was forced to leave in such of a suitable place for abode under the leadership of Tarjuo, a big doctor and warrior', ' The people of the Plahn Tribe traveled for months and at last reached a certain mountain, now called “Tarjuo Mountain”, in honor of their leader Tarjuo', ' He is also whom the Tarjuozon Tribes named where they decided to settle', '  The decision to make the Tarjuo Mountain was unanimous among the people of the Plahn Tribe', ' They therefore settled and remained there for a few years until the death of the leader, doctor Tarjuo', '  When Tarjuo died, the Plahn Tribe people felt discouraged; and after a deep contemplation, decided to leave the Tarjuo Mountain', ' Because of their strong conviction in superstition, the tribal people found the mountain unsuitable to live, and felt that upon their failure to leave, they would suffer an untimely death', '  Under the leadership of one of Tarjuo’s sons, Plahn, after whom the tribe is named, the group again left the Tarjuo Mountain in search of another place for settlement', ' For months they traveled so many miles and finally reach a certain creek, called “Slae-Nee” meaning Magic Creek', ' This was their final destination and settlement', ' History shows that when they reached this area a mental picture of a bright future was formed; previous conflicts and disturbances were decreased', ' They believed that this creek also greatly and surprisingly aided their Tribe during a war between her and the Krahn people', '  The main cause or source of the Tribe’s decision to settle around the Slae-Nee Creek was for protection', ' Since the organization and establishment of the Plahn Tribe, the people of said Tribe have been worshipping the Slae – Nee Creek as one of her tribal gods', '  From the earliest stage of the Tribe, the following had been some of the most outstanding leaders who have contributed and accomplished much to her development:   Chief Jowiehfueh  Chief Sworrfueh  Chief Gbartieh Jarfueh  Chief Gborpannon  Chief Gbarweh Nuon  Chief Karjah  Chief Dopaetron  Chief Wiehkue  Chief Kujah Sworrfueh  Because of lack of written records, nothing much can be said about their contributions made', ' However, it is said that they had ably and conducted and protected the affairs of the Tribe', ' Since its establishment, there have been diverse kinds of governments', ' Since there was no central government at the time, the tribesmen wisely organized themselves into a strong body of local tribal government and elected Jowiehfueh as their first chief or king', ' He faithfully conducted the affairs of the tribe to the best of his ability and remained in power until his death', '  Since the death of the first king, there has been a succession of others up to the present as listed below:  Paramount Chiefs:   Jowiehfueh  Pantonteh  Jarkue Wolloh  Teah-Deboe Pajibo  Wrogbo Jah  Weagbah  Tanneh Weah  Torteh  Clan Chiefs:   Pantonteh  Kietegbeh  Nyonuwion  Nyenfueh  Tanneh Weah – Plahn  Weagbah – Kulu  Pobleh – Nyarn  Pallaywion - Shoah  Tanneh Weah - Plahn  Torteh - Nyarn  Falleh – Puea - Kulu  Borjobo – Buer – Shoah  David Pyne - Plahn  Torteh - Nyarn  Wionjuo - Kulu  Borjobo – Buer -Shoah  Brown Nyenfueh – Plahn/Nyarn  Wionjuo - Kulu/Shoah  The Tribe as a whole is divided into three main family groups comprising twelve subdivisions', ' The causes or reasons for the divisions are on account of repeated conflicts and dissatisfactions among the three distinct original families', ' They felt that this would enable them to multiply, expand and to build the Tribe', ' They also wanted a separate and independent leadership for each division', '  Below are the three original family groups and their subdivisions:  Plentarh Group  a) Chuoh  b) Sworrh  c) Kaetarh  d) Gedaquen  Snoh – Dea – Quen  a) Weorh  b) Tartouh  c) Wenjaoh  d) Saoh  Barlor – Quen  a) Chuoh  b) Swisslow  c) Tuon  d) Clayar -Quen  Information reveals that all tribes were, from the beginning, wandering from place to place in search of suitable sites for settlements', ' The Plahn Tribe therefore did not come in contact with any tribal group in traveling from the Cavalla River area and the Tarjuo Mountain', '  The sum total of the attainments and activities, in other words, the culture of the Tribe is the making of wooden utensils such as spoons, and pans; clay pots for cooking and water buckets; the first clothing were made or obtained from bamboo limps, barks of trees, etc', '; melted rocks to make cutlasses and spears; and the making of rattan baskets and chairs acquired from other neighboring tribes', '  The method of serving God was through their various tribal gods such as Slae – Nee Creek, the Rock Wiah, Kae – Gedoe – Plie, Nyanfurh, and Genopuarch', ' In the event of war with other tribe, a special selected group of the Plahn Tribe would go to these gods and make sacrifices', ' Their belief in these gods would avoid the war and other unnecessary confusion that would exist, and would make the Tribe very wealthy and productive for abode', '  Nowadays, most of these gods have been abandoned and replaced by Christianity', ' This is the result of civilization which has dispelled ignorance from the minds of the inhabitants of the tribe', ' There is no record of the Plahn Tribe when engaged in conflict or war with the colonist or the pioneers who came from America', ' There has also been no war between the Plahn and the Sinoe tribes, known as Murrayville Settlement in Sinoe County', ' These two Tribes have been very friendly since their settlement and were kind to the colonists', '  Today, members of the Plahn Tribe from Tarjuozon District in Sinoe County can be found all over the globe serving in different ways and the District according to the latest census from the Liberian Government have a little over 428 inhabitants', '  Category:Districts of Liberia Category:Sinoe County']","Their belief in these gods would avoid the war and other unnecessary confusion that would exist, and would make the Tribe very wealthy and productive for abode"
LB-2007-5#-00000088,"['[[Image:Grand Cape Mount County Liberia locator', 'png|thumb|right|Grand Cape Mount County (highlighted) in western Liberia]]  Lake Piso, also known as Lake PisuWalters, Guanya Pau, p', ' 79', "" and Fisherman's Lake,Cole, The Liberian Yearbook, p"", ' 192', 'Nelson, Liberia, a Country Study, p', ' 47', ' is an oblongStreissguth, Liberia in Pictures, p', ' 10', ' tidal lagoonFox, Butterflies of Liberia, p', ' 26', 'Hughes et al', ', Directory of African Wetlands, p', ' 387', ' in Grand Cape Mount County in western Liberia, near the town of Robertsport', ' At an area of , it is the largest lake in Liberia', 'Streissguth, Liberia in Pictures, p', ' 72', ' Its name originates from a local term meaning ""pigeon\'s hole"" – a reference to the flocks of pigeons that once came to Lake Piso for water', '  Hydrology and geology The brackish water lake borders the Cape Mount peninsula, and is connected to the Atlantic Ocean by a narrow inlet known locally as the ""bar mouth""', 'Walters, Guanya Pau, p', ' 39', "" Various rivers empty into Lake Piso, including Mole Creek and Mafa River, which discharges at the 'bar mouth'"", ' There are a number of islands in the lake, including Massatin Island, which offered a haven for monkeys and birds species, it also served as temporary refuge for some Liberians during the Liberian Civil War', '  History During World War II, Lake Piso functioned as a military base for Allied seaplanes', '  Lake Piso overflowed its banks at least twice in 1998, causing heavy flooding in Garwular District', ' Flooding in August 1998 occurred due to a blockage of the narrow inlet connecting the lake to the Atlantic Ocean, damaging some homes', ' Additional flooding in September and October, brought about by heavy rains, affected over twenty settlements, causing at least ten deaths, leaving thousands homeless, and forcing others to leave their homes', ' The floods led the government of Liberia to declare the area a ""disaster zone""', '  On December 13–14, 2002, the Papa Friends 2000 capsized in Lake Piso, at the confluence of the lake and Mafa River', ' The overcrowded wooden ferry was transporting approximately 200 passengers, most returning from the funeral of a local footballer', ' Only 15 people were rescued; the rest drowned and were recovered or presumed dead', '  A nature reserve was designated near Lake Piso in 1999Outram, Africa South of the Sahara 2004, p', ' 613', "" and, as of 2004, the Lake Piso wetlands, covering an area of , were Liberia's only designated wetland of international importance"", 'UNEP, Desk Study on the Environment in Liberia, p', ' 52', '  Human activity The area near the lagoon is the homeland of the Vai people', '  Human activity in Lake Piso includes fishing and water sports such as swimming, canoeing and water skiing', ' Prior to the outbreak of the First Liberian Civil War, the lagoon was a popular travel destination for tourists', '  High-quality diamonds have been mined from the rivers that discharge into Lake Piso where ""igneous intrusions provide potentially rich structural traps""', '  Notes  References                  Category:Grand Cape Mount County Category:Lagoons of Africa Category:Bodies of water of Liberia Category:Tourist attractions in Liberia Category:Ramsar sites in Liberia']","High-quality diamonds have been mined from the rivers that discharge into Lake Piso where ""igneous intrusions provide potentially rich structural traps"""
LB-2007-5#-00000132,"['St', "" Joseph's Catholic Hospital is a Christian-run hospital which was established in 1963"", ' It serves everyone around the community in Liberia', ' The hospital does not charge for providing services to its clients', ' It is a not for profit institution', '   History   Founded in the 1960s, St', "" Joseph's was forced to close in 2014 by the Ebola epidemic in Liberia"", '   See also   List of hospitals in Liberia   References  Category:Hospital buildings completed in 1963 Category:1960s establishments in Liberia Category:Hospitals in Monrovia']",It is a not for profit institution
