DHSID_EA,clean_sentences,most_relevant_sentences
LB-2007-5#-00000179,"['The Booker Washington Institute (BWI) is a public, post-secondary school in Kakata, Margibi County, Liberia', "" Founded in 1929 as the Booker Washington Agricultural and Industrial Institute, it was the country's first agricultural and vocational school"", ' BWI was founded with assistance from Americans and is named after American educator Booker T', ' Washington', "" Located east of the country's capital of Monrovia, the school sits on a large rural campus and has about 1,800 students"", '  History During the 1920s Liberian President Charles D', ' B', ' King visited the United States and toured the Tuskegee Institute in Alabama founded by Booker T', ' Washington', "" Upon his return to Liberia, President King hired Massachusetts Institute of Technology's first African-American graduate, Robert Robinson Taylor, to design a campus for a similar school in Liberia"", ' The government donated  in Margibi County for use by the new school, which was named after Washington', ' The school opened in 1929 with the financial assistance of the Firestone Natural Rubber Company and the Phelps Stokes Fund', "" Firestone had opened the world's largest rubber plantation in Liberia in 1926"", ' Other supporters included the American Colonization Society, missionary boards, and individuals', '  American James L', ' Sibley served as the first principal of the new school', ' All principals of the institute were white until 1946', "" BWI's board of trustees was run by Americans until the Liberian government assumed control in 1953"", ' Board meetings were held in New York City', ' Prior to 1980, the school was one of several in the country to participate in the Army Student Training Program used to train officers for the Armed Forces of Liberia', '  In 1990, the school was closed due to the violence from the First Liberian Civil War, and did not re-open until 2000', ' During the Second Liberian Civil War, it was attacked by rebel forces in April 2002, which then caused the school to close until September 2002', "" At one point in 2003 it was the only college open in Liberia after the University of Liberia had been attacked by Charles Taylor's forces"", ' The school was the largest secondary school in the country during part of the first decade of the 21st century with around 1,500 pupils', ' In September 2003, ECOMIL peacekeeping troops used the school as a base', ' The alumni association started construction on an alumni center at the school in 2014', ' As of 2014, the school is transitioning from high school to a community college curriculum', ""  Academics The school was Liberia's first agricultural and vocational school"", "" It is located about  east of Monrovia, country's capital city"", ' As of 2014, BWI has approximately 1,800 students enrolled at the  rural campus in Margibi County near the Kakata Rural Teacher Training Institute in Kakata', ' BWI has a computer lab used by both the school and other students, and offers courses in welding, carpentry, and agriculture', ' It also is an American Corners institution in which the United States federal government provides items such as computers and books used to study about the United States', ""  References  Further reading The Politics of Miseducation: The Booker Washington Institute of Liberia, 1929-1984, by Donald Spivey  External links BWI National Alumni Association of North America Liberia's Educational system Liberia agriculture students benefit with US$100,000, GVL’s donation  Category:Margibi County Category:Universities in Liberia Category:Educational institutions established in 1929 Category:1929 establishments in Liberia Category:Agricultural schools""]",The school opened in 1929 with the financial assistance of the Firestone Natural Rubber Company and the Phelps Stokes Fund
LB-2016-7#-00000019,"['thumb|right|200px|Location of Kongba District in Gbarpolu County Kongba District is one of five second-level administrative divisions located in Gbarpolu County, Liberia', '  Economy and Society All towns and villages are involved in mining activities and have large expatriate populations from countries such as Guinea, Sierra Leone, Mali, Burkina Faso, and Niger', '  Whenever there is a new discovery of diamonds or gold in a village there is a large migration of both miners and business people to that particular center for the time the minerals are being mined', '  Livelihood activities include farming (slash-and-burn), alluvial mining of diamonds and gold and hunting of bush meat', ' Over 50% of the villages have fewer than 100 inhabitants', ' Kungbor has the largest population, followed by Zuie and Nomo', ' Butter Hill, Nomo, Fula Camp, Camp Israel, Fornor, Kawelahun and Kungbor are of medium size', ' There are two types of communities: the more permanent and stable communities - which have developed retail services, palm oil production, cocoa and coffee cultivations and more established houses (with zinc roofs), and the unstable transient towns or camps which are newly established or only inhabited in the dry season when mining activities take place', ' On this basis, six forest edge villages in Grand Camp area and eleven in Zui clan are classed as permanent settlements', ' Five communities in Gbarpolu County are classed as not stable', '  Language Both Mende and Gola are spoken in Kongba district', '  Mende is preferred for general usage as it is largely understood both by the indigenous population as well as the expatriate worker community, but for issues regarding land ownership disputes, Gola is preferred as it is generally only understood by the indigenous population and excludes the expatriate community from such discussions', '  Surfeit of men The ratio of men to women throughout the district skews higher than average, due to the overwhelming reliance on mining as an economic activity', '  District-wide, the ratio of men to women is 3:1, with 70% of the villages having more men than women', ' In one village, Sonah Creek, the population consisted solely of men', ' Similarly, gender ratios in Soso camp (17 times more males) and ULC (9 times more males) are highly skewed towards males', '  History Diamond and gold have been the two major mineral resources of the Kongba community since before the founding of the Republic of Liberia', ' They have continued to serve the people of the community and others from far and near', ' As early as the 1900s the people of the community could not pay taxes to government in cash but in goods of diamond and gold', '  This practice continued until the late 1960s', '   During inter-ethnic wars, the Gola people were overpowered because of the British influence in neighboring Sierra Leone and many of the Gola people were absorbed into the Mende-speaking community', '  Category:Districts of Liberia Category:Gbarpolu County']","Surfeit of men The ratio of men to women throughout the district skews higher than average, due to the overwhelming reliance on mining as an economic activity.History Diamond and gold have been the two major mineral resources of the Kongba community since before the founding of the Republic of Liberia.As early as the 1900s the people of the community could not pay taxes to government in cash but in goods of diamond and gold"
LB-2019-7Z-00000146,"['thumb|right|200px|Location of Konobo District in Grand Gedeh County Konobo District is one of three districts located in Grand Gedeh County, Liberia', ' The administrative seat of the District is Ziah Town', ' As of 2008, the District had 50,161 people making it the second most populated in Grand Gedeh County next to Gbarzon District', ' In area, it is about 1,400 square miles', '  There are several gold mines particularly in the eastern belt of which the CVI mining camps of New Creek, Solo Camp and Belleh Yallah are the most renowned areas of significant production', ' Mining, small scale farming and hunting are the main source of income for bulk of the population', ' Remittances especially from U', 'S', ' based families are reliable income for some residents', '  The District only has one high school in Ziah Town and few deports of the Liberia National Police', ""  In 2012, the Liberian government arrested and is still detaining several suspected men from the District and other parts of Grand Gedeh accused of cross border raids which left seven Niger UN peacekeepers and 8 Civilians dead in neighboring Coted'Ivoire"", ' The men and vast number of the district residents continue to plead non involvement in such act and many of them have repeatedly accused Monrovia of discriminatory treatment against the Krahn ethnic group where former president Samuel Doe hailed from', '   Infrastructure in the district is generally substandard and extremely bad especially for roads running in the tropical rainforest section of the District', ' Motorcycles are the popular and in some cases the only means of transport especially during the rainy season', ' Notable buildings are based mainly in Ziah Town, and they include the administrative building, a non-story building which houses the offices of the District superintendent and other officials, and the house of the mother of former president Samuel Doe', ' Road maintenance is carried out mainly by hand work particularly with cutlasses for side brushing and axe for removing logs thrown across by heavy storms or other features', ' The only well maintained road in the district is the Liberia national highway which runs through the District on its way to River Gee and Maryland counties', '   The District is home to George Dweh Jr, former speaker of the National Transitional Legislative Assembly of Liberia(NTLA) between 2003 and early 2005, shortly before the 2005 general elections', ' The current Liberian lower house delegate from the District is Hon George Boley who succeeded Morais T', ' Waylee in the 2017 general elections', ' Like many parts of Grand Gedeh, majority of the people are supporters of the ruling Coalition for Democratic Change (formerly Congress for Democratic Change) (CDC) as shown in the past 3 general elections where the District helped Grand Gedeh produced the party highest presidential percentage of any County until 2017 before Grand Kru County took over', ' Grand Gedeh County current superintendent, Kai G', 'Farley, a former member of the Liberian House of representatives who represented the District in parliament from 2006 to 2012 is member of the ruling party since 2005', '  In January, 2018 Roland B', ' Kai was appointed superintendent of the District', '  Chiefdoms of Konobo district: Konobo and Putu  Clans of Konobo chiefdom: Gbilibo-Gbalu and Glio-Twabo  Clans of Putu chiefdom: Gbaegbo and Jibehgbo  Category:Districts of Liberia Category:Grand Gedeh County']","Mining, small scale farming and hunting are the main source of income for bulk of the population.based families are reliable income for some residents"
LB-2013-6Z-00000231,"['St', ' Paul River is a district located in Montserrado County, Liberia', ' It recorded a population of 71,831 in the 2008 census', ' It has no official administrative status', ' Its inhabitants are primarily Christians and members of the Bassa, Dey, or Kpelle tribes', ' Farming and fishing are the main economic activities along with some small scale trading', ' The district has one paved road', '  References  Category:Districts of Liberia Category:Montserrado County']",Farming and fishing are the main economic activities along with some small scale trading
