DHSID_EA,clean_sentences,most_relevant_sentences
LB-2009-5Z-00000108,"['The Supreme Court of Liberia is the highest judicial body in the West African nation of Liberia', ' The court consists of the Chief Justice of Liberia, who is also the top Judiciary official, and four associate justices, who are nominated by the President and confirmed by the Senate', ' The justices hold court at the Temple of Justice on Capitol Hill in Monrovia', 'The NEWS', ' ""Liberia; Transforming the Judiciary"", Africa News, March 16, 2006', '  The Article III of the Constitution of Liberia stipulates judiciary as one of the three branches of government that ought to be equal and coordinated based on the principle of checks and balances', ' The court was originally authorized by the 1839 Constitution of the American Colonization Society signed on January 5, 1839, while subsequent constitutions continued to authorize a supreme court, with the 1984 Constitution as the most recent version', ' Powers and structure of the court are determined by Article VII of the 1984 constitution', ' The Supreme Court is granted original jurisdiction over constitutional questions, cases in which the country is a party, and for cases where ministers or ambassadors are involved by the Constitution of Liberia', '  The Supreme Court, as in other democratic countries, is found to be the weakest among the three arms of democracy', ' Trial by ordeal is prohibited by the court, but it is still practiced commonly in modern times to adjudge cases', '  Jurisdiction and structure 200px|left|thumb|Chief Justice Zacharia B', ' Roberts along with his associates Chief Justices of Liberia\t\tChief Justice of Liberia TenureSamuel Benedict1848–1856John Day1856–1861Boston J', ' Drayton1861–1864Edward J', ' Roye1865–1868Cyrus Louis Parsons1869–1894Zachariah B', ' Roberts1895–1910James Archibald Toliver1911–1913James Jenkins Dossen1913–1924Frederick E', ' R', ' Johnson1924–1933Louis Arthur Grimes1933–1949Martin Nemle Russell1950–1958Eugene Himie Shannon1958-1958Dash Wilson1958–1971James A', ' A', ' Pierre1971–1980Emmanuel M', ' Gbalazeh1980–1986James N', ' Nagbe1986–1987Chea Cheapoo1987Emmanuel M', ' Gbalazeh1987–1990James Henrique Pearson1992James Garretson Bull1993–1996Her Honor Frances Johnson Morris1997Her Honor Gloria Musu-Scott1997–2003Henry Reed Cooper2003–2005Johnnie N', ' Lewis2006–2012Francis Korkpor2013–Present  The Article III of the Constitution of Liberia stipulates judiciary as one of the three branches of government that ought to be equal and coordinated based on the principle of checks and balances', 'Kaydor, Jr', ' 2014', ' p', ' 1 The court was originally authorized by the 1839 Constitution of the American Colonization Society signed on January 5, 1839', ' Subsequent constitutions continued to authorize a supreme court, with the 1984 Constitution as the most recent version', ' Powers and structure of the court are determined by Article VII of the 1984 constitution', ' The Supreme Court is granted original jurisdiction over constitutional questions, cases in which the country is a party, and for cases where ministers or ambassadors are involved by the Constitution of Liberia', 'Jallah, David A', ' B', ' “Notes, Presented by Professor and Dean of the Louis Arthur Grimes School of Law, University of Liberia, David A', ' B', ' Jallah to the International Association of Law Schools Conference Learning From Each Other: Enriching the Law School Curriculum in an Interrelated World Held at Soochow University Kenneth Wang School of Law, Suzhou, China, October 17–19, 2007', '” International Association of Law Schools', ' Retrieved on September 1, 2008', ' The court has appellate jurisdiction over other matters, with the next lowest court being the 15 Circuit Courts', ' The Court has five members, which is headed by the Chief Justice', ' The Chief Justice is appointed by the President of the country with the consent of the Senate', ' The Chief Justice can continue in his office up to the age of 70', ' The Supreme Court circuit and speciality courts, magistrate courts and justices of the peace', '  Eligibility of Justices The Chief Justice and Associate Justices of the Supreme Court of Liberia must be a citizen of the country for the past ten years previous to his appointment, should be 30 years of age and should be a Counselor at Law Licensed to practice in the supreme court bar, and engaged in the active practice of law for at least seven (7) years prior to his appointment (Judicial Service, Governmental Service and Teaching of Law)  citation: Judiciary Law – Title 17 – Liberian Code of Laws Revised 2', '4  There are four Associate Justices in the supreme court and they are ranked based on their order of superiority', ' Any three members of the five can form a quorum and when agreement is not arrived by the quorum in any case, the President of Liberia appoints an ad-hoc judge from the circuit judges based on seniority', ' There are five special seat of honor in the Supreme Court chambers and the center seat is reserved for the Chief Justice', ' The two seats immediately adjacent to the Chief Justice are occupied by Associate judges next in rank and the corner most seats on either side for the lower ranked Associates', ' The seat of the judges are conferred during the appointment ceremony and the chair would remain vacant in the event of death or such extraneous situation until a new judge is appointed', ""  The current Associate judges of the Supreme Court are Sie-A-Nyene Yuoh, Kabineh Ja'neh, Jamesetta Howard Wolokollie and Philip A"", ' Z', ' Banks, III', '  History 200px|thumb|left|Chief Justice during 1910 In 1864 one of the most controversial legal battles was fought between two presidents, Joseph Jenkins Roberts, President of Liberia during 1848–55 against Stephen Allen Benson, another president of the country during 1856–63 over charges of land speculation', ' Roberts won in the lower court on account of his powers, the Supreme Court overturned the decision', '  During August 2007, the Supreme Court allowed proceedings against Gyude Bryant, who was an interim President and allegedly stole $1', '3 million of government property', ' The Court noted he was not immune to prosecution as a head of the state as he was not elected by people and was not abiding by laws of the nation', '  Criticism The Supreme Court, as in other democratic countries, is found to be the weakest among the three arms of democracy', ' Some experts quote the language in the habeas corpus that implies judiciary is powerless against both legislature and executive', ' Trial by ordeal is prohibited by the court, but it is practiced commonly in modern times', ' The process of physical examination amounting to ingestion or application of fire warmed machine to the legs of the accused are commonly followed', ' The suffering has often quoted as discomfort and sometimes lead to death', '  During 2005, Liberia acceded to the Second Optional Protocol on the International Covenant on Civil and Political Rights, committing to cease capital punishment', ' The move was welcomed by United Nations', ' An amendment was made to the Penal Code in 2008, which indicates ""in the event of death occurs during the commission of a crime of armed robbery, terrorism or hijacking, the accused under Section 14', '54, 15', '32 and 15', '33 of the Act shall be sentenced to death by hanging or life imprisonment without possibility of parole""', ' Many human right activists and organizations see this as the reintroduction of death penalty', ' The Chairman of the Law Reform clarified that the accession was during the interim government and could not be deemed valid', '  Notes  References    External links Recent court decisions History of the Supreme Court U', 'S', ' Department of State A Guide to the Liberian Legal System and Legal Research Republic of Liberia Supreme Court Reports, Volume 1  Category:Liberian judiciary Liberia Category:Monrovia Category:1839 establishments in Liberia Category:Courts and tribunals established in 1839']",3 million of government property
LB-2007-5#-00000088,"['[[Image:Grand Cape Mount County Liberia locator', 'png|thumb|right|Grand Cape Mount County (highlighted) in western Liberia]]  Lake Piso, also known as Lake PisuWalters, Guanya Pau, p', ' 79', "" and Fisherman's Lake,Cole, The Liberian Yearbook, p"", ' 192', 'Nelson, Liberia, a Country Study, p', ' 47', ' is an oblongStreissguth, Liberia in Pictures, p', ' 10', ' tidal lagoonFox, Butterflies of Liberia, p', ' 26', 'Hughes et al', ', Directory of African Wetlands, p', ' 387', ' in Grand Cape Mount County in western Liberia, near the town of Robertsport', ' At an area of , it is the largest lake in Liberia', 'Streissguth, Liberia in Pictures, p', ' 72', ' Its name originates from a local term meaning ""pigeon\'s hole"" – a reference to the flocks of pigeons that once came to Lake Piso for water', '  Hydrology and geology The brackish water lake borders the Cape Mount peninsula, and is connected to the Atlantic Ocean by a narrow inlet known locally as the ""bar mouth""', 'Walters, Guanya Pau, p', ' 39', "" Various rivers empty into Lake Piso, including Mole Creek and Mafa River, which discharges at the 'bar mouth'"", ' There are a number of islands in the lake, including Massatin Island, which offered a haven for monkeys and birds species, it also served as temporary refuge for some Liberians during the Liberian Civil War', '  History During World War II, Lake Piso functioned as a military base for Allied seaplanes', '  Lake Piso overflowed its banks at least twice in 1998, causing heavy flooding in Garwular District', ' Flooding in August 1998 occurred due to a blockage of the narrow inlet connecting the lake to the Atlantic Ocean, damaging some homes', ' Additional flooding in September and October, brought about by heavy rains, affected over twenty settlements, causing at least ten deaths, leaving thousands homeless, and forcing others to leave their homes', ' The floods led the government of Liberia to declare the area a ""disaster zone""', '  On December 13–14, 2002, the Papa Friends 2000 capsized in Lake Piso, at the confluence of the lake and Mafa River', ' The overcrowded wooden ferry was transporting approximately 200 passengers, most returning from the funeral of a local footballer', ' Only 15 people were rescued; the rest drowned and were recovered or presumed dead', '  A nature reserve was designated near Lake Piso in 1999Outram, Africa South of the Sahara 2004, p', ' 613', "" and, as of 2004, the Lake Piso wetlands, covering an area of , were Liberia's only designated wetland of international importance"", 'UNEP, Desk Study on the Environment in Liberia, p', ' 52', '  Human activity The area near the lagoon is the homeland of the Vai people', '  Human activity in Lake Piso includes fishing and water sports such as swimming, canoeing and water skiing', ' Prior to the outbreak of the First Liberian Civil War, the lagoon was a popular travel destination for tourists', '  High-quality diamonds have been mined from the rivers that discharge into Lake Piso where ""igneous intrusions provide potentially rich structural traps""', '  Notes  References                  Category:Grand Cape Mount County Category:Lagoons of Africa Category:Bodies of water of Liberia Category:Tourist attractions in Liberia Category:Ramsar sites in Liberia']","High-quality diamonds have been mined from the rivers that discharge into Lake Piso where ""igneous intrusions provide potentially rich structural traps"""
LB-2007-5#-00000252,"['West Point is a township of the Liberian capital city of Monrovia, located on a 0', '53\xa0km2 peninsula which juts out into the Atlantic Ocean between the Mesurado and Saint Paul rivers', "" West Point is one of Monrovia's most densely populated slums"", '  Environmental degradation has gradually caused part of the peninsula to erode into the ocean', ' Endemic problems include overpopulation and diseases such as tuberculosis', '   History  The informal settlement was squatted in the 1940s or 1950s by fishermen', ' An experiment in the 1970s to move people from West Point failed', ' Residents returned despite squalid living conditions', ' People moved back to fish and make a living as informal shopkeepers and service providers close to the city centre', ' ""LIBERIA: Disease rife as more people squeeze into fewer toilets"", IRIN News, 19 November 2009', '  During the 2014 Ebola outbreak, the neighborhood was placed under quarantine, such that nobody could enter or leave, a practice known as Cordon sanitaire', ' This drew criticism from health experts and human rights advocates', ' The quarantine was halted after 10 days, and President Ellen Johnson Sirleaf later acknowledged that this decision had been a mistake', '   Government  In 2018 President George Weah appointed William C', ' Wea as Commissioner for West Point', 'Executive Mansion', ' President Weah Makes further Appointments in Government  West Point is part of the Montserrado-7 electoral district', 'National Electoral Commission', ' Montserrado County Electoral District No', '7 2017   Demographics  West Point (or Zone Z400) is divided into six communities:Liberia Institute of Statistics and Geo-Information Services', ' Population 2008, 2014 by County, District, Clan and Households, Liberia CommunityInhabitants (2014 est', ')No', ' of Households (2014 est', ')Central West Point7,9591,941Fish Town6,0941,486Grandcess Yard7,3411,790Police Station4,9111,198Power Plant4,6511,134West Point3,649890Total:34,605\t8,439   Social issues  Sanitation  The area lacks proper sanitation and public toilets', ' and a 2009 report by United Nations Office for the Coordination of Humanitarian Affairs estimated that there were four public toilets in the area', ' Pay toilets exist, but residents cannot afford them, and thus public defecation is common', ' The beach surrounding West Point is often used as a lavatory which creates health hazards as the water is used for drinking and fish from the water are consumed', '   See also   Clara Town Ebola virus epidemic in Liberia  Freeport of Monrovia  General:  Slums in Africa  References  Category:City corporations, townships and borough of the Greater Monrovia District Category:1940s establishments in Liberia Category:Slums in Africa Category:Squatting in Liberia']",West Point is one of Monrovia's most densely populated slums.Endemic problems include overpopulation and diseases such as tuberculosis
LB-2019-7Z-00000254,"['The African Methodist Episcopal University (AMEU) is a private institution of higher learning located in Monrovia in the West African nation of Liberia', ' Located on Camp Johnson Road, the school is the second largest college in Liberia with over 5,000 students', ' The school was established in 1995 by the African Methodist Episcopal Church, and chartered by the Liberian Legislature in 1996', '  History AMEU was organized in 1995 by Bishop Cornal Garnett Henning, Sr', ' and leaders of the African Methodist Episcopal Church, during his administration as presiding prelate', ' Bryant Theological Seminary was the first component school of the university', ' Bryant Theological Seminary had been started in 1992 by David R', ' Daniels, Jr', ', now a bishop in the church', ' The university was then chartered in February 1996', '  In 2003, Louise C', ' York served as president of the university, and accounting was the most popular major at the Christian school', "" During the Second Liberian Civil War in 2003, the school's campus was attacked and ransacked"", ' As the commencement ceremony proceeded that year, the 185 graduates could hear mortar shells exploding in the background as rebel forces attempted to take the capital', "" After the civil strife ended, the country's National Commission on Higher Education approved the university to operate on a temporary basis in November 2005, and in February 2006 the school received full approval"", '  A scam by students at the school in February 2006 cost the university US$100,000 in lost funds, which resulted in the arrest of four people the next month', ' Also in February 2006, USAID paid for some reconstruction on the campus', "" Levi Zangar resigned as president of the school in November 2006 citing problems with the school's board of directors"", "" In April 2007, students protested against the university's administration for requiring students to pay 80% of tuition for the new semester prior to classes beginning"", '  The school held its eighth commencement in November 2007 at the Samuel Kanyon Doe Sports Complex, with Liberian President Ellen Johnson Sirleaf as the convocation speaker', ' The school graduated over 400 students at that time', ' In February 2011, students at AMEU protested an increase in tuition, poor pay for their instructors, and for providing a poor education', ' The school had raised the cost per course to US$11 from $8', ' As of 2018, the school had 5,051 students enrolled, with 254 of those being graduate students', ' The total enrollment placed the school as the second biggest in the country, behind only the University of Liberia', ' On March 31, 2020, a new interim president, Rev', ' Alvin E', ' Attah, Sr', ', was named by the Board of Trustees of the University', '  References  External links    Faith Based Higher Education Institutions at the National Commission on Higher Education, Liberia  Category:1995 establishments in Liberia Category:Educational institutions established in 1995 Category:Private universities and colleges in Africa Category:Universities and colleges affiliated with the African Methodist Episcopal Church Category:Universities and colleges in Monrovia']","In April 2007, students protested against the university's administration for requiring students to pay 80% of tuition for the new semester prior to classes beginning.In February 2011, students at AMEU protested an increase in tuition, poor pay for their instructors, and for providing a poor education"
LB-2007-5#-00000252,"['West Point is a township of the Liberian capital city of Monrovia, located on a 0', '53\xa0km2 peninsula which juts out into the Atlantic Ocean between the Mesurado and Saint Paul rivers', "" West Point is one of Monrovia's most densely populated slums"", '  Environmental degradation has gradually caused part of the peninsula to erode into the ocean', ' Endemic problems include overpopulation and diseases such as tuberculosis', '   History  The informal settlement was squatted in the 1940s or 1950s by fishermen', ' An experiment in the 1970s to move people from West Point failed', ' Residents returned despite squalid living conditions', ' People moved back to fish and make a living as informal shopkeepers and service providers close to the city centre', ' ""LIBERIA: Disease rife as more people squeeze into fewer toilets"", IRIN News, 19 November 2009', '  During the 2014 Ebola outbreak, the neighborhood was placed under quarantine, such that nobody could enter or leave, a practice known as Cordon sanitaire', ' This drew criticism from health experts and human rights advocates', ' The quarantine was halted after 10 days, and President Ellen Johnson Sirleaf later acknowledged that this decision had been a mistake', '   Government  In 2018 President George Weah appointed William C', ' Wea as Commissioner for West Point', 'Executive Mansion', ' President Weah Makes further Appointments in Government  West Point is part of the Montserrado-7 electoral district', 'National Electoral Commission', ' Montserrado County Electoral District No', '7 2017   Demographics  West Point (or Zone Z400) is divided into six communities:Liberia Institute of Statistics and Geo-Information Services', ' Population 2008, 2014 by County, District, Clan and Households, Liberia CommunityInhabitants (2014 est', ')No', ' of Households (2014 est', ')Central West Point7,9591,941Fish Town6,0941,486Grandcess Yard7,3411,790Police Station4,9111,198Power Plant4,6511,134West Point3,649890Total:34,605\t8,439   Social issues  Sanitation  The area lacks proper sanitation and public toilets', ' and a 2009 report by United Nations Office for the Coordination of Humanitarian Affairs estimated that there were four public toilets in the area', ' Pay toilets exist, but residents cannot afford them, and thus public defecation is common', ' The beach surrounding West Point is often used as a lavatory which creates health hazards as the water is used for drinking and fish from the water are consumed', '   See also   Clara Town Ebola virus epidemic in Liberia  Freeport of Monrovia  General:  Slums in Africa  References  Category:City corporations, townships and borough of the Greater Monrovia District Category:1940s establishments in Liberia Category:Slums in Africa Category:Squatting in Liberia']",West Point is one of Monrovia's most densely populated slums.Endemic problems include overpopulation and diseases such as tuberculosis
LB-2007-5#-00000088,"['[[Image:Grand Cape Mount County Liberia locator', 'png|thumb|right|Grand Cape Mount County (highlighted) in western Liberia]]  Lake Piso, also known as Lake PisuWalters, Guanya Pau, p', ' 79', "" and Fisherman's Lake,Cole, The Liberian Yearbook, p"", ' 192', 'Nelson, Liberia, a Country Study, p', ' 47', ' is an oblongStreissguth, Liberia in Pictures, p', ' 10', ' tidal lagoonFox, Butterflies of Liberia, p', ' 26', 'Hughes et al', ', Directory of African Wetlands, p', ' 387', ' in Grand Cape Mount County in western Liberia, near the town of Robertsport', ' At an area of , it is the largest lake in Liberia', 'Streissguth, Liberia in Pictures, p', ' 72', ' Its name originates from a local term meaning ""pigeon\'s hole"" – a reference to the flocks of pigeons that once came to Lake Piso for water', '  Hydrology and geology The brackish water lake borders the Cape Mount peninsula, and is connected to the Atlantic Ocean by a narrow inlet known locally as the ""bar mouth""', 'Walters, Guanya Pau, p', ' 39', "" Various rivers empty into Lake Piso, including Mole Creek and Mafa River, which discharges at the 'bar mouth'"", ' There are a number of islands in the lake, including Massatin Island, which offered a haven for monkeys and birds species, it also served as temporary refuge for some Liberians during the Liberian Civil War', '  History During World War II, Lake Piso functioned as a military base for Allied seaplanes', '  Lake Piso overflowed its banks at least twice in 1998, causing heavy flooding in Garwular District', ' Flooding in August 1998 occurred due to a blockage of the narrow inlet connecting the lake to the Atlantic Ocean, damaging some homes', ' Additional flooding in September and October, brought about by heavy rains, affected over twenty settlements, causing at least ten deaths, leaving thousands homeless, and forcing others to leave their homes', ' The floods led the government of Liberia to declare the area a ""disaster zone""', '  On December 13–14, 2002, the Papa Friends 2000 capsized in Lake Piso, at the confluence of the lake and Mafa River', ' The overcrowded wooden ferry was transporting approximately 200 passengers, most returning from the funeral of a local footballer', ' Only 15 people were rescued; the rest drowned and were recovered or presumed dead', '  A nature reserve was designated near Lake Piso in 1999Outram, Africa South of the Sahara 2004, p', ' 613', "" and, as of 2004, the Lake Piso wetlands, covering an area of , were Liberia's only designated wetland of international importance"", 'UNEP, Desk Study on the Environment in Liberia, p', ' 52', '  Human activity The area near the lagoon is the homeland of the Vai people', '  Human activity in Lake Piso includes fishing and water sports such as swimming, canoeing and water skiing', ' Prior to the outbreak of the First Liberian Civil War, the lagoon was a popular travel destination for tourists', '  High-quality diamonds have been mined from the rivers that discharge into Lake Piso where ""igneous intrusions provide potentially rich structural traps""', '  Notes  References                  Category:Grand Cape Mount County Category:Lagoons of Africa Category:Bodies of water of Liberia Category:Tourist attractions in Liberia Category:Ramsar sites in Liberia']","High-quality diamonds have been mined from the rivers that discharge into Lake Piso where ""igneous intrusions provide potentially rich structural traps"""
